S0198	they're probably alright i mean we always boil it down anyway and oh it's quite noisy isn't it
S0192	mean isn't it
S0198	so before it just wasn't screw in at all
S0192	so be it be it do now do you think i'd say so
S0198	yeah
S0192	pretty powerful it's good
S0198	yeah yeah it's pretty nippy isn't it
S0192	yeah
S0198	it's
S0192	i'll just put it in here
S0198	mm don't you think that look like taco shell beef
S0192	yeah it do
S0198	oh look how frothy that's go
S0192	yeah it have go frothy
S0198	different colour as well don't you think
S0192	yeah it's go a very different colour
S0198	completely different colour
S0192	just in generally ingredients
S0198	the ones that i use
S0192	they're gonna come out as pink
S0198	the ones the ones i use for the lasagne be like really quite sweet
S0192	yeah
S0198	but er not in a good way i don't think
S0192	right do you wanna give this a clean
S0198	it smell differently
S0192	sorry i make a mess
S0198	mess everywhere
S0192	there really be
S0198	where do that go
S0192	yeah this doesn't look like the right colour
S0198	no
S0192	do you have a oxo cube
S0198	yeah yeah yeah
S0192	i can make it a bite darker with a bite of beef stock
S0198	yeah it's in there
S0192	in where
S0198	in there cupboard on the right side
S0192	oh i see
S0198	they're not permanent place here they're just somewhere there
S0192	yeah yeah
S0198	cor that one's get a chill in it hasn't it
S0192	yeah it do have a chill we should have our other beer now before this
S0198	yeah
S0192	do you think
S0198	yeah
S0192	leave it to cook
S0198	leave it to simmer enjoy the beer and maybe settle down for the even and watch something
S0192	yeah that sound good to me
S0198	i need to pack a bag actually i've get to pack a suitcase to take to dorset
S0192	yeah you have
S0198	how stupid be that i haven't even unpack here yet and i'm pack something
S0192	can't believe you're go so quick
S0198	oh i don't wanna go
S0192	i don't want you to go either
S0198	but
S0192	you don't know what time it be yet
S0198	no why hasn't my brov not phone me today it be really strange
S0192	maybe they want you give them a call
S0198	he's sit at home sulk
S0192	why cos you're out there
S0198	yeah no not cos i'm out there just cos he's home alone he's happy that i'm er he's happy that i'm in i think
S0192	that you're around at least
S0198	yeah and he get excite when live in different place and if it's
S0192	yeah as long as there's
S0198	somewhere else for him to drive to and something for him to actually do
S0192	do yeah some herbs would be good
S0198	yeah they shouldn't be too difficult to come by
S0192	yeah no we be go to put some yoghurt in it weren't we
S0198	oh yeah be we gonna put it in it or just have it like on the side
S0192	yeah
S0198	yeah you'll taste it more i think if you just have it at at the end
S0192	yeah
S0198	ah that's tough to open
S0192	right just get to do the kidney bean and
S0198	yeah i'll have to oh my dad's gotta call me someone's gotta call me
S0192	yeah they do
S0198	do we put we don't put garlic fridge do we
S0192	er no no garlic stay out
S0198	well well
S0192	people leave onions out as well
S0198	we be yeah well yeah potatoes be normal but i think we be in korea though weren't we i mean i don't have anywhere to put it so i'm just gonna put it in the fridge
S0192	yeah
S0198	that'll do for the moment
S0192	yeah we be keep it in the fridge in
S0198	in korea yeah
S0192	so we're go to have this with rice
S0198	have to turn off the megatron cos i think that's do yeah we'll have a see what that rice be like it's half the price of the rest so i don't know
S0192	yeah
S0198	but erm
S0192	well i'm gonna have cheese with mine though my dad think that's sacrilege
S0198	what cheese on a chilli
S0192	yeah
S0198	ah i mean
S0192	do you think
S0198	you know anything's sacrilege put cheese on something like that though
S0192	it's something from latin america i think it's
S0198	if it's spicy i don't know it just like be isn't it
S0192	yeah
S0198	chilli
S0192	they put cheese in them they probably not to i mean they go so far as to have it with with noodles don't they
S0198	yeah my erm my
S0192	oh gosh be you kid me whole black pepper corn
S0198	yeah if it's
S0192	perfect for pepper mill
S0192	and no pepper mill
S0198	oh you haven't get any pepper
S0192	by the time i have any jesus
S0198	don't even have what make you pick up that one
S0192	that be the only one there that look like a miller
S0198	oh you've bugger that didn't you
S0192	i need to add some more cumin and and chilli to this one but do it matter when i
S0198	no i don't think so
S0192	somewhere ouch that's cinnamon
S0198	oh sorry
S0192	i don't need that one
S0198	i didn't realise your leg be there you didn't put much cinnamon in it do you
S0192	no no i didn't i just want erm another spoon and
S0198	somewhere in this cutlery anyway
S0192	just need to clean this mess there's a good deal of mess everywhere
S0198	so what so both time you be at your dads you be cook for you do she
S0192	no my dad cook twice and
S0198	oh
S0192	i cook once
S0198	what do your dad cook you
S0192	erm he do er
S0198	curry
S0192	thai curry once erm
S0198	be it good
S0192	and erm do chilli another time actually
S0198	oh any good
S0192	yeah they weren't bad it be alright thai curry he do light colour but when i've cook with the chillies here
S0198	yeah
S0192	they're pretty strong
S0198	yeah
S0192	i only put the two in the other day pretty strong so i don't know what it's like put twenty in
S0198	yeah
S0192	you know what i mean when we use to make the thai green curry we need to get use to their ingredients
S0198	ingredients yeah i guess we'll try in the halfway point get to take it from there decrease and increase
S0192	maybe we'll have to
S0198	just to be clever
S0192	yeah
S0198	we're make mess already aren't we look that's already tear down there
S0192	wasn't really tear
S0198	we haven't move the oven
S0192	yeah so we need to take a picture of that
S0198	yeah
S0192	sure
S0198	and i'll roll my own rollie
S0192	well we should just make up photoshop picture of things that we think we're gonna break
S0198	i don't think i don't know how you'd go about do that i mean i guess there's no but we be submit that er those photos soon aren't we
S0192	yeah soon as we've get internet
S0198	perhaps we can use these box for a side thing for now
S0192	right this thing need much more of a clean
S0198	i know it hasn't nothing's be clean yet
S0192	cool
S0192	do i need to turn the hot water on
S0198	no it can take too long
S0192	be this go in the rubbish
S0198	yeah or there i guess i'll just wash it with cold water
S0192	that can be do
S0198	erm
S0192	or you
S0198	could boil a kettle but it's not really worth it be it i think it
S0192	well we do have the light on why do we have the light on
S0198	oh sorry there be something
S0192	must be
S0198	i be look at the guide the one on the can't leave any light on especially when we've get the oven run as well i wonder if cook be go to be really expensive
S0192	hopefully not it's electric hopefully just we'll just heat this through turn it off separate it what be we actually separate this into
S0192	if we don't have any tupperware or cling film have we get saucepans with lids
S0198	yes
S0192	so be just gonna
S0198	but how big be they be they gonna fit in our fridge i don't think so
S0192	probably it's probably about that long you could put two thirds of that in here
S0198	oh yeah you just wanna separate it out yeah yeah
S0192	we'll have today's
S0198	and keep it all together can't you you don't have to separate it into days
S0192	there's quite a deep one that one
S0198	yeah there be a nice couple there that one's deep too
S0192	it's a good rice one
S0198	yeah we'll put the rice in there
S0192	oh there's a bite of rizla in there wet rizla lovely
S0198	wonder where that come from
S0192	no idea we gonna have another cigarette in a
S0198	and a beer
S0192	and a beer
S0198	while that cook there
S0192	what's the time when be you speak to your family
S0198	i haven't get a set time think they would've call by now but they didn't so i don't know why cos my i'm pretty sure my dad's be home alone all day unless he's go out somewhere fish or something
S0192	do you say they be do something on saturday or or a thursday be it thursday soon
S0198	no mum be work work so i don't know what else they could be do
S0192	there's like a piece of garlic and like a whole piece of garlic
S0198	they look bad
S0192	yeah what's that look like to you
S0198	yeah some garlic it's a piece of garlic it's a piece of garlic isn't it
S0192	eat it
S0198	i'm not eat it
S0192	fine
S0198	i'm not eat it
S0192	this need wash as well oh
S0198	de da de
S0192	we can get our drink if you want
S0198	cheer
S0192	nearly get through the maltesers
S0198	yeah that's good though isn't it
S0192	mm it's look good
S0198	yeah so it's enough for three days isn't there
S0192	i'm pretty sure if we separate it
S0198	and then you can use it as and how you like
S0192	yeah that would be easier
S0198	portion accord you can always get something you could always get like a jacket potato or something to go with it for lunchtime
S0192	yeah i could do that would be nice actually but then i've get to go out to the shop wherever that be
S0198	wouldn't cost you very much would it
S0192	oh the batteries go down a little bite on here
S0198	oh put that
S0192	important
S0198	these be
S0192	i think it's probably cook enough
S0198	want to turn it off
S0192	yeah i mean for like a few minutes we're gonna eat dinner quite early aren't we
S0198	yeah
S0192	if we have another beer and a cigarette maybe
S0198	yeah perhaps we shouldn't leave it on anymore so you'd reheat some in a little while
S0192	yeah i'd reheat some in a little bite
S0198	yeah
S0192	should be pretty cook now
S0198	alright look good actually doesn't it
S0192	look
S0198	oh i didn't realise how hungry i be might be
S0192	do you wanna save the beer for after then
S0198	no no i'd rather have it now okay and then we can just chill
S0192	yeah
S0198	and we'll just have it in a little bite
S0192	cool
S0198	i think i'll be too full after dinner to drink beer
S0192	no i agree
S0198	we usually drink it earlier anyway
S0192	do we have any dessert or do we eat it
S0198	oh we've eat it all
S0192	oh that's tragic
S0198	oh we've get fudge
S0192	there be some fudge
S0198	and
S0198	no i don't
S0192	there's an easter egg
S0198	oh there's an easter egg
S0192	yeah
S0198	there you go
S0192	have you ever be tempt to take an easter egg of that size and fill it with ice sugar like a cream egg
S0198	no it would be horrible
S0192	it would be pretty bad
S0198	it would be terrible
S0192	have actually fill it with like ice cream
S0198	yeah i haven't be
S0192	can you imagine an egg like that
S0198	ice cream
S0192	about that big fill with ice cream
S0198	mm
S0192	but every like few centimetres of ice cream there's another chocolate egg
S0198	oh
S0192	so you have to keep crack through to the ice cream
S0198	that would be amaze i think isn't like the layer i think you'd want the chocolate to get quite thin
S0192	yeah yeah it would get thinner as you go along
S0198	you'll want er want some chocolate
S0192	it would start thicker and get thinner as you go along but can you imagine crack that egg and eat around it and get all the and there's another egg
S0198	and there's another chocolate egg oh sound awful for you
S0192	and more ice cream then
S0198	yeah some days i'd find that disgust other days it would be irresistible
S0192	yeah what be you feel today
S0198	just like a oh irresistible
S0192	yeah
S0198	for sure
S0192	oh for sure now the other beer should be cold now shouldn't it
S0198	oh yeah i didn't put it in the freezer do i
S0192	it's be in the fridge though right i've turn this thing off though clearly
S0198	it's still bubble
S0192	it's this electric
S0198	yeah
S0192	it
S0198	it's kind of like storage heaters but in an oven so
S0192	yeah these hot plat take a little while to cool down it's not stick too badly to this pan though
S0198	be we stay in here or go to the balcony
S0192	erm we could just sit in the lounge couldn't we and open a window
S0198	yeah sure
S0192	it sound like the nursery children have go
S0198	the children have go home
S0192	so that's good
S0198	back home to their parent so they're there
S0192	it get a little bite cold out there for them
S0198	i really can't get over what good
S0192	it's not great be it
S0198	no it's not
S0192	would be nice to have a little bite of sunlight just a little do we need some glass then where's the box of then
S0198	yeah there's two here still i have to give them a rinse
S0192	there's still two be they wash
S0198	yeah
S0192	and where's the bottle opener
S0198	that's still in the drawer i think
S0192	it's right here
S0198	san miquel
S0192	san miquel and the bottle opener
S0198	it's there it's in the drawer
S0192	you already tell me that do you
S0198	yeah
S0192	i just want it in stag
S0198	and the glass
S0192	yes
S0198	there you go
S0192	what percentage be the san miquel what do you guess
S0198	four percent
S0192	exactly five
S0198	oh be it
S0192	yeah
S0198	oh it's when it get to five isn't it
S0192	yeah
S0198	it's not
S0192	yeah a lot of beers be under five nowadays aren't they
S0198	yeah
S0192	just feel like a beer should be about five back in the day it be probably like eight or something
S0198	yeah
S0192	beer drink then we're look at five what's that girly thing you're drink
S0198	yeah
S0192	five do you know what i mean
S0198	absolutely
S0192	oh i've get a perfect head on that one crack
S0198	that's quite a statement
S0192	look how long this take to cool down
S0198	i know
S0192	turn it off a while ago
S0198	that's why electric's terrible terrible
S0198	terrible
S0192	should be alright to leave though shouldn't it
S0198	yeah i think so
S0192	i don't see why i wouldn't be
S0198	and i'll just keep click it smell good
S0192	smell okay smell like chilli
S0198	it smell like chilli
S0192	shame we haven't get any crme fraiche
S0198	we've get yoghurt it's the same thing although do you do you notice it in the supermarket just aisles of the
S0192	be it there
S0198	crme fraiche
S0192	oh
S0198	next to the milk that simple
S0192	how much of it be it expensive
S0198	i didn't see the price
S0192	that would be nice
S0198	i don't think it be that expensive
S0192	no
S0198	it be i don't think anything aldi you can probably describe as expensive
S0192	no i doubt it be
S0192	be we go to go and eat this then
S0198	drink our beer
S0192	drink our beer smoke our cigarette
S0198	and then we'll
S0192	we'll eat this after
S0198	mm
S0192	definitely
S0198	sound good
S0192	that's quite a noisy bubble okay where's the tobacco
S0198	i think you've put it somewhere
S0192	would you like to roll it yourself or shall i
S0198	so you haven't look at the price of the tobacco anywhere since we've be back
S0192	no no i haven't be it that bad now
S0198	i don't know i i reckon a fifty gram pouch will probably be like
S0192	fifteen quid
S0198	no i think it's it be fifteen when when we leave
S0192	sorry bite of an itch
S0198	so i reckon it could be
S0192	what closer to twenty
S0198	maybe
S0192	that's insanity
S0198	no maybe i don't know i bet it's closer it's just like sixteen they can only take things so high before it become ridiculously unreasonable
S0192	so we say but
S0198	yeah that's true
S0192	i don't think they've reach that limit yet
S0198	the sun's get purple on it definitely
S0192	yeah it have
S0198	so when do sun change colour in different continents
S0192	perhaps we're all slightly different be we go to have to get blind do you think for that
S0198	no we're gonna rig one of these it's gonna be wonderful
S0192	weren't we gonna cut one of those in half and see what we can do
S0198	yeah but i we haven't get anything to cut this in half with
S0192	no
S0198	no there's no good scissor for that
S0192	there's no knife or anything okay so we'll just have to live like hobos
S0198	yeah
S0192	for the next couple of days but we can at least put the mattress on here tonight
S0198	yeah i don't yeah it would be nice to sleep on a mattress wouldn't it
S0192	yeah this one's not as good as the mattress
S0198	no
S0192	it's a bite of a mission carry it i would say
S0198	yeah it be erm but it'll be alright this couch be fine just get to get a bite more tableidge go on
S0192	tableidge
S0198	so you're on your own friday be what time will come round after dinner
S0192	probably not until like eight or something
S0198	yeah
S0192	if he come round and then it would just be for an hour or two
S0198	yeah
S0192	not entirely sure when
S0198	be he still a bite certain whether or not he will come round
S0192	yeah yeah he be say
S0198	you say he's not he's not certain that he's not certain
S0192	no then i've get saturday and my dad and aren't go to come at least you know lunchtime maybe a bite later
S0198	yeah then you can hang out and have some food
S0192	don't know maybe not it depend if parking's okay i guess
S0198	yeah park the van
S0192	if erm it's less than a hundred pound then i'll just
S0198	yeah
S0192	pay for the food if it's not then i'm not go to
S0198	oh right you gonna yeah yeah okay so
S0192	do miss a day at work then he should have get more probably
S0198	yeah well they don't care but i care but
S0192	he do it for us just to
S0198	care
S0192	yeah your dad's get serious with him
S0198	he do it for my dad and my mum
S0192	do he
S0198	yeah i dunno but that's
S0192	i bet oh i'm gonna get angry if anyone
S0198	no
S0192	but not anymore
S0198	no he be a genuine he's just just raise the tone so he wouldn't question it again
S0192	yeah but i didn't
S0198	yeah
S0198	it work
S0192	yeah
S0198	you need an ashtray don't you
S0192	no it's cos he threaten me
S0198	in a very serious tone of voice
S0192	yeah
S0198	little bite
S0192	we need to open this window as well
S0198	yeah shall we do that too
S0192	yeah the neighbour don't seem to be too nosy or anything
S0198	no
S0192	not as of yet it be a weekday i guess
S0198	it's hard to know who's in isn't it though
S0192	the weekend might be a bite noisier
S0198	yeah while we've get friends here
S0192	or when they've get friends here
S0198	oh and they've get friends here
S0192	yeah
S0192	no
S0198	well then
S0192	really like the windows
S0198	yeah i like how big they be definitely
S0192	the sash actually open up i'm sure that's safe in your back pocket there
S0198	well it's cos i be wash up and handle dirty things i be protect it
S0192	i'd say just wear when it you know go out or whenever
S0198	i like wear it i like i do i'm doesn't bother me if it get scuff
S0192	it's not permanent so
S0198	no it doesn't it shouldn't be it's okay
S0192	but what be permanent be that i'll replace it
S0198	i don't i don't i don't need a new ring you know i mean if we can it need to look wear everything else about me look wear
S0192	it would be nice if it look
S0198	all those wear clothe that i get off people
S0192	good the first time people saw it though i guess
S0198	well most people have see it and it still look good it look excellent there's a few people that haven't see it i guess your family
S0192	be your mum interest or not really
S0198	mm i mean i speak to her and this guy at about it before we've come back and it's you know it's kind of you know
S0192	do she ask if you know
S0198	i don't remember i think so
S0192	oh
S0198	i'm pretty sure she ask
S0192	i be convince you know
S0198	no
S0192	you feign surprise very well
S0198	quite surprise
S0192	you didn't
S0198	yeah i be pretty surprise
S0192	yeah
S0198	it's kind of surreal have your brother there too
S0192	yeah you didn't see my email
S0198	no no
S0192	no fair
S0198	i think it be fine well they're
S0192	mm
S0198	i don't
S0192	do know innit no go back
S0198	i don't really remember the temple anymore
S0192	no i do i've get photos of it
S0198	but i think that's cos that be yeah
S0192	all the photos be on there so we've get so the printer come today they just deliver it in the little box
S0198	yeah
S0192	the man
S0198	that's random isn't it
S0192	think that's safe it be some random company it wasn't royal mail
S0198	no so i guess it depend they do try and leave it at place sometimes
S0192	i mean there's a royal mail depot
S0198	didn't they lose your didn't they leave your suitcase in the garden you ask them to
S0192	because we ask them to yes
S0198	yeah and they should if you ask
S0192	that be a bite of a pain in the arse actually i couldn't get hold of my dad
S0198	so if you don't have internet and your internet go down you can't use your printer
S0192	if we don't buy a cable for it you can buy a cheap printer to computer cable but they don't tend to come with them anymore
S0198	oh right
S0192	erm so this will work with wireless but yeah when if the internet be to go down then we couldn't print
S0198	yeah i'm not sure if my parent have a wireless really
S0192	yeah might not be might just look similar there be quite a few model that look pretty similar
S0198	it's very the the front of it look look like erm it's something well they do look identical
S0192	but you're alright with me get that one
S0198	that's good yeah definitely i trust your judgement
S0192	they have a lot of sales erm the other one be slightly cheaper but the ink be like seventeen pound a replacement or something i pay ten pound and get three replacements
S0198	oh have you
S0192	for each one yeah some other one that everyone say work
S0198	oh awesome yeah definitely it's all about the ink cartridges really and how much they cost
S0192	definitely
S0198	that's what you're gonna continue to pay for every like month or couple of months
S0192	mm
S0198	around the year they be just run a printer's expensive fuck a car
S0198	or anything else
S0192	my dad say the other day oh running's a car's cheap i be like whatever i mean he doesn't even pay for it really
S0198	yeah i know he he get free fuel
S0192	doesn't pay for his car so that be a bite of a funny thing to say oh well
S0198	you need money to buy a car to begin with although 's car he pay three hundred pound for it
S0192	oh
S0198	it's a little old car and obviously it fail its mot but he be expect that but he have be rid it to er from london quite a lot lately and
S0192	and he's get his use out of it three hundred quid
S0198	just for three hundred quid he's earn it yeah
S0192	he still do he have to pay that every year
S0198	what to re to
S0192	yeah get get another car
S0198	well people seem to anyway
S0192	yeah i know
S0198	oh what to get another car yeah he probably will that's a
S0192	that's where you're gonna spend about five hundred quid a year just on upgrade your car and on and or maintain it
S0198	insurance
S0192	and more people spend like over the years
S0198	just you have to pay for an mot don't you and like everything cost
S0192	yeah road tax lessons
S0198	yeah
S0192	we be become the minority though of people that can't drive
S0198	no well chris say when he have drive lessons they be ten pound a lesson
S0192	oh it be over twenty when i do it
S0198	i know in the
S0192	i reckon they're probably twenty five
S0198	which mean in er in the space of like seven years they're like seven years they've double in price
S0192	yeah
S0198	from when he be seventeen to when i be seventeen
S0192	well they've just like double in price
S0198	it's a joke ten pound a lesson be pretty reasonable isn't it be that cos fuel double in price i doubt
S0192	i guess for the driver that's pretty cheap isn't it
S0198	mm
S0192	you're not get pay much an hour people pay ten pound an hour
S0198	yeah
S0192	to sit in his car and drive it around
S0198	that's true petrol be expensive as well
S0192	well just
S0198	maintain cars be expensive
S0192	mm er if you can do those crash course for like five hundred pound learn to drive in a week sort of thing
S0198	be they still five hundred pound
S0192	they be i don't know if they be anymore
S0198	i'd be tempt i think they be more like a grand maybe that be just that's still a lot of money isn't it a thousand pound
S0192	yeah it be a lot of money
S0198	yeah
S0192	well for the two of us to learn to drive
S0198	yeah well yeah see that's the thing i have get to the point now where i'd like to confidently get in a car and drive it regardless of like the the licence
S0192	but even if you have lessons and even if you pass the test you're not gonna do that very often so you're gonna have gap
S0198	you're always gonna be
S0192	of two or three years and you're gonna be a bite
S0198	you're never gonna be that comfortable in a car
S0192	wary no you're gonna be wary
S0198	so long as you're confident enough though
S0192	i mean i could probably drive a car now
S0198	mm
S0192	just not very well i don't know if i could drive a car actually or reverse like pull out of that park space and then
S0198	yeah
S0192	i don't think i could i'm alright too many cigarettes
S0198	yeah
S0192	definitely we should probably eat soon shouldn't we
S0198	yeah yeah
S0192	just need to do another minute and it's all good
S0198	those two have be sit there as well
S0192	yeah we don't wanna get in the habit of smoke cigarettes
S0198	yeah i'm gonna come back sunday
S0192	i think we've be smoke a load this week really
S0198	and that's gonna be the first thing that i'm gonna do
S0192	when you're away with your parent i don't wanna
S0198	cos they're gonna come in and i don't want to don't want to start smell like a smoker again
S0192	no well we've get tomorrow if we don't smoke in the morning
S0198	yeah
S0192	that should be alright i'm like our hello kitty towel it's very cool
S0198	mm
S0192	i wonder if get one of those with his hello kitty guest house
S0198	guest house statement yeah all pink
S0192	do you hear about
S0198	where be he where
S0192	he say i be pretty feel pretty crazy
S0198	where in northern thailand why be there
S0192	he be in pai
S0198	hello kitty guest house
S0192	i don't know he be in pai pai's obviously change quite a bite
S0198	mm
