S0192	yeah one of them i attach we're go to have some permanent music set up
S0198	absolutely
S0192	in here
S0198	and something probably er don't need to plug it in yet do we
S0192	if you just get an mp3 player
S0198	just to make sure it work and put this away
S0192	yeah so
S0198	so you can charge your your mp player via this as well you don't need to i mean you can do it on your computer obviously do that have
S0192	oh do that work for both of them
S0198	it work for a plug socket yeah just anything that's a samsung device will use the same connector
S0192	alright do you wanna grab an mp3 player
S0198	yeah put it on here
S0192	alright we should have some sound minimum maximum some speakers
S0198	get some music go then
S0192	where's the mp3 player where's that little cable as well
S0198	you throw it as it's it's between your feet
S0192	it's get a plug here
S0198	for some reason
S0192	right this whole
S0198	now these speakers haven't be use for about six years
S0192	where do this i always struggle to formulate again use
S0192	yeah this one go
S0198	that's a good
S0192	here
S0198	that's good news
S0192	yeah
S0198	obviously not the volume too loud at first
S0192	no get to choose an artist just whoever or whatever come up first
S0198	the power's on so that's the half promise
S0192	hopefully it'll work
S0198	that's promise
S0192	can't be sure though we need to check both speakers
S0198	oh they're work they're both work
S0192	be they both work
S0198	yeah
S0192	see if it's
S0198	that's fine isn't it
S0192	it's not very loud or
S0198	i mean you can go louder but yeah
S0192	it's erm it work
S0198	it's some speakers isn't it
S0192	we'll just make
S0198	we just need to clean them up
S0192	so therefore that
S0198	and once they're hook up to the i mean we can't have music too loud here anyway
S0192	no
S0198	we've get all kinds of neighbour that we have to think about
S0192	we've get some sound there so that's good so hopefully they won't pop round anymore
S0198	no
S0192	at least we won't have people round
S0198	he be go to post it through the door weren't they
S0192	yeah
S0198	bite lazy in the car unless he's do a few round which i hope he be
S0192	yeah
S0198	to kind of do it on their way out to do something
S0192	he's only just round the corner isn't he
S0198	yeah
S0192	i wonder how many properties you can have round here
S0198	i know probably a few
S0192	shall i make another rollie
S0198	there's a yeah there's a couple down the road that have get the young the er outside of their apartments so
S0192	there be
S0198	erm
S0192	that's useful shall i just make one of my list
S0198	yeah
S0192	yeah erm
S0198	just need to get and this will see what your dad bring up see how that because i mean we're gonna he's gonna have a bite of stuff i think i think we're probably gonna want as least another bookshelf or something erm to put some book to like to make it tidier basically
S0192	no definitely
S0198	yeah
S0192	what
S0198	erm
S0192	on top of what we're get
S0198	yeah i think so
S0192	so we need to buy one i mean maybe argos have a cheap bookshelf or something
S0198	it probably do
S0192	write it down here
S0198	should have probably grab at argos catalogue while we be there
S0192	oh be they free
S0198	i think so i don't even know if they even do you remember you'd be able to go in and there'd be a pile of them but
S0192	be argos
S0198	everything's online now isn't it
S0192	yeah be it the cheapest of place until we get the internet we're in a bite of limbo really and until you get back form dorset
S0198	yeah
S0192	typical you go to dorset just after we move in
S0198	i know sorry darling
S0192	it's rubbish
S0198	it's the one time of the year there's the bloody steam fair
S0192	i'm sure that's important the steam fair
S0198	well my dad's pretty excite about it they would have be pretty gutted if i couldn't have go
S0192	they don't seem bother that i can't go then
S0198	no i mean my mum be would have quite like it of course she do she's like she's a bite more like your mum i suppose they'll hopefully get to spend some time with with you as well as me this year i suppose
S0192	yeah if possible
S0198	just to build a relationship or whatever
S0192	my mum want you up for christmas if that's possible
S0198	but erm yeah obviously i'll come up maybe the week before christmas
S0192	yeah or the week after
S0198	and then or the week afterwards christmas day box day christmas eve they're
S0192	for your family
S0198	they're a no go
S0192	no of course i'm not expect you to come
S0198	but no yeah no
S0192	i don't think they're expect you to come up either erm bear in mind that i've get two families as well
S0198	where be you go be it your mum's for christmas
S0192	yeah i can't really
S0198	just for sentimental that that's
S0192	yeah i can't really disappoint my mum too much by not go to hers
S0198	mm i think she'd be a bite upset
S0192	i'll probably have to
S0198	why isn't any we don't have any like piece of er cable attachments for cameras that we don't use that we can string across that that erm oh it's all attach isn't it
S0192	yeah i don't think they're thin enough or long enough
S0198	that we can put through the
S0192	that cable we just buy would've work
S0198	what about this to hang across the thing to attach the curtain rail net to
S0192	that's much too thick to go through a curtain
S0198	oh right to actually go through the curtain er no it wouldn't go through the curtain the curtain would still have to have something to hook it to hook onto this
S0192	but if you've just get one piece of rope that go through the curtain
S0198	this would just be the wire
S0192	be it possible to go through the curtain be there like a
S0198	i don't know i'll have a look
S0192	have a closer look
S0198	they're big old curtain
S0192	if you be to get just a piece of rope of a piece of string would it go through
S0198	no
S0192	no
S0198	no the curtain need to attach to something everything's er
S0192	those little bits for the thing
S0198	it it's not horizontal it's long width ways
S0192	we'll figure something out i need to see what my dad's get maybe the curtain that he's get be different
S0198	slightly different
S0192	i didn't look at anything too closely before so i should do that
S0198	i think they do yeah but then i guess the wire need to what we just need like you say be a little piece of wood that go along there basically a little bannister that's so little that it hook into those hook
S0192	yeah
S0198	yeah don't know if that make any sense
S0192	i'm not gonna sleep in there until we get something sort cos it's too bright and i'll see what it's like with the curtain close tonight
S0198	yeah
S0192	but i can't see it'll be
S0198	well not with that other door expose
S0192	no it's pretty bright with the street lamp just there
S0198	yeah
S0192	you need like blackout curtain you need something thick blind would definitely help can we shut that door if we're gonna smoke inside
S0198	yeah i suppose we should we've still get a window open in here though haven't we to air it
S0192	yeah
S0198	yeah it'll be fine
S0192	if we just sit at the back window
S0198	yeah sun's go in now anyway
S0192	it have
S0198	more or less
S0192	of course it be it's england it's fleet and
S0198	i know doesn't last long
S0192	won't last you long
S0198	enjoy it whilst it last
S0192	be we gonna prepare the chilli con carne after
S0198	yeah
S0192	yeah
S0198	i mean yeah it doesn't we can just get it on can't we see how that beef mince be
S0192	can i borrow your glass
S0198	it's probably not as erm they're in the bathroom
S0192	it's twenty percent fat so it's not too bad
S0198	be this be this too
S0192	no no that'll be fine
S0198	too big
S0192	that'll be fine
S0198	erm it's certainly cheaper than the mince we be buy that's five hundred grams for two pound
S0192	that's pretty good isn't it
S0198	that's really good
S0192	it's like the same as it be in lidl's
S0198	i think like we'll be get our beef from there from now on regardless of quality still probably a step up from expat marts like beef
S0192	yeah i think so
S0198	i mean that be a bite on the one side wasn't it
S0192	gonna finish this beer for first
S0198	yeah mine's always erm be a little bite smaller but i have be drink more than you recently
S0192	yeah i haven't be drink very much at all
S0198	although i didn't drink from i drink last time i drink be friday before i come here
S0192	that's pretty good
S0198	or smoke a cigarette
S0192	do we
S0198	saturday sunday
S0192	that's really good be do we sit on the floor out here
S0198	yeah that's fine
S0192	alright battery's still full on this thing
S0198	yeah be it
S0192	wow
S0198	seem to have do quite a few hours it's pretty good where's the lighter
S0192	pretty good er
S0198	oh think i've get one
S0192	oh there's two over here now
S0198	oh all the box be here though for sit on
S0192	no they're not you're not gonna be able to sit on that
S0198	no i know but it's kind of in the way of
S0192	oh be able to get it move it
S0198	move it out the way
S0192	you can really hear those children here can't you
S0198	yeah
S0192	i'll just leave that there i'm sure it'll be fine
S0198	it'll be good when we get a couple of the chair
S0192	that glass there you get it
S0198	i'll get that
S0192	sit there just on the floor
S0198	yeah
S0192	no one out here be there
S0198	get out of your way
S0192	don't think there be
S0198	you see do you ask him about the rubbish that we've get
S0192	yeah i do he say he didn't know
S0198	yeah
S0192	but one of the people who live around here she might know so we'll just have to go into the office well he say to ring them i say i'd probably just
S0198	pop in
S0192	pop in yeah
S0198	save myself the credit thank that's a point where
S0192	pretty pretty close
S0198	think my parent would have phone by now so i suppose i'd better have it i bet he want to he just hasn't
S0192	yeah try to let you settle in your mum's like oh leave her alone be she work today
S0198	yes eight till eight
S0192	oh she be
S0198	yeah
S0192	that's a long old shift
S0198	it's a bite really long she doesn't come back very happy
S0192	no i'll after do twelve hours
S0198	and she's tire and she's just try to do her best to function
S0192	i'd say she hasn't be use to work but she's be do a lot for them well she as do a lot for your nan
S0198	yeah that yeah
S0192	and for the grandchildren
S0198	if only she could get pay to do that
S0192	yeah definitely wouldn't be a bad job would it
S0198	she can't
S0192	she be be pay for your nan though wasn't she
S0198	yeah about fifty pound a week
S0192	mm it's not a wage
S0198	not a wage no
S0192	no
S0198	but you also get she also get additional help in other ways through other benefit and things to be a for be a carer
S0192	so there be benefit to it
S0198	wasn't major though but now that
S0192	she's
S0198	she's earn more money now like she like the other month she's like get eight hundred pound and she's like you know that's what's incredibly useful that's a massive boost to my monthly income
S0192	yeah it really be to not have that and then to have it
S0198	yeah
S0192	fifty quid a week be only two hundred quid so
S0198	mm
S0192	she know the difference
S0198	so she need to keep work
S0192	be that after tax that then
S0198	i think so
S0192	yeah sound about right if she get about a grand
S0198	yeah and she's not full time but she keep do all this full time hours
S0192	my mum's on that contract
S0198	oh be she like
S0192	so you know like in in america where they
S0198	oh yeah there's no
S0192	that's mine
S0198	oh sorry
S0192	where they erm they keep them on part time job form
S0198	yeah yeah
S0192	like i'm one hour away from be full time so they don't give me
S0198	we do the same
S0192	yeah
S0198	and my brother doesn't get any sick leave full time job no sick pay
S0192	what a joke
S0198	specsavers retract it because too many people take liberties
S0192	well you would never take
S0198	so he doesn't actually get sick pay
S0192	oh that isn't good
S0198	say i think that's illegal in england isn't it
S0192	what do he say
S0198	don't know apparently not they're not gonna be break that law
S0192	it's perfectly fine
S0198	so he say he go in once and he be clearly so ill that they send him home but like the last week he have a flu type thing like he say he be really ill but he still go to work still kind of go through it and i say that's great so now that everyone you come in contact with for a week be go to go home and get sick
S0192	yeah have get the flu
S0198	because your company won't pay for you to have a day off work
S0192	it's ridiculous
S0198	it's terrible
S0192	stuff just seem to be get tighter and tighter doesn't it job don't seem to be get better
S0198	no
S0192	they seem to be cut back on everything after the recession there be like you know
S0198	like the
S0192	want a job in a hotel need to speak three languages
S0198	yeah
S0192	have a degree in hotel management or something ridiculous
S0198	i know and if you're gonna take away people's sick pay well then just be like look we'll meet you in the middle and we'll give you six days sort extra vacation
S0192	yeah
S0198	pay leave
S0192	yeah
S0198	cos that's what you would have i suggest you keep that as a sick pay
S0192	yeah definitely
S0198	people wouldn't but then they can't call in sick so it's up to them isn't it
S0192	yeah sometimes you really be too sick to work though
S0198	yeah
S0192	teach especially when i have some basically migraines i'm pretty sure
S0198	yeah
S0192	it's pretty horrible just teach when your head be pound and you've get to perform and you've get to talk to people
S0198	it's terrible
S0192	not nice
S0198	i guess it's in an ideal world be that class that they do but you can't really do that in our job
S0192	depend the class or the course that you're run
S0198	yeah it do depend on the class and the course get through it though and the conversation programme come and go didn't it
S0192	it really do yeah six weeks of that be pretty quick
S0198	yeah really quick
S0192	erm
S0198	they weren't difficult days be they
S0192	no three hours a day
S0198	mm
S0192	of work most people can't confess to that it's pretty good
S0198	it be pretty good
S0192	yeah
S0198	well probably won't have that in our next job
S0192	no probably won't in any job for a while
S0198	or the job after that
S0192	by the sound of things in saudi they make you work full days
S0198	yeah
S0192	and we're gonna be at different institute so
S0198	mm
S0192	it's we're not gonna see each other in the day
S0198	no
S0192	not at all i be say to my friend some of my friends have ask about our marriage and stuff and like be you actually marry and it kind of annoy me a bite that like apparently in my dad's house so 's
S0198	yeah the doctor
S0192	missus they're marry now and somebody else all ask my dad like within a day of me us post that be marry like write it up or something and so do
S0198	mm
S0192	and he say no we're not marry
S0198	yeah
S0192	and i be a little bite like well
S0198	that's what my i'm look at that sort of thing
S0192	i say it you know i explain that in our eye we be and i say think about it i've live with her for nine years i say we've basically or we haven't quite get but we're get a joint bank account we work together
S0198	mm
S0192	teach together pretty much and have always live together how more marry can you be other than have children
S0198	i know i don't know why people be so it surprise me that some people still that i think be more not open mind just they don't care themselves about marry but still ask and get excite and
S0192	don't deem it yeah yeah
S0198	they still think of it as be significant if you've actually go and do it
S0192	yeah
S0198	sign the paper
S0192	guess people must think that we do to have do it
S0198	i i guess so
S0192	that would try to explain that but no i we're not that traditional
S0198	no
S0192	get a wooden ring
S0198	yeah
S0192	you be wear it earlier oh you're still wear it now
S0198	i'm still wear it it's be er scratch and dent quite badly oh my god
S0192	have it
S0198	yeah look at that side
S0192	let's have a look
S0198	that might have be from
S0192	oh wow yeah
S0198	yeah
S0192	yeah it be
S0198	it's get a bite of wear to it i quite like it
S0192	do you
S0198	yeah sorry it's damage through
S0192	oh it doesn't matter
S0198	that side's be seem more pristine
S0192	doesn't bother me just when it's too damage for you we'll get you another one
S0192	say that be a bite of a fart wasn't very girly
S0198	shut up whatever
S0198	it be really scratch
S0192	let's have a look
S0198	i wonder if i maybe i've be wear er carry too many box and stuff
S0192	i can see that scratch
S0198	probably wasn't the best idea
S0192	oh i do see a few there
S0198	yeah there's a real impact spot isn't there
S0192	oh wow that's really wear yeah and scratch
S0198	and do you know what i haven't even be wear it at home very much
S0192	maybe you can buff it
S0198	i've do that i do that yesterday
S0192	do you
S0198	yeah
S0192	maybe you can buff it and give it a polish
S0198	yeah that's true shine it back up
S0192	but erm i'll just replace it for you
S0198	i mean as long as the ring itself remain intact i don't mind
S0192	maybe if we actually sign in next year then er we'll get each other
S0198	oh what be that
S0192	we'll both get each other one
S0198	it's an earwig where's that come from
S0192	it's like an ant with an extra
S0198	mm i can see an ant be batter by an earwig
S0192	it's an elongate thorax do you know that's call a thorax
S0198	no
S0192	it's the head and the and then the abdomen and then the thorax
S0198	oh
S0192	i don't know why i remember that or where i learn that but
S0198	yeah i be gonna ask
S0192	i i've know it since i be a child
S0198	mm oh just do a little it look kind of angry
S0192	yeah it doesn't look too happy
S0198	oh he's figure it out now he's forget how to walk or something
S0192	really need to stop smoke cigarettes
S0198	yeah
S0192	it's only because we've just move in drink a bite let's smoke a cigarette with as well
S0198	cos we can't do too much else we're in limbo
S0192	we be in limbo
S0198	it's like be on holiday basically and when you remember you just
S0192	well we're still be pay
S0198	yeah
S0192	the exchange rate's good at the minute i hope it stay that
S0198	yeah that should go in friday shouldn't it
S0192	it's it's how it's be it's be in ninety days what's today and friday i do want
S0198	so do we get our severance on friday too
S0192	no maybe it can but it probably not
S0198	so yeah i remember the same old thing in our
S0192	it can take up to two weeks or something like that er she hasn't contact me since
S0198	no
S0192	she didn't replay to any of those email i imagine she's quite busy at the moment
S0198	yeah well yeah she's set up all the new teachers isn't she
S0192	there's lot of people leave and lot of people join
S0198	yeah
S0192	so i understand she's probably quite busy
S0198	yeah it must be a really busy time of the year isn't actually at that job
S0192	mm she definitely she have to go through the rigmarole of hire
S0198	mm
S0192	you've get a whole different round of teachers there now we're still on vacation
S0198	's go to be greet some other people in her way
S0192	yeah she end up be a funny one didn't she
S0198	yeah
S0192	she be a strange one
S0198	i wonder if she's she's she keep talk like she's go to leave in er after christmas but
S0192	she might have be say that for years
S0198	yeah
S0192	she may
S0198	maybe she will just out of like shit i'm go to i can't like just to save face almost
S0192	mm
S0198	cos 's leave
S0192	oh he be leave yeah
S0198	's go to have a baby
S0192	he say to me to yeah it's all change erm her and obviously get on really well
S0198	yeah
S0192	and i do like but at the same time she's a complete fuck up
S0198	yeah
S0192	she's a proper alcoholic
S0198	yeah
S0192	but it's you know she start off so
S0198	she must work feel horrible sometimes
S0192	mm sun's back out
S0198	mm
S0192	i mean the sun it's nice yeah it's not good
S0198	no the amount of wine that her and can consume and still go to work be pretty
S0192	she's go to have to calm down on the front when she move to back to america with
S0198	yeah
S0192	yeah
S0198	absolutely yeah she really be hopefully she'll just get like really active and proactive and stuff
S0192	lose a bunch of weight
S0198	cos yeah i can't i can't picture them in
S0192	she's carry around about twenty gallons of wine
S0198	in america yeah i know
S0192	in that belly and that arse pretty sure she be
S0198	there's a lot of wine there
S0192	mm and go a bite schizo when she drink
S0198	mm
S0192	she click and she's a different person very very repetitive
S0198	yeah
S0192	but even before that she's a different person repetitive be her pretty drink and then pull face be her extremely drink
S0198	yeah
S0192	or she's fall asleep on random people at that point remember when we take her to that bar
S0198	ah
S0192	i have to put her in a taxi
S0198	yeah
S0192	what be that call that place
S0198	where be that
S0192	and it's where 's band keep play
S0198	you have to put her in a taxi
S0192	be it call radio star
S0198	ah radio star yeah that be when it happen ah no that night like it yeah that be that be a that be a bite of an eye opener
S0192	yeah
S0198	cos i mean i don't think we'd ever actually go out drink with her in public
S0192	no and it might explain why she doesn't go out
S0198	so there be no one yeah there be no one there
S0192	we be drink quite heavily include
S0198	yeah
S0192	erm
S0192	yeah we be all drink quite heavily just take a lot of shots of whiskey in the park or whatever and i didn't like in the end
S0198	yeah
S0192	she come up to me that night straight away and know that i have a
S0198	a bottle to
S0192	obviously know that i carry it around
S0198	yeah
S0192	so i fill her up a glass
S0198	i mean she take it though so she mustn't have mind that much
S0192	no i know she didn't mind she want it
S0198	yeah
S0192	it be the fact that she kind of use me but then didn't really talk to me
S0198	oh right then yeah
S0192	that group in general get a bite funny with us
S0198	yeah well they just didn't
S0192	don't know what happen
S0198	bother anymore do they they get bore
S0192	no the first semester or in the second semester they be
S0198	yeah
S0192	we have a gap go on vacation come back
S0198	maybe i feel like you have to keep go to radio star to keep see those people
S0192	yeah didn't really want to
S0198	no
S0192	so we didn't erm
S0198	i mean that be fine and her tea party suck
S0198	that be terrible i don't like you didn't wear a dress
S0192	me too
S0198	it wasn't there be nothing mad about that tea party
S0192	well we kick it into gear i think when we arrive
S0198	yeah someone's get to step it up right
S0192	yeah i think be fairly please that's what's er i didn't like and they be both very
S0198	yeah so they're go back to korea
S0192	yeah
S0198	how do you know that
S0192	cos their status be like seoul bind or something and i comment er underneath it like back to korea so soon and she just like it so i don't know if she's go with
S0198	mm
S0192	i presume she be cos they've just get marry didn't they
S0198	er to teach though they may they may be just transfer or
S0192	i know didn't sound like it
S0198	there's no i don't feel like that it would be a comeback that quickly
S0192	it sound like it but we didn't think would
S0198	i know but we didn't come back that quickly
S0192	they may have test the job market there and it be the wrong time for saudi and they just turn round and
S0198	i mean when do they leave
S0192	and they don't have that much experience they've get no post celter experience they
S0198	they've be basically do a few months
S0192	they've they're like us when we leave the first time they do their celter and then be like er what job be we gonna get
S0198	mm
S0192	and they're like well actually i quite like korea i reckon they be go back i reckon they've just weigh up some things and probably have a few job interview or try to get into place and didn't that's ah it's great though korea be too easy
S0192	and they'll do another couple of years there and then they'll er
S0198	they may have consider it if they've both what they consider quite good public school job or at avon university position
S0192	mm yeah they might have be able to get a uni job
S0198	it's really just luck of the draw
S0192	we could have get in at what do you think that would have be like
S0198	i feel like it would be like work at where we do but that your
S0192	but just less organise
S0198	yeah that your job be be split over both program like you do have at like at everyone teach a bite of everything maybe
S0192	yeah
S0198	and it it be still the same yeah but like your cos do you remember they would they say you get eight weeks pay holiday but they be always dodge the question of how their eight weeks happen
S0192	mm
S0198	and they wouldn't like they didn't want to say and i'm pretty sure it's probably the same at the end of every six weeks or semester or whatever you get a two week break or whatever it depend what i feel like it would've be on the same maybe work you even more
S0192	yeah
S0198	we didn't have any office hours i don't know if do
S0192	not have any office hours be amaze why don't all job do that
S0198	i know it's just do your job and make sure you do your job cos i don't know they don't know when they need you it depend on the type of job
S0192	i mean surely like in saudi do you have like a boss somebody that's look over you or be things actually a lot more chill than they seem to be
S0198	mm
