S0037	no no but like from today it's a if you get catch water your garden it's a thousand pound fine
S0115	that's quite that's quite bizarre you know
S0037	ridiculous isn't it
S0115	it's quite strange consider the amount the sheer enormous quantity of rain that fall in england
S0037	i know i know well we've get a rainwater thing haven't we so can just collect it
S0115	why be they sort of do all this all this stuff anyway about it's rain now
S0037	i know it's rain now
S0115	be you suppose to collect your own water or something
S0037	i think it hasn't be rain for a while though
S0115	um i mean can they not take water from the sea somehow
S0037	well i don't know
S0115	yeah uh i suppose like that that's the most efficient that you know with the with um reservoirs presumably you have to store water in a reservoir you can't store it in in in some way to prevent it from evaporate
S0037	i don't think plant like sea water that much in the sea don't know
S0115	i guess
S0037	well
S0115	a a lidded reservoir
S0037	no i suppose it always do evaporate it would be quite a big lid for the reservoir
S0115	yeah
S0037	so
S0115	but it's just be it's just not perhaps that that possibility's there isn't you know it would be too expensive to uh
S0037	put a lid on the reservoir
S0115	to to lid the reservoir
S0037	i think it most definitely would be they could store it underground maybe
S0115	depend what you lid it with though doesn't it
S0037	could store it underground
S0115	yeah i mean presumably there's some reason why they because they collect the rainwater but um
S0037	i dunno
S0115	i suppose there could there could be able a method of of try to keep
S0037	but you're right it's rain all day today
S0115	cos cos it's it seem that the volume be there you i mean
S0037	yeah
S0115	somehow anyway
S0037	but i bet they'll still water the grass at king's and all that they'll just pay it won't they
S0115	um i don't know uh they they they would be pretty exempt i imagine cos they're a public um institution or something
S0037	yeah be it just private home then
S0115	guess so yeah i imagine you could get round it if you if you're a public institution no that's never well it use to be hosepipe like um
S0037	yeah
S0115	they always use to have those things but but um uh it it's pretty wasteful i suppose innit all the get a hosepipe and just like sort of let it let it run
S0037	squirt it around yeah i suppose it be but if you're grow stuff like we're grow vegetables i mean i'm not gonna be like let them dry out be i
S0115	well part of it they'd have to prove they'd have to prove that you that you water your garden or something they'd have to come round and i mean sort of
S0037	look at your garden yeah see if it's wilt
S0115	and then um you could you could be frame though someone could uh
S0037	ah and like neighbour take picture of you like the uh stasi
S0115	get get a hose hose pipe and sort of spray like could get their hose pipe and spray it on your garden then like
S0037	then you can like remember
S0115	well that that's like one of those one of those stupid petty garden war where
S0037	yeah yeah
S0115	where neighbour chop each others' tree down
S0037	that's right yeah or argue over like spend hundreds of thousands of pound on legal cost about like like land the size of like a stamp or something
S0115	like border border that happen quite a lot i think you know when have work in litigation there be a lot of case you know the fee be enormous like
S0037	why do people do it people've just get more money than sense haven't they
S0115	well yeah basically i think that's that's mainly um but they're also just some people be just genuinely bad people so you have to do something to um
S0037	yeah yeah but if it be like a tiny strip of land then you would just be like d'you know what have it like
S0115	well i mm i it's not it's not be something that well some that i ever really think of but you've get a kind of neighbour that decide to sort of rebuid a fence and then sort of you know put his fence sort of
S0037	yeah right on your bite
S0115	like a a metre further in
S0037	they do that to me nana like me nana use to um have
S0115	i think it's just bad people isn't it
S0037	me nana have daffodils
S0115	person who's always get to
S0037	have all these tulips and daffodils a massive big load of them against against that fence in her old garden where we where she use to live and the council come and replace the fence um cos the her neighbour be horrible
S0115	yeah i know yeah i remember you say
S0037	yeah and they replace the fence cos um when it be me marge use to live next door they have a lower fence cos they would chat over it but they get it she have it replace when these horrible neighbour come and have like a high one
S0115	yeah
S0037	so then they move it though and like she lose all of her flower they all go on the other side of the fence they move it over like by
S0115	how who who move it
S0037	the council move the fence by about you know
S0115	but how i mean that can't just happen can it or be there some corruption or something
S0037	dunno just by mistake i think not on purpose
S0115	so she she wasn't there to see see it happen
S0037	well i don't think you realize until the spring time come and all the flower be on the get eat by the like horrible like staffies and that next door
S0115	fuh
S0037	never mind
S0115	there um uh they're i guess some them sort of families cos like we be watch the uh that um that gypsies program weren't we
S0037	yeah
S0115	uh i suppose when if you see those sort of staffie type families it it remind you of the similarity to some of the um gypsy families like a cultural similarity
S0037	yeah but i mean you can't say that anybody anyone with a staffordshire bull terrier's bad i mean it's not the dog's fault like you say before
