S0254	it's just useful to have for things that you have to buy that be very expensive and you don't have the money right now you know you will in like and spread over two or three months but to pay it all in one go be just a bite too much
S0253	yeah
S0254	so why pay interest on your overdraft when you can put it on a credit card for free
S0253	yeah
S0254	just make sense you've just gotta be clever with it
S0253	i just yeah i just lose track of it and then most people i know who have get credit card always have credit card plural never just one credit card
S0254	yeah whereas i just have one
S0253	i think of it a bite like the woman who swallow a fly
S0253	honestly it's like
S0254	like yeah i know i know it do
S0253	they're not do it
S0254	most people get out of their depth and then they can't pay what they've buy but that's when people go shop and put their shop on a credit card and then they're like oh yeah i'll put it on the credit card i'll put it on the credit card and then they completely lose track of how much they've get on their credit card and then they can't pay it back in monthly instalments before they have to start pay interest
S0253	yeah i dunno i just i whereas i'd like to be frivolous i'd like to be frivolous and just buy like a really nice camera or a really nice computer
S0254	yeah i know
S0253	for myself and and then just worry about it later but i just i always feel that i need to watch what i spend and stuff
S0254	yeah
S0253	don't know but erm
S0254	i mean i would say if you be gonna buy i think if you be gonna buy like a mac or something
S0253	mm
S0254	i'd put that on a credit card
S0253	well then have the point of say i mean get a mac didn't he and then he say i say how
S0254	
S0254	oh do he
S0253	and i say i say how
S0254	pay for by mummy and daddy like his flat and everything else he own
S0253	yeah i say
S0254	well it's true though how do he afford a mac on like one day a week employment
S0253	i say erm
S0253	like and he say well well basically a case of you get it on a credit card or borrow it off my parent and you know they don't
S0254	oh and pay them then
S0253	well they don't charge interest my parent don't
S0254	the bank of mother and father
S0253	mm
S0254	erm well that's right you could put it on a credit card and you could put you could pay three hundred pound off it straight away
S0253	yeah
S0254	and then put a hundred pound each month for the other six months or whatever it would be
S0253	yeah i mean you can afford it if you if you're really you're commit
S0254	if you really want it yeah just do you really want one
S0253	nope there's other things i want
S0254	exactly
S0253	as well like an electric toothbrush
S0254	mm and flight to australia
S0253	there's that as well haven't hear actually she be mean to ring me this weekend
S0254	yeah
S0253	and mum say she hasn't be in touch i'm sure she's fine
S0254	i'm sure she be she'll be have far too much fun
S0253	there's just a picture of her today in some kind of vineyard
S0254	oh right so she be alright then
S0253	erm
S0254	what have i be tag in something borrow bridesmaids dress from the eighties
S0254	i think something borrow apply to her only i will point that out
S0253	you don't have to wear something borrow do you
S0254	no
S0253	er do you watch that gogglebox
S0254	i have watch it on the past it's quite funny
S0253	yeah
S0254	there's a family on it that own a store in market and it's
S0253	really
S0254	yeah there's quite a few and families there be them that own the store there's someone in like or something in think and there's a
S0253	yeah
S0254	old couple from then there's like a posh couple i don't know if they've get different families or on it now
S0253	yeah
S0254	haven't see any of this
S0253	that's 's new dog
S0254	ah that's cute it look like a toy
S0253	probably be
S0254	i be say to my mum yesterday cos i be genuinely think about it as when i be drive home on friday i be like wouldn't it be really great if i go home and then mum have just buy a puppy and there be a puppy there
S0253	really
S0254	yeah and just be think about it and i be like that would be really cool and i tell my mum and she just start laugh and she say well
S0253	oh right and
S0254	so that didn't happen
S0253	i i i i think i think you be gonna say that and then she have one
S0254	oh no no i keep tell her that she should because it would make her go out for walk and stuff cos she keep go on about how she want to walk more and like every night they need to go out and i say well if you have a dog then that would make you go out wouldn't it
S0253	yeah
S0254	and she be like no
S0253	it's
S0254	don't start
S0253	be say like cos i i say i'm i'm devoid of something to do with my even and he say well he say i wouldn't
S0254	have a dog and a baby
S0253	yeah that's your solution but he say like because of er he say it it just get him out the house and he'll he'll get up really early in the morning and take him out
S0254	mm
S0253	and it's just a nice thing i use to love walk the dog
S0254	yeah
S0253	erm it's just a good way it it's you know it's sort of sad that you feel you have to have an excuse to go for a walk but
S0254	mm
S0253	have a dog just you're not you're sort of bite of company and you're not on your own and there's kind of a purpose to it
S0254	yeah
S0253	you're not just
S0254	force you out the door a bite more doesn't it cos you have to take for a walk
S0253	yeah erm so he be it be something like that i'm not sure i could handle a dog
S0254	well it's like that pre baby stage isn't it everyone i know who's have a baby recently have have a dog about a year earlier it's like a test
S0253	well say it do prepare you
S0254	yeah
S0253	he say he say it he say it he say it sound stupid but he say it just get you use to have to think about
S0254	something else
S0253	yeah and something depend on you and things like that so i'd be really i'd i'd like a dog but i just can't picture have one now
S0254	mm
S0254	it would be a cruel in a small flat in and although we be near a park so the thing be though it would be on its own from about eight in the eight o'clock in the morning till oh i suppose you come in in the afternoon
S0253	but not always and then it could be on its
S0254	yeah
S0253	it could be on its own like eight till five or something
S0254	mm it's just too long isn't it
S0253	yeah
S0254	it's cruel
S0253	what dog would you have if you could have any dog
S0254	a spaniel
S0253	you can't you've gotta get over like the
S0254	i know
S0253	your childhood dog it just would never be the same
S0254	mm maybe
S0253	you'd get it and it
S0254	but berta's exactly the same as barney
S0253	but you'd get one and it just wouldn't be the same
S0254	mm
S0253	it's like it's like our friend when she get that cat
S0254	when she get the cat
S0253	so
S0254	yeah i really like border colly but they're too they need too much walk they're too lively i don't want anything that smell like your dog or be load
S0254	really energetic or would like destroy everything
S0253	so you're not look for an animal
S0253	per se
S0254	a stuff dog would be perfect
S0253	or or one that
S0254	a toy
S0253	like a taxidermy dog
S0254	yeah what do would you have
S0253	erm
S0254	cos i like tish but tish isn't fluffy she's not cuddly
S0253	i'd have one that like rescue children from mine
S0254	what a kangaroo
S0253	i be think more of lassie unsurprisingly
S0254	oh i be think of skippy
S0253	yeah
S0253	i don't think a kangaroo
S0253	erm
S0254	that'd be like i be say about the
S0253	i've never watch skippy but i'm start to think about that cos that's the thing isn't it like
S0254	skippy skippy
S0253	i don't have you ever actually see it
S0254	skippy the bush kangaroo yeah i have i've see one
S0253	i'm familiar i'm familiar with the theme
S0254	one episode or something
S0253	but they
S0254	maybe an end of
S0253	but how do a kangaroo save people from
S0254	he's fall down the well
S0253	but how how do the the do do the kangaroo climb down
S0254	i don't know
S0253	it's not the
S0254	just somehow get
S0253	it's not the best animal be it for
S0254	he just jump
S0253	jump around
S0254	yeah anyway maybe i haven't ever see an episode
S0253	i don't think i have i think it's one of those things that's etch into my brain
S0254	maybe yeah i make it up in my head
S0253	yeah could well do but erm
S0254	mm
S0253	do i tell you about the guy the other day
S0254	mm i don't think so
S0253	be that a miniature spider crawl on the wall
S0254	oh yeah maybe
S0253	mm i don't like miniature spiders do you know why i don't like miniature ones
S0254	cos it mean there's bigger ones
S0253	but it also
S0254	doesn't it mean there be no bigger ones cos the bigger would have eat it
S0253	no it mean that it's recently be bear to something to another one
S0253	that be its first little adventure out of out of the house
S0254	oh
S0253	but that's go in the wrong direction cos it will get eat by that one that live in the corner
S0253	the one in the office be really big now
S0254	be it
S0253	yeah
S0254	you be feed it
S0253	i've be give it give it pork scratch every day
S0253	it's massive it's like lake placid
S0254	oh god
S0253	yeah
S0254	you not kill it
S0253	no
S0254	how do you sit in there with it
S0253	cos it's i don't know i i feel a bite bad
S0254	you
S0253	i kill one today and i feel a bite bad about it
S0254	mm
S0253	i mean
S0254	it's the time of year though isn't it
S0253	well that one's be live there all summer and that's why i feel like i can't kill it it's get it's a bite
S0254	and now it's your friend
S0253	it's spend more time in the office than i have
S0254	it's more its home and yours
S0253	it's get a it's get a right to be there
S0253	it's like squatters' right or something
S0253	what's
S0254	yeah
S0253	what be i say before that
S0254	about skippy and
S0253	yeah well i know it be skippy the bush kangaroo erm in term of a dog i'm not sure
S0254	erm there we be that's what you be talk about
S0253	maybe like something like warm and kind of like cantankerous like like a kind of dog that's like it doesn't it demand your attention all the time and
S0254	yeah
S0253	like jake use to be just kind of fat
S0253	slow and and
S0254	an old dog
S0253	yeah
S0254	mm
S0253	arthritic
S0253	immediately arthritic have to like
S0254	i like cocker spaniels as well
S0253	mm
S0254	they're nice i don't like that many dog actually
S0253	don't you
S0254	no most of them just look a bite mm there's like westies or terriers they're all a bite yappy and a bite bitey i don't really like them
S0253	well isn't what's 's dog
S0254	er a lhasa apso
S0254	that's just mean
S0253	i love how she hat it though
S0254	i know
S0253	she use to love the like use to be like they'd put all these picture of it on facebook
S0254	but that's a classic case of a really really love family pet die so they buy a new dog and then they all just hate it cos it's this horrible mean dog that bite everyone
S0253	be that alfie alfie's the current dog
S0254	alfie be the current dog ted be the old dog who be a westie and be like i think pre exist i think he be dead old and he he must have be must have get him around the time that like they start have children
S0253	yeah
S0254	he be about nineteen or something when he die i think oh no maybe not maybe about how old must have be fourteen fifteen maybe
S0253	yeah
S0254	so he be about seventeen i think cos when he get very old he go to live er with his with their nan cos they be out at the time and stuff
S0253	ah
S0254	erm but yeah alfie's just a bite grumbly isn't he he doesn't really like people
S0253	well the funny thing be be that the number of time i've be round to her house for party and stuff and the dog's never there
S0254	yeah
S0253	it's always shut in the front room away
S0254	yeah
S0253	from everyone
S0254	alfie mm
S0253	yeah poor thing
S0254	yeah
S0253	i hope i've get a shirt for it tomorrow
S0254	mm have to go and have a look you must i think you will have won't you
S0253	perhaps
S0254	how many do we wash
S0253	what
S0254	how many do we wash
S0253	be it five
S0254	then maybe you won't
S0253	no
S0254	put a wash in tomorrow yawnsville
S0253	mm
S0253	yeah i'm gonna stop this now
