S0253	i felt a bite bad actually it today put say sorry i couldn't make the pub guy erm me and be gonna have you all for dinner next saturday so i just put and then i read it and then straight away and straight away just say i didn't say where i be cos i wasn't really sure whether he'd be invite on 's stag i mean i kind of presume not
S0254	mm
S0253	but i think he might be a bite offend and then i wasn't sure whether you know
S0254	oh yeah
S0253	i mean presumably 's
S0253	's know about it maybe he's go i hope he be
S0254	i dunno dunno
S0253	erm but then maybe not because it's his brother who's organise it and it might just be a case of like
S0254	yeah
S0253	his like the guy from the family and your friends from school erm so i just put i'm out that saturday erm would really like to catch up with you soon though and then and then put sorry that's my hen and then like everyone else follow suit
S0254	yeah
S0253	and it be like sorry that's the hen party but i didn't know whether to mention the fact it be 's stag cos i feel a bite bad that he's not
S0254	yeah it's not really
S0253	he's he's not they're not friends
S0254	for you mention it though
S0253	and er yeah if want to say sorry that's my stag do then that's fine but it's nothing to do
S0254	yeah
S0253	with me
S0254	yeah
S0253	but it's a pain it's a shame to turn down a free dinner
S0254	yeah
S0253	this side as well
S0254	yeah this side of
S0253	yeah
S0254	we'll go to his thirtieth though will we oh you're out aren't you
S0253	i'm go
S0254	i'm not go on my own
S0253	you're in spain
S0254	no i'm not
S0253	yeah you be
S0254	no i'm not
S0253	yoga retreat
S0254	no it's like the twenty sixth or something of october isn't it the party i'll be back then
S0253	but you're away the weekend before
S0254	i'm away the sunday the nineteenth to wednesday the twenty second
S0253	oh right okay yeah we've get that crappy gig book but i really listen to that band i just don't wanna go
S0253	and i've get i mean it'll be i'll be nice i mean if want to go that's great
S0254	mm
S0253	i'm happy to you know
S0254	spend an even with him
S0253	yeah it's just nice to go to gigs now like old time
S0254	mm
S0253	but i've get a feel that won't come along
S0254	no
S0253	so
S0254	mm
S0253	oh but erm i mean i'll see i'll see if want to go to that i mean
S0254	be he stay here be he that weekend
S0253	yeah he might go home that night he's gonna stay here for mogwai
S0254	yeah when's that
S0253	on the friday friday the twenty fifth
S0254	okay that's fine
S0253	erm so that'll be quite late one and then
S0254	yeah
S0253	i need to book off the the friday off so i'll as well
S0254	mm
S0253	right
S0254	and that's it you use up
S0253	no i've get one more day i should think
S0254	mm
S0253	so i'll just take a three day weekend towards christmas
S0254	yeah may as well
S0253	yeah
S0254	why be you look at stethoscopes
S0253	it's not it's the back to school section on the
S0254	oh
S0253	e45 cream
S0254	and bio oil
S0253	bio oil yeah
S0254	do they have clipboards
S0253	they've get aero bubblies on them or something
S0254	rescue remedy how many aeros can you buy can you like bulk buy them
S0253	yeah of course aero biscuits
S0254	mint chocolate multi bar pack of twenty twenty three pound
S0253	it'll be rrp it won't be anything special
S0254	think of like what do you call it industry price
S0253	oh because you buy load at once
S0254	yeah bulk buy aero bubble that say a pack of twenty total a hundred and forty so be there twenty in a so must be what's that seven in a box
S0253	yeah
S0254	and you're buy twenty but aero biscuit though be that like a twix but with aero bubble in the middle i think i've have them
S0253	what's the name what be they call i there's an amaze chocolate bar like the most amaze chocolate bar i've ever have echo they're call
S0254	oh yeah i love echo
S0253	and they're like
S0254	can you still get them
S0253	dark chocolate white chocolate and biscuit
S0254	yeah
S0253	they're just
S0254	yeah
S0253	unbelievable
S0254	yeah they be good
S0253	what be your favourite biscuit when you be a kid
S0254	erm i always like a twix
S0253	mm twix be awesome get really really happy
S0254	mm
S0253	cos he say about cos be say how he doesn't drink milk and he say like on his cereal he'll have like a drop of milk
S0254	like me
S0253	and he yeah cos i be say about how i i really understand why people don't like the idea of it and then we get onto like yeah things with milk and stuff you know
S0254	obviously
S0253	obviously
S0254	the obviously place to go with that conversation
S0253	i be pretty drink at the time
S0253	erm and then but then be just say how like he erm his his like guilty pleasure be like a muffin and a glass of milk
S0253	and i be like yes
S0254	that's a good pleasure
S0253	they be both of my favourite things
S0254	mm i'd understand that but i just don't like it
S0253	yeah it's weird isn't it
S0254	yep mm
S0253	let's play a game let's play
S0254	okay
S0253	let's play let's make a list of our christmas present now
S0254	i want i want a nice i want a flour sifter
S0253	okay you can choose it
S0254	no i it's on our wish list just it'll come on my wish list
S0253	oh now it's in now it's in my wish list which one do you want
S0254	no i want a fancy one go and er search my wish list that one
S0253	this one
S0254	yeah retro flour sifter
S0253	you know the rule with kitchen appliances or kitchen just be be that
S0254	what be
S0253	for every one you buy you have to throw one away
S0254	no but
S0253	so so
S0254	i haven't get a flour sifter
S0253	exactly so you'll have to
S0254	so i can't throw one away
S0253	er how how attach be you to the pan cos they'll have to go
S0254	all three i'll probably
S0253	which one
S0254	your nan's one
S0253	that's horrible
S0254	i'm joke i wouldn't do that
S0253	and that be a better quality pan than anything
S0254	yes
S0253	else we've get
S0254	it be we'll throw the one pound fifty one away from asda i would like that and the erm ice sugar shaker
S0253	i don't like it it look a bite it's like
S0254	don't you like it
S0253	it's bite pastiche
S0254	what do pastiche mean
S0253	i'm not quite sure i just use word like that all the time i use i use word i use them and i don't know what they mean erm
S0253	pastiche
S0254	the person on the recorder will be like mm incorrect use of pastiche
S0253	yeah
S0253	i hope i hope no one judge that
S0253	no i think i believe pastiche be like be when you take you take like an old style of something
S0254	and do it badly
S0253	no cos that's parody so like
S0254	mm but parody be like a comedy isn't it
S0253	no
S0254	if you're parody something
S0253	yeah so like
S0254	you're look at comic effect
S0253	so it's so it's so it's without irony so like
S0254	okay
S0253	but this yeah it's where i think if you look at it it's like it look like that kind of fifties
S0254	yeah
S0253	retro style
S0254	but i don't i like i like the the motion of it the i like the gadget
S0253	but that's gonna oh see this be me say i don't care about what like what er go in my house
S0254	that's okay you don't have to if you don't agree then we won't have it in our kitchen
S0253	well it i think if if if you're one of those people that like love elvis presley and love the fifties and have like you know a a jukebox in your house then yeah
S0254	what other flour sifters have they get then have they get any nicer ones
S0253	and i'm surprise that there's there's there's more than one in existence
S0254	oh yeah i've never see them before
S0253	well what what about a nice chrome one
S0254	mm cos they're bore
S0253	they're futuristic though
S0254	mm
S0253	they're all pretty much the same aren't they apart from that one
S0254	yeah okay well we probably won't chase it then
S0253	how about that one mrs anderson's bake three cup stainless steel crank flour sifter
S0254	mm cos it's still stainless steel that's more expensive as well
S0253	so how much be that one so you want that retro flour sifter yeah i'm just gonna put it on the list add to wed list
S0254	mm
S0254	add it you don't have to buy it me
S0253	see it's all this stuff isn't it
S0254	mm
S0253	power
S0254	not the measure cup i think that's a bite pointless
S0253	yeah that's the thing i think people would have like a whole fifties sort of diner
S0254	set
S0253	diner style
S0254	yeah
S0253	things anything else you want
S0254	erm
S0253	just just say stuff cos i need to get ideas
S0254	i like the emma bridgewater spice jar
S0253	emma bridgewater spice
S0254	spice tin i think they be
S0253	spice tin
S0254	might not have them it's old stock oh that's it so look see and it come with erm load of different label so you can put your own label on but it doesn't match all
S0253	do it
S0254	doesn't
S0253	do it do it actually have space these look rubbish
S0254	yeah they don't have they don't match my orla kiely so everything have to match orla now so i don't want to be one of those people that have like an entire collection of something
S0253	feel like i'm in like revolutionary road
S0254	you don't have to get me anything for the kitchen i'm quite happy with the spice be in their own spice jar that you buy them in i'm okay with that
S0253	mm i dunno i don't like it when everything match
S0254	yeah no i don't either
S0253	sort of just
S0254	i like it to be i like it to erm complement but not like the entire orla kiely set like it can't look it can't clash
S0253	but that's what it appeal to doesn't it like sort of people's like fascinate with like order and like
S0254	mm
S0253	everything match and everything look the same sort of kind of yeah
S0254	we need to make our seat colour
S0253	i wanna get a better chair for the office
S0254	what's wrong with the chair we've get
S0253	it's not comfortable
S0254	isn't it
S0253	well
S0254	well you haven't be in wow look at that
S0253	what
S0254	it's like
S0253	a hundred
S0254	a hundred and sixty quid wow
S0253	just something a bite more comfortable than the one we've get
S0254	mm
S0253	i just can't lean back on it anything like that i feel
S0254	yeah you feel like you're gonna tip over
S0253	no i just feel like my back's break
S0254	oh that one's quite nice barcelona office chair
S0253	that be nice
S0254	what colour do they have i like the cream actually
S0253	no one's gonna see it
S0254	i know but
S0253	just me
S0254	eventually they might
S0253	when
S0254	i don't know if we move house and i want it match we wanna make our nice office we need to do something with that blind i think cos it's gonna get really cold in there soon
S0253	this be your interest isn't it
S0254	what
S0253	like
S0254	interior design
S0253	furniture do you ever think you be waste in psychology
S0254	yeah possibly
S0254	i'm no good at it though i just copy other people's ideas
S0253	what psychology
S0254	yeah
S0253	just just steal other people's research
S0254	mm erm i like interior design i'm i don't have my own style i just steal things i wouldn't be interest in do it as a career
S0253	but but
S0254	other people
S0253	what happen when er you get your house exactly how you want it
S0254	then i'll be quite happy then so i probably won't bother look
S0253	really
S0254	yeah
S0253	i don't think that's true
S0254	do you not
S0253	no
S0254	i think i'd be one of those people who'd decorate their house every six months
S0253	no cos you'd be skint but
S0254	yeah
S0253	dunno it's just just an interest like anything else isn't it
S0254	yeah it's just
S0253	just an expensive
S0254	wiles away the
S0253	just just an expensive hobby we've get like from now i've get friends who do that like they they they redecorate
S0254	mm
S0253	annually sometimes biannually
S0254	we need to stay in touch with them so we can get their hand me down
S0253	someone be talk about go to erm if you go to auction
S0254	yeah
S0253	erm i think be say that his couch be really nice and like designer couch but they're they're like john lewis couch or something
S0254	mm
S0253	be that expensive
S0254	yeah john lewis be quite expensive
S0253	but they erm but they get them from an auction or something that to me that sound really reasonable
S0254	yeah
S0253	i
S0254	sound like a good idea
S0253	erm you know just not sure i want like a haunt couch or anything
S0254	a haunt couch
S0253	yeah
S0254	do you think that's how they'll market it auction haunt couch lot number
S0253	it be once
S0254	thirty one
S0253	it be one cover in
S0254	in dead body
S0253	yeah no
S0254	an old woman die on this couch
S0253	great that must be why they go cheap though surely
S0254	no it's just people redecorate and get rid of stuff or downsize or
S0253	mm yeah
S0254	i be look on that preloved website
S0253	what's on it do that have everything on it
S0254	yeah it have all sort
S0253	do they have guitars cos maybe i
S0254	maybe yeah
S0253	i need a guitar
S0254	probably oh do you want any hamsters do we want any more hamsters
S0253	no who's who's offer hamsters do you
S0254	no one's offer us hamsters ask me if he want me to if i want him to sell the hamster cage and i say i'd talk to you about it cos you buy it as a present for me so and then once i'd say it
S0253	would i be offend
S0254	i be like okay do i want hamsters again
S0253	erm
S0254	but
S0253	no
S0254	really they be
S0253	you didn't look after the last two very well
S0254	they last age they live to about three for little dwarfy hamsters that's a really good age
S0253	ah lennie and george
S0254	mm
S0254	i know i don't think i ever have any picture of them i don't remember take a picture of them
S0253	i use to have some on my phone
S0254	do you
S0253	yeah keep them a week or something
S0254	that be a great present or possibly one of the best present you ever get me for the sheer surprise factor cos we could call them like curley for one and then i couldn't remember any other character erm or something
S0253	oh what's his name it be the stable boy
S0254	i know that's who i be try to think but i can't remember
S0253	it's like a don't wanna name a series of hamsters name after
S0253	john steinbeck character so i don't get this website what's the deal be it essentially ebay
S0254	erm to yeah and you don't bid you just buy
S0253	you just buy
S0254	yeah you can offer a price i think sometimes
S0253	and like
S0254	like a car it's an internet version of a car boot sale
S0253	i want a like an actual classical guitar not like a children's one that look nice
S0254	cedar top
S0253	a hundred and sixty pound
S0254	that look like the furthest possible point from us you have to put in so you don't get
S0253	where's that
S0254	erm they have a little thing it be like portsmouth for something
S0253	portsmouth
S0254	it's a bite of a long way to go
S0253	bite of a do it for pickup
S0254	oh you may like
S0253	yeah
S0254	mm
S0253	be on today about well when you say about how there should be a a magna carta for the internet
S0253	like there should be a sort of direct
S0254	mm
S0253	it's quite an interest point but then do you think like people don't take that seriously it's like oh don't be silly the internet doesn't need a bill of right but it's just accelerate isn't it in its importance in your life and
S0254	mm but it do need some regulation really doesn't it
S0253	badly er this website's rubbish
S0254	your computer's rubbish
S0253	no it's not
S0253	it be it's really it's get worse somehow
S0254	er i dunno just people aren't sell what you want to buy that's all
S0253	mm mm try to think there be load of things i want and i be excite about my my shop spree tonight
S0254	your even of shop
S0253	and i can't think of anything that i want to buy
S0254	it's always always the way
S0253	i'm not buy any more book until i've finish
S0254	no don't buy any more book we've get no more space for book
S0253	oh but we've get space for
S0254	a flour sifter
S0253	a flour
S0254	yes we've get space
S0253	a retro flour sifter
S0254	get the space for a retro flour sifter
S0253	what else do can you think of anything we need for here
S0254	just stuff that you want to make it more homely for you to make it feel like your home rather than my home
S0253	i'm welcome no more
S0254	a poster you be gonna buy a poster
S0253	a poster
S0254	you be gonna buy a like nice art weren't you for the live room
S0253	i know but now i just don't want to
S0254	why
S0253	cos we'll we'll be out of here in february
S0254	yeah but we'll be somewhere else
S0253	true erm try to think of stuff stuff we need
S0254	it's not about stuff you need it's about stuff you want you want stuff you want
S0253	awkward
S0253	no
S0254	what about a new bedspread don't you feel the need to buy a new bedspread that you've choose
S0253	no i like this bedspread
S0254	i like this one too i haggle for this in the or whatever the place be call
S0253	i think you be gonna say like dar es salaam or something like
S0253	like i haggle for this in
S0254	road and there be like a market day where you could haggle for stuff it be fun
S0253	that's good
S0254	i always think that shop's go to go bankrupt and it just always seem to have a close down sale but always keep just keep go
S0253	that's the sort of business strategy in street at the moment
S0254	yeah
S0253	it's like close down
S0254	last chance
S0253	like your last chance to buy
S0254	it's like the work it's the bed equivalent of the work it's always close down
S0253	yeah
S0254	end of line stock and it's good though
S0253	i want a jacket
S0254	mm
S0253	but that's not like
S0254	oh how much be you will to spend
S0253	on this company
S0254	yeah
S0253	i'd spend it all
S0254	mm
S0253	do you hear about those
S0254	dad's go to norway on friday
S0253	be he
S0254	yeah
S0253	that'll be good
S0254	mm i'm quite jealous i think we should go on a drive holiday there
S0253	pardon
S0254	i think we should go on a drive holiday in norway
S0253	i'd be more than happy to do that with you
S0254	you need to learn to drive though and then be comfortable drive on the opposite side of the road up a mountain so we can share the drive
S0253	these jacket be all like six hundred pound
S0254	oh my god that one's only two hundred and ninety
S0253	which one
S0254	the winter parka w
S0253	i'm sure they're very good but it's just the same as like north face or anything like that
S0254	mm
S0253	they're just so expensive
S0254	they don't look particularly special
S0253	that's the brand though isn't it like
S0254	yeah
S0253	it's
S0254	i don't like the feather down
S0253	no i don't really so have you get any plan for this week
S0254	erm no i don't think at all in every night and then friday go straight to wales and i'll be back on sunday what be you plan oh yeah you'll go be you gonna go home after work on friday
S0253	er yeah i should what i should do be just pack my bag and go home
S0254	yeah
S0253	but i always i just
S0254	you should
S0253	i feel too busy on the thursday i go to work and then i get a bus back here then i get a bus back to town it's just stupid
S0254	mm
S0253	erm so yes i'm gonna pack my bag i mean because i i think i be gonna see on on friday but he just say oh midweek would be better
S0254	
S0254	oh you've never call him
S0253	sometimes we call people by their first name
S0254	that's
S0253	occasionally
S0254	his brother's break up with his girlfriend
S0253	that's sad
S0254	yeah
S0253	i think he say it be i remember say it be a long time come though
S0254	oh i know be quite please about it but she's er
S0253	she
S0254	not take it too well anyway despite the fact that he be the one kind of hold her back really he's quite happy to sit and play game all day every day
S0253	yeah
S0254	like he doesn't wanna go on holiday he doesn't wanna move out he doesn't wanna get a job or a life
S0253	this be what a
S0254	it seem
S0253	say to me that be his concern
S0254	about his brother
S0253	yeah i mean it you shouldn't like you shouldn't sort of deride him you know because his interest be computer game it's no different from be interest in
S0254	mm yeah of course
S0253	play play the sunday league or
S0254	but i i like paint but i don't sit at home all day every day and refuse to get a job
S0253	but but but you're not
S0254	because i like paint
S0253	but you're not like er you know you're not obsess with it like and you know i think i tend to think with computer game people who don't play them often thing oh god sit at home and play computer game and they picture like a teenage boy in a bedroom with a lara croft poster
S0254	mm
S0253	but he one i know for a fact that be be like you know incredibly good at like certain computer game and it's it's his interest it's his passion
S0254	yeah i know but
S0253	but i know what you mean i'm not say that's an excuse i mean hamburgers be my passion but i wouldn't break up with you just so i could eat more i probably would
S0253	i probably would
S0254	i take it back i would
S0253	erm
S0254	but you know unless he's pursue that in some sort of
S0253	professional
S0254	yeah way
S0253	but why do everything always have to be job like
S0254	well it doesn't but you can't you've gotta make a choice haven't you you either try and make that your job or you have to get a job and do that in your spare time like you can't choose to not work and live at home with your parent and because you don't and like not want anything else cos you just wanna spend all your money on computer game that's you can't really do that can you that's not be
S0253	no
S0254	not grow up
S0253	no i agree
S0254	i feel like 's like that well i'm just gonna hold out until i'm a computer game expert how exactly do you expect to be a computer game expert when you're just sit in your bedroom as if like someone's gonna knock on his bedroom door and be like oh er there's this professional like computer game tester job open up do you wanna do it and that's just not gonna happen be it so people be quite naïve
S0253	yeah that's it i do see your point
S0254	like i don't
S0253	i think i think you're just really like it's just not in your it that's not in your sort of nature to to to think like that or to be like that so
S0254	mm no no it's not but like you know i it's fine for people to have
S0253	that sorry just to put that shirt be two hundred and seventy pound be they have a giraffe
S0254	a mountaineer mountaineer shirt number three
S0253	i'd feel i'd feel really cool in a mountaineer shirt
S0253	but i'm not pay two hundred and seventy pound
S0254	you would also feel very poor you'd have no money to go or anywhere and wear the shirt what possible reason can be two hundred and seventy pound
S0253	it's make from real fox
S0254	oh that's
S0253	it's not like an ethical company
S0254	make from fox entwine with gold thread
S0253	gold thread fox but yeah no i dunno i i think it be a bite of a male thing as well
S0254	why i wouldn't like i feel a bite bad that you don't play on your xbox at all like
S0253	well i've lose interest in it
S0254	well yeah
S0253	i've just grow out of it really i feel like i don't have the time if i be unemployed i'd be all over it
S0253	but it it's like it's like be say the other day like he's get a ps4 like cos he's he's move in with erm
S0254	really
S0253	yeah
S0254	i think he always say live apart that's the best way
S0253	it be that's why they're move in together next year
S0253	it be mean to be this year
S0253	but erm so they've kind of they've agree so they're gonna move in together in but i think i think he's quite happy without it
S0254	mm
S0253	erm but he say he say obviously i'm gonna have to get a credit card cos i don't think he can really afford it the or he can't afford the whole shebang
S0254	mm
S0253	he's on he's on like a he's get a good job erm but he say so he say i'm just gonna get a playstation on my credit card as well and pay it off bite by bite
S0254	might as well
S0253	erm
S0254	i'm all about the credit card
S0253	really
S0254	yeah you know i've get a credit card
S0253	oh just the stupidest thing
S0254	no the reason i have get a credit card be because when you buy flight and holiday it if you need the proof and you only get the proof if you've buy it on a credit card so when i go to australia i buy my flight on a credit card
S0253	yeah
S0254	then just pay it off the next month essentially or no a couple of months but it's interest free so now i just move it whenever i have to start pay interest i move the account to somebody else
S0253	yeah
S0254	and then what this one i've get now i buy my car insurance on it because i didn't have enough money to buy my car insurance all in one go
S0253	yeah
S0254	but if you buy it month if you pay the them monthly you end up pay an extra hundred pound by the end of the year so i think well i might as well put it on an interest free credit card and then pay it off monthly and i'll still pay the same amount rather than pay
S0253	oh
S0254	an extra hundred pound in interest to an insurance company
S0253	yeah i get it just don't
S0254	so that's why i do it i don't like i don't go out and buy things i can't afford on it
S0253	no
S0254	i'm nearly do i'm just pay off my car insurance on it
S0253	do you think i can get away with another grey t shirt
S0254	i don't like that
S0253	that logo
S0254	yeah
S0253	what's wrong with it
S0254	i don't know i think it's a bite how much be thirty five quid for that
S0253	yeah
S0254	no
S0253	no i'm not allow to buy it
S0254	it's it's not very nice it's like the most bore logo
S0253	i know
S0254	it's horrible you can get a much nicer grey t shirt than that
S0254	for less money than that
S0253	that's all i own just grey t shirt
S0253	yeah i don't know i just it's i i don't like the idea of money not be my own i really really don't like it and i hate
S0254	i i know exactly how you feel because if i have no way of pay that money off then i'd be freak out but i can afford to pay it i pay that off a hundred pound a month and i know i'll have pay it off before i start pay interest on it
S0253	mm
