S0282	we're all in the same boat it really really fry your brain so it take such a long time for you brain to come back and by the end of tuesday and by the end of wednesday i be so
S0293	aspect of work isn't it
S0282	tire
S0293	it's what
S0282	that er this guy be tell me he be sort of say right okay start with your tool over here bring it round like this use that hand as a lever that hand as a fulcrum go in this direction and by the end of the afternoon i be like er i couldn't make my brain tell my arm what to do especially my right arm the right hand side of my body seem to be completely unbiddable and my brain be just like not send message it's like i be suppose to have my elbow up here and do this with my elbow and my brain be say okay elbow move and my elbow be just not go anywhere
S0282	and the man's go no no not like that no not like that no not like he's he's very very patient and but i'm gonna have to have some more class and not do all day just do half a day at a time because by the end of the day i be just completely
S0293	expensive hobby though isn't it it's very expensive these class
S0282	it be an expensive hobby
S0293	mm
S0282	but the thing be that if you erm once you've get the tool and once you've get your own stock of wood it's fine
S0293	once you've get the tool it's a mega investment
S0282	i know the tool be very expensive
S0293	and you can buy endless tool have them come in for years every time they go down the pub er a new one would come in by the back gate
S0282	really
S0293	he'd think i wouldn't notice
S0282	well we only use four five different tool
S0293	no 's get an awful lot of them
S0282	have he
S0293	mm
S0282	well it's the lathe that's the most expensive i should imagine you pick up the tool if you if you er keep an eagle eye open cos i've never you know i wouldn't've know what i be look at
S0293	's your man
S0282	be he really
S0293	yeah
S0282	i need to pal up with despite his girlfriend
S0293	yeah she's get a bite better recently
S0282	have she
S0293	i have a couple of even which weren't quite so bad
S0282	she be weird
S0293	yeah she she can be very strange
S0282	she be very weird at your party
S0293	mm she get very nervous i think that's partly it
S0282	i think yes it be kind of she be be highly irritate i think
S0293	mm be absolutely er happy with her so that's that's good
S0282	well that's really nice but she's get one of what we call a muttley laugh in our house
S0293	a what laugh
S0282	muttley laugh
S0293	what do that mean
S0282	do you know like wacky race on the television when we be young
S0293	yeah
S0282	it be a cartoon
S0293	yeah
S0282	and there be a race car driver who have a dog call muttley and the dog would go
S0293	oh yes
S0282	it's a particular kind of weird laugh that people have
S0293	mm
S0282	so she be very much like that
S0293	mm
S0282	so anyway we can stop in a minute it's nearly there you do realise you've help me to earn twenty quid near enough fifty two minutes it's only a few minutes to go so what be your so this weekend in what erm my husband keep ask me question about it
S0293	i don't
S0282	and and i keep say i really don't know
S0293	don't don't don't come if it's er
S0282	well it's not that it no it's not that it's not that actually
S0293	it feel like if er it
S0282	no i tell you what
S0293	we very rarely we very rarely ask people to to come down and i guess cos it's so such a special place to us in a funny kind of way
S0282	mm
S0293	and erm i guess it may not be like that for other people and and er i guess er i can quite easily take offence actually when people don't seem seem to like it so i really wouldn't it's not a big deal come down cos we
S0282	no no no i i tell you i can tell you exactly what the problem be first of all have get a week off last week
S0293	mm
S0282	secondly i be suppose to go to hospital on monday for an appointment and then thirdly there's that weekend which involve take the monday off work now monday's at work for him be really big days they have really big meet with the permanent sector on a monday and with all the senior managers and stuff like that
S0293	well that's why i'm say just don't don't bother come a different time
S0282	so no no no no no well that it won't help because it'll be always be a monday but because erm
S0293	no it won't always be a monday er it be this time cos of the half term
S0282	mm well okay okay but er because my appointment be cancel and he go into work this monday he then relax a lot more because he think that out of four out of four mondays in the month he be take three of them off which er leave him quite vulnerable because that mean that he's not in the room when really quite big decisions get make about his work
S0293	well i quite understand that
S0282	and stuff like that but because i didn't have a hospital appointment on monday
S0293	yeah
S0282	it mean that he be now far more relax
S0293	but even so
S0282	about
S0293	even so we you can wait and we can go on a friday sometime we just didn't get the friday date during half term this time sometimes we get friday saturday sunday but we didn't this time
S0282	no no no no no that's fine now he's all square and but also he's just be he's be arsey about he's just be arsey he's be arsey with me that's the point he's not be arsey with anybody else he's just be arsey with me and also maintain also the other thing of course be he maintain it be the first he'd hear of it well actually i then find a note of a phone conversation he's have with you where it be quite plain that he'd talk to you about it he swear blind that this be he'd never hear of it before but which be just him again be arsey with me really but erm so the friday
S0293	yeah er i think we will drive down in our car so if you drive over here
S0282	mm
S0293	we wouldn't leave before probably eight i think not early
S0282	eight what
S0293	seven seven thirty at night
S0282	at night
S0293	seven
S0282	not in the morning
S0293	yeah no no no no on friday
S0282	oh well that yes and oh right okay
S0293	er maybe maybe seven eight nine ten yeah maybe seven seven thirty
S0282	oh right okay to avoid the traffic and everything
S0293	yeah
S0282	okay oh well that make that put completely different complexion on things as well
S0293	i think probably seven thirty
S0282	okay
S0293	i'll talk to tonight but er it it wouldn't be any earlier than that
S0282	oh well no that's fine
S0293	mm
S0282	because that's fine
S0293	wouldn't be earlier than seven definitely
S0282	okay oh no cos the other thing about him be he's extraordinarily conscientious i've leave him at home today and he will've work all day without stop he be at his desk at eight o'clock this morning and he will've sit there absolutely all day and he won't've he won't've shift out of his chair all day and he he be extraordinarily self discipline and he be like oh well i have to cos he be like oh i can't possibly skive any work on friday as well that's er no i can't i can't do that that would be wrong if i skive and it's like well actually i'm sure they owe you load of hours quite frankly
S0293	mm yeah
S0282	oh no that make that make it very much easier as well
S0293	but i i wouldn't do it if it's if it's difficult
S0282	no it's not that it's no it's not that it's difficult it's no no it's absolutely fine with me it's just that er you know it really be er broader circumstances that he's in
S0293	i know but that mean we we could do a different we can do different time
S0282	that's just lead him to be an awkward sod really no no he'll be it'll do him good
S0293	we just go we haven't have many well hasn't get any any more leave so that's why we can't take well why couldn't we take the friday we couldn't take the friday cos the kid be at school and and then they're off on monday so we've get that we've get that weekend at er sometimes we get erm in the holiday we get friday saturday sunday but 's get that this time
S0282	right
S0293	and in fact it's better for us this way round because 's gotta go there's concert go on but anyway so this way yeah so it'll be erm it will be wet so you'll need full waterproof you need proper walk shoe
S0282	when you say full waterproof
S0293	er oh just a mac
S0282	i've get that be that enough
S0293	it's just get to be really waterproof
S0282	that say waterproof breathable
S0293	i'll i'll bring you a spare mac with me you can i'll bring another one with me just in case it's not as good
S0282	and i have get
S0282	i have get proper walk boot
S0293	yeah and erm probably be helpful if you bring have you get erm double sheet just for an ordinary double bed
S0282	yeah yeah
S0293	so if you bring a bottom sheet and a duvet cover and pillow case that's probably a good idea actually bring pillow
S0282	okay
S0293	cos the pillow be not fantastic there be pillow there but you might want your own ah no bring pillow it's a good idea to bring pillow
S0282	okay
S0293	erm probably enough there i didn't count there's a lot lot of duvets there i haven't count pillow recently 's do a clear out there's load of blanket load of duvets
S0282	we're fine with blanket really i'd we haven't get a problem
S0293	well duvets there's load of duvets duvet
S0282	okay
S0293	and erm er we get there about ten thirty at night and we'd light the fire and then we would saturday morning we be collect from station at eleven so i suspect we'll take and her friend over swim in that area and we will go possibly to castle
S0282	mm
S0293	if you're interest i don't know if you've be to
S0282	er er er not for
S0282	not for decades not decades and decades
S0293	we might go we might go to or or castle
S0282	alright okay yeah no 's always nice
S0293	erm
S0282	and last time i go to i be so ill that i actually bloody didn't get out of the car
S0293	er and then er so we'll probably do that in the morning
S0282	mm
S0293	and then collect her at eleven oh i don't know how we're gonna do it actually maybe we'll collect her and then go into i don't know how we'll do it anyway something like that and then erm we'll do a walk possibly round the if the weather's alright we could do a walk round the in the even and erm there's some fantastic walk some really brilliant walk through the woods it's just spectacularly beautiful actually when we go last weekend very wet but it be lovely lovely and then on sunday we would probably go down to the and have a walk erm and er er well we could go out out and about there's place to go there's but actually 's saturday so we'd have to think about that work out what we do
S0282	mm
S0293	on monday well mixture basically of i don't know
S0282	mm no that sound really nice
S0293	mm
S0282	haven't be that way for a bite
S0293	yeah
S0282	we have a holiday in erm just between and over easter and that be
S0293	you've only be to the old cottage haven't you you haven't be to the new one
S0282	no i haven't see the new one
S0293	the new one's different it's erm
S0282	mm
S0293	it's better i mean it's not better it's just erm higher quality er build put it er internally build if you see my point
S0282	mm well it's such a long time since i be there that erm
