S0282	so
S0293	mm
S0282	so what that mean be that it's really difficult to to to translate the file the audio file from the android phone into mpegs
S0293	right
S0282	which be music file
S0293	right you sound very techy to me
S0282	no i've have to learn this
S0293	right sound rivet
S0282	it be well er no it's quite i mean it's a different language
S0293	do you want some more cake
S0282	no thank you
S0293	more tea
S0282	mustn't have more cake i will i've help myself to more tea and i will have even more tea i should think
S0293	that's oh no that's the horrible milk i'll get the better milk
S0282	no i've get no it's the good milk in
S0293	no that's no that's
S0282	oh oh for you oh right okay erm this be ideal for me
S0293	no full fat in my tea
S0282	so i submit all my old tap do you tell that i'd edit that tape
S0293	i haven't actually cos she fell and break her shoulder
S0282	oh right
S0293	and just go out of her mind at the time i don't know if she worry about it she she would've say
S0282	erm if you hadn't know what she be talk about you wouldn't've you wouldn't've pick it up
S0293	no well i don't i don't think so i mean i i happen to know the what she's worry about so
S0282	oh yeah no if you when you know what she's talk about
S0293	yeah
S0282	then er you think oh really
S0293	mm
S0282	crikey
S0293	mm
S0282	erm if you didn't know what she be talk about she it be so elliptical a reference
S0293	yeah
S0282	that erm you wouldn't really've understand
S0293	well she she's very conscientious about these things as you've gather
S0282	yeah
S0293	she will go to her grave with all kinds of secrets i go to the physio the other day and that be jolly useful
S0282	you go to where
S0293	i go to i go er to the physio the other day and that be jolly useful
S0282	oh what persuade you to do that
S0293	well i'd be well i'd be refer to this bloke before
S0282	mm
S0293	and er i didn't get on very well with my last physio cos he keep and erm er he always hold it
S0282	oh right yes
S0293	and erm and so er and in the end anyway i i didn't end up go to two appointments and er be obviously blacklist they be furious with me absolutely furious
S0282	be this a referral do you have you be refer by the
S0293	i'd be refer and then i be refer back a second time yeah i be refer for my back which be the reason well i the reason i want to go the er reason i ask for the referral be because i be so bloody stiff all the time i can't move and erm i really can't move any more erm i i i can't put my clothe on and things like that i've be be tell you haven't i for some time how stiff i be and erm i ask them to erm i'll do that afterwards if i start even think about it i will not stop talk and erm er
S0282	mm mm so you so you go to the physio
S0293	can't bear it i hate it
S0282	just pretend that nothing's go on
S0293	but i can't when you're put your little pen down it's horrid
S0282	sorry
S0293	anyway erm
S0282	i don't have to do that
S0293	erm yeah so i'd already be refer for my back and er then i end up do this stuff which drive me mad and erm then i get refer again and i miss two appointments so she be absolutely hop mad with me so i go in there and i think oh my god she's gonna be she do give me such a hard time and erm actually i say look i'll be perfectly frank what i want be i want a set of exercise cos i be so stiff i don't know what to do with myself and i've get knee pain and back pain and actually she be really very switch on erm and she say yes i be extraordinarily erm stiff
S0282	mm
S0293	i've be you know i keep say this to everybody but nobody believe me you know i have i have a very flat back which be an indicator of how stiff i be and i can't rotate in any
S0282	mm
S0282	in any dimension
S0293	in any way no i can't and i keep say this to people and i know you know it's not a a major thing but it it make life quite hard work and also things like i fall off my bike i fall over i i er cos i can't bend to get out of situations
S0282	yeah
S0293	i'm all so it's actually quite
S0282	but also if you're if you're tense
S0282	then you can't fall properly and you can't correct yourself because you need a certain amount of fluidity and relaxation
S0293	yeah yeah so my daily life be more dangerous as a consequence everything be more dangerous about it so
S0282	yeah yeah
S0293	erm anyway she agree with me that yes it be a level of stiffness that be really quite acute so i i felt quite kind of you know sometimes they look at you as if you're mad you're say you're stiff you know oh why be you come why be complain about this i say you know i just need some exercise i need to know what to do but i have to be very careful cos otherwise i set my back off and if i start do things that set my back off then i just don't don't do the exercise so erm and then she say with the knee which be even more useful she say the reason i'm er she she reckon with the correct exercise plan i may actually be able to stop the knee pain because what's happen be my knee cap have move outwards
S0282	mm
S0293	i guess cos of the back and erm i'm very strong on the outside
S0282	mm
S0293	but on the inside and therefore they're not be support correctly
S0282	right
S0293	so if we can build up muscle here
S0282	yeah
S0293	actually we could probably physically rectify the stress which be oh i've get arthritis but not very bad arthritis
S0282	no
S0293	so i can probably improve the situation a lot myself
S0282	yeah
S0293	which be what i wanna do you know
S0282	yeah
S0293	i'm not say miraculously cure me i'm say you know there must be a way of improve life cos again with the knee it's it's incredibly impractical you know you can't get i can't get up and down i can't get out the bath i can't get into my cupboards erm
S0282	i've end up on in a supermarket go to get something off the bottom shelf and think i can't get up now
S0282	and have to put a hand on the floor or on the shelf and
S0293	i can't get up i've fall over
S0282	pull myself up
S0293	erm in the street and not be able to get up you know it's really really embarrass
S0282	mm
S0293	erm and i've be in situations with big step when i actually just can't get out of the situation i'm think oh shit what do i do now
S0282	mm could be your feet as well
S0293	no no i've be that alley
S0282	have you
S0293	mm
S0282	cos i mean that my er the pronation of my knees come out as a consequence of me go to see the podiatrist about pain in my feet and they they they have this little er studio where they make you walk on a treadmill they attach electrodes to your bum and they film you erm at the same time so they could see so they could see what your feet be do your knees your thighs your bum and so i be all one side so one buttock higher than the other my knees be point outwards my toe be point inwards
S0293	yeah but i don't know about you but didn't they just give you thick insoles which you can't get in any shoe you see that's what they do with me
S0282	ah they give me a thick pair of insoles which i can er wear in one pair of shoe and when i have pain in my feet i wear those shoe and if i'm walk a lot or
S0293	oh you see i do have pain i do have pain but a very high arch it's which be the problem
S0282	oh i have the opposite i have really low arch
S0293	mm mine be exceptionally high exceptionally high arch so and very high feet er my feet be you know very solid and sort of high so but i can't get anything in i can't get them in any shoe even walk shoe so you know it's no bloody good
S0282	i think the only way you can go from there be to actually have your shoe make and have them make so that they're the right shape for you
S0293	oh mm well my mum's be down this cos we've all get my mum's feet basically
S0282	mm
S0293	and it it it do limit you know my mum use to go round in i don't know white lace up things which be they're just horrible anyway it's
S0282	you can get nicer shoe if you have them make
S0293	yeah it's just expensive though
S0282	oh yeah no absolutely expensive
S0293	yeah
S0282	but perhaps you know just one pair really or something
S0293	well possibly but i can't imagine
S0282	a treat for your birthday present
S0293	i can't imagine that there be many treat that i want at the moment but
S0282	i know
S0293	i can't imagine that particular one come my way but erm i find this in the charity shop it's you know the
S0282	i notice that it's really nice
S0293	but it's it's only size ten which be er you know it's a blow so it doesn't even cross it doesn't even erm fasten but
S0282	it's look good it's a nice shape
S0293	oh my god it's just
S0282	let me feel
S0293	it's not the feel it's just the colour aren't the colour fantastic
S0282	oh it's soft mm it really match
S0293	the of blue and brown i just
S0282	er yes i be look at it earlier and i couldn't work out if it be er it be brown or grey
S0293	i love their colour i just think their colour be every time i go in that shop and i think oh my god so fantastic
S0282	mm
S0293	i love er all the colour jerseys but who would spend that kind of money unless you have silly money i mean have you see the price
S0282	well when your children eventually leave home
S0293	no no nobody would buy a jersey that expensive
S0282	you can have i don't know i've get a cashmere twinset which be really really expensive really really really expensive but it have last for twenty plus year twenty five years and it still look as good as new so it's not a false economy
S0293	yeah well there be that if you do get good jerseys it do make a difference doesn't it
S0282	yeah cos the rest look so ratty so quick
S0293	my suit be just er er you know i've get a couple of suit which i buy really really early on and they're fine now you know
S0282	mm
S0293	er i agree with you about buy good stuff but
S0282	oh well it's out of the question now
S0282	and anyway i'm change shape all the time so i'm
S0293	how's your weight erm loss thing go
S0282	er well last time i weigh myself i have lose twenty kilos
S0293	how much be that in stone
S0282	i have no idea
S0293	sound a lot
S0282	there's two point two pound per kilo
S0293	sixteen pound er no fourteen pound in a stone fourteen twenty so you've lose two stone er almost
S0282	oh be that be that all i don't want to do it in stone then in that in that case cos that's really depress that take a year
S0293	two two kilos in a no i'm gonna be wrong about this two pound
S0282	two point two pound i think a kilo be two point two pound so twenty kilos be ten kilos be oh no this be ridiculous this be embarrass i'm not do i'm sorry it's friday afternoon and i i can't do maths
S0282	and i can't there's no point it doesn't mean
S0293	twenty kilos be i'm just gonna look it up on the computer twenty kilos be how many stone
S0282	how long be go to be go
S0293	three minutes
S0282	well
S0293	i'm a whizz at this
S0282	yes but then what be i gonna do be i gonna talk to myself for three minutes i be gonna talk to myself for three minutes this be just plain sabotage actually if somebody leave the room in the middle of a record to go away and do something for three minutes it's just plainly sabotage so this be very nice i have a day out walk with some people and i'm now exhaust cos we've be out for such a long walk and now i'm have lapsang souchong lapsang souchong that just show how tire i be and cake which be a really nice treat at the end of the afternoon
S0293	it's very very impressive
S0282	be it
S0293	yeah it's over three stone
S0282	oh wow well good i hope it show actually
S0293	well it do show
S0282	it's be hard win
S0293	well it do show three stone be pretty bloody impressive how much further have you get to go
S0282	er well i don't know if i get back to my sort of erm you know my glory days
S0293	no no we're not go for i wouldn't er go for glory days aren't you just go for normal
S0282	well the thing be it depend i need to get back into the clothe that i have when i be work up to the year two thousand and four and and they i can't remember even what size they be but they be my posh clothe and my expensive clothe and my really nice work clothe
S0293	can you not alter the size
S0282	they're all pack away i haven't look at them for age
S0293	mm
S0282	because it's just too depress i haven't throw them all i haven't throw them away because that would just be that would break my heart really and i use to look at them and think oh i'll never get into that but
S0293	i get rid of a lot of mine the smaller ones so wait a minute er anyway if you want to get to er your fight fit weight what would that be then
S0282	nine and a half
S0293	and what be you now
S0282	don't know well last time i weigh seventy eight kilos so i don't know what that be in stone
S0293	you haven't get that long to go then have you you're do quite well
S0282	no no no i'm i'm get there it's probably another well it depend how strict i be if i stay on the strictness of the diet i've be on it should be another six months but i'm lately i'm just get a bite tire and feed up so i haven't be as assiduous and actually have not be help me because he have not be er measure quantities and he's be start to go like we be before which be just basically you know just not measure or weigh pasta or portion of food so i shall have to get him back do that as well and when my dad move in he's my dad's suppose to be on a diet so we're gonna erm have to start try to enforce that as well
S0293	mm
S0282	but erm my dad be try to they tell they say to my dad he have to lose weight because it be a strain on his heart and of course he and my mother be take this as be a kind of a question of defeat er you know of confound a person in authority by by you know eat cup a soup for the two weeks before you go and see the specialist and then the rest of the time just ignore
S0282	what you're suppose to be do
S0293	mm
S0282	but anyway
S0293	yeah i've er i'm go to get down to my sister's go down to eight stone eight and a half stone
S0282	really mm that's
S0293	she's quite similar build to me she's a bite taller than i be perhaps
S0282	oh that's too thin then
S0293	which be oh er she's ridiculously thin erm it's you know she's five foot oh actually she be taller than me i reckon she's five foot nine five foot eight five foot nine
S0282	well that's just ridiculously thin in that case
S0293	so she i the lowest weight i'd be happy if i get down to ten and a half ten and a half would be erm a fine weight to be in my book
S0282	mm
S0293	so i've still get another stone to go
S0282	well it's not so much about i mean i cos i never know how much i weigh before really it's just about whether my clothe whether my nice clothe fit
S0293	well i know i have to do it that way cos i have to kind of er we put on two stone completely accidentally that be well we put on one stone completely accidently
S0282	mm
S0293	i know i be around eleven stone and then we put on a stone
S0282	one do one do it's very easy to do that
S0293	so erm
S0282	but also er it's it's come off the wagon and stop be vegetarian because erm in er and actually then not adjust because if you put meat back in your diet and you then don't
S0293	you gotta cut the fat back
S0282	rack back on the carbs severely and the fat
S0293	the fat as well yeah
S0282	straight away
S0293	but you have a very yeah you have a very fatty diet didn't you very i for me come in to a vegetarian diet be a lot more fat and a lot more carbs than i would eat naturally
S0282	yeah oh yeah much more carbs absolutely
S0293	but fat actually as well interestingly sort of the cream and the cheese and the
S0282	yeah and pastry and
S0293	yeah mm
S0282	and stuff like that so you you have to erm if you er when you're eat on your own on a weekday night you can just have a vegetable stew and throw in one pot but if you invite people round it's very difficult to give them a vegetable stew people really feel hard do by so you have to do a thing to mimic what you would have if you be eat meat which be you know a piece of meat and discreet vegetables
S0293	do you eat much fish
S0282	no not really
S0293	you see we eat a lot of fish that's our
S0282	i'm not really very partial to fish
S0293	mm we eat we're eat as much fish as we can get away with actually
S0282	mm
S0293	so we eat fish er three four three time a week at least yeah
S0282	mm well we have now things like can tuna cos that's always a really quick supper and er we have er and when my day off be friday so we have fish and chip on friday night which be also 's treat as well i have some rock salmon or something the other day which i'd never have before cos i think cod be extraordinarily bore or er have say that when we go to this restaurant on thursday we have last thursday i have erm a piece of smoke cod which be beautiful really nice but it be all this this er sort of very high end michelin star er you know little teeny weeny portion of things so like little scallop about this big
S0282	and er and then they sort of say oh with er you know with parsnips and and actually they must've make one parsnip go round the whole din room
S0282	because you just get like half a matchstick of parsnip
S0282	it be really quite extraordinary and and they have a hierarchy of waiters and erm and so one person come round and be like oh no i can't describe the food to you i shall have to call my colleague so the other colleague have to come and say oh this be a carpaccio of cod with a erm
S0293	do you dress up to go
S0282	no not particularly
S0293	it's so you know i really there's no nothing we ever dress up for any more it's quite sad really i like
S0282	it be sad
S0293	i like dress up i really do like dress up and er you know you can't you know christmas party no party ever people dress up these days
S0282	no
S0293	smart casual i mean they spend lot of money on their casual clothe but it's not
S0282	no
S0293	what i like enjoy do i like to wear i don't know i like to wear nice fabrics and nice cut things and
S0282	there's somebody who's in my erm in this group of 's who be always dress in a really quirky fashion and she have she buy clothe from this woman who who make clothe out of vintage bits of fabric so she's always wear something that be extraordinarily quirky with a very quirky print and er erm very kind of odd shape and really peculiar button and stuff like that and she look amaze she always wear really bright colour so pink or red or green or blue just vibrant hue and she's very i mean it look really nice and but she er you know it doesn't matter the rest of us be in jeans and t shirt and she'll turn up in like a prom dress or something like that or a
S0293	it's really cheer though you know
S0282	yeah oh yeah
S0293	and you know when i go and see my dad they all notice when you're dress up
S0282	mm
S0293	the old people cos it's get bore
S0282	yeah
S0293	it must get so bore look at old people in bore old clothe mustn't it
S0282	yeah
S0293	oh it's
S0282	oh really
S0293	give me a second darling hello hello mm doesn't work for some reason
S0282	erm have you get a a different tune for everybody then
S0293	no
S0282	oh right so how do you know it's her
S0293	cos it say
S0282	oh right okay
S0293	hello
S0293	oh god
S0293	video that's very frighten here's i'll show you
S0282	oh no it's go off
S0293	have it
S0282	slide to unlock
S0293	hello oh god
S0293	crash hello
S0293	it crash you see if it see my face
S0293	i be yes
S0293	be you around later at all or not i'd love to chat
S0293	oh very good where do you play table tennis ah blast phone keep go down hello
S0282	it might be her connection be she call from germany
S0293	yeah
S0282	well it's gonna be
S0293	well normally she's it's really quite good it's brilliant actually this
S0293	last term we didn't have any contact at all
S0282	and so what she's get a video on her phone as well be it worth
S0293	yeah
S0282	be it worth do can you see can you actually really see her
S0293	i can't bear it
S0282	can't you
S0293	no i can't bear the video call we have to do that by skype last time
S0282	mm
S0293	and actually it be very grainy
S0282	yeah
S0293	and we couldn't hear each other properly it drive her absolutely will call later so that's fine just
S0282	just sound as though she might be in a place where the
S0293	sorry
S0282	it might be that she might in a place where her reception's not good or be your reception alright here
S0293	yeah
S0282	i be er we i we go to today and erm go to be slightly complicate because it's not very obvious the route and so i set off and my satnav honestly i'm gonna i'm i don't know whether it's do you think it's this area because er our satnav just do not work our my satnav almost all the way to say it couldn't find a satellite signal and so it just keep switch itself say can't find a signal can't find a signal turn itself off
S0282	so i be late because by the time i be fiddle with it and i miss a turn off and
S0293	oh
S0282	goodness know what
S0293	i do find round your area i can't get much of a signal sometimes
S0282	it might be that it might be the i don't know if it's the tree
S0293	yeah
S0282	or whether the soldier have get some sort of damp
S0293	i think there maybe some er there may be some blockage system
S0282	round the erm round all the barrack er so you can't get a signal on the barrack like in a hospital where you can't get a signal
S0293	mm
S0282	cos they've block it off
S0293	there's something like that round your area definitely
S0282	mm i wouldn't be at all people pooh pooh me when i say that
S0293	no i wouldn't be surprise
S0282	and also er i get this funny buzz in my ears when i'm on erm the east side of my house
S0293	mm
S0282	and i think that there's there may be some electronic thing go on there but everybody say that er i be erm paranoid and this be not true but i definitely have a ring in my ears that i don't have at other time when i'm in my live room or in my bedroom
S0293	mm oh well i trust your trust your instincts on this thing er i should think the army have all kind of weirdo weird and wonderful things
S0282	but i could turn into one of these barmy old ladies who believe that you shouldn't be anywhere near a you know telegraph pole or something who know
S0293	no i'm increasingly increasingly anti anti technology although this have this have be very good cos er er as you interestingly neither of us like do facetime we only like see speak as if an on a phone it's the only feel or else it make her feel further away actually
S0282	mm oh
S0293	if you speak on the phone it's fine
S0282	yeah
S0293	cos it just feel like an ordinary telephone call
S0282	yeah
S0293	she's like around the corner and like you know you'll ring your mum up
S0282	yeah
S0293	feel okay if you start get skypy it start feel like she's bloody miles away and i think she feel the same way actually so
S0282	mm
S0293	she doesn't normally phone me very much she's have such a nice time but erm
S0282	well that's that's so good i'm just so please about that it's just such a good decision wasn't it
S0293	mm it's marvellous yeah it's er it's absolutely marvellous and she's you know she's quite proactive about things i don't know she's yeah she's change er have definitely turn a corner unlike our who's erm definitely not
S0282	oh dear poor kid that's just so not fair but then i don't know whether it's cos she's have that kick back with the exams as well or be it just too much now
S0293	no it it's a disaster at this particular point cos she's get these big college audition as well just come up so it's very difficult from a confidence point of view to pick yourself up and erm and and er get out there it but on the other hand you know for be in the music industry you've get to be prepare for this
S0282	well yes that's true
S0293	er because they all have different they like different style i mean they er her and her friend obviously they're the same standard although her teacher say she should've get it er she teach both of them
S0282	ah
S0293	she say she really do reckon should've get it but
S0282	and what happen if this other girl bomb out
S0293	she won't bomb out
S0282	why not cos the thing er the thing that er strike me about be how much she enjoy it
S0293	oh she
S0282	and she er she appear not to have very bad nerve and when you when we when we go to see her in that concert she be so joy of it
S0282	and she be just so
S0293	yeah
S0282	into the performance
S0293	mm
S0282	and so engage in everything but
S0293	you couldn't get more involve than actually
S0282	yeah
S0293	you really couldn't wasn't like that
S0282	no
S0293	nobody
S0282	whereas actually yes and erm
S0293	mm
S0282	you you know obviously doesn't like it at some level to be in a kind of competitive situation and and erm do get nerve and do lose lose her you know sort of
S0293	this girl oh no no 's fine on
S0282	her calm sometimes
S0293	she she doesn't like she doesn't like erm she doesn't like the orchestra so much she work with a big group of people be hard work for her
S0282	mm
S0293	whereas er just can't get enough of it
S0282	mm
S0293	the more people around the better
S0282	mm
S0293	and to be in charge of a section she couldn't you couldn't've get a better section leader cos she so good
S0282	well i know that's er that's why i'm think well you know be there a chance that they'll sort of think my goodness what we need be we need back
S0293	she'd be so fair and
S0282	you know
S0293	she'd be so fair but this other girl be er er er er she i know she's quite bossy and whatever sometimes they have terrible section leaders they do last year absolutely bloody awful she have asperger's and really really bad with them and you just have to put up with em and bear it erm and it do happen there's two things erm one lead the section and two do the solo
S0282	mm
S0293	and three prepare the section get the section to do the work on it but it's it's do you have to move on
S0282	well i hope she get another opportunity
S0293	mm
S0282	what's happen about her maths
S0293	she's plod on
S0282	be she poor sausage
