S0293	yeah it's it's not erm she be do a lot of extra class and things but i don't i don't think she's really get how important it be but i don't know we'll see
S0282	be this will this give her a chance to catch up a bite
S0293	well only she she wouldn't get above a c if even if she work her bollocks off she couldn't get above a c now
S0282	well that's alright it's a pass
S0293	yeah oh i'd be perfectly happy with a bloody c i tell you but
S0293	it's a shame because i think she could've get a b but erm i'd be very happy with a c er to get a c in german will be a miracle get to go from a u to a c for coach for that oh god bloody coach
S0282	ah that's er extraordinary isn't it really
S0293	yeah it be and she's very dismissive of it but that's cos she's so pliant about the money she get terribly worry about pay out money i mean that's part of the problem i have with be she try to economise on things so for example reeds she won't buy enough reeds and then she run out and then
S0282	mm
S0293	and you can't order them or she won't do the coach cos she say it's too expensive or she won't take she hasn't get enough money on her therefore she end up at a station without enough train fare to get home that kind of thing that kind of thing happen to quite a bite
S0282	mm
S0293	cos she's so busy try to save money it doesn't doesn't help really
S0282	mm
S0293	a good good attitude but it just doesn't help in the long run like she wouldn't have any money in her account like i like to have a hundred pound in her account for when she need money urgently for an audition or reeds or something turn up and otherwise i have to be available at precisely that moment lot of things have deadlines you know you've get to be able to do it sometimes and she wouldn't have it her account and of course we just end up with me have to do three very complicate transfer against the clock and i'm think you know if you'd only have the bloody money
S0282	mm
S0293	it would've be an awful lot easier for all of us
S0282	mm
S0293	erm but anyway we'll see
S0282	mm so where be she at school at the moment
S0293	yeah she's get an orchestra course she's do they're do this concert actually and erm in a symphony concert on sunday they've get a course and then she go off to this holiday that we totally disapprove of to spain without her oboe and without her text book
S0282	oh right oh yes
S0293	with the girl who's get her place in the orchestra
S0282	oh
S0293	so yes so we
S0282	do you think their friendship will survive this
S0293	's quite generous about it actually she she couldn't talk to her for a day but she seem to have work it out
S0282	mm
S0293	but then er the girl work out why be so upset it's funny isn't it that's she's slightly she slightly catch cold she didn't work that bite out i guess if you haven't be in a i dunno i don't know why she hadn't work out how erm couldn't care about anything else except
S0282	oh no
S0293	it's funny but er
S0282	that's er
S0293	anyway her teacher her teacher be very good and
S0282	poor kid
S0293	her old teacher be really good she we brilliant actually she couldn't couldn't get hold of her teacher this be when you realise they're such fantastic human be she couldn't get hold of her current teacher so she ring up her old teacher and she's so brilliant at sort of put it all in perspective and be sensible about it and calm down and understand the realities of it all she be absolutely fantastic
S0282	that's good i mean will will it help that she do it for a year
S0293	oh yeah yeah no it do help yes you can two years
S0282	you can you can you can present it that actually for personal reason she couldn't do it
S0293	you wouldn't want you couldn't lie cos they all they work with these people er all the time people would be able to tell
S0282	well in which case everybody will know that there be a change of policy or that there be a decision make so
S0293	well no it wasn't exactly it wasn't as it's not as clear as that they never tell you er it's a very strange email they send through they they're never really clear of the reason
S0282	mm
S0293	so they say it's a it's a general email they send through say that they have to balance er that first and foremost it's the erm er it be do on merit it's meritocratic the best the person get the best position however this be balance out with how this have to be balance with how much each person would get from continue in the orchestra so there have to be a balance of whether they feel that she would get enough from continue in the orchestra or whether somebody else who hadn't be in it before would gain more and i can understand that if you're a equal standard
S0282	that's very weasely
S0293	it's very weasely it basically give them
S0282	and how be they to say erm i suppose that that you know that's kind of sop cos you're then you're suppose to conclude well actually i'm so good now and i've progress so much
S0293	it's weasely
S0282	that actually i've get eighty per cent of the value i can get out of this and another year would only give me another twenty per cent and therefore somebody else would
S0293	but then on the other hand they're say it's completely meritocratic
S0282	yes
S0293	so it's not really it's
S0282	no it's not meritocratic be it
S0293	no
S0282	how can
S0282	no it's either meritocratic or it isn't you can't have meritocratic er mitigate with some other factor
S0293	exactly
S0282	because then it's it's
S0293	yeah er but er it it er be renowned i mean paul daniel who be most famous oboist there be never get in to
S0282	really
S0293	yes
S0293	and erm er we know many stories whereby a teacher would say this be the most definitely will get in this person hasn't get a cat's chance in hell and then that person that hasn't get a cat's chance in hell will get the position and the other one won't so it be very idiosyncratic
S0282	mm yes
S0293	they never give you any rationale you never know what's really happen there's quite a lot about personality in fact get on very well with this tutor but i don't think she's she have a terrible injury so i don't think she'd see much of er operate so she probably didn't realise how serious she be erm it's a variety of things there always be always be a variety of things
S0282	mm
S0293	i mean if er when she get chuck out it be for very good reason and er but we be very lucky cos he felt so bad well 's teacher know him very well and and he she make him ring her up and that be brilliant because he say you know you didn't know the piece well enough you you and she be she be she didn't
S0282	she be wing it again
S0293	practise it she be wing it yeah
S0282	yes
S0293	and and you know that be a reality to that and it it be a terrible shock but er you know there be some reality to it
S0282	mm
S0293	erm anyway
S0282	i don't know perhaps it's better if you have an experience like that somewhere along the line when you
S0293	it be you have to have it you have to have it
S0282	mm so it just teach you what happen
S0293	well you have to
S0282	when you don't
S0293	you have to be robust enough to deal with the knock you can't be a musician and many many good musicians fall by the way at this stage
S0282	yeah
S0293	or at music college cos they can't can't cope with the rejection if they've always be the best
S0282	yeah
S0293	and suddenly they start get knock
S0282	but then on the other hand this be where it start get serious because it's you know beyond a certain age nobody's go to stand up and clap you and beam all over their face and be please to see you stand on a stage just cos you're you as your parent and your friends and your aunties and uncles et cetera would do you know you become just another musician in an orchestra one of however many perhaps you're cannon fodder you're certainly pay a shitty amount of money you know and actually the reality of be a musician as an adult be be you're not a gild youth any more at all you're a hack
S0293	no no no
S0282	and the transition from gild youth to hack must also be
S0293	it's a really rough transition
S0282	yeah
S0293	it's really rough and and and interestingly now i've go through it with the kid i think it's more interest because they be train to such a high level and they dedicate themselves from such a young age all of these kid will've be practise serious amount of time from fourteen onwards
S0282	mm mm
S0293	you know it's they be adults in their play
S0282	mm
S0293	from the age of fourteen onwards
S0282	yeah
S0293	and then as you say they just become any old hack who's sort of hire for a pittance to do you know play a tune
S0282	mm yes
S0293	and it
S0282	and nobody notice you again and actually you're probably sit in the dark most of the time
S0293	yeah
S0282	cos erm you know you're just you're just at the back and super you know just i don't know just
S0293	well that's why
S0282	you might as well be play the triangle or something ping
S0293	but it's a society unto itself i think the musicians all appreciate each each other so
S0282	oh yeah there must be a benefit there must be a benefit to it i mean i suppose i don't know an artist or
S0293	yes it be an artist
S0282	any any other kind of perform really that that actually the comradeship of your peer and be part of the little
S0293	well they know whether you're good or they know whether you're good or not
S0282	yeah no
S0293	and you be create music and er you know you know whether you're do it well or not about personal satisfaction i think
S0282	yeah yeah yeah
S0293	for you know like with er with the she actually really didn't care whether she get through or not all she care about be whether she felt she have do her best
S0282	yeah
S0293	it be about it be a personal thing
S0282	no
S0293	it be she could stand up in front of her contemporaries and feel pride in what she have produce and she could and that's it wasn't anything to do with anybody else it's just whether she could actually say she actually play like she want to
S0282	yeah and what be really nice when we go to that concert be other people see other people around go oh that's oh that's and come up and say oh hello
S0293	
S0282	when we go up to the to see what be the name of that musician that whose piece we listen to that time when we go up to see on that saturday night at the there be that modern begin with a a modern composer
S0293	oh adès
S0282	adès
S0293	yeah
S0282	be it adès
S0293	yeah
S0282	and i really like that music
S0293	i oh i i we saw erm the tempest which be an opera by adès which i think be bloody brilliant it's it's a film you if you ever get a chance to see it
S0282	mm
S0293	it's it's quite weird but i think it be wonderful
S0282	oh right
S0293	yeah well mm we shall we shall see but erm 's actually win a competition she's win a concerto competition and she's do erm a performance up at erm the new well it's a new concert hall in it's call it's just opposite the centre it's part of
S0282	mm
S0293	and it's huge and she's do that in december so she's get big things come up
S0282	oh well that's good
S0293	so it's yeah
S0282	and what do you say erm that erm what do you say that et cetera be come round to have a look at a gym to have a look at oh no to have a look at 's
S0293	's house
S0282	's house not er at a gym i think oh my god
S0293	no no no they're come round to socialise really
S0282	oh right
S0282	and be come as well or just
S0293	no
S0282	no cos he's on holiday
S0293	's well doesn't socialise with and doesn't come down ever
S0282	doesn't he
S0293	no be very antisocial he play he play golf but he doesn't he go on the golf trip but he doesn't doesn't socialise otherwise
S0282	mm they be down at our house the other day mend the boiler again again something else go wrong but it's a three way valve and they always go wrong it's very bore indeed it drive me bonkers you wake up in the middle of the night and you think what's that noise you think it's the boiler what be the what time be it why be the boiler go and of course because it's the the valve have block it's still just go like billy o and it's the middle of the night and all the radiators be boil hot and the water be pip hot and everything and it won't switch itself off because the valve be stick in the open position it's really frustrate
S0293	mm mm yeah they be annoy we when we do the kitchen we need a new boiler i guess will talk to
S0282	how far have you get on with
S0293	nowhere
S0282	nowhere
S0293	we've get the plan for we've get build regs plan now
S0282	oh
S0293	saw the builder but he can't do us till next year so i don't think any builder's go to be able to do us until next year
S0282	oh it's frustrate isn't it
S0293	to be honest there's quite a few things we have to do ourselves and we're not progress with those you know we've get to change some gutter we've get to move a flower bed we've get to empty the shed get rid of the shed you know there's quite a lot of stuff we have to do
S0282	mm
S0293	which erm we're not really address at the moment we've get to get
S0282	no it's very frustrate
S0293	skip in and we've get to actually
S0282	it's very satisfy get a skip
S0293	i know well i want to get one now cos it's the only way i'm go to get to empty the bloody shed and we've get just we've empty 's loft which be a huge and to be fair to him he do it himself erm which be well help him
S0282	mm
S0293	erm but that be a huge relief cos we do a whole load of old carpet and god know what else
S0282	oh that's terrible and you imagine that they're still gonna be alright and you look at them and you think
S0293	they probably would've be alright but you know there come a point when you just don't have the will to lay these things do you
S0282	no and actually also we roll up the carpet in one room in our house to put to to put the wardrobe in new wardrobe what i didn't realise be once you've roll up the carpet the last thing you should do be walk on it because when the guy come round and i say oh can you relay that carpet he say no i can't cos it's all crease up if i lay it now you're gonna have to call me back in about three weeks' time because when all the crease have have unfold from it again it will be too loose so therefore you have to lay it back down and not pin it down for the next sort of three or four weeks and when call me back after that when all the crease have go and then i'll then i'll pin it back down again
S0293	mm
S0282	that and he sort of say have anybody be walk on there so say er er well yeah didn't realise we weren't suppose to so so it's so once they've be roll up in the loft for however long i would imagine they're never gonna lie flat again actually
S0293	no
S0282	they're not roll down to a piece of cardboard like they be in the first place
S0293	no
S0282	they're just sort of sloppily throw up there likewise lino
S0293	and the other thing well 's friends have just be sleep on them and sleep on em
S0282	oh yeah
S0293	but erm the other thing be i suspect this bloody project be gonna end up er exponentially must more expensive than we'd anticipate
S0282	mm
S0293	because actually when it come to it 's begin to realise that he can't do certain things himself and he hasn't get he just hasn't get the time
S0282	be that his knees as well
S0293	it's just time hasn't go the time erm
S0282	mm
S0293	you know er
S0282	er i be gonna say earlier as well be have you do you ever have massage cos er if you have massage that i think that would help as well
S0293	i don't find anybody i trust cos the cos i've have a back problem i'd only want to do it with somebody i really trust for massage
S0282	yeah
S0293	i wouldn't go for a general massage cos some people can bugger me up
S0282	yeah
S0293	and there be people that that be good but i would only go on personal recommendation
S0282	yeah no quite but i be wonder if that might help really
S0293	it's expensive expensive
S0282	yeah all these things be expensive
S0293	but actually that's what my mum use to do think about it she do yoga massage and she that help her with her stiffness so perhaps that be something well i'll try these exercise and see cos i've be do quite a lot of swim recently and i think well it have help i have get
S0282	well that ought to help a bite yeah
S0293	well yeah but it it actually hasn't help on the lower back it doesn't hasn't er it help in term of pain and it help in er term of general strength but it doesn't help it have help to a certain extent with the knee but it hasn't help get up and dress and move around type things
S0282	mm mm
S0293	so er
S0282	and when be the last time you have a new mattress
S0293	er fifteen years ago it be a good one
S0282	perhaps you should get a new mattress
S0293	well i know we've be think about that we probably do need a new mattress
S0282	my actually er my er cos er have one of 's fetishes be about mattresses and he always use to say i like a really really firm mattress so he we go out and buy a we have to go to to buy this mattress and we get the hardest one in the shop which he insist be the only one he could sleep on and we sleep on that for i don't know er for i can't remember how long and in the end i have to say to him i cannot sleep on this mattress any more because actually you know what it be really seriously do my hip in and my leave hip i have
S0282	i er my hip be out of joint really just a bite kind of erm just i don't know unbalance or slightly twist or slightly tense er i don't know i be kind of cock my hip a bite
S0293	mm
S0282	for such a long time and i just have a permanent hip ache so i have to go on my leave hand side and in the end i have to say to him look we will have to get we'll have to get a softer mattress so we do get a softer mattress
S0293	why don't you do er two two
S0282	and then ah well no and then we have erm and then we get a softer mattress still wasn't enough and my hip be still bad and then in the end i buy a i buy a new bed and a new mattress without consult him and i get a more expensive mattress and one that i've get more pad and one that have more independent spring which mean that actually that it it's much more responsive to your individual weight and protuberances
S0293	ours be an incredible expensive bed we buy
S0282	mm
S0293	because actually interestingly as you say we have be have a terrible time and i be in agony at night and hadn't sleep for years and we be you know some friends say we'd only just inherit bed and whatever we'd never buy one so we buy a really high quality bed and it's be really really good
S0282	yeah
S0293	it's it's difficult to know whether we actually would improve matter or not er can still sleep on it it's not bad the bed
S0282	well the thing the thing be say that he have to have a hard mattress he sleep he sleep whatever he's sleep on so actually it hasn't matter to him at all that we've get a soft mattress he's be absolutely fine but it's be much much better for me but it's take an awful long time for my hip to get better after that my hip be bad for ten years but the other thing that help me be t'ai chi
S0293	yeah you see i can't do anything like that at the moment cos i fall over
S0282	no but it help with that it's be prove scientifically prove don't give me that look
S0293	no no no
S0282	scientifically prove in ancient japanese people chinese people that it improve your balance
S0293	i'm not very good at class to be honest
S0282	no it be a pain in the arse
S0293	i i erm i i'm not a very groupie person
S0282	you can get youtube videos and you can get
S0293	yeah i'm not i'm also very bad at follow things cos i don't know my right and leave
S0282	oh yeah no yeah that's very
S0293	it's really i can't follow a video
S0293	it's twenty past five
S0293	come on homework it's gonna be a nightmare otherwise tomorrow come on
S0293	i've buy some kitkats for tonight
S0282	and you're not have one unless you've do your homework
S0293	but you do need to get some homework do
S0282	no shame bribe your child with kitkats that's terrible
S0293	well i er i i er i bring up completely differently you should see her pack lunch they're absolutely ridiculous
S0282	chock a block with crisp sweeties
S0293	crisp everything the lot
S0282	jelly cub
S0293	things i completely ban from the other children but i've just give up well just not i haven't give up but bring her differently it be interest how i'm bring her up it's just different and i have to bring her up differently cos she be a different child
S0282	she's a different animal that girl she's be that way
S0293	and er she she's on board now with pack lunch
S0282	mm
S0293	she
S0282	well if she as long as she eat something
S0293	exactly
S0282	just eat anything girl
S0293	well exactly i come to the point where she be eat a lolly for lunch you know it be better than a lolly
S0282	yes quite
S0293	erm
S0282	she's get the will of a
S0293	yeah
S0282	stubbornness of a whatever
S0293	she's quite funny actually cos for somebody who doesn't really take school very seriously she actually do do her homework it's quite amaze to me i haven't have any kind of detentions for not do it or anything
S0282	oh that's quite good cos she's not yeah she's not actually get detention she's not actually you're not actually be haul up
S0282	to have little you know discussions with the headmaster about you know
S0293	well they may be be be very cautious cos she's know to be emotionally vulnerable i don't know
S0282	ah right okay
S0293	but i haven't
S0282	yeah but then on the other hand actually that's the worst possible thing that could happen to her because then she'll just turn out to be a monster when she's thirty cos she'll she'll just be expect people to stay out of her way
S0293	hi darling
S0293	i'm not free to talk at the moment i've get with me can be you free at any other time to talk to me
S0293	could you could you ring me a bite later would that be possible
S0293	be you alright
S0293	be do the orchestra course today
S0293	oh
S0293	oh dear so you ought to go outside and rest yourself have a bite of a walk round
S0293	go and have a walk outside
S0293	mm sound absolutely rivet
S0293	okay well give me a ring er later yeah okay that'd be nice thank
S0293	yeah
S0293	yes
S0293	yes yeah
S0293	oh okay
S0293	well let's talk about that this even let's we'll work out an an an an er a weekend this even
S0293	yeah okay okay
S0293	lot of love bye
S0282	bye
S0282	what be you cook for tonight
S0293	er salmon and chip we er it's the
S0282	oh right
S0293	it's the only reason come home on a friday
S0293	we're creatures of habit we be
S0282	ah
S0293	actually doesn't eat any vegetables
S0282	doesn't he
S0293	no no
S0282	god he's such a nice man he be so nice
S0293	he be a nice man he's very nice he's quite funny he doesn't er he doesn't do anything weird or wonderful he's very very kind of traditional
S0282	very very conventional mm
S0293	traditional yes very conventional
S0282	but that's well that's
S0293	he look after his father who have very serious alzheimer's and be doubly incontinent and god know what else for about ten or fifteen years
S0282	oh do he really
S0293	mm
S0282	er be he he's not marry be he not marry
S0293	he be marry
S0282	oh
S0293	and it didn't fall apart anything to do with him
S0282	oh
S0293	it be very sad he be very in love with her they meet when they be about fifteen i think and erm
S0282	mm
S0293	she just go off with somebody else but
S0293	they have two children and whatever and he he have girlfriends now and again
S0282	oh well that's mm okay
S0293	but he be a very commit family man
S0282	mm
S0293	both his children live with him and that kind of thing
S0282	mm
S0293	so mm be a funny bloke i don't er i don't i can't get my head round at all i think he's a bloke's bloke i don't think he talk to women really or he he might charm them but he doesn't he's not kind of
S0282	he's just about start speak to me he'll talk to me now
S0293	doesn't talk to me you see at all
S0282	no he'll talk to well he'll talk to me about boilers and stuff not not anything about anything boilers but you know it's quite interest that when be there one day they insist they both insist on talk to
S0293	they're men's men
S0282	and they might as well not bother i i be er say to i nearly felt like say to them why be you talk there there's no point talk to him and in fact they leave him instructions as to how to clean the filter and i think he probably he he maintain he's do it once but i think to myself if they if they've have to come round again cos hasn't clean that filter i shall be really cross because have not clean the filter again and there's no point in ask to clean the filter he do it once as far as he's concern you know that's it you know you're not that you do it every six months he can't possibly remember something as repetitive as that although i have to say he be get far more practical in his old age at least
S0293	i'm get more impractical you see cos live with i get terribly impractical
S0282	mm
S0293	i use to be quite a practical person not at all now
S0282	no well i suppose it's very easy to leave it to them but erm but anyway erm do you say that have a lathe and everything
S0293	yep bury
S0282	be it don't throw it away
S0293	no no he wouldn't give it away
S0282	there be i be on the the the other person on this course be a barrister who erm who erm have get a i don't know must have his own house with all his own tool and make his own long longbows er longbows and have now and have get a lathe that he buy off somebody for a hundred quid when the person get bore
S0293	that's what that's what 's do use to get him all the stuff from auction
S0282	oh right oh right okay
S0293	so have get a shed full of unbelievably high end wood turn tool
S0282	oh right i'll have to bring in my things to show you
S0293	mm
S0282	i i be quite please with them actually
S0293	mm
S0282	although it be so tire we be just discuss today with the others about how our brain don't work properly any more since we have chemotherapy
S0293	mm
