S0198	bend you up yeah
S0192	stick your back in your own gut
S0198	mm
S0192	and eat your sausages excuse me it doesn't seem like a very friendly thing to do
S0198	it doesn't but it taste good
S0192	mm
S0198	whoever decide to do that that one time and make a sausage who make the world's first sausage
S0192	do you think he be a bite weirded out the first time he do it like people don't like this i don't know surely at the time everyone just eat whatever part they have though
S0198	maybe it come out of just the necessity like you have all this leave over meat that be bits and bob
S0192	mm
S0198	and you couldn't cook it in bits and bob so you stuff in inside something you could cook it
S0192	yeah
S0198	i bet we've be do it for years like haggis
S0192	stick it in the organs of the other animal
S0198	mm
S0192	yeah i don't see why not
S0198	my go down slowly
S0192	be you gonna smoke a cigarette
S0198	i'm gonna pour this coffee and then smoke a cigarette
S0192	we're go to stop again
S0198	yeah i mean i probably won't be able to even smoke much in there
S0192	we need to stop at least a couple of weeks before our course we don't want to be like
S0198	yeah of course not i mean as of monday just we're just i mean we're not go over the top with anything have we we have one cider last night and smoke a cigarette so
S0192	no yeah
S0198	as long as we're conscious of that
S0192	i just feel bad that we be try not to smoke cigarettes and we just smoke them
S0198	no
S0192	i smoke a few cigarettes with
S0198	yeah i do when i go out drink i do in the when i be at home
S0192	and cigars
S0198	if i have a free house i think i'd be have be worse for it
S0192	mm
S0198	but i do really try not to smoke around my parent they must have smelt it i know but i never go out more just for a reason just to keep me from smoke too
S0192	i get a little bite addict to cigarettes again on that last day i have to smoke out my dad's window
S0198	oh do you in his house
S0192	in the bedroom yeah he probably could smell it
S0198	mm before you meet er when do you do that what of an even
S0192	yeah he didn't come back in again but
S0198	mm
S0192	do you want one then
S0198	yeah
S0192	where be the cigarettes
S0198	er that's your department i think
S0192	it's drum
S0198	yeah what how many grams be it
S0192	it's not the best tobacco
S0198	how many grams be it
S0192	it's a fifty gram pouch
S0198	oh
S0192	so it's go to last a while
S0198	oh how much be that oh it's our pouch
S0192	yeah of course
S0198	oh fuck yeah awesome
S0192	yeah
S0198	it's three pound something for just have you see it the three in one old auburn or whatever everyone's buy at least round my way
S0192	no
S0198	and you get a very small pouch of tobacco it's like seven six point five grams
S0192	oh yeah i do know that one
S0198	you just get one though and not two before you use to get two of them in the box know you get one of those a pack of rizla and some filter tip and it's call the three in one
S0192	how much be it
S0198	and it's like three pound forty nine or something
S0192	wow that's well expensive for half the
S0198	but i'm like i'd rather spend yeah i'd rather spend the less or more and get i don't need to get the three in one rubbish
S0192	no
S0198	but for people like and who don't smoke all the time they also only smoke when they drink then they just get that buy that like once a week and that's not plenty enough for the week
S0192	yeah
S0198	erm stuff like that so
S0192	i mean you still get quite a few rollies out of it i'm sure
S0198	yeah yeah yeah it still last like erm even when we've drink between
S0192	probably get
S0198	we share between three of us one of them that's fine
S0192	i wonder what the tobacco company think of erm all these vapo cigarettes
S0198	yeah i know if they've
S0192	unless they're behind it
S0198	unless they've already get their investments into it yeah
S0192	yeah
S0198	they may either be behind or if they're not
S0192	cos really that's i mean it would have be within their interest maybe even like forty years ago to start invest to start produce stuff that smokers people these you know fine to smoke something else that they could do that wouldn't be so harmful to them
S0198	yeah definitely but you continue to make money from it
S0192	but vaping isn't it i don't think it's like completely unregulated
S0198	no
S0192	whenever we've try it i think it be horrible
S0198	yeah it taste it feel like a you know that like liquid stuff you burn around the house or something
S0192	yeah it doesn't taste healthy at all
S0198	i don't think it's mean to be inhale
S0192	i mean cigarettes don't either but at least it's a plant of some sort
S0198	yeah
S0192	i mean it's just a chemical
S0198	mm
S0192	how can you think that's a good idea i don't really understand wait until we're absolutely
S0198	no it be a chemical erm i be speak to and he be say about his brother get into vaping
S0192	yeah
S0198	i wasn't speak to him and have you see the picture up on facebook
S0192	yeah he vapes quite a lot doesn't he
S0198	yeah
S0192	in the philippines
S0198	be that what those cloud smoke be then it's just really weird be that be this smoke cloud be
S0192	he's definitely into it
S0198	yeah
S0192	anyway do you want to smoke this cigarette
S0198	yes
S0192	yeah do you want to smoke it out there
S0198	yeah do we smoke it in the kitchen and then out of the window will be better
S0192	in the kitchen maybe
S0198	i don't remember where the ashtray go have you see it
S0192	no i haven't the ashtray either oh we've already make a mess
S0198	i know we need to wash up
S0192	lovely
S0198	i dislike the mess the sound of children cry that's worst sound
S0192	i know it's a bite of a
S0198	downer
S0192	yeah it's something they should have tell us i mean
S0198	yeah i know what i couldn't see what that be from
S0192	it's not something you expect
S0198	unless it's someone's cos it's right next to the nursery that pub thing and we never saw anything that look like a pub do we so it's either someone's garden or it's a bed and breakfast or something there be a bottle of beer out on one of the table
S0192	there be
S0198	yeah
S0192	as we say hopefully it will erm once the weather get worse
S0198	yeah that's true it be the summer
S0192	they won't come out there as much
S0198	mind you when it's really nice people do sit in their garden
S0192	yeah i would hope so it's very nice isn't it
S0198	we've both
S0192	have you be feed up with have pocket full of change since you return
S0198	well i don't i keep it in a purse er
S0192	quite infuriate wow
S0198	well i've be almost put almost everything on my card so i don't break change very often
S0192	have you
S0198	i use the money when it's something
S0192	be we gonna still get a joint account
S0198	mm
S0192	do you think we just join one account or we're go and get a new account be good to have a santander account
S0198	i guess if we want a santander account then we can just open
S0192	and we've get more chance of get one
S0198	and then we can just for er the sake of i don't know anything oh wait nationwide or whatever that's just an old account i've get
S0192	yeah
S0198	like i don't know whether or not if we open a joint one to close the like be it
S0192	yeah i mean if we get if we open a joint one and have still get the nationwide one
S0198	mm
S0192	separate then i'm go to shut
S0198	be there a limit be you allow to just keep open bank account
S0192	yeah i think you can have as many as you want
S0198	mm
S0192	don't think it matter
S0198	i think i've get one with natwest somewhere from my old student account
S0192	you do yeah apparently they shut them down after a while if you don't if there's
S0198	if they're inactive
S0192	no activity yeah
S0198	i should perhaps contact them at some point
S0192	put in some money every so often i mean you don't need natwest
S0198	i certainly haven't receive anything from them for a long time
S0192	they probably just presume yeah
S0198	a bite of spam mail
S0192	those children sound possess
S0198	yeah it's just children
S0192	they really do
S0198	my niece for her eighth birthday have rent like the church hall and they'd pay for this like entertainment group to come and they come in the freeze theme it's go to be a freeze theme birthday
S0192	that will be good
S0198	they they er we could go to it of course for the second week we'll be here
S0192	yeah maybe best do too much this kid be go crazy
S0198	though she say she understand if why scream at your own girls for two hours
S0192	no
S0198	it doesn't sound like much fun and at least they've get a hall this time
S0192	she's a mother she have to do that kind of stuff
S0198	yeah i think they enjoy it it's fine
S0192	the sound of seagulls it would have be nice to have have some nice weather
S0198	i know i'm hop between now and before our course start we'll get a couple of days and we can stroll down to the to the seafront maybe sit on the beach
S0192	it would be nice to go and sit out in the park yeah yeah that would be lovely wouldn't it
S0198	mm we do live by the coast now
S0192	that should be the last one of these today
S0198	yeah
S0192	maybe split one more later
S0198	i didn't get to the room and get my coffee with it do i
S0192	oh do you not
S0198	it just go so quickly
S0192	just talk sorry
S0198	no it's okay it's because the coffee's hot isn't it
S0192	we have wash up liquid do we have any wash up sponge
S0198	mm we've get dishcloths which be better
S0192	dishcloth but no sponge
S0198	because they they last so much longer oh we've get tea towel
S0192	be we keep the egg out
S0198	no they stay in the fridge
S0192	do they
S0198	yeah we keep egg in the fridge once you buy them
S0192	once you buy them
S0198	but i mean once i mean to be honest probably if we want to save on fridge space in the long run
S0192	this this need it's too high
S0198	we're not go to be able to store batch and stuff too easily be we once we've buy our fruit and veg
S0192	yeah it's go to take up a good deal of space we're go to have to live more hand to mouth i think i'm alright what be we do now be we get ready
S0198	yeah we should try to go out the i don't think the i water on and it doesn't come out hot
S0192	it doesn't
S0198	we'll try it in the end you try
S0192	yeah run that one
S0198	shall i put this one on
S0192	be we call this for now
S0198	yeah
S0192	more later
