S0198	yeah i don't remember you didn't tell me at that time though that your dad have
S0192	i didn't look
S0198	no but when i tell you about that it
S0192	oh something's burn
S0198	be it on i think it's just on
S0192	a hundred and it smell bad yeah maybe take keep it open put the sausages on it doesn't sound on be we sure this thing work be it from a charity shop
S0198	oh it isn't cut them
S0192	yeah of course they need cut
S0198	i don't know it's be a while since i've handle sausages okay
S0192	be you go to use these little scissor do you think they'll work
S0198	i've think about it that's the only kind of sharp knife
S0192	a little knife would be better
S0198	oh yeah we haven't we've also get to consider what we have to actually cook with so
S0192	yeah cut with and
S0198	i mean anything can be blend in the bullet thing
S0192	yeah be it call the bullet
S0198	which be handy yeah it's basically a bullet
S0192	don't forget this thing
S0198	a bullet with yeah i know a bullet with additional accessories
S0192	right so we've get a fry pan for the egg how many be you have then two this be your lunch
S0198	no i still only have one egg at lunch
S0192	one egg what's that all about i appreciate you get all these pot and pan you may just have to send some back just see which ones be the best quality i mean these look pretty good where do you get them from prestige durable stainless steel
S0198	no i didn't my parent get them for me i would have get them from a boot fair or something
S0192	what's that smell
S0198	sausages cook
S0192	be that what it be
S0198	but erm i just didn't realise the i think you say your dad go out and buy you some since since my parent buy those
S0192	no he the ones that you tell me you have you must not have have so he buy
S0198	oh
S0192	he just tell me that you have some age ago but either he do or he didn't i don't know
S0198	oh that smell good
S0192	we're have a whole of
S0198	be you hungry
S0192	yeah i'm get there you know be you
S0198	oh yeah yeah
S0192	be we recycle them
S0198	i mean i've get all these cardboard box that i be just
S0192	we've get a metal i'll put the can in here
S0198	yeah we may as well try any how
S0192	i'll wash it out this do come out really hard something smell like burn
S0198	i think it's just because it hasn't be use like
S0192	it look
S0198	more or less i think i don't think the people before use it yeah my dad try it out it might be just where it's have clean or it's be clean i'm not sure i think it's fine though or
S0192	it's not that erm mega plug
S0198	i'm not sure now you've mention that no now it just smell like
S0192	can't really tell
S0198	hopefully it's alright
S0192	there's definitely a smell of burn i can't smell it out here
S0198	no
S0192	oh we just put the kettle on as well
S0198	i'm sorry i'm sorry i'm sorry but i do want to have a cup of coffee afterwards maybe
S0192	yeah you can put it on but these things be on at the same time
S0198	be you prepare oh these aren't go to take too long i don't think
S0192	no i know i know so i need to put this on but i need to actually figure out how to work this thing cooker on
S0198	i know
S0192	back right front right
S0198	it didn't seem too difficult when we do the pizza
S0192	front leave yeah it be good with the pizza wasn't it
S0198	yeah
S0192	what's that selector on can we do that
S0198	i don't know
S0192	we buy butter didn't we
S0198	yes there's butter in the fridge i don't know what a selector be like
S0192	fridge be work seem to be work
S0198	yeah that's good
S0192	be the freezer work
S0198	er seem to be
S0192	how be there not enough
S0198	such a small fridge freezer
S0192	like
S0198	really small
S0192	they've get some compartments here we can fit a good deal of stuff on here but like this side bite
S0198	i know
S0192	we could do with an egg tray
S0198	i know yeah it just limit our stuff even more
S0192	yeah
S0198	what we're gonna pile stuff on top of stuff
S0192	egg trays be
S0198	i'm impress
S0192	oh
S0198	what a skimpy landlord
S0192	i think it's just landlords everywhere
S0198	yeah
S0192	they just do what they have to do
S0198	oh that's cool bird candle
S0192	how long do it take for these things to heat up
S0198	what the sausages or the
S0192	no the pan
S0198	they're boil there
S0192	do we have a knife in general
S0198	we don't have a big knife
S0192	we've get a garlic crusher
S0198	yeah which be annoy isn't it how be we gonna chop vegetables oh we're gonna blend them
S0192	we've get this
S0198	yeah
S0192	that's that knife will cut that need a clean so you still just want one egg
S0198	yes i'm go to have bean too aren't we
S0192	yeah
S0198	shall we put the bean on
S0192	egg be good for you
S0198	yeah but i've also get two sausages and bean and
S0192	i think this thing's work but i can't really tell
S0198	i don't need any more than that trust me
S0192	i trust i trust
S0198	where be those tongs
S0192	i'll turn these both to four i'm sure if electric be it erm
S0192	take a while to heat up
S0198	yeah
S0192	and then take a while to cool down
S0198	yeah
S0192	oh these sausages don't fry them
S0198	oh leave them sorry
S0192	yeah i didn't think you need to do
S0198	stick them on the barbeque
S0192	turn them down a bite that's fine
S0198	on a barbie
S0192	yeah you be on a barbie with your i'm so proud of it i put my name on it
S0198	george foreman
S0192	apart from the rust it's clean
S0198	yeah it's just it's just gonna keep that alive isn't it
S0192	as long as you can
S0198	it stop work and then what not replace it it seem harsh
S0192	surely she'll replace that we have a spatula where be the egg
S0198	egg be in the fridge
S0192	do you have some as well what be you eat
S0198	oh these ones with the little i don't even know what we call them hundreds and thousands bobbly bits
S0192	they're hundreds and thousands aren't they
S0198	they're not hundreds and thousands though be they they're round
S0192	i think they can be hundreds and thousands even if they're round
S0198	be they just sprinkle in chocolate
S0192	yeah
S0198	there you go sprinkle in chocolate
S0192	smell like burn but this shit that's on the top of this thing be come off on the pan and maybe oh be that just tell you it's half way
S0198	mm mm
S0192	it's quite noisy
S0198	that's if i put it up to ten minute erm i don't think i put it up maybe i do
S0192	be it actually cook be it heat it's pretty slow if we have to turn this thing on about ten minutes before
S0198	i mean it's melt so it's definitely
S0192	yeah unless there's just
S0198	it's not that hot
S0192	the temperature of the room
S0198	sow your bean
S0192	yeah be that all you've get
S0198	yeah
S0192	out of bean
S0198	well we've get some plastic ones as well so
S0192	well it's definitely start to steam so
S0198	we've you only have three egg there three egg
S0192	i know i don't know
S0198	i think that's okay
S0192	i eat it the other day
S0198	just cos you have all day you want all that yoke don't you like gravy we do have bean though that's my save grace
S0192	yeah i'll just do two egg i guess be you just have one
S0198	yeah but you can have two i mean don't let don't let that be a judge of anything i'm tempt not to wash up until we have put hot water on to shower
S0192	yeah that's not a terrible idea
S0198	to run our little sink with
S0192	it's good that we've get a nice size side here for food preparation
S0198	yeah er
S0192	we do have george foreman's what's wrong
S0198	it go
S0192	fat
S0198	fat that come of of it
S0192	christ there's three egg in there how do be those
S0198	erm they're not that do i don't know if we should be cook the egg yet actually
S0192	okay where's the bin
S0198	under the sink in a bag in a that bag
S0192	this one
S0198	yeah
S0192	i mean if we'd have fry the sausages they'd be alright like that we could have all for five six minutes it doesn't take to fry sausages ten minutes
S0198	it's true once it's at temperature though i don't know how hot it be originally
S0192	but look at look how slow this one be
S0198	er the fat's start to come out yeah
S0192	look how slow this be shall i shut this window well no do i
S0198	no cos the
S0192	this isn't go to cook very well at all
S0198	i guess three erm thing be it will get really hot and then it will be too
S0192	it's just smoke
S0198	it will be too hot and then you won't be able to turn it down again
S0192	they're just smoke
S0198	i reckon it's where they've be bleach though it smell like you've scrub the oven after you've put
S0192	do you think it will erm clear out
S0198	well i hope so it's really
S0192	cook a few time it's not good
S0198	yeah cos the stuff that come off straight away
S0192	yeah
S0198	that oven's
S0192	so it just need a good scrub or something
S0198	terrible no cos the actual part come off of it though i think you just need to er i don't want that smell every time we cook something
S0192	no we need to tell her that it's smoke do you want to check on sausages make sure they're okay
S0198	ah i'm stick still think they've get a little longer
S0192	oh they definitely do
S0198	they're big sausages i guess
S0192	we should turn this down i guess it's go to get really hot isn't it we won't be able to change yeah they be quite big sausages even try and push it down yeah turn the temperature up maybe we'll whack it up two hundred and fifteen that will cook them
S0198	you can smell it oh we haven't shower yet have we that's good
S0192	no no of course we haven't shower
S0198	i don't like smell like fry or grill food for the rest of the day
S0192	no i don't either you see now it's go
S0198	really stick to your hair yeah now you're probably won't go to cool it down
S0192	no
S0198	i guess you can take it off let it cook itself
S0192	yeah
S0198	so
S0192	cos they're not do yet be they
S0198	no
S0192	where's the spatula
S0198	i mean if you put them in ah yeah it's not an oven though be it
S0192	i mean yeah
S0198	yeah have you have many bean since you've be home
S0192	yeah i have yeah
S0198	eat bean i've only have it once or twice
S0192	have you
S0198	i've have a few slice of marmite toast
S0192	you can definitely smell that stuff
S0198	oh sorry
S0192	these egg be get really stick on here
S0198	yeah hopefully your dad have a few piece of stuff
S0192	i'm not sure oh right no it just look like a cheap pot and pan set it's just about the same
S0198	oh right
S0192	we need like a decent wok or something i mean you've get a wok there
S0198	yeah that's what i think like
S0192	a decent fry pan we get everything for free again in korea
S0198	yeah we do didn't we
S0192	yeah
S0198	that massive pan of that he give us
S0192	yeah
S0198	i bet he hardly use that
S0192	yeah i bet he hardly use that
S0198	for a start he be you know very and secondly i don't think he do any cook in his apartment ever
S0192	no i don't think he do too well the fat's really come off of that now
S0198	yeah i know it's really ooze
S0192	how be it look it's cook but it's still not do
S0198	no four more minutes
S0192	damn we're gonna have to get use to these cook
S0198	get some cutlery ready none the less
S0192	you like your egg to be cook dry
S0198	do you bring back chopsticks with you
S0192	yeah i do yeah yeah
S0198	you grab some didn't you i grab one set which mean in the end but erm i wasn't sure if you do you take some or not
S0192	i think this one you probably want to boil this up to six immediately and then turn it down after like three minutes
S0198	yeah yeah just to get it up to really hot
S0192	do english people leave their butter out
S0198	yeah mainly especially in like a butter butter bowl
S0192	butter thing
S0198	er butter dish
S0192	yeah
S0198	yeah it's to keep it soft because butter never use to be spreadable
S0192	no
S0198	they put something in it do they though
S0192	do they
S0198	how do they make it spreadable
S0192	isn't that like margarine though cos butter isn't spreadable though until you
S0198	you can get spreadable butter
S0192	until it's warmer
S0198	yeah
S0192	until it's warmer
S0198	my oh be utterly butterly butter i swear you can get spreadable butter now
S0192	i mean then a spreadable butter would have something add to it
S0198	like olive oil or something
S0192	i have no idea probably some
S0198	oh man the sausages smell good i literally have sausages once but it we do it properly we have a sausage
S0192	what be the pork percentage on these be it in this bin
S0198	yeah i think so i don't know though i think they're or maybe no
S0192	it should say on it thick outdoor grade pork sausages oh that look alright eighty five percent pork they're pretty high
S0198	mm
S0192	i don't think i've have higher than seventy since i've be here
S0198	oh really i wouldn't i don't think that my mum buy anything less than eighty five now
S0192	yeah good
S0198	but they don't eat sausages ever actually which be why she give them to me she's like my dad doesn't eat them anymore because the skin's too tough for his teeth
S0192	oh i bet
S0198	yeah
S0192	i mean toad in the hole make for a good dish
S0198	yeah we have it with jacket potato and with gravy and everything
S0192	yeah that's nice or with bean and cheese
S0198	bean and something it be good yeah it be really good but that's the only time i have sausages
S0192	that's good old british cook that be
S0198	we do use to cut them open at uni and sear them didn't we
S0192	i know
S0198	be that to make it quicker oh that's cos we always have sandwich though
S0192	no
S0198	be it
S0192	not a lean mean grill machine
S0198	yeah
S0192	this be do now okay
S0198	do we need to do that erm
S0192	how do be this
S0198	i don't know
S0192	sausages erm surely that's just open them up and have a look
S0198	do you think they're cook yet
S0192	yeah maybe yeah get a knife and fork and quickly just do we have a knife and fork each that we can there's not there's not another knife be there
S0198	there's only this
S0192	do you want me to do it really quickly you turn them over
S0198	i think they're cook
S0192	it do look pretty cook
S0198	come on
S0192	let's just quickly do that as quickly as possible
S0198	i think they're cook but they be sausage
S0192	i ask if it's alright to pause this thing
S0198	yes
S0192	and they seem to think so
S0198	yeah
S0192	so i've be like if i need to pause it or somebody have a phone call or something happen then erm oh do you want to check on the bean and the egg just make sure that be silent
S0198	yeah
S0192	and the same people be talk when you come back and it's not just cut in half way through a conversation
S0198	no
S0192	so you'd get it at the begin of a conversation do this thing turn off now
S0198	yeah that's the best thing to do isn't it no i don't well i don't know i've never use it before so it could do that will be exactly like
S0192	yeah
S0198	but erm maybe it's just to let you that ten minutes be up because it will be annoy for it to start cool down
S0192	just give give it another yeah
S0198	it's think it's probably turn of
S0192	i think it's still on
S0198	yeah it's just on now
S0192	where's the spatula
S0198	i think there might be a better thing for it to register as isn't it
S0192	have this stop cook or have you just put it back on
S0198	no i just put it back on i haven't touch any of the dial the tin be still hot
S0192	should be yeah i do see it bubble
S0198	where be we go to eat this just on the how can we eat oh we eat on the couch didn't we
S0192	be we gonna keep this go or pause it
S0198	there's no table or chair be there
S0192	there be no table or chair
S0198	erm i don't know it depend i suppose
S0192	erm i'll eat it in here
S0198	what just stand up
S0192	yeah
S0198	no i'd rather sit down and eat dinner wouldn't you
S0192	yeah i guess so but i've get nothing to eat it off so here i can stand up and eat but
S0198	oh i'll just sit it on the floor i think and just
S0192	oh i'm not very good at that
S0198	i'll sit it on my lap
S0192	yeah i guess so i'll try the floor
S0198	i think these sausages be probably cook
S0192	i think they be but i'm just make sure these be hot all the way through cos i take them off the heat a little bite
S0198	yeah
S0192	yeah they look good enough
S0198	yeah they're cook all the way through aren't they
S0192	yeah i'll just leave it back on
S0198	i guess once we go down we'll just
S0192	be we eat there
S0198	it's on forty so we can really
S0192	or just keep it on i mean can you talk while you're eat
S0198	yeah that's true yeah
S0192	if you can that will carry it on
S0198	okay
S0192	okay
S0198	shall i just dish out these sausages
S0192	i'll have to have a cigarette after dinner
S0198	oh that's why i need to put the kettle on get to have a coffee and a cigarette before we go out be that okay
S0192	yeah me too yeah
S0198	you'll have to wait for my coffee brew though shall i put the sausages on do you want to put that on
S0192	yeah i think put the sausages on now this be do
S0198	quite handy we have get we can do we've get tongs and everything immediately
S0192	yeah i know that be good it's work out
S0198	this your plate over there
S0192	right
S0198	these be like a bowl plate
S0192	shall i just turn this off the cooker off
S0198	yeah yeah probably the best thing
S0192	yeah
S0198	oh george foreman's always a bite of an arse to clean
S0192	yeah it's another thing to have to clean
S0198	yeah
S0192	rather than just a fry pan
S0198	i don't oh no i do have dish clothe
S0192	i think just a bite of tissue and some tongs while it's still a bite like bite wet
S0198	yeah i think there should oh no like i don't want to scratch it or ruin it do we
S0192	be you ready i'm go to put the bean on
S0198	i don't care about the one at uni very much but i want this one to last
S0192	yeah you want your dad to be able to sell it don't you so you're probably best not to cut
S0198	what on earth would you for a toast be it
S0192	i don't know what it's for
S0198	why do we even i be really i couldn't believe it when i saw this cos i'd never see one outside of korea before
S0192	yeah
S0198	what on earth be you do that use that for where have you get that from
S0192	toaster oven
S0198	it's the same brand from the erm bullet as well they're just import more and more eastern asian stuff in or something
S0192	yeah do seem to be there you go
S0198	cheer my dear
S0192	be sure one egg be enough
S0198	yeah yeah i'm positive
S0192	a simple brunch of
S0198	sausage egg and bean
S0192	sausage egg and bean i mean that could be why i think you know what
S0198	what
S0192	there's probably quite process the sausages and the bean have definitely get sugar in them but
S0198	yeah
S0192	there's a lot of protein it's not carb heavy
S0198	yeah it's not it's still some sort of food
S0192	be this clean
S0198	yeah yeah they're fine the way people just like my brother and i go round his house and the lunch be sandwich which be fine but they be just like very cheap process meat sit down i won't be long behind you
S0192	okay you need to be right behind me
S0198	very cheap cheap process meat oh give me a second then
S0192	yeah
S0198	erm with just bread and then he their mad like he's quite health conscious in some ways and do work out but the amount of butter or or spread he put on them be insane i be like that be really thick like don't do mine like that it's it be insane
S0192	what be he make you
S0198	just sandwich
S0192	yeah
S0198	crappy ham sandwich or whatever
S0192	just not good
S0198	no not good at all
S0192	be it margarine as well cos that's even worse
S0198	i think it be margarine
S0192	have you turn off this main plug that surge
S0198	yeah no my kettle's on so after that i'll turn it off
S0192	oh your kettle be brew
S0198	noisy old kettle
S0192	it be quite noise isn't it whenever you run the tap it's pretty noisy
S0198	yeah really or rustle the bag
S0192	yeah rustle the bag
S0198	what be you cook with you brother that day
S0192	but people make noise don't they
S0198	yeah
S0192	maybe stuff pepper with potato i don't remember
S0198	ah
S0192	do you remember i do that
S0198	what do you make for erm that you
S0192	eat that i cook him a couple of things
S0198	oh right be that the one where you be like slightly like it be okay but nothing special
S0192	mm
S0198	be that that night none of our doors actually fit the frame
S0192	no they don't do you need to take a photo of that
S0198	mm that one might push in a bite more
S0192	do you just not push it in properly
S0198	mm maybe
S0192	mm first meal in the flat
S0198	yeah
S0192	other than that pizza
S0198	pizza
S0192	eat junk food
S0198	we eat a banana
S0192	mm banana
S0198	mm bananas oh the egg be
S0192	the sausage be good
S0198	yeah
S0192	they taste like they're a high pork percentage i guess whenever we get sausages just don't do it very often and get nicer ones
S0198	get meatier ones
S0192	yeah
S0198	well like i say there be
S0192	less crap in it
S0198	that be a pack of erm
S0192	how much be they
S0198	i think they be a pack of ten i guess maybe
S0192	mm
S0198	and you get those and you can get two other type of meat or just three pack of those for ten pound in morrisons
S0192	oh that's not bad
S0198	you can get like chicken breast erm other stuff as well i can't remember what like but for a weeks worth of meat it be easily enough but then erm
S0192	we're definitely go to need to go to a few different supermarkets
S0198	yeah waitrose be not convenient i mean it's convenient it's not
S0192	be farmers' market here cheaper or just more expensive
S0198	or more expensive i don't know er i think they're probably they can be better value if you be like be at the farm like if you drive past farm sometimes they're erm
S0192	they'll have deal they will just put out
S0198	well they sell out they'll their egg cheap and they sell potatoes really like for a better value
S0192	mm
S0198	and much better potatoes too
S0192	cos there's no middle man
S0198	yeah but actually they be grow in israel and then freeze and then ship over or whatever
S0192	do you think a lot of the produce be freeze then
S0198	i don't know how do well it go in the refrigerator lorry things that be i don't know maybe maybe not freeze just keep at this happy cool temperature that's quite quite cool
S0192	mm
S0198	just so er it preserve the food for as long as possible until it reach your destination or still i think really
S0192	i don't really like apples
S0198	i think we be the last time we be in england it be earlier in the summer and there be more english fruit like strawberries and stuff cheaper i remember around the market and things
S0192	yeah
S0198	but it's more for
S0192	have you be to the market since you be back
S0198	well i go through the one in cos it have the fruit man
S0192	it's not be too cheap
S0198	no it's not as cheap as it be last summer
S0192	not as tasty it wasn't last summer we be here
S0198	oh yeah sorry the summer before that even but then i guess everything go up every year anyway
S0192	it wasn't even the summer before that
S0198	well it be the june may june
S0192	no two summer ago we be still in korea we be live in korea for two years
S0198	no we arrive in august though oh yeah i see what you be say yeah
S0192	but that's still three summer ago
S0198	cos the first june or july we be still in and the second june and july be this year
S0192	it wasn't last summer we be in korea yeah
S0198	oh yeah oh so it be the summer before that
S0192	mm
S0198	mm
S0192	be that three summer ago
S0198	oh so yeah
S0192	just since you've be in england
S0198	things have change but oh well
S0192	yeah
S0198	if we can get on to the erm aldi and whatnot once a week that's really it we're pretty good at
S0192	certainly for like onions and stuff
S0198	it might take a few few weeks to get into a routine and there's like an here
S0192	mm
S0198	and then before we know it will be in christmas holiday
S0192	a real shame we can't record them
S0198	no this semester's go to go really fast
S0192	yeah i know
S0198	like so fast this year's go to go really fast
S0192	mm every year will be faster than the next
S0198	yeah but kind of want some years to last a little bite longer i'm happy for the work years to go as quick as possible
S0192	yeah
S0198	but the travel and study years i'd quite like for them to last a little bite longer
S0192	mm definitely it's certainly not go to feel as long as our first time we go to uni
S0198	no ah three years er yeah three years
S0192	how's yours go down
S0198	mm it's go down well yours
S0192	mm
S0198	do you need anymore of anything
S0192	no
S0198	be you sure
S0192	i'm get full another egg would have finish me off
S0198	i'm still only on my second sausage something to yeah gonna be a one too many
S0192	mm
S0198	mm i do like bean
S0192	i wonder if they ever will make a yolk sauce
S0198	well no i'm clearly surprise they haven't i feel like they'd be a market for it but then maybe not
S0192	i don't know how you would do it
S0198	some people quite a few people be kind of i suppose not actually in england but egg can be a funny food so
S0192	oh people be a bite uncertain about them
S0198	yeah
S0192	i be for age i didn't like the white
S0198	no someone else didn't as well that i speak to recently i can't remember who it be
S0192	mm
S0198	maybe one of my brothers maybe
S0192	it be quite common to be a bite weirded out by egg
S0198	apparently be terrible at eat
S0192	and by bean
S0198	mm
S0192	god what be that it's not skin be it it's it's like
S0198	no don't
S0192	some
S0198	get to eat it
S0192	rubbery skin
S0198	yeah what be this fake skin they use for sausages
S0192	i don't know
S0198	be it bad for you do you reckon
S0192	no i don't know
S0198	it's probably not good for you be it
S0192	i really don't know i have no idea what it be it use to be pig intestines
S0198	yeah sometimes it still be in a high quality end sausages i think i bet they still use it
S0192	i mean i imagine if it be like pig intestines i imagine it to be more like that
S0198	mm
S0192	thicker
S0198	mm
S0192	it's better we just stuff the animal back in it's own arse
S0198	yeah i know really harsh
S0192	basically and then eat it
