S0041	be there
S0084	i think that's the problem he give all the big i be but i don't really think er he's really on the same planet
S0041	no i don't think he's get any brain that's the issue here
S0084	mm
S0041	oh my mystery meat's stick come on mystery meat
S0084	mystery meat
S0041	oh huh oh huh i only want two i don't think i'm gonna get the mystery meat back in as it happen
S0084	i think you'll probably have to eat it
S0041	oh huh
S0084	probably need it probably need all that
S0041	oh
S0084	just tuck it back in if you don't want it
S0041	there you go it's on now i'll know for next time i only need two
S0084	mm
S0041	not three
S0084	definitely not three
S0041	there we go what else be to go back in here you can go back in here
S0084	mm
S0041	in there you're for do you're for bin
S0084	oo maybe i'll get the tuna steaks out now and put them in the fridge for tomorrow and i'll try and do the tuna thing after the gym
S0041	if you
S0084	uh
S0041	wrap them in um foil that usually go down well
S0084	wrap them in foil well yeah i cos i think tuna steaks though be the ones that you're suppose to you know sort of fry on one side
S0041	be you
S0084	yeah cos they're suppose to be pink i think you very quickly um blast them in the pan but that that oven uh huh fuck me uh that oven suggestion wasn't a bad one i think i've get some i can probably make up some sort of sauce to go to um cook it in nice
S0041	hm hm hm mm mm mm
S0084	i've get chillis i might just buy some fresh ginger tomorrow cos that'll be nicer fresh ginger last for for age and age
S0041	i have pretendy ginger
S0084	i think i've get pretendy ginger i think it i think if you buy fresh ginger er it taste much nicer and it last a really long time it's like when you've get garlic in the fridge
S0041	real garlic you mean
S0084	real garlic yeah i've get fake garlic as well but huh i try and keep real garlic in like i've always get an onion in cos you think you always
S0041	mm
S0084	need onions just gonna pee
S0041	i have load of onions oh no an escape mystery meat
S0041	mm
S0041	hm hm hm hm hm hm hm
S0084	be you enjoy your mystery meat
S0041	yep
S0084	hit the spot
S0041	it's escape leave right and centre but
S0084	for goodness sake mystery meat oh i might just er close that window so the bug don't come in uh
S0041	the spiders don't get in
S0084	spiders indeed
S0041	hm
S0084	dunno why have to just leave all his stuff everywhere all of the time all of the time
S0041	mm those shoe under there
S0084	i know feel like he's just actually move in
S0041	mm i mean they're not even by the front door
S0084	i know huh urgh just rot foot
S0084	there's toe jam in there
S0041	oh no
S0084	so sorry sorry sorry
S0084	oh
S0084	it's a good one for the tape
S0084	toe what
S0041	he must've go to his mum's then
S0084	yeah i remember him say he want to cycle over and stay the night so he would've cycle over he be cycle to cos say he'd it use to take him just over an hour something like that i dunno which roads you'd go down though that's the thing it's probably take longer because he can't go on the main roads
S0041	i don't even know where be
S0084	no er it's over there
S0084	just like my geography of the north be everything be together up from er here as we discuss
S0041	yeah yeah
S0084	everything be on top of each other about there
S0041	yep i be tell about that
S0084	oh god
S0041	and i say to be fair everything from here downwards be london
S0041	so
S0084	fair i think
S0041	all of it
S0084	i think unless you go to these place you have no er i mean even i've be to and i've actually be to these
S0041	mm
S0084	place
S0084	i've be to and i've i couldn't tell you where they be i be er think
S0041	mm
S0084	actually if you go there you know er you know where you be but no i've no idea i just get on a train
S0041	oh yeah i think if you drive it you'd probably have move of an idea
S0084	yeah well that's the thing well i be talk to someone about this about have a sit nav and i be say oh it's so good when i drive to like i know the roads pretty er pretty well from have be with other people up and down
S0041	mm
S0084	between and or and but i'd never drive it myself and it be really easy someone else be say well actually she try not to use a sit nav cos then she lose any understand of where she be like if it break
S0041	mm
S0084	something go wrong you'd have no clue cos you're you're so dependent on it
S0041	yeah definitely
S0084	i suppose that's that be the danger i i have the sit nav on my phone when i drive to last week and i have no idea like if it's east west north south
S0041	no
S0084	not a clue
S0041	it's the same way as if you never walk through you only get the tube
S0084	mm
S0041	no idea where anything be
S0084	yeah absolutely and that's the thing i mean er i think it's probably just the tourists who end up do that because people who actually who know the city know that there's stop in between and that in the middle be all so close together that you can quite easily walk between them
S0041	mhm
S0084	and it really help with join the dot i think i didn't really get to know until i do that till i
S0041	mm
S0084	till i walk through and i'd have to go and meet my dad somewhere cos my dad work in the city for years and obviously he's a boy
S0041	oh
S0084	through and through anyway so when i be go home from to i'd always stop off and i'd meet him at we'd go for a little wander and
S0041	mm
S0084	then he'd put me on the train from er i think or so we'd do quite a lot of walk which help
S0041	i can't remember where i've walk to now i always make a point of walk if it's an option
S0084	mm
S0041	but i what be that
S0084	that's the freezer i think
S0041	yep
S0084	don't know don't know if that really help
S0041	i think he want to talk
S0084	i think it want to take off
S0084	i think there might be alien life form live in there in fact there probably be i doubt that's be um defrost for years
S0041	ever
S0084	cos you can barely get anything in it i think it's only that use it
S0041	that's really concern ain't it do you think it's gonna explode in the night
S0084	well so long as um we no no one's here do it normally make that noise and be it the freezer or the fridge could we go in your room cos i'm scar that the freezer's gonna explode
S0041	yes yes
S0084	i don't want to be in here when the freezer explode just if if in doubt we didn't touch the freezer
S0041	no we didn't touch it
S0084	that wasn't us
S0041	you can stay here for tomorrow you can go in this cupboard
S0084	be you alright have you get enough hand
S0041	mhm
S0084	yeah okay
S0041	you can come with me you can just stay there for now
S0084	oh huh ah huh lovely donkey
S0041	i dash back from work on friday and be like oh hi be you alright do you wanna talk and i be throw stuff all over the room i be like no gotta go
S0041	late for late for 's
S0084	i think you be go straight from work
S0041	yeah well i didn't pack my bag do i look cereal bowl's here from the morning
S0084	you animal mm so you just rush home
S0041	yeah
S0084	so you must've
S0041	and all my clothe that i take off the hanger they're still there
S0084	good and your work trousers be lovingly throw across the sofa
S0041	yep all well care for
S0084	all love
S0084	nothing but pure love
S0041	pure love and affection this
S0084	oh huh
S0041	can go to tesco's tomorrow
S0084	that keep rear its ugly head doesn't it every time we
S0041	i know
S0084	think we've get rid of it i think those bras be even cheaper cos on my receipt it say something about two pound
S0041	oh
S0084	yeah but then i put the receipt in the bin cos i be
S0041	tomorrow
S0084	leave it er key mm oh
S0041	you can go in the boot tomorrow you can be unpack well i know exactly what's gonna happen i'm gonna get up in the morning
S0041	have to unpack that and then repack it
S0084	no for why
S0084	for next week
S0041	swim
S0084	oh for swim
S0041	mm
S0084	oh actually i might not be able to go swim because my bikini's at my mum's
S0041	huh
S0084	i could go first thing in the morning and pick it up
S0041	we could go en route
S0084	we could go en route it do mean go to the garage so i wouldn't wanna inflict that on you
S0041	you don't wanna what now
S0084	from the garage and i be go to go into the garage today to get my suntan lotion because obviously it be you know it be really sunny and warm and
S0041	mm
S0084	definitely sunbathe weather but i've pack it all i pack my sun lotion now what's it call yeah suntan lotion in my box of summer clothe
S0041	tut well that do make logical sense to be fair
S0084	it do but no one know it be gonna be tropical heatwave in spring i should've realize
S0084	it's really er i think pile be fine
S0041	pile
S0084	pile of good stuff
S0041	you can go in there
S0084	mm
S0041	in you go close you in
S0084	la la la
S0041	yeah la la la la you can just go there a bite
S0084	oh the um tesco's mouthwash
S0041	yes
S0084	burn like a mofo
S0041	what
S0084	burn your mouth burn your mouth
S0041	um
S0084	i mean i don't know if i'm be a bite of a child about it because the one i use before be not very burny it be just fresh
S0041	i'm not sure it's suppose to burn your mouth
S0084	yeah or or i be just gargle it or swish it for too long i don't know but um it be intense i'm not gonna lie
S0041	oh look what i've get
S0084	er you do not need those
S0041	i do
S0084	well they're all over the floor and the bathroom
S0041	and the bathroom they're still there
S0084	yeah
S0041	mm you need to go upstairs you're hair things you can go in there
S0084	oh this be your exfoliator
S0041	huh yay
S0084	mm mm mm mm
S0041	you're for the bathroom
S0041	oh
S0084	that's not gonna
S0041	oh
S0084	escape escape
S0041	you're for the bathroom you're for the bin that i can't get now cos i
S0084	aw
S0041	oh do you know what there be in the kitchen sweeties
S0084	sweeties
S0041	yes i'm go to get them
S0084	what be what's ah
S0041	to get the sweeties
S0084	just don't listen to the freezer
S0041	whatever it say to you it's lie
S0084	defo lie
S0041	mm can i interest you
S0041	in dolly mixtures or frosties
S0084	huh um
S0084	dolly mixtures please please please mum
S0041	huh
S0084	please mum please mum
S0041	dah dah
S0084	thank so much thank
S0041	thank
S0084	be take us to the lamb tomorrow
S0041	oo i should text him and find out
S0084	i think that do probably need to happen but um tut let me check the weather forecast for tomorrow huh do you know er what temperature it be right now
S0041	what
S0084	oh one degree
S0041	no
S0084	yeah
S0041	huh one degree now
S0084	and that and that be at seven o'clock actually
S0041	no
S0084	so it's gonna be colder than that
S0041	that can't be right cos we be walk and it wasn't one degree
S0084	huh can you see sunday twelve degrees er sunshine
S0041	lamb time
S0084	lamb time
S0041	lamb time
S0084	like hammertime
S0041	lamb time
S0084	but not not quite as good unless we make up a good song and wear big trousers
S0041	i could do that
S0084	with mc hammer and then wednesday this be so weird i mean they change their mind every two minutes when i check the weather forecast this afternoon it say on wednesday it be gonna be snow
S0041	oh i hear actually at work be tell me about sleet on wednesday
S0084	yeah it be gonna be two degrees now it's not say sleet we just can't trust these people
S0041	do you know um the wed girl
S0084	mm
S0041	be tell me that she you know they be look at the weather forecast to find out whether she be gonna go where she be gonna go for her photograph in short
S0084	yeah
S0041	um and they say oh well the weather forecast say it's gonna be nice and she say oh that's good then they be like no you can't trust the weather forecast even the day before it's probably wrong
S0084	mm
S0041	she be like what
S0041	what do you mean it's wrong so why do they tell it
S0084	mm
S0041	in america it's never wrong
S0084	tut really how do they get it so right
S0041	we're just shit apparently
S0084	well
S0041	they get it right all the time she say you can check the weather forecast a couple of weeks in advance and it's bang on the money
S0084	i just i don't think their systems can be that different because why would we not just use their systems i think our weather be just so changeable
S0041	compare to theirs
S0084	compare to theirs it's really
S0041	mm
S0084	unpredictable we we don't have clear season either in the way that they do i don't think like er
S0041	i think we might have use to have them i think they need to start change the season over cos they're all go to pot now
S0084	certainly the summer be always a bite shit isn't it
S0041	mm
S0084	june july august i feel so sorry for the kiddywinks now
S0041	yeah
S0084	cos july and august be shit usually and then as soon as they go back to school glorious weather
S0041	sunshine
S0084	mm huh uh huh uh huh uh huh uh oh i can't get them huh uh huh
S0041	oh no
S0084	fff uh fff uh be this the workout before the sweets
S0041	yes
S0084	be that how it work
S0041	yes
S0084	i see i see i'm on the page mm would you like some dolly mixtures
S0041	er no i'm good thank you right alex contact list
S0084	where be the lamb bring them to me
S0041	what time be baa lamb time tomorrow
S0084	yeah
S0041	and that if he hasn't sort it let's hope he just use the initiative to sort it out to please me
S0084	yeah don't i don't i wouldn't be too hopeful
S0041	no
S0084	not with that one well it need to be p m doesn't it if we're aquafitting
S0041	hm let's see what he say
S0084	mm
S0041	all the excitement oo i wonder if the matt have reply to my message
S0084	huh what do you say do you say fuck off and die
S0041	no
S0084	really you surprise me
S0041	yes
S0041	um i can't remember what i say back
S0084	mm
S0041	something something
S0084	mm
S0041	and then yes that er you know it would be nice to catch up some time really noncommittal didn't tell him when i be free or anything
S0084	as we're not in germany
S0084	motherfucker
S0041	as it er i should have say do you want to let me know when the best flight be
S0041	and then he'd be like what i'm in ah not germany
S0084	so not germany that's interest
S0041	or if you're not in germany i don't wanna know
S0084	mm
S0041	it's not the free holiday
S0084	yeah
S0041	it's just not cricket
S0084	it's a goodbye from me and a goodbye from him mm
S0041	mm
S0084	mm i'd forget how
S0041	uh uh
S0084	nice these be
S0084	num num
S0041	dolly mixtures yeah
S0084	yeah
S0041	it's like the sugar it's like these frosties
S0084	uh think might be a bite of a genius just have a momentary
S0041	yeah
S0084	period of genius
S0041	yeah yeah i don't think we can give him that forever unfortunately for him
S0084	have you hear from
S0041	mm mm
S0084	no
S0041	hear from his mum
S0084	from his mum bless really what do she say
S0041	to just see how i be do and if i'd get a date for my fit medical
S0084	mm urgh
S0041	brown one
S0084	it's disgust
S0084	no i'll just chew it really quickly
S0041	i want to know if it's a brown one though
S0084	green i think greeny brown whatever it be it's rank as hell
S0041	oh er oh be it the jelly
S0084	yeah and now it's out
S0041	yeah
S0084	it's not go back in
S0084	i think it be lime or or the closest thing that artificial flavour can make lime
S0084	feel like something's die in my mouth that's kind of put me off them a little bite
S0041	i um
S0084	i'll come back to you
S0041	haven't hear from that crazy guy yet there
S0084	oh yeah sorry i just think er do i take do i put the freeze the word word come on now
S0041	wine in the freezer
S0084	yeah
S0041	mm
S0084	well i put it in the fridge that's fine er crazy which one er there be so many crazy guy pedro
S0041	the one that um
S0084	the one from the hotel
S0041	yeah
S0084	the one in afghanistan
S0041	the one from the hotel that never shut the fuck up
S0084	oh yeah
S0041	i be talk to er er about him
S0084	mm
S0041	and she be like
S0084	say what a he be
S0041	um actually that's not that rare i be like what
S0084	men talk about themselves
S0041	so i tell her about the book of course
S0084	mm
S0041	and um that now we've get wizards i i play live wizard to add to that do you er what the hell happen with that
S0084	oh i go mental i go absolutely mental the girl i think the girls be they be er truly horrify particularly when i say i dress up as um merlin um cowboys and indians et cetera et cetera
S0041	all of the above
S0084	um he do carry on texting me and he texted me er to which i didn't reply and he basically just say oh i hope your phone's okay and i be just like yeah mm goodbye and he say well be that a bail out and i didn't reply and then he texted me on friday morning say be that you i be follow all the way home if it wasn't you've get a double to which i didn't reply because i be like well you haven't tell me where you be so i don't know and if you think it be me why the hell do you follow me and how far be you follow me
S0041	yeah
S0084	or some poor other girl that you've be follow and i didn't wanna encourage him so i delete it
S0041	yeah
S0084	and luckily he do work in the other build so i don't ever have to see him
S0041	what do the girls say
S0084	tut oh well they just say they think it would be a really good idea they think we'd get on really well they didn't they don't even really know him that er be what really piss me off they've meet him in the bar out like at work and er
S0041	so basically
S0084	they've get chat to him
S0041	they know him a little bite
S0084	yeah think what the hell
S0041	and er and think what the hell he seem nice
S0084	er he well he'd ask for my number and they be the so that's when they er the er bright spark think it up the thing be
S0041	the genius come into play
S0084	because with and 's always say this she's always say tut well she's too nice to say i don't trust her but she's whenever i talk about her she's always like that she's a bite crazy isn't she but like it make me think cos i trust 's opinion above a lot even though we've only know each other a couple of years like you know when people come into your life and you just feel like they get you
S0041	they'll only tell you the truth
S0084	they really understand
S0041	yeah
S0084	yeah and and you're so similar and you're you know you've just make a friend for life and um with her i really feel that and i really value her and not that i would not be friends with someone that she didn't like because er you you know
S0041	mm
S0084	you're your own person and you can make decisions for yourself but you'd certainly take it in as a factor and
S0041	yeah if she doesn't like them there's a reason why
S0084	it make me question the friendship and it doesn't make me stop be friends with her with but it do make me think well what be it that she that doesn't trust or doesn't like
S0041	yeah
S0084	and so i do i've always keep at arm's length mainly because the first time we go out drink together when i'd only work for the company a couple of months and we hadn't really work together at the time and er we go out drink and i be say to her oh i really like this guy in the office and she be like oh yeah er like load of girls really fancy him he's really nice isn't he and really cute and i be like yeah he's really cute know that he would be there at the pub later
S0041	mm
S0084	so we all proceed to get absolutely smash this be in a er salisbury arm off mill road
S0041	yep
S0084	and er lot and lot of booze later we're in
S0041	yep
S0084	some time in the morning
S0041	that's the place that stay open till like
S0084	all night
S0041	yeah
S0084	yeah till the last person leave
S0041	leave yeah yeah yeah
S0084	which could be like monday morning
S0041	yep
S0084	um and at the time it be christmas and i be work at on the saturday this be friday night i be work at at nine a m on the saturday morning it be some ridiculous hour of the morning all of us really drink and i turn over be sit in 's lap er in the in the pub now i think that have a bite of a thing for her cos er she's really pretty and er all lot of boys like her but obviously we'd have a conversation she'd never express to me oh yeah well i quite like him too or there's something go on or whatever there'd be no
S0041	yeah
S0084	conversation
S0041	yeah
S0084	nothing offer but she do know that i really like him and even during that night she be like why don't you you know i'll er leave you two to it or well something er er
S0041	like encourage this
S0084	yeah and i just think you know you're not in the playground you're not i saw him first he's mine
S0041	yeah
S0084	but a bite of like a bite of tact
S0041	yeah
S0084	i know you're fuck and i know we're all so piss but from that point on
S0041	mm
S0084	i do think
S0041	no
S0084	um this be a bite weird
S0041	yep
S0041	i think that's a bite weird
S0084	so i like the girl but i have always have my reservations and she she and helen live together and er they when i first move in here and i wasn't sure about it and i be definitely wasn't sure about trudy i be look around and the girls say well we might be move out so do you wanna move in with us like find a three bed place
S0041	yep
S0084	and i think even though i like them i've live with live as one of three girls before and the two girls fell out and i be piggy in the middle and it be horrendous fff and i just didn't want that to happen again and also er just i'm just not sure
S0041	mm
S0084	they're very very close and you'd be the person come in and you might disturb that
S0041	yeah and i always think as well if you work them
S0084	yeah
S0041	and you go home with them that could get really too much like
S0084	tut mm
S0041	i do it with for three months solid and we both say like we really live in each other's pocket it be so difficult because we be work all day while i be her manager
S0084	mm
S0041	and there be only sometimes there be just the two of us so sometimes she really have to take direct order
S0084	yeah
S0041	and i have to tell her off and stuff and we take her on know that if she be gonna get fire i be gonna have to fire her
S0084	yeah
S0041	so that be quite stretch sometimes especially if she she make a mistake or not just a normal error but if something be serious
S0084	mm
S0041	um but we manage it fine completely fine to the point where the md be like a bite worry about say something to her and i be like why well i know that she's your friend and i be like bullshit
S0084	mm
S0041	we both have make such a point to keep it so professional
S0084	mm
S0041	there's no way you could've pull that string i be like absolute bullshit
S0084	mm
S0041	cos our desks be join onto his
S0084	mm
S0041	cos we have a separate office to everyone else
S0084	oh okay
S0041	and so it be blatant lie he be he be just be a coward
S0084	mm
S0041	and then we be live in monday to friday
S0084	mm
S0041	literally a pull up bed and an air bed in the live room of a three bed flat cos we didn't want to heat up the whole place cos it would've be freeze the whole time cos it be middle of winter it be snow on the grind live on like salad and bean eat nothing
S0084	mm
S0041	cos we be slimming and then drive home at the weekend which she be then share with me and which be rocky
S0084	mm
S0041	so it be really the most stressful
S0084	mm
S0041	possible situation imaginable
S0084	mm
S0041	and we be with each other twenty four seven and we still didn't fall out
S0084	yeah that's a real test of the friendship definitely
S0041	and i say to like how much more stressful could this be
S0084	mm
S0041	really and we're still not fall out and get angry with each other
S0084	mm
S0041	and not get piss off and i wasn't look forward to the day she leave
S0084	mm
S0041	but then i think if you work with someone that you don't really know like i know when i take her on
S0084	mm
S0041	i be we be still worry the pair of us be a bite concern that it might just make us fall out
S0084	mm
S0041	i think if there's um any doubt don't do it
S0084	well absolutely and that you know that's why i didn't er we do work in the same office you know with her and the three of us all work at the press but work in the other build work for a different department and be very er in like a completely different business stream she's it
S0041	oh right okay
S0084	um and they there's three business stream there's elt er the english language teach which be where i work there's journals and then there's academic and professional and the it department support all three of those business stream
S0041	mm
S0084	so it's very separate so we're support by their team but we don't er really work together
S0041	yeah
S0084	generally speak they they deal with the systems that we use
S0041	they're helpers
S0084	they're the helpers they're the people who work behind the scenes so we don't really er have much day to day interaction with them so that's why it work for them
S0041	mm
S0084	because they have enough common interest in their their industry in term of their work and what they can talk about but it's very different to when they come home and they can just
S0041	mm
S0084	i mean i i would hope that they don't actually talk about work cos it would be really really bore
S0041	yeah
S0084	cos you'd be at work all day and then you'd be come home and talk about work and it would be really easy to spend your entire life talk about work
S0041	work
S0084	that'd be
S0041	yeah
S0084	my worry i don't want to i mean i very rarely
S0041	it'll just take over
S0084	do yeah i very rarely do actually i think i don't think i talk about work that much
S0041	no not not at all i think the only time work come up be when it's a relationship within that environment
S0084	mm mm
S0041	or an event within that environment
S0084	mm
S0041	in which case it doesn't really matter that it's at work cos it could be it could be anywhere
S0084	could be a friendship
S0041	it doesn't matter
S0084	yeah
S0041	cos it's the event that's the important part of the conversation or
S0084	mm i i try and leave it at the door just think you know i'm here one hundred percent seven hours a day that's enough
S0041	mm
