S0444	yeah i know and i i know that and i know that i know that you would do that and i know that he would do that and i'm quite you know i just i just put it plainly i say look you know
S0439	you're gonna have to grow to like her one day cos she's not go anywhere
S0444	but also it's that kind of thing where you know it it's that kind of thing you don't have to love each other
S0439	no no no at all
S0444	you just have to er respect each other
S0439	yeah
S0444	and hopefully you will like each other and i
S0444	i do think that when hopefully you kind of that you both be just like
S0439	yeah
S0444	that's that i'm not i'm not gonna be able to get a word in for the rest of the night like that's just how it will be
S0439	yeah
S0444	but
S0439	but i think also like i've grow to appreciate the fact that i'm quite i've be tell that i'm quite intimidate and like like
S0444	who tell you this
S0439	well basically whenever i go round 's house doesn't really talk to me like he's fine er we
S0444	well he he's quite bore because he's scar of you
S0439	well that's what she say she say i think he's intimidate by you because you're not a normal woman i be like
S0439	okay what do this mean she go well you're very
S0444	be this compliment or an insult
S0439	yeah i be like where be this go she well you're very strong
S0444	mm
S0439	and you're very like confident in what you say
S0444	it's not
S0439	it's and i'm like
S0444	it's not that
S0439	be that a good thing or i'm i'm like i don't want to
S0444	no it be a good thing i see what she mean it's more about how it's more about how assure you be
S0439	mm
S0444	and er it's more that people do just get that straight off i'm not take any shit kind of
S0439	yeah
S0444	that and that be not a bad thing it's just you know it might be different
S0444	to me or like let's be nice to everyone kind of thing
S0444	you know and it's not you know for a lot of people that kind of i'm not gonna take any shit from you come further down the line in a in a
S0439	yeah
S0444	in a certain friendship or relationship whereas you be just kind of hey what you see be what you get
S0439	yeah
S0444	that's it this be what i want if you don't like that we're do
S0439	yeah
S0444	and that's fine you go for it
S0439	yeah
S0444	if er if somebody's intimidate by that
S0439	it's it's just
S0444	let them be i mean i know that at certain point i be like wow
S0439	yeah
S0444	okay but it never stop me from be your friend or talk to you
S0439	that's what's the people who know me the closest i be like like what say after she say that she go like when i first meet you i could probably understand why he would be intimidate by you
S0444	mm
S0439	but now that i know you it make me laugh
S0444	yeah it's more like it's it's more about just get the chance like
S0439	yeah
S0444	with with er with a lot of people it's more about just get the chance to know them
S0439	just to get to them yeah
S0444	like you know oh that's really sweet
S0439	she's just like well i i think he's just like you're not cos very much view women as object
S0444	oh okay yeah that
S0439	not not in a
S0444	not in a
S0439	not in a horrible way like he'll do anything for you
S0444	he date them he like that like
S0439	yeah
S0444	he like them he's very nice to like and yeah
S0439	he respect and he love but i don't think it's because he see her in that way erm
S0444	yeah
S0439	but he doesn't he doesn't think he doesn't really see women as women he see them as like object really
S0444	mm
S0439	and he isn't really interest in them unless they're there for that reason
S0444	yeah
S0439	so i think with me like i'm round their house a lot and i think with me because he can't have that type of relationship with me he's kind of lose for what type of relationship he can have with me
S0444	to have cos it's like you're not like you're not like the girl that
S0439	i'm sleep with yeah so i think he be a bite like i don't know i don't know what we be so he kind of like have a little mini panic
S0444	oh
S0439	this this advert's really creepy
S0439	it's just that's just weird although chris robshaw be a very beautiful man that's just creepy what you can't ban other people from like drink lucozade
S0444	er sorry like or what be it like
S0439	trinidad and tobago
S0444	yeah be they er be they even in it
S0439	i don't think they be no samoa
S0444	samoa yes
S0439	sunny samoa
S0444	sunny samoa
S0439	no lucozade for you be you a home nation no you're not oh god
S0444	but they do do they do they class ireland as a home nation they do don't they
S0439	yeah they do
S0444	interest
S0439	part of the unite kingdom
S0444	but it's technically not
S0439	isn't it
S0444	republic
S0439	oh yeah northern ireland not eire my sister get tell off in school for call it eire
S0444	yeah
S0439	yeah don't know why it's quite an old fashion term for it i guess
S0444	er yeah it's quite er i think like maybe because it's er i dunno like could be it's not even that republican
S0439	no yeah
S0444	they oh that's not the you know correct term to use do you watch gogglebox
S0439	i don't but i think i'd be really good on it
S0444	no you'd be brilliant on it
S0439	i think i'd be ridiculous on gogglebox
S0444	i think you would throw things at the tv
S0444	like this be shit
S0439	i would be like what be this why be there a
S0444	what be this advert
S0439	oh it's for edf energy isn't it or for some type of energy isn't it
S0444	can i can i just watch it
S0439	yeah of course yeah it's the monkey isn't it with energy i think oh creepy hair
S0444	ah be that a gorilla or a
S0439	i think it's suppose to be an orangutan
S0444	yeah yeah it's an orangutan
S0439	ah
S0444	oh ah
S0439	an orangutan on a fairground ride
S0444	i proper love that i think it
S0439	oh sse energy
S0444	right that's it
S0439	i know it be some type of energy though
S0444	well do
S0439	the hairy bikers
S0444	mm
S0439	location location location
S0444	yes
S0439	please don't say you watch strictly come dance
S0444	oh gosh no
S0439	good that's what i like to hear
S0444	i'm just like no
S0439	the polar express it's not even it's not even christmas rumor have it have jennifer aniston in it therefore it's go to be shock
S0444	that's a christmas film yeah
S0439	poor jennifer aniston i'm so horrible about her i'm just like
S0444	but she be marry to justin theroux now
S0439	she be
S0439	she do get marry to him didn't she bless her heart
S0444	i know
S0439	i can't believe i be bless the heart of jennifer aniston like
S0444	what be go on
S0439	she be stun and amaze she's just an shit actress bride war
S0444	no don't do it
S0439	no good
S0444	it's get anne hathaway in it but it's one of her bad film
S0439	i haven't do anne do anne hathaway have any good film
S0444	princess diaries
S0439	okay princess diaries er can miss oh no miss congeniality's sandra bullock
S0444	sandra bullock
S0444	oh
S0439	i be like miss congeniality's amaze
S0444	tragic tragic
S0439	tragic
S0444	she couldn't get
S0439	i love it so much in friends when chandler when monica's like okay we can we can do your favourite thing and he's like watch miss congeniality one and two she's a spy who become a model
S0444	i do love a bite of miss congeniality mustang sally
S0439	she's so good
S0444	love it
S0439	be you bathrooming
S0444	i be
