S0444	that would be my point cos it's just a point of principle that i don't really wanna take the job search too far
S0439	yeah
S0444	while i'm not on full hours because i just don't think that's application
S0439	oh no of course not no
S0444	and i know a lot of people would apply and be like i'm ill but who care but er from both side apart i don't wanna apply to a company when i'm still poorly and achieve
S0439	and also you kind of don't wanna turn not turn your back on but you don't wanna be like oh you've support me through my illness and now
S0444	and now i'm fuck off
S0439	now i'm piss off yeah
S0444	or i've use that tack you'd never want it to be the case that they'd turn round and be like oh but you be on sick leave then but be you that sick
S0439	yeah exactly yeah
S0444	if you could search for job and that's not
S0439	you don't wanna damage your relationship with
S0444	and also don't want it to be the case where they think oh we move you from a certain subject to another one and you weren't happy so you've now leave and it's kind of like well yeah it it doesn't look great
S0439	yeah
S0444	but i'm just like you know what
S0439	but after six eight months i think that's probably fine
S0444	yeah i mean that's the thing like the hospital treatment be like the first batch of it be pretty much come to an end erm and then they're go to reassess and see what more
S0439	yeah
S0444	cos the problem be that everyone else in the that i've be go to have be receive lot of extra help from their doctor and their gps or other hospitals
S0439	yeah
S0444	so i haven't have anything like my doctor er you know nobody have be tell me how many hours to do
S0439	mm
S0444	and what be good and what be bad and what to look out for nobody
S0439	yeah
S0444	i've be try to dictate all of this myself and i could've get it completely wrong in some in fact in some ways i think i have erm which be why i'm struggle with
S0439	but if you've never you've never be through this before like you well obviously not in a work environment so
S0444	no not in a work context and that's the thing and when i go to the when i talk to the specialist they be like what you mean you've have no help and i be like no the gp just say that you guy would sort me out with this they be like oh right at the end of the like you know the three appointment programme well we'll have to sit down and review what you're do cos a lot of the people in the clinic it be really it's it be quite depress in a way but they be all off work or choose not to work or you know they they they can't walk more than ten minutes and but like you know and some of them be bed bind and some of them go to a doctor's appointment and that's it they're lay up for a week and er you know it be quite extreme
S0439	mm
S0444	i'm not i've not ever be that bad that one appointment be enough to set me off but also
S0439	but also i think the the difference between you be that you're drive and you don't you don't use this illness as an excuse
S0444	no and it just
S0439	for you to like get out of things cos i think i think some people would take this as like
S0444	no i think
S0439	take this opportunity to be like oh i need this much time off work because i've get chronic fatigue syndrome or like
S0444	i miss be at work i miss
S0439	yeah exactly i think you've
S0444	i miss be at work and i miss be able to and be spontaneous
S0439	you've get that drive
S0444	and that's what i've miss and that's what i'm start to get back now
S0439	yeah
S0444	be get that bite of drive so me look at stuff like you know i've have my inbox i've er get a separate inbox for it pile up of all the industry news and analysis and research
S0439	mm
S0444	and stuff that i find interest
S0439	yeah
S0444	and would use in er like in interview and things like that that's all be pile up and for the first time like in months this week i actually start to look through it
S0439	yeah
S0444	and start to make note and er and that's me start to get that drive back and i be like oh i'm gonna go you know and i'm go on a lot of train course over the next couple of weeks which should be quite good
S0439	yeah
S0444	cos you know i've still get that question of do i want to be in market
S0439	yeah
S0444	be it market but not in a publish industry or be it definitely publish that i wanna be in but maybe not market
S0439	yeah
S0444	or be it publish but just not like
S0439	yeah
S0444	i don't know whether you can really like isolate the different things but i sense like er i've notice some of the girls yesterday i just say you know cos they be ask about like the house and stuff and how that be go and i be kind of like well you know it's it it's kind of start to run its natural course like
S0439	mm
S0444	it's er i'm it's kind of mm kind of do
S0444	yeah not in any bad way but it's kind of yeah i wouldn't like like pretty much i wouldn't want to be there beyond like next december hopefully i won't be anyway if i move job but i be kind of say i be like so it's not essentially all or none
S0439	mm
S0444	but actually oh maybe i can do this cos you know it's start to you know i could start to function a bite more i've i've have a holiday
S0439	yeah
S0444	i'm able to have a holiday i'm able to see my friends yay
S0439	and like live with be always like it's nice and convenient and good price and stuff but it hasn't really be able to give you the freedom of live on your own
S0444	no
S0439	or have your own space
S0444	well put it this way
S0439	like you've get a room but it's not the same
S0444	happily
S0439	mm
S0444	er there be ten people in the house
S0439	oh my god why be there ten people in the house
S0444	so so there's me
S0439	's the dad
S0444	no be her son
S0439	oh
S0444	me cos and her daughter who be stay for a month because they've decide to move over here to england
S0439	okay
S0444	there be also and today and yesterday who sleep over at weekend so
S0439	who's
S0444	friend of 's
S0439	yeah
S0444	and then have you know one or two friends like that be just round and it be like oh
S0439	she's a forty year old he party like a twenty year old
S0444	yeah she be
S0439	but
S0444	i be like anyway i don't do that as a twenty year old like
S0439	do they go in your room do they stay in your room
S0444	no
S0439	no
S0444	oh gosh no no and that's one of the things i like i'd it's it's kind of never say but they they wouldn't like
S0439	yeah you rent that you buy you pay for that space and you get that space yeah
S0444	yeah and if it have sound ridiculous but i've kind of do stuff like i kind of unpack like they know that i be come to view so i be like well i've get all my toiletries for go away it's a bite i can just
S0439	yeah yeah yeah
S0444	put my suitcase on it if they move my suitcase
S0439	you'll know
S0444	it's gonna be pretty obvious and usually i leave my bag in quite a like a messy way especially since see erm how you do not wanna make your bed again i think oh gosh
S0439	oh yeah cos buzzfeed be the knowledge for knowledge yeah
S0444	oh i'm i'm read buzzfeed article
S0439	i read so many buzzfeed article
S0444	that be pretty much my life read on the way
S0439	but i do that as well like erm when sometimes have party i don't mind if like this weekend let you sleep in her room like i don't mind if she have one or two friends over who i've meet and who i know
S0444	yeah
S0439	but she have like she's have a few house party over the summer and i be like i'm really sorry but er the one thing i don't want be anybody go in my room
S0444	mm
S0439	i don't want them go in my bathroom i don't want them use my room
S0444	yeah
S0439	because i just don't trust them and i don't trust them when they're drink
S0444	no
S0439	and it's just drink people go in your room and go through your personal things and it's just it's not fair
S0444	yeah it be like er it be erm at the house party where meet the the guy
S0439	yeah
S0444	erm they start like they get drink and start put red wine all over the stairs on the carpet and they put coke like coca cola on the wall and it be like oh gosh like
S0439	and whose house be this
S0444	one of the girls from er you wouldn't know her cos she's just start
S0439	yeah yeah
S0444	erm and it be like oh no i mean they manage to get all the stuff out but it be it be that kind of thing i mean you know yeah they have to come into my room if the fuse go cos erm that's where the fuse box be
S0439	yeah yeah yeah
S0444	and yeah okay some of them use the shower if they're in a hurry but usually they'll knock on the door or ask if i'm use it or you know whatever so
S0439	yeah
S0444	so you know it be that kind of thing but to be honest it's just i don't feel like i've really be there that much i i don't
S0439	yeah
S0444	i'm not i'm not really there that often cos you you know quite a lot of weekend you know i've be like i be in and then you know and then i'll probably be at 's and then i'll be at home in and like i'm hardly ever there really like
S0439	yeah so i'm like when me and do spend time together we have to schedule in time together to spend as like like good friend like
S0444	yeah i remember you say yeah
S0439	cos like this week so this week what have i do erm monday i be at 's because it be her last day
S0444	mm yep
S0439	tuesday i go run so and i have my hair cut beforehand so i didn't come home till like half nine
S0444	mm
S0439	wednesday i go i go round 's after after work and have dinner with her and thursday i have netball until half nine so friday yesterday be the only day i'd actually properly see all week
S0444	mm
S0439	because she'd be at 's at the weekend and i have be at with all weekend and so she wasn't here anyway
S0444	mm
S0439	so er yeah i because we're just so busy just see each other like even just be in the house for long periods of time be like i spend hardly any time in this house at the moment
S0444	yeah you're so busy
S0439	yeah it's manic and i like it i like be busy i like do stuff but like this weekend it's just nice to have a chill weekend where you just
S0444	oh good
S0439	no no
S0444	i be i be worry that i might be like deprive you of some kind of like
S0439	oh oh no no no trust me no
S0439	i have enough social stuff in my calendar to last me a lifetime
S0444	so yeah i'm just make you have a chill weekend just the my worry about your life busyness i'm just like mm
S0439	no i'm very good thank you i be good with a nice chill
S0439	chill even i'm just gonna put the light on though cos it's a little bite dark
S0444	i be gonna say i'm not like it get so dark so soon
S0439	no i go to i have netball the other week and erm i go into 's room and i be like okay i'm just pop out now to netball and then i be like why be you sit in the dark watch tv and she be like it just catch up with me i be like
S0444	it do that to me
S0439	yeah it just creep up on you doesn't it
S0444	and i be like i don't know
S0439	yeah it's really peculiar she she be like it's i i be watch it in the daylight and and now er now er dark
S0444	especially i don't wanna move
S0439	yeah
S0444	i'm not move
S0439	just a penalty dunno what accent that be suppose to be
S0444	get like a glittery like number on the back
S0439	who the south africans
S0444	the south africans
S0439	yeah it's gold isn't it
S0444	yeah but it's kind of like a pattern so it kind of look glittery from a distance
S0439	what be they call they're call the springboks aren't they what do springbok mean be that a kangaroo or something or i dunno
S0444	i think it be
S0439	ah some rugby players be absolutely gorgeous
S0444	what be they do now
S0439	oh he's have a penalty because he do a spear tackle on him
S0444	oh okay
S0439	but it wasn't an intentional spear spear tackle it be just kind of how he fell and he end up roll onto his neck
S0444	oh
S0439	and then onto his back
S0444	oh
S0439	he do like a he do like a bite of a forward roll
S0439	but could you imagine a sixteen stone seventeen stone man do a forward roll
S0444	oh
S0439	yeah oh it's really funny there's a boy in my office call
S0444	yeah
S0439	and he's a very skinny kind of tallish maybe five ten maybe five something like that he's he's tallish he's not small erm ginger hair very skinny look a bite like what you could imagine one of the weasley twin to look like but not as tall
S0444	yeah i've get you yeah
S0439	and he play rugby this boy be ten stone and he be play rugby against fifteen stone boys he's twenty two
S0444	he's gonna get throw up in the air
S0439	he come into work every week with break nose last week he come no not last week a month ago he come with a break nose and massive bruise under both eye he have cut on his face he have limp
S0444	oh
S0439	and i be like i'm sorry i'm sorry boy when be you gonna accept that just rugby be not your sport like seriously have you not think of something like a little less contact like cricket or
S0444	not your sport football
S0439	yeah football or basketball although you're not really tall enough for basketball
S0444	yeah
S0439	but badminton tennis you know there be lot of sport out there
S0444	swim
S0439	swim yeah and he's just like he be like
S0444	why do you do it
S0439	he be like well i like rugby i'm good at it i'm like you might be good at it against like ten year olds
S0439	but not against fifteen stone
S0444	he's like a featherweight really
S0439	like there be no way like have you like some of these players on the pitch be like twenty years old
S0444	yeah
S0439	be like
S0444	half the size yeah
S0439	half the size of them and you're just like
S0444	that blondie he's like a right
S0439	i know some of er some of them be beautiful though beautiful muscly body
S0444	but the concussion like issue be quite off put
S0439	oh yeah george north last season get concuss in three match and wasn't allow to play
S0444	yeah
S0439	it's so dangerous apparently the average professional erm career span for an american footballer be four years because of the amount of
S0439	the amount of concussion they get do you remember i know that you you'll appreciate this cos you like gray's anatomy as well
S0439	do you remember that gray's anatomy episode where erm mcdreamy be do an operation on a nfl player
S0439	and the nfl and he be like you're such an amaze player you know i'll get you back on the pitch you know i'll help you and the nfl player be like i don't want to
S0444	yeah
S0439	please don't fix me because if i go back on the pitch and i get concuss again i won't even remember my own child
S0444	yeah
S0439	and he be like okay
S0444	but i wanna fix you
S0439	and then they kill mcdreamy
S0444	oh my gosh i know
S0439	he die he die in a car crash didn't he
S0444	i i yeah
S0439	same as george to be honest that's a bite
S0444	yeah i mean it's because they kind of announce that he be gonna leave in advance it be like oh how they be gonna get rid of him
S0439	yeah
S0439	but meredith's still in it isn't she
S0444	yeah
S0439	she's be do it for a very long time now i can remember when it first start
S0444	yeah it be like eleven ten or eleven years ago now
S0439	and that first episode where she have that one night stand with mcdreamy
S0444	yeah
S0439	and then kick him out and then find out he's her boss and you're like
S0444	i didn't watch it from the begin you see
S0439	ah didn't you
S0444	i watch it a couple of episodes afterwards but my mum
S0439	mm
S0444	my mum and sister saw it oh i'll i'll watch it
S0439	when she go up to him and she's like i want you and then he's like this be my wife
S0444	yeah
S0439	she's like shit
S0444	i kind of wanna make watch it
S0439	do you think he'd appreciate it
S0444	oh hell no
S0444	but i'm like this be why i be the way that i be
S0439	yeah
S0444	this be why i'm all about the emotional speeches
S0444	look at that like
S0439	that be a good emotional speech by meredith gray and she's like she's like me she's awful at emotion
S0444	there be a buzzfeed article i think you've probably read it girls who don't like feel
S0444	i be like
S0439	i don't like feel
S0444	but you but you be sentimental babe
S0439	i be
S0444	that's the thing with the people that you really care about like the postcards in the box you be really sentimental and er when you when you do feel things and allow yourself to feel them things will hit you hard like
S0439	yeah
S0444	you know you're human but you kind of just
S0439	in the small things
S0444	it it take it take it take quite a bite
S0439	yeah
S0444	to that way
S0439	take a while it take a while to get through my wall of pain and doom and
S0444	you er you and be actually scarily similar
S0444	do that sense it's like why do i not recognise that be like
S0439	be like
S0444	it be quite true
S0439	yeah
S0444	i mean i know you you might not really think the best of each other at the moment but it be quite true that like in term of like your attitude towards people in term of like when
S0439	i'm sure we'd get on
S0444	i think it be just not really the right context or whatever and it be
S0439	i think i be just yeah i think i be just angry at him that he kind of ruin your birthday
S0444	oh that's alright i have a nice birthday
S0439	yeah
S0444	i like just see everybody it be so nice like
S0439	yeah
S0444	have you there have like the guy there have the guy there have there have turn up later on like it be just so nice have a day like
S0439	yeah
S0444	be there erm
S0439	like i'm definitely not somebody who celebrate their birthday though in march and i'm not someone who think that the world should revolve around me on my birthday and stuff but
S0444	mm
S0439	i just expect a bite more from him that be all
S0444	i don't know we we we we air it out
S0439	good
S0444	on on the even er when we well when we get to my house pretty much
S0439	yeah
S0444	i be not happy with this and he be like i be not happy either and like we both just kind of
S0439	yeah
S0444	rant for quite a while but you know it's i pretty much turn around i say look you know this go for any of my friends you can have your own feel about them i cannot convince you
S0439	mm
S0444	to think about a certain person in a certain way you know that that's not my job erm but all i expect you to do and all i ask you to do be respect that person
S0439	mm
S0444	and appreciate and understand how much that person mean to me as a friend and how much
S0439	yeah
S0444	they have be there to for me as a friend and it be like you know it be quite easy think of the box
S0444	you know and it be that kind of thing like i i be like you know but you know like yes that she be one the most important people you know
S0439	mm
S0444	okay you may not be best friends from day one but you know as long as you have that respect for her as one of my good friends
S0439	mm
S0444	respect the fact that she look after me she support me and i support her and i look after her when she need it and you know that she's important to me that's what i ask at the moment
S0439	yeah the thing be like
S0444	you know and that you know it's fine and whatever happen happen but i i'm just like you know and vice versa it go for you it's like you respect the fact that he's my boyfriend
S0439	yeah
S0444	i'm make my choices and you know
S0439	that's the thing like
S0444	and it's the kind of thing that as long as you if you think that i be make a completely wrong choice further down the line
S0439	i would
S0444	you would say something and i i
S0439	i would tell you yeah like that's why like i never pretend with you like like yeah like today in the car when i like when i say like that i wasn't impress with him i wasn't gonna lie to you like erm but i like on the day like even after everything after like all of last year when like he say he didn't have a spark with you like all of that
S0444	mm
S0439	i didn't dislike him
S0439	and i don't like i don't dislike him now i think it be just
S0444	no
S0439	but you know like mr darcy say like
S0444	yeah
S0439	you know the first like first impressions
S0444	but not
S0439	no like erm be it when a good reputation be lose it's lose forever
S0444	lose forever kind of thing
S0439	and like and i i do get over that now like sometimes i'm really just like i instantly don't like somebody i'm like i'm not make any effort with you but with him like i genuinely do want to make effort i think it be just on that day
S0444	yeah it be just that day no exactly i think that i think
S0439	it be just hard and i just
S0444	i think he be er kind of the same but the thing be that both of you react in the same way to each other
S0439	but i don't think i do anything wrong like i don't
S0444	as in like he he be like oh well you know she she didn't come and say hello or anything so i didn't you know it be that kind of thing i be like i wasn't there for the entirety of it
S0439	mm
S0444	so i okay
S0439	yeah
S0444	you know but i be kind of like
S0439	like hate the not just him but i hate the idea of anybody dislike me when they don't know me
S0444	oh no it be more but he have the kind of thing where he be like well she hasn't talk to me much so
S0439	yeah
S0444	i don't you know
S0439	that be my fault cos i didn't want to talk to him cos i think his behaviour be appal so i didn't so i didn't talk to him so that so that be my that be my bad
S0444	well i i figure that bite i figure that bite and i be just like
S0439	that be my bad i do
S0444	i'm not gonna say oh yeah i really
S0439	no i take no i take complete responsibility
S0444	actually i probably tell him that you know
S0444	she probably hasn't see the best of you either but
S0439	no no i take responsibility for probably not also say hello to him
S0444	oh i know but you know i don't but that's the thing
S0439	next time
S0444	i don't i don't i don't have to tell both of you to act in a certain way with each other
S0439	no no no
S0444	that's not my job my job be just to go er look i'm the person that
S0439	yeah
S0444	both of you love to piece and for that reason you will respect each other and hopefully find things to bond over when you actually realise how similar you be as people
S0439	yeah like i know next time like if i ever meet him it'll be fine
S0444	oh yeah
S0439	just as long as he doesn't do something stupid
S0444	well
S0439	i'm a very scathing woman i protect my girls to the end
S0444	i know but that's what that's what you need and you know that's what i say to i be like you know cos er you know i be in a position where i i think one of his friends be a complete twat
S0439	really
S0444	and tell him not as in his friend
S0439	mm
S0444	but tell and get really defensive and i be like well think of it like it wasn't once i get to realise that that be him
S0439	mm
S0444	and er you know cos it be the guy in i don't know you might not remember the story who kind of say oh yeah i sleep with my ex's best friend or whatever and it be like what like
S0439	what a dick
S0444	it's the lowest er pretty much and he'd say er i'd never meet him before
S0439	yeah
S0444	and then it be like oh you know i dunno it be just it be just a bite of a weird one to begin with and i kind of just say oh you're a right
S0439	mm
S0444	like erm and you know me i would never really say that about someone straight out
S0439	no no yeah
S0444	and i be like oh god right okay well of course er alright to their face and i'm like you know be a bite like i'm not happy about the fact that i even say that
S0439	yeah
S0444	then i i be like the difference be that when i realise that that be actually him be him not him try to impress a certain
S0439	mm
S0444	thing but him be him yeah okay in that aspect he be a dick and
S0439	yeah yeah yeah
S0444	but agree and his friends do that this guy have no particular like social tact
S0439	yeah
S0444	in a way so then when i realise that that be him but then i saw him later on and be plaster out of his face and i didn't know this then he be like be you and gonna get home okay
S0439	mm
S0444	be he gonna be alright be you gonna be alright
S0439	like he do care
S0444	yeah and it be when come out i be like you're not you're not a dick you're just
S0439	no
S0444	you know in that instance and i be like think of it like that with you take what she say a certain way in the sense of he take it as a criticism it's not a criticism although you
S0439	yeah
S0444	you know and i know you didn't mean it that way
S0439	mm
S0444	i know the mean that i know the way that you mean it and i be kind of i know the way that she mean it because she mean it in a nice way
S0439	yeah
S0444	try to put you at ease
S0439	i be try to be nice
S0444	but then it kind of didn't put you at ease it just make things worse
S0444	gosh right but anyway and i be kind of say you know think of it like that you kind of react to that but then you you haven't have the moment where he's like oh that's how she she's a person
S0439	mm
S0444	she see it from that way like
S0439	yeah
S0444	do you know what i mean so i be just like okay
S0439	yeah it's just not worth like argue about like and yeah like i have complete respect for you and i respect your relationship and i trust that you know what you're do
S0444	yeah
S0439	and like i like i be all for somebody that cos a lot of people not a lot of people but people didn't like hat erm er genuinely do not like him at all
S0444	mm
S0439	and when i be date him she do not like him
S0444	mm
S0439	but so i'm very use to someone tell me that they don't like my boyfriend
S0444	yeah
S0439	and i think but with her i be like okay you don't like him that's fine i can understand why you don't like him we'll leave it at that and then i think yeah you're not gonna get on well with everybody
S0444	no you're not
S0439	and like and never really get the time to bond anyway not that they would but
S0439	but like and like i do hope that if i meet in the future like it'll be fine and i'll explain to him i be like i be just try to be nice like i wasn't try to be a bite like
