S0192	oh i like your background
S0189	it be like a japanese
S0192	do you take that picture huh
S0189	no it's just off google
S0192	let's have a look
S0189	i just shut down
S0192	oh you shut down your computer
S0189	well i have to swap over to windows but i'll
S0192	ah
S0189	i'll and you can see
S0192	what be it you're run on if it's not windows
S0189	it's the mac operate system
S0192	be it just call mac operate system
S0189	it's osx ten point something
S0192	os what do you mind if i leave this up here
S0189	yeah go on
S0192	alright never do that then eight page in
S0189	yeah it could've do better to be honest
S0192	yeah
S0192	so the thing when you're travel and do so many things you do tend to not read very much
S0189	i know i think i'd be read lot
S0189	to be honest i think i'd just be like chill on the beach do nothing but it get too hot to sit on the beach
S0192	yeah it's bright as well that's a really nice picture be that fuji in the background
S0189	yeah it be er
S0192	where do you get these from just any website in particular or you just search beautiful japanese image
S0189	yeah i think that's the coolest one i've get the other ones be kind of just a bite stock
S0192	yeah okay be this one stock
S0189	no
S0192	no
S0189	get it off google
S0192	ah dude your desktop be horrible
S0189	be a bite what do you mean that it's
S0192	how unorganised it be oh it's you've get three different desktops
S0189	yeah you have so i can have like a bunch of crap open on this one and then put stuff on another one
S0192	oh this be the these things that these can do when you pay a lot of money
S0189	suppose money money money money
S0192	ooh do that slow it down at all
S0189	no
S0192	it's just too fast
S0189	yeah it's quite cool
S0192	but this all this crap on your desktop be that just
S0189	it's not really need
S0192	you be unorganised
S0189	i could probably clear it up
S0189	but i can't be bother
S0192	how do you find stuff that you don't sit look through them
S0189	well the stuff that be on here's not stuff that i really need access to
S0192	for
S0189	don't really have many apps up there just utorrent
S0192	okay and you're tell me i need all those apps
S0189	mm
S0192	those ones
S0192	word powerpoint which version of of word and powerpoint have you get
S0189	this be a mac one or
S0192	do it just come free with it
S0189	no i just torrented it just cos it's for two thousand eleven
S0192	oh cool
S0192	i'm run on like yeah windows two thousand eleven i think or windows two thousand and nine
S0189	mm
S0192	do the job
S0189	yeah
S0192	so what kind of game do you think we've get
S0189	ah bunch
S0192	do you have counter strike huh
S0189	yeah but it's not instal at the moment plus we'll play it terribly when be the last player
S0189	time you play a first person shooter
S0192	er it's pretty terrible pretty bad you get better quickly though when you play it i'm sure we as long as we get
S0189	do i show you that planetside game
S0192	no what be that
S0189	that's a shooter
S0192	yeah
S0189	it's quite cool
S0192	be it two player
S0189	it's not two player
S0192	be it one that you have to like take turn do it
S0189	possibly yeah
S0192	right
S0189	i will get it update and download it and i'll show you that quickly
S0192	i'm up for play a few game i get nothing else to do tonight if you're up for it
S0189	sure
S0192	cool
S0189	we're probably not gonna let you play directly the learn curve be way too steep
S0192	yeah
S0192	it look a bite crazy that's all good be you sure this isn't bane's mask
S0189	it's not
S0192	so be it tiny oh stonehenge a brit through and through
S0189	it's just some random background
S0192	cool planetside
S0189	yeah it's like a giant
S0192	i think you've be play this for years haven't you
S0189	that be planetside one they rereleased it
S0192	oh
S0189	like er last year
S0192	so you're gonna play one game put a one player game first
S0189	yeah i'll show you this one quickly here
S0192	cool
S0189	but it might take and it's around here i think should be one of these
S0192	welcome to
S0189	while i do this i'll set up the emulator
S0192	do you put the amp up on ebay
S0189	huh
S0192	do you put the amp up on ebay
S0189	no i can't until i can test it and i can't test it until the
S0192	oh shit
S0189	yeah i've actually get another mouse if you need a mouse
S0192	yeah i do
S0189	it's a good one
S0192	do you not need it
S0189	i don't need it
S0192	but i mean like what happen if your one break and then you'd a backup wouldn't you
S0189	ah this stand the test of time i don't think it'll break it's
S0192	what happen if you lend me this one and i break it
S0189	doesn't matter
S0192	cool i mean yeah that look pretty nice
S0189	it's it's a really good mouse
S0192	really cool be it just plug and play
S0189	yeah it's great you get erm scroll wheel it's also like get leave and right as well
S0192	oh that's pretty useful
S0189	yeah that's probably
S0192	what be the button on the side
S0189	er other button er yeah you can have it that be my favourite mouse like
S0192	really why why do you stop use it
S0189	just cos i get that one there's not really any difference to be honest
S0192	do look pretty nice
S0189	yeah
S0192	yeah what's mean to be better about this one
S0189	nothing i just for some reason i want a new mouse cos i get bore with that one cos i have it for years
S0189	but that be like a fifty quid mouse
S0192	oh bloody hell
S0189	it's just
S0192	you sure you wanna put that into my
S0189	yeah it's fine
S0192	uncapable hand and then this be just an xbox controller
S0189	yeah
S0192	through and through
S0189	mm
S0192	i'm gonna be so crap i haven't play computer game in age take it you've never read nineteen eighty four
S0189	no i read that one
S0192	you do
S0189	yeah
S0192	do you like it
S0189	yeah it be good
S0192	it's a good book isn't it that one
S0189	what's that book
S0192	can't even remember what i buy you now world war z er do you read that
S0189	well the film's crap so
S0192	the film's terrible but don't not read the book because of that because the book be nothing like the film
S0189	be it
S0192	nothing like it
S0189	really
S0192	it's quite you would really like this there's a good few well i'm not say you would really like it but there's a good few stories in here set in japan basically it's very short stories like i mean let's go through from the begin this first one greater chongking in chongqing in china so it's like really short stories for each person so like ten to twelve page next one lhasa in tibet it's like different people around the world find out what happen there
S0189	how do they make a film out of it and call it world war z
S0192	what's this in meteora greece quite a few of the cool stories be in erm japan this one guy like get stick in his complex and have to shimmy on the wall and like out the windows and stuff to like get out of the build and like zombies everywhere it be really disappoint see the film because this book's really quite good
S0189	yeah
S0192	and then the film
S0189	god the film's crap
S0192	have nothing to do with it whatsoever
S0189	it's just action
S0189	yeah it really be just shove zombie down your face
S0192	dad like it
S0189	i don't think he like it that much like when i i watch it with him
S0192	do you
S0189	and like i have i be pretty much just texting the whole time it didn't capture my interest
S0189	it's pretty bad
S0192	it's pretty poor yeah i want him to read this though cos this be genuinely a good book there's one like they miss out load of bits that be in this the the zombies in this water doesn't stop them they try like live on islands or like be out on boat and stuff but the zombies just sink and they walk along the seabed and then eventually they find like a chain with an anchor and they start pull themselves out so like they start like climb on boat and stuff
S0189	oh shit
S0192	it's worth read don't let the film put you off
S0189	this be like a massive game it's like a a multiplayer but it's shoot so like role play shoot em up
S0192	i wonder if i can put this like that that's alright as well
S0189	a lot those speakers though
S0192	yeah i know i'm just wonder if it's pick up quite a bite it's kinda directional so surely it's now point more to us
S0189	perhaps
S0192	the speakers be come
S0189	it have it's gonna get a lot of keyboard
S0192	oh that's true yeah it will get a lot of keyboard where can we put it that be it be pick up a lot of that speaker
S0189	i think it'll be alright
S0192	yeah we'll have to try or maybe put it here do that work any better
S0189	i dunno hopefully the thing be now like
S0192	yeah no it's not
S0189	reflect
S0192	actually point towards us right hang on mate can you
S0189	but now i can't play
S0192	be there not room for your mouse there if you move the keyboard over a little bite like that
S0192	be that good
S0189	it's rubbish
S0192	you've not lose any space
S0189	oh my god this doesn't seem to be work what's go on move that recycle er
S0192	these be your nice speakers aren't they
S0189	yeah
S0192	mine be crap
S0189	right can't remember when the last time i do this be
S0192	a while ago
S0189	by the look of things
S0192	alright that's pick up
S0189	that's good and then pad two pad four can be
S0189	what
S0189	okay so i'll play with the keyboard which be gonna be confuse
S0192	oh so we be play two player
S0189	i'll try it
S0192	yeah cool
S0189	but not for that game doesn't seem to be work though woah that be weird erm right need to think about how this work so can be up and down yeah you normally play that on these
S0192	yeah
S0189	a w w a s d or whatever
S0192	button
S0189	these
S0192	that keyboard be so small
S0189	yeah
S0192	how do you fit your hand on that so just set up the button
S0189	set space
S0192	do you normally play game with the controller then
S0189	what what it can pick up the mouse as the controller that's a bite weird
S0192	can it
S0189	look look watch
S0192	what if we talk
S0189	no it's it's pick up the mouse on here
S0192	oh the mouse
S0189	that's weird
S0192	yeah that be weird
S0189	i dunno how if that would work very well
S0192	how that's very sensitive
S0189	i can't imagine play like that
S0192	no
S0189	give it a try
S0192	what game we play first then
S0189	well i've get super smash
S0192	oh you do
S0189	yeah that's it
S0192	be it the same version that i know
S0189	no it's probably a newer one
S0192	oh cool
S0189	erm
S0192	i'm up for play that so what game be it
S0189	underside
S0192	cool
S0189	maybe it'll work maybe it won't
S0192	what wasn't work about it before
S0189	it just doesn't start
S0192	it's a long game
S0189	this be a long game
S0192	when be the last time you play it
S0189	weeks
S0192	i haven't really play very often
S0189	i try to i tend to play one game and just play the shit out of it
S0192	yeah
S0189	and not touch anything else
S0192	do you remember that game you play like evil something something
S0189	god that be bore
S0192	be it
S0189	yeah
S0192	you fly around in space
S0189	yeah yeah
S0189	it be like a visualise spreadsheet but a game
S0189	yeah
S0192	you play it quite a bite
S0189	well cos like you have the ability to get so rich and like control so much but like it never happen
S0192	no
S0189	and it just take so much work
S0189	and like anyone could just come out of anywhere and blow your shit up and destroy you and then you're back to square one so you'd get like proper sweat when you play
S0189	like no
S0192	don't destroy me
S0189	five hundred hours
S0189	of this and
S0189	this and now you're hold me for ransom
S0189	no it's not so good this work
S0192	well this isn't work
S0189	no that's not work
S0192	i remember play settlers that be a fun game
S0189	that be rubbish
S0192	why
S0189	that be just be bad
S0192	total annihilation
S0189	right super smash brawl
S0192	i like that one as well
S0189	total annihilation be awesome
S0192	oh be this a wii version
S0189	oh have you see the new total annihilation
S0192	no
S0189	oh man they redo it yeah this be the wii version let me see if i can find that game if i've still get it instal
S0192	how big's your hard drive on this one
S0189	erm terabyte it's split up between quite a few things like
S0192	partition
S0189	ah no i don't think i've get it
S0192	do you uninstall game quite frequently
S0189	yeah
S0192	do you think windows defender be okay that's just my the only virus thing that i've get on
S0189	dunno sound like er some kind of spamware windows defender
S0192	apparently it's oh crap i didn't get the wash in don't let me forget to do that once it get dark
S0189	i don't think it's gonna rain
S0192	no but still get damp at night doesn't it
S0189	yeah
S0192	the dew start come out
S0189	let me have a look ah
S0192	what be you look for
S0189	i'll have a look on my hard drive see if i've get that game
S0192	where would it be on your old hard drive
S0189	whoop where be it
S0192	where's what
S0189	oh here it be
S0192	have you get a wd my passport one as well
S0189	not my passport this be the cheaper one just a wd
S0192	oh cool
S0189	something or other
S0192	hang on a sec once you've do that
S0189	see if this work
S0192	online interaction's not rat be there be any new character
S0189	yeah think so see if this work mm
S0192	the one on the n sixty four be pretty fun wasn't it
S0189	yeah i think maybe i don't have the the erm other controllers actually enable ah here we go standard controller standard controller let's try that
S0192	so it should work
S0189	yes there you go
S0192	good stuff
S0189	right there you go
S0192	be you prepare to get whoop
S0189	ah
S0189	probably actually
S0192	so what be it in general can you remember
S0189	just gonna get the wireless keyboard
S0192	yeah that be pretty useful
S0189	these controllers these controllers be gonna be a pain to remember
S0192	yeah
S0189	erm right
S0192	be this just you against me first
S0189	yeah we'll have a quick practice
S0192	olimar what be that oh he's from erm
S0189	pikmin
S0192	yeah do you remember that game
S0189	i've get that as well yeah
S0192	that be kind of fun i think i use to like link
S0189	ike's my favourite he's cool
S0192	ah there be two of them and it be he have a brother or something
S0189	marth marth yeah he's that's marth there
S0192	fox be quite good
S0189	yeah
S0192	hang on these look like the same character as last time
S0189	yeah it would mostly be the same
S0192	mm
S0189	erm shall we have me and you against
S0192	right okay try and set them up not too hard
S0189	this be five
S0192	and you've gotta throw em off the screen haven't you
S0189	erm
S0192	you gotta keep beat them up until you can throw em completely off the screen
S0189	yeah right hang on
S0192	that be a good concept er it be like the only game that fight ever do that
S0189	here we go ah we've get er that one there that one we'll do er the one that you'll remember which be be an old one it's on here this one
S0192	cool
S0189	you should remember this
S0192	and i'm zelda oh it's jittery
S0189	yeah that's not a in fact i probably don't have the settings right okay
S0192	who's that dude not move at the top link why can't i hit him be he not really there
S0189	oh that's erm he's not really there it's the pokemon that he control
S0192	so be it me and you against these two
S0189	yeah
S0192	cool ah i'm get can already
S0189	i might need to mess with the settings on this it's not perfect
S0192	i use to know all the move and stuff now i don't know how to do anything fire an arrow
S0189	right let's let's try something this doesn't seem to be it's quite laggy
S0192	yeah it be a bite laggy with all this super pc stuff
S0189	let's try the different dolphin
S0192	yeah i remember have a dolphin don't tell me you have to set it all up again
S0189	i dunno i just load that one maybe that be just a shortcut to the same one
S0192	yeah
S0189	probably let's have a look at the settings erm
S0192	what do you think could be go wrong
S0189	i dunno i probably don't have things set right i don't remember how it's suppose to be
S0189	hang on
S0192	i mean it be run
S0189	yeah
S0192	it's definitely a bite laggy though
S0189	file
S0192	gamecube
S0189	let's have a quick look online
S0192	see what they say
S0189	so dolphin super smash bro brawl settings
S0192	do you have to set it up differently for every game then
S0189	sometimes yeah i have it set up perfectly but then i change i update to the new version and i lose my settings
S0192	oh no
S0189	erm configurations right here we go skip
S0192	skip graphics skip efb access from cpu
S0189	ah where be that
S0192	there
S0189	there we go
S0192	skip note this prevent sudden first person
S0189	okay be that it there's nothing else nothing else what
S0192	what other kind of settings should there be
S0189	i don't know but i have it work perfectly once one time
S0192	just not today
S0189	no for some reason
S0192	maybe that thing you just click will do it
S0189	let's see see what happen
S0192	do you exit the game or be we just pause
S0189	er it's exit
S0192	oh no
S0189	let's try this one
S0192	you look like you have zelda on there
S0189	yeah i do i get a bunch of game
S0192	the original zelda
S0189	yeah i think i get that as well
S0192	do they ever release a newer one
S0189	yeah they do
S0192	be it any good
S0189	yeah it be
S0192	yeah
S0189	oh let's just do this bite first
S0192	i never complete the original one either
S0192	ah cool
S0189	well this look faster
S0192	so what's it do yeah it look much faster just that one little thing that you change
S0189	i dunno have a look
S0192	cool who be you
S0189	i think i'm these i'm two people
S0192	yeah you be we're not against each other be we
S0189	well i think we be actually
S0192	ah didn't you use to be able to do a
S0189	right shall we repick our character
S0192	yeah i'm still try to figure it out let me play with this guy for a little bite
S0189	alright
S0192	that one use to ah that be how you do that it's come back to me oh i've get him in the corner how do you grab them again and throw them
S0189	it's one of the side button
S0192	oh yeah
S0189	like z or something but there be no z so it's must be a shoulder
S0192	that one yeah
S0189	yeah ah
S0192	oh yeah and you have a defence bubble
S0189	yeah
S0192	i forget that
S0189	i don't know where my button for that be
S0192	that's the shoulder button but on yours i don't know didn't you use to have a gun that you can charge up or be that
S0189	no not that you can charge
S0192	how do you grab them
S0189	erm use the
S0192	how do you throw em
S0189	just punch i think be the big one below
S0192	yeah which one's punch
S0189	woah i've get two items at the same time
S0192	be there two of you
S0189	i didn't know they could do that that's cool
S0192	yeah yeah that's cool what level be these guy on
S0189	three not very high
S0192	what you've gotta hit em out and then keep hit em out haven't you oh
S0189	yeah
S0192	yeah
S0189	i think we might be on the same team
S0192	i mean you you didn't hit me then
S0189	whoop i don't know how to throw my items ah that's it
S0192	oh shit
S0189	there we go
S0192	oh no he's headbutt me oh shit
S0189	you're lucky you have controller this be confuse
S0192	yeah i bet oh i be hit you sudden death why
S0192	oh
S0189	what what
S0189	we've lose
S0192	what happen there we just all have three hundred percent health
S0189	yeah
S0192	just one hit death
S0189	pretty much
S0192	they haven't really change anything
S0189	no not really
S0192	no
S0189	you get extra move
S0192	all the move be the same
S0189	you do have more move than the original
S0192	you do
S0189	brawl
S0192	like i can't remember you think you'd want them to change a bite more wouldn't you
S0189	yeah
S0192	this thing's have another go
S0189	it have change a bite like they don't really do much like they just make the graphics a lot better
S0192	yeah
S0189	and kind of refine
S0192	oh lucas be that guy with the yoyo isn't it
S0189	yeah
S0192	diddy kong wasn't in it before be he
S0189	no
S0192	zelda sheik pit i don't think pit be in it what's meta knight pokemon trainer yeah some of these be different do you wanna play me against you
S0189	sure
S0192	just so i can see what's go on a bite better
S0189	shall we have no bots then
S0192	yeah how do we take em off
S0189	there we go
S0192	there we go
S0189	let's change this
S0192	yeah just
S0189	five live
S0192	yeah sound good i'm a pokemon trainer
S0189	right we'll go on a cool level
S0192	yeah
S0189	this one's pretty cool
S0192	what's cool about this one
S0189	the be like quite a lot different to the old ones
S0192	oh what i think i be a pokemon trainer
S0189	you be a pokemon but some one of his move be to swap out for another pokemon
S0192	ah ah
S0192	oh shit oh look out i don't really understand what's go on at the minute
S0189	well
S0192	there we go here how do i change to a different pokemon then
S0189	well like up and b or down and b whatever your
S0192	which one's b
S0189	probably the red one oh no that's jab it'll be the blue one then
S0192	down and b oh oh can you can i just keep do that
S0189	you've get a couple yeah
S0192	oh that's cool
S0189	they've all get different move ah
S0192	oh my god oh squirtle
S0189	ah stop it do you think be gonna make much sense
S0192	no
S0189	in the record
S0192	probably not there you go who be i again bulbasaur i think charizman's gonna be the best
S0189	charizman
S0189	that's what dad use to call it
S0192	yeah oh shit oh
S0189	do you forget about that
S0192	can me what do you do then
S0189	you can charge this thing up
S0192	oh shit
S0192	oh what's go on there
S0189	it's
S0192	it's just shoot above me
S0189	yeah that's cool
S0192	how do i shoot with this gun ah
S0192	how do you charge it oh
S0189	woah there
S0192	oh what the hell just happen there
S0189	it you shoot out with a staple and catch on how the hell do you do that
S0192	erm i just use my up and b really
S0189	oh no yeah oh shit
S0192	i forget how fun this game be
S0189	yeah it's cool
S0192	i always think you could throw these things
S0189	i use to play this for hours rather than go to school
S0192	yeah you didn't go you'd skive
S0189	yeah i'd play this
S0192	oh shit what do school say
S0189	oh the usual crap i get really good
S0192	yeah use to play things all the time when you be do
S0189	er use to be like we just we'd fight for like ten minutes and like no move would actually connect cos we'd be dodge everything
S0192	woah
S0189	yeah
S0192	woah what the hell happen there
S0189	it be a star ah
S0192	ah shit i keep do that by accident i don't mean to he's not very powerful thingy this pokemon
S0189	we've get the like the power scale down low
S0192	oh shit
S0189	but like stay still for a second
S0192	no
S0189	i'll show you my guy's move
S0192	no
S0189	if i can fully charge that up you
S0192	what happen there
S0189	oh shit
S0189	that's get it
S0192	oh yeah there might be too much silence in this but that's all
S0189	yeah
S0192	that's all good i'll just go back and listen to it tomorrow just tell me where there's a piece of software that can automatically cut out
S0189	that'd be good it might be a bite strange you know like depend on how you cut it
S0192	yeah that's the thing you've gotta listen you can't just cut the sound out and then it's go to another
S0189	right
S0192	topic of conversation
S0189	you need to kind of work of try to actually have a conversation and play it at the same time it's not so easy
S0192	no well we're do it
S0189	kind of
S0192	yeah
S0189	but then there's the awkward silence where you get into play cos
S0192	yeah
S0189	you forget that's all good so i'll try and kill
S0192	ah
S0189	yeah
S0192	we keep change i can't really keep up with the way we be on this like i can't
S0189	yeah it's a bite random
S0192	oh oh you can go in there
S0189	i've get erm ah do you remember do you ever play soulcalibur
S0192	yeah
S0189	i've get that it's awesome
S0192	it's a fight game right
S0189	yeah
S0192	yeah
S0189	it's gonna be horrible with a without a controller for me
S0192	yeah i bet oh bloody hell he doesn't seem very good this guy don't really know what that rock headbutt thing do
S0189	oh dammit it's quite good this game when you've get a whole bunch of people play
S0192	yeah it get hectic
S0189	it's a good party game
S0192	yeah definitely ah you can me there
S0189	get two row leave
S0192	oh oh
S0189	one life leave
S0192	what happen there
S0192	you can me then
S0189	yeah
S0192	oh i'm really out of practice
S0189	oh shit
S0192	get you that time though i don't really like this pokemon character though cos they keep change so i'm kinda learn three character at once
S0189	yeah it's not so easy
S0192	which isn't that good there's no way of get other live be there or anything like that
S0189	no you're on your last one now you're dead
S0192	yeah
S0189	ooh
S0189	crazy
S0192	he catch on with his vines
S0189	yeah that's cool
S0192	oh i kill you three time that wasn't too bad
S0189	yeah that be pretty good
S0192	you be use that terrible controller
S0189	it's not so bad it's playable
S0192	slightly handicap ah i'm not gonna be him again who the hell be king dedede
S0189	he's no good try fox
S0192	there's fox
S0189	oh yeah just do
S0192	yeah i wasn't great with him mario be quite solid
S0189	yeah mario's good
S0192	mario donkey kong be good
S0189	that one be cool i'll show you
S0189	press the no zelda's awesome
S0192	oh yeah
S0189	i'll show you that that one's good
S0192	where's the other zelda that's another good level
S0189	oh right let's see a cool one i always like the erm f zero level
S0192	yeah that be cool
S0189	where be it though
S0192	really like this and do you have f zero x
S0189	no i don't
S0192	ah that's but i'm sure you can get it like that
S0189	probably although these game get a bite bigger than the n sixty four ones
S0192	yeah i bet oh shit i'm not play
S0189	be you not
S0192	no
S0189	oh shit oh i don't know the battle combination to get out of this
S0192	er no i don't either can i get out of it
S0189	maybe
S0192	or something
