S0189	let's try press like a x r start but i don't think i've get those button bind so a x
S0192	be there no way out of this match for us
S0189	god i'm try button and nothing's happen i'll just
S0192	try and quit l r a and start hang on
S0189	yeah but it doesn't work for you cos you're not play it's for me
S0192	but if i pause it can i do that
S0189	you can't pause it
S0192	right
S0189	cos you're not play
S0192	i do something
S0189	we'll just restart cool
S0192	so this be for the wii or isn't it do the wii ever get big
S0189	not really
S0192	seem a bite crappy to me
S0189	it be a bite i don't what ah nintendo be play at
S0192	oh what be they do next
S0189	like the gamecube be good
S0192	it be alright
S0189	and then it kind of
S0192	i really like jet force gemini on it
S0189	yeah
S0192	that be a cool game
S0189	probably get that it be two player but like the second player didn't really do much
S0192	no
S0189	just play that little dog thingy or
S0192	oh yeah
S0189	could do that yeah
S0192	meta knight so i'm in right so what happen last time
S0189	i don't know we'll put the damage ratio a little bite higher
S0192	okay
S0192	just so you can cane me
S0189	right that
S0192	never know i might get my own
S0189	we'll see
S0192	oh you weren't gonna be meta knight last time what the hell be that i just change my outfit or something
S0189	you've get a water gun now
S0192	what happen to my old thing where i go up in a do you know what i mean when i
S0189	when you do what
S0192	he's lose it he have his little whirlwind thing
S0189	down and b
S0192	down and b just change
S0189	i think you've lose the whirlwind though
S0192	oh that be a good move what be those things woah
S0189	it's gonna be much easier to get knock out now i don't know of this guy's move they always
S0192	oh
S0189	play epic guitar solo
S0192	yeah
S0189	oh shit
S0192	i didn't know that they come do you kill us both
S0189	yeah
S0192	poor what's this little thing i just seem to turn you around doesn't seem to have go that way
S0189	doesn't do much i dunno what that do be that just a dodge
S0192	really gotta rely on weapons a little bite
S0189	yeah ah ah ah
S0192	yeah yeah
S0189	no
S0192	ah you're alive how do you survive that
S0189	don't know
S0192	oh what be that do in oh
S0192	if you get hit by any one of those you die
S0189	mm
S0192	so it seem
S0189	let me see what this do
S0192	no
S0189	come on
S0192	you can just do it yourself
S0189	doesn't seem to do anything
S0192	oh crap what happen to me
S0189	what be this suppose to do
S0192	yes
S0189	that move hasn't do anything yet let me just stand i
S0192	alright well we're on zero zero so
S0189	yeah right
S0192	if it hurt me i get to hurt you in equal proportion
S0189	ah yeah it's not sensitive enough hey there's nothing what's the purpose of that
S0192	dunno but you've hurt me fourteen
S0189	you've hurt me more than fourteen
S0192	i don't like his little oh shit
S0192	bastard
S0189	do you forget you could do that
S0189	ah
S0192	ah
S0192	run out of fuck ammo ah ah i don't like his little thing i mean it's pointless now i've get one that shoot fire and one that shoot water
S0189	you might win though
S0192	i doubt it we're both on zero bugger
S0189	ah if i can get this
S0192	oh no
S0189	ah no no no no
S0192	yeah yeah
S0189	that be like
S0192	fair and square
S0189	ah man
S0192	one all
S0189	that be so bad
S0192	it be good
S0189	ah
S0192	didn't think i be gonna win that
S0192	it's a bite of luck
S0192	who you gonna go for now
S0189	er dunno
S0192	what's diddy like be he alright
S0189	oh yeah i be gonna do the zelda wasn't i
S0192	oh yeah sheik
S0189	she's cool
S0192	be it cos it's two character
S0189	yeah
S0192	which one now
S0189	right another cool one
S0192	pikmin i'd like to see that one
S0189	no this one's cooler
S0192	yeah
S0189	look at that realistic crowd in the background
S0192	oh she's peanut diddy kong use to be quite good donkey well in donkey kong what oh be this that thing you can steer
S0189	yeah
S0192	wasn't it what's his face that have that how do you get out of this
S0192	oh look at that rocket boosters ah wow that hurt you just gonna keep do that yeah
S0189	yeah
S0192	woah he grab it on his way run that be quite cool oh shit she deflect it oh
S0189	unlucky
S0192	what what's go on
S0189	the map change right look she can change into sheik and i've get more move god she's get like a chain it's really buggy without a controller
S0192	woah
S0189	yeah yeah oh shit i've get ninja dart oh
S0192	see how how full my thing be it be terrible
S0189	mine defeat your giant peanut
S0192	i'm not entirely sure how ooh
S0189	right in the face oh no
S0192	yeah
S0189	dammit
S0192	what's go on with that banana who put the banana there
S0189	seem a bite random do it do anything yeah
S0192	not much though do it hurt you if you go on the grind and no oh what's happen fall really slowly
S0189	it's the windmills
S0192	oh yeah that's cool huh
S0189	i bet you like look back to the old erm super smash and you're like oh i don't remember the graphics be much different to this but then like i go and play it and it's ancient
S0192	be it
S0189	yeah you can really everyone's so blocky
S0192	oh my bananas do a lot ah
S0189	this one's no good
S0192	yeah
S0189	oh you be lucky
S0192	yeah yeah oh nice
S0189	ah man
S0192	i wanna
S0189	play with this keyboard be hard
S0192	it's fine until you start lose
S0189	cos ike be my best character
S0192	ah how do you get out of that
S0189	well i fell over
S0192	be it my banana
S0189	or the ice
S0192	oh crap free fall trip on my banana why don't you
S0189	what
S0189	be that one your down b or something
S0192	do it hurt you every time
S0189	a little bite
S0192	how many can you put
S0189	a few that's quite hilarious oh shit
S0192	bet he hurt you didn't i nicely do that be it wasn't it i don't really need that one
S0189	what the how do i go out and you didn't'
S0192	yeah cos i hit you in the back
S0189	i don't think you do then not the back er your hand
S0192	ah
S0189	why do you stay still
S0192	i just start do that move so i couldn't get out
S0189	oh what no
S0192	yeah two live to zero
S0189	nice
S0192	get can that time i be never terrible at this game though don't think
S0189	no you're probably right it be your game
S0192	yeah
S0192	you like kirby don't you
S0189	samus be pretty cool
S0192	you can set people in i quite pikachu if i must be
S0189	let's try it
S0192	mm to the death i really like star fox that one that one's quite good
S0189	that's not star fox
S0192	oh
S0189	this one be a star fox one but it's get the one eight sim card
S0192	oh it's a different one no be that one go
S0189	er you it's still there
S0192	right so it still do that
S0189	home missiles attack
S0192	shit
S0189	look out
S0192	oh shit there's a platform these platforms don't work so well for me
S0189	no not my style
S0192	ah
S0189	oh shit
S0192	they can't go too far those things can they those star
S0189	no
S0192	can we get hit by the star war ship the
S0189	yeah
S0192	nice
S0189	you get some ridiculous game modes on there like you can make the character ridiculously big
S0192	yeah you you could couldn't you i do remember that it be quite fun there be all sort of things i remember you can make em really small as well
S0189	yeah
S0192	oh have they release any more be this the latest one sort of
S0189	this be the latest one
S0192	oh what what console be this oh it's for the wii
S0189	yeah
S0192	they've not release em on anything else
S0189	er no i don't
S0192	be there any other good game on the wii or be this the only one game
S0189	nintendo have get this wii u or some crap
S0192	wii u
S0189	yeah
S0192	i wee on you
S0189	yeah
S0192	that's really bad
S0189	bitch
S0192	you're goddamn right oh shit we're come in to land or something
S0189	hm
S0192	shit you won't get me with that mate it's hard to get when you
S0189	no one stay still for it
S0192	no it's slow as well
S0189	yeah really slow like most people's move be so quick
S0192	yeah
S0189	that you just get stop immediately it's rubbish
S0192	you're get can oh god no
S0189	no oh
S0192	yeah yeah
S0189	i've get one life
S0192	and i've get three
S0189	ah no no that
S0192	yes
S0192	it's three to one bro
S0189	that suck
S0192	three to one shall we try a different game then
S0189	yeah
S0192	that be good though well do you wanna try with bots me and you against bots
S0189	no let's try er soulcalibur
S0192	cool i would be never good at that game so i'm just gonna be hit
S0189	i can't remember any of the move cos i play with a controller
S0192	yeah so he say i'm sure you're gonna cane me with a bunch of move think i have soulcalibur two or something once or
S0189	i dunno what this one be soulcalibur three maybe be that one
S0189	do you wanna play that one
S0192	yes
S0189	oh soulcalibur two
S0192	oh this be soulcalibur two
S0189	yeah this be the one you have
S0192	yeah i think so look like it so we just want team we want arcade
S0189	i like team better
S0192	do you remember that old game we use to have on the i really like it on the mega drive you be like police or something and you be constantly go along the screen like fight people then you could press a button and like a police car could come in and shoot a bazooka do you remember
S0189	no
S0192	you be like these two guy and you have to beat load of boss it be like some gangster underworld
S0189	oh be you sure it wasn't like streets of rage or something
S0192	yeah streets of rage that's what i'm think of yeah
S0189	yeah
S0192	that be a quality game
S0189	it be a good game
S0192	yeah so be it arcade we're play
S0189	no it's team battle
S0192	cool but now we have a team
S0189	oh no actually yeah it's not that go back
S0192	it's just arcade isn't it
S0189	yeah
S0192	pretty sure
S0189	oh wait no it should be versus why be i not a player
S0192	no i dunno can you press start to come in do you have a start button
S0189	i think the game's run too quick
S0192	yeah it do seem to be duh duh duh duh duh yeah
S0189	what's go here let's quit out of that it's not pick me up somehow maybe cos it's not a four player game it's not pick up player four
S0192	no be you player four then
S0189	yeah
S0192	put it as player two
S0192	why's your clock wrong on your computer
S0189	it's just on windows some reason it's wrong
S0192	you're not player more you need to put player two don't you put it as the keyboard what game do you say we could play like one player be there something we could take turn on
S0189	dunno erm
S0192	it be erm that other game you be try to play wasn't it that wasn't work
S0189	yeah why the it go really weird i dunno what cause that let's see if it's fix now
S0192	do not touch the memory card do you remember this little door
S0189	yeah that be cool
S0192	slot em in do you remember that game on the n sixty four erm where you do like wrestle move hybrid heaven or something
S0189	oh yeah
S0192	i really like that game
S0189	that be it didn't get very good review
S0192	okay it didn't but like
S0189	yeah but like you have the power
S0192	yeah
S0189	it be a really weird game
S0192	you could like power up bits of your body couldn't you
S0189	yeah
S0192	you have to run around this weird sci fi institute it be a bite strange
S0189	yeah but like you be get shoot no for some reason there be no gun or anything like they just
S0192	oh yeah
S0189	just fight with their body
S0192	do they have these weird like mutants and stuff
S0189	yeah
S0192	oh you in
S0189	yeah
S0192	i don't remember this game at all i don't remember ever be very good be that bane down there look ridiculous the
S0189	you've always get female character whose boob jiggle like this
S0192	yeah
S0189	yeah
S0192	that's why you boys love it isn't it
S0189	look at this one
S0192	go for that then that's how they sell these game anyway
S0189	i might as well be her oh no not that one go back no
S0192	oh no
S0189	go back go back there we go
S0192	there you go that's better isn't it how do we choose the just randomise i'm definitely not gonna win this this be the same game that i have
S0189	yeah
S0192	exactly the same i didn't know you like this game that much
S0189	yeah it be cool
S0192	i always like erm
S0189	god i don't know
S0192	ah what's block think be that it
S0189	what's that block
S0192	how do you walk like that so you kinda dodge it
S0189	oh just down or up
S0192	yeah
S0189	yes you've catch some crazy shit
S0192	i'm about to die you can me how be i mean to beat that i be too distract they look like they're in cambodia or angkor wat or something to you
S0189	yeah do look a bite like that doesn't it
S0192	yeah
S0189	quite cool
S0192	right i need to do better than this be there no jump on this thing
S0189	don't think so
S0192	i remember this game they don't really have many special move it's not like you know shoot a fireball or do anything
S0189	no not like magical move like that
S0192	no i always like mortal kombat for that kinda stuff
S0189	yeah you do get some though she's get this whip
S0192	i don't seem to be able to do anything
S0192	i don't ever remember play very well at this game
S0189	her outfit be just outrageous
S0192	yeah it really be
S0192	why be that allow
S0189	i don't know you challenger will fight
S0192	you challenger oh it's just me again how do you change their outfit
S0189	i don't know what button it be for you
S0192	mm duh duh duh
S0189	this guy be always freaky do you remember him
S0192	yeah he be pretty weird
S0189	creepy as fuck
S0192	what be he wear then
S0189	some gimp suit
S0192	he's scorpius out of farscape
S0189	yeah
S0192	bite strange
S0189	i use to play this guy cos he's just retard and hilarious
S0192	yeah
S0189	he like attack on his back and stuff
S0192	yeah he fall over doesn't he
S0189	yeah
S0192	it's weird be he mean to be a snake or something
S0189	he do a moonwalk and doesn't even go anywhere
S0192	go on then show me that
S0189	i've get whole new
S0192	it's alright i'm
S0192	what the hell be that bite of a strange character now i'm finally kick some ass take this yeah it's get a button mash on this one i think super smash brothers be nice and simple as well isn't it it's just the up and b down and b leave and b do it work if you that woah like double button on this thing
S0189	there be load of combos some of them be really hard i don't wanna lose
S0192	ah i didn't think you be gonna
S0192	what's that little dance he do
S0189	you'll see it there
S0192	who come up with that character for why be it always that they never stay on the grind properly
S0189	er look at him he's fuck he's hover that's really weird
S0192	you always go through the grind don't you come down where i can get to you hell kinda move be that
S0189	there may be some of this hang on oh
S0192	yeah ah new challenger every time why's that happen
S0189	don't know maybe cos i press start
S0192	who's this guy raphael
S0192	what have you
S0189	i don't know it look retard
S0192	why do you like this game again
S0189	cos when you can actually both play the controllers it's quite competitive
S0192	yeah exterminate
S0189	this doesn't look like a fair fight look at them
S0192	no don't worry boff
S0189	i've get really short range weapons
S0192	yeah
S0189	this isn't fair pff she's tiny
S0192	maybe even when i kneel down i'm still the same size watch she's kill me though this guy's slow as fuck
S0192	ah terrible right win but now i'm gonna kick some butt range isn't the problem here he's too slow
S0189	oh a little bite look
S0192	oh that guy suck ball
S0189	it's too slow
S0192	he's lose his er she's nice and fast i be one with the wind
S0189	a new challenger
S0192	zelda a new zelda
S0189	yeah
S0192	be he actually zelda
S0189	it's zelda
S0192	what
S0189	that
S0192	what's he do in this game
S0189	cos it's on the nintendo console like i think with the xbox you have an xbox other character
S0192	oh
S0189	like for the playstation
S0192	didn't know that
S0189	playstation i think they get like erm
S0192	the guy from metal gear solid or something
S0189	yeah snake or whatever his name be
S0192	we get gay old link
S0189	yeah
S0192	so if he doesn't throw anything what's the point
S0189	he do
S0189	he's probably gonna drink some milk what's with her outfit where only her like her arse be show
S0192	yeah he i get his bow out a second ago but ah that's oh right yeah
S0189	that be good
S0192	about to die ah okay i'm gonna beat you this time that be terrible oh already don't really understand how to get my bow out there seem to be a different button every time come on link you're a superhero dude cassandra's just get her bat out ah
S0192	i give up on this game i'm terrible at this one
S0189	i'm find this one easier to beat you at what the
S0192	what what happen there
S0189	don't know
S0192	this woman here well she's get a bite of a mound on her
S0189	woah
S0192	be she good
S0189	yeah she's gonna kick my arse i dunno what i'm do
S0192	no
S0189	die bitch
S0192	look at that mound in between her legs
S0189	i know why do they do this to the character
S0192	i don't know cos that's what boys like
S0192	wobbly boob even if they're just pixels
S0189	they do wobble quite well
S0192	i know that's probably the first thing they put a lot of effort into make it realistic wobble
S0189	probably get like sixty percent of the pixel count be probably on boob
S0192	yeah don't doubt it what other game do you have apart form this
S0189	not many that be cool
S0192	not just on the emulator but just in general
S0189	i don't have that many game any more
S0192	do you not
S0189	no
S0192	that suck
S0189	still get that i'll try that planetside game again
S0192	yeah you don't have counter strike
S0189	yeah yeah what be go on how have i end up have to fight a bunch of people
S0192	i don't know
S0189	what the fuck
S0192	skip it
S0189	i haven't really get any other good game i can try the planetside one again see how it go
S0192	yeah give it a try be you gonna be able to figure out what be wrong with that
S0189	i don't think anything be wrong with it on my side just maybe the game say that it be down
S0192	be you try to connect with the server
S0189	yeah a problem
S0192	lovely
S0189	why do you do that
S0192	wasn't me know it
S0192	what game would you just be play now then would you just be play doi or whatever it be
S0189	yeah i'd probably be play that
S0192	it's not much fun to watch though
S0189	no
S0189	it's er
S0192	do they ever release a battlestar galactica game
S0189	oh look it's work
S0192	awesome this be a take it in turn game i take it then
S0189	yeah it's not so easy to play i always get my arse kick
S0192	i'm gonna need more space for the mouse on this one
S0189	okay
S0192	and you're say let's play this game cos can't really play game
S0189	on this game there's four continents
S0192	mm
S0189	two of them be lock at the moment but they're like completely different like this one's all icy this one's like a jungle like a rainforest and this one's like a like a desert er don't see much fight happen here not anyway
S0192	well
S0192	it's like turok or something
S0189	yeah it be a bite like turok in here but like this tiny point be where i be
S0192	yeah the map's pretty big then
S0189	yeah and there's usually people fly but there's not many people here just oh there's much more go here
S0192	yeah there's a lot more in this one
S0189	oh i there but first i dunno where the fuck i be you get a bunch of gun i've get a this assault rifle and it's get an underslung grenade launcher on the bottom
S0192	oh nice do this game get good review
S0189	yeah it's quite good it's free i get a pistol
S0192	it's free
S0189	yeah i've get a repair gun to repair i've get some landmines i've get oh that's stick
S0192	sorry
S0189	i've get a portable rocket launcher which be like a battle one
S0192	oh holy shit
S0189	this bit's really awesome
S0192	and then you can fire it oh no way
S0189	yeah it's really hard to hit people with though
S0192	oh i bet
S0189	and i've get some ammo that's one of the class and you can all your weapons and stuff you can customise so like i've get my own attachments on here
S0192	oh that's cool
S0189	on the rail grenade launcher
S0192	load of them
S0189	different sight and stuff
S0192	oh
S0189	and er that's just for that one gun
S0192	you've get the set up you like there
S0189	there's tons of different gun so there's infiltrators which can go invisible light assault which have a jet pack which can resurrect people
S0192	mm
S0189	engineer which can place shield and gun and shit heavy assault which you've get rocket launchers and big gun and then a max which be like a tank that's pretty cool and then you get all vehicles and shit but i don't wanna be here
S0192	no
S0189	so i'm go to
S0192	you can get vehicles as well
S0189	redeploy
S0192	this game do look cool
S0189	yeah it's really hard to play though i'm redeploy right so
S0192	right let's get to where the action be there's a lot of fire here
S0189	indar here we be deploy
S0192	these map be humongous
S0189	yeah they're quite big now deploy no i think i need to go to hossin first
S0192	where's that
S0189	and at every oh i've get a sniper rifle now
S0192	ooh
S0189	yeah so that's the infiltrator so you can go invisible
S0192	that's cool
S0189	that's look a bite bug there why's it blue er i prefer engineer
S0192	he can fix things and stuff
S0189	yeah ah that's cool i haven't see that before
S0192	what
S0189	it's the portable shield
S0192	do they keep get new staff then for the gear
S0189	yeah this be in a giant bubble here
S0192	the whole world
S0189	not the whole world but this part be call the warp gate and it's we've get one the enemy team have get one and the other enemy team have get one
S0192	oh cool
S0189	so it's like a safe zone but i don't wanna be here so i'm gonna go to
S0192	how many people can you get on one map
S0189	hundreds oh right there's a queue okay well i'll show you some
S0192	the continent be full so this be a bite like that battle something game
S0189	yeah it kind of be so you get land vehicles which you can buy with point these they slowly regenerate depend on how well your team be do
S0192	yeah
S0189	a tank a bigger tank it's pretty cool and you can like
S0192	it's massive
S0189	customise all the weapons
S0192	weapons
S0189	erm and then aircraft the i fly around in an aircraft
S0192	cos you have to go and get all these little
S0189	yeah so this
S0192	that that look cool
S0189	this be the big transport for the galaxy which be from this one this be huge
S0192	yeah
S0189	i'm get a little fighter and then each faction each of the three have get different like vehicles and stuff so this be
S0192	oh you're straight in one
S0189	yeah
S0192	it's really hard to see
S0189	well feel like my game be bug where's my hud i cannot see
S0192	do you say your hud head up display
S0189	yeah like where's all this information okay oh well i'll fly around these things be quite difficult not to crash in
S0192	yeah they look a bite difficult to manoeuvre there's quite a few tree in the way as well it's cool how big the map be
S0189	yeah
S0192	so where be you head how do you know which way to go
S0189	ah right well i need to have a look at the map i should probably land somewhere woah
S0192	be it quite difficult to land
S0189	yeah woah woah woah woah woah
S0189	there we go alright so i'll go and do some fight i'm currently here
S0192	so where be we now
S0189	i'm there
S0192	oh
S0189	so i'll go up here think someone's try to take that or maybe i'll go and fight them
S0192	yeah
S0189	that's probably more interest than fight them cos it's like a waypoint area which be now
S0192	over there
S0189	no here should be there we be but it's like a challenge to try and go under the tree it's impossible
S0192	very misty this map
S0189	yeah ah
S0192	oh you're do pretty good i'd have definitely crash by now can you do it by go over the tree
S0189	yeah i could but where's the fun in that
S0192	could just choose the just choose
S0189	if i go over the tree
S0192	woah
S0189	woah i won't see a thing will i
S0192	er
S0189	woah
S0189	i don't have very good gun for this
S0192	no
S0189	just one main gun which be impossible to hit anyone with
S0192	can you just jump out of it now you're in it er
S0189	you could yeah
S0192	okay
S0189	i don't really want to cos i don't get too many of these oh woah my
S0189	no
S0192	oh you're burn out
S0192	seriously no good didn't even make it to fight those people
S0189	no i'm bad well i'm gonna have to be back where i start i'm gonna get a sniper rifle
S0192	suppose you get part of it there
S0189	yeah so it should be fine go down here
S0192	how good's the sniper on this thing
S0189	pretty good well i've get like a basic oh shit basic sniper rifle it's like
S0192	be it fairly easy to kill people with this
S0189	if i hit them in the head they're dead in one if i hit them in the body it's in two
S0192	two
S0189	there's no good vantage point here this be not a good idea
S0192	choose a different weapon
S0189	yeah
