S0517	ah what be you do down there mister what be you do be you kick those legs be you smile be you smile be you smile at the turtle he play for a long time doesn't he mm yes can you reach him can you reach look at this one too fish oh my goodness you're learn french can you say say i can't say fish yet let alone mm what's this one oh you do look sleepy you do you do
S0525	i try facetiming mum and the other night
S0517	oh i be
S0525	and i i didn't
S0517	i be
S0525	i didn't but i get them the i miss the call er last night i think while we be out in the restaurant
S0517	i speak to mum the other thursday it be
S0525	oh yeah come on then
S0517	but cos i go erm i go to the flat on thursday
S0525	sorry you go to
S0517	i go to her flat on thursday
S0525	right
S0517	so i email her and just tell her what be happen
S0525	yeah
S0517	and then i be just cook tea for the boys it be only it be only about quarter past five in the even and and an email come in and it be from mum so which be like half six in the morning there
S0525	oh right
S0517	so i think blimey she's up early so i just facetimed her cos i think she like she'll be in bed won't she
S0525	oh okay
S0517	so i facetimed her and she answer
S0525	when be that thursday
S0517	so thursday night quarter past five our time so friday morning their time
S0525	be she go out cos i phone her at the equivalent of about quarter past nine in the morning and i think it be the same night
S0517	on no they weren't go out but the day before
S0525	oh maybe it be the day before then
S0517	they'd get up really early to go and watch the sun rise cos it's thirty degrees out there at the moment
S0525	oh wow
S0517	and she say
S0525	i bet it be the day before then
S0517	they get up really early to to go and watch the sun rise and i think she be just awake early again cos of course it's night isn't it
S0525	mm
S0517	so i speak to her briefly then and yeah the nothing much to report she's have a nice time but it's very hot but i go back today because when i open the cupboard for the you know where all the bird seed be
S0525	yeah
S0517	like that there be a carrier bag but it be shred and you know that paper that she's get down just in case
S0517	there's that leak at the back that be shred and i think
S0525	oh
S0517	what would you think
S0525	a a mouse
S0517	a mouse that's what i think and like inside the the be you dribble again inside the bag of
S0525	oh
S0517	she's get the seed oh he's all dribbly let's
S0525	there's muslins there
S0517	oh there it be inside the bag of seed
S0525	yeah
S0517	you know
S0525	put a clean bib on him
S0517	the seed she's get well i think so
S0525	yeah go on then
S0517	the seed that she's use be in a tupperware but then er after that she's get a big bag that's just in a carrier bag and i think it be that anyway there be no mouse droppings but there be there be shred bits of carrier bag inside the bag of seed
S0525	oh really oh it's all wet there
S0517	no he's not too bad i just felt under his chin you put this on in case you keep dribble little man mm yeah so i do tell her i wasn't gonna tell her
S0525	yeah
S0517	but i be talk to her on the facetime that day
S0525	there
S0517	and erm
S0525	and so you say yeah
S0517	so i say oh it's just but she say oh it's not that cos you know she'd see that rat outside her house
S0525	oh yes oh yes
S0517	i say it's not mum i say it er i say and also in that cupboard you've get a whole stack of paper
S0525	yeah
S0517	none of that be shred you've get a whole thing of toilet roll all that be intact
S0525	so what what be
S0517	and say i can't quite decide it
S0525	mm
S0517	be almost like maybe a mouse have come maybe it think oh seed's not for me and and hadn't bother but
S0517	but i go back today with a tin
S0525	batteries be go on that aren't they
S0517	oh yeah they be be i go with a tin to put the bag of seed in so it can't get into the tin
S0525	oh okay
S0517	so there's a tupperware there's a tin and i've sweep it all up and there again there be no mouse droppings and it didn't look any different to how it have look
S0525	oh alright then
S0517	on thursday so i think she's okay
S0525	it's alright
S0517	but i just
S0525	never solve the mystery of the er miss christmas card then
S0517	er no they weren't go she won't have throw them
S0525	who won't have
S0525	well where's she put them then
S0517	i don't know
S0525	you you wouldn't even take them
S0517	no you wouldn't i don't know
S0517	those anyway i didn't solve but everything else be fine
S0525	who know eh
S0517	she have a message on her machine again it be somebody at the bowl club can you ring me when you get in i think well he'll be wait a bite
S0525	yes
S0517	so that's why i have to go again today just in case there be a mouse
S0525	oh right
S0517	i be a little bite wary to open the cupboard but it be fine it be nothing
S0525	and have tell her about er the latest death from the church then cos she
S0517	yes
S0525	it wasn't till the wednesday morning actually he die cos put it on facebook cos have tell her it be a
S0517	oh okay
S0525	monday or something
S0517	right say he die
S0525	he
S0517	in his sleep
S0525	yeah yeah well it i think it be it be and and they be on some sort of group email because they be try to book another date to go walk
S0517	oh
S0525	and they and then come back with this news and say that so tell me i think well i will mention to mum at some point and then erm
S0517	but have already tell her
S0525	er and then do put a post on facebook so i just put a comment to that you know just sorry about the news and all that
S0517	how old be he
S0525	dunno oh he be well into his eighties
S0517	be he
S0525	erm must have be i mean 's in his fifties
S0517	oh oh he must be
S0525	shall we turn
S0517	what
S0525	this turtle off i think he's lose the will to live isn't he
S0517	he be we all will be much more of that oh there we go yeah be that better oh well that be his
S0525	it's funny he's lose his batteries isn't he
S0517	what about this one look
S0525	he's lose his batteries
S0517	what about this
S0525	he's get little scratch mitts anyway now he just lose them i think i leave a couple
S0525	in your coat over here shall we have a look pick them up
S0517	do he he doesn't look like he's get any scratch on
S0525	no well
S0517	and he's not wear them
S0525	she cut his nail in the day so i've leave them off him today well i i
S0517	oh okay
S0525	since i leave them behind in his coat to be honest here they be here they be
S0517	oh look
S0525	that's why we we be struggle to put your coat on weren't we cos you be
S0517	when your mum get home what do you think she's gonna make of nanny eh do you think she's do a good job or be mummy gonna say
S0525	well as long as you're happy and smile look we've get three scratch mitts here so that's an odd number then we've get one that doesn't match anything and then we've get two blue ones so i don't know what we've do with it
S0517	be he still sleep well at night
S0525	oh here's another white one erm yes cos she's she's keep him awake more in the day and he's do ever so well today and he hasn't be asleep at all hardly
S0517	well this be the problem though cos it's only half past three he'll probably fall asleep at like five o'clock and then he won't go to sleep
S0525	she let him have an hour then and that's it
S0517	oh do she
S0525	yeah and wake him up
S0517	then and then wake him up
S0525	and then she's do him his bath and but he's go down at about eight o'clock in the even
S0517	oh brilliant
S0525	but he sleep till about four four thirty
S0517	right
S0525	but she be keep him awake till sort of ten and he be wake up at twelve cos she say and it be all a bite at twelve
S0517	oh
S0525	and then two and then
S0517	so she they may as well have a bite of an even if they
S0525	yeah
S0517	just have a couple of hours
S0525	so she's do eight o'clock now and she say he's absolutely shatter by the time it come to his bath and that and he's fall asleep
S0517	ah
S0525	on his bottle and he stay asleep till
S0517	four
S0525	yeah but she's not
S0517	oh it's a
S0525	i don't think she she do fee him then yes yeah cos he start wake up in the night and so she be just try to water and
S0517	and do they still
S0525	dummy and
S0517	be it still six months before you're suppose to put them on solids cos it change didn't it
S0525	they say that but i don't think she's gonna leave him that long she be in the erm clinic the other day i think probably the weigh clinic and er
S0517	oh
S0525	there we go again
S0517	oh shall we sit you up what be go on with that milk
S0525	come out there isn't it
S0517	it be whoop
S0525	and there be erm there
S0517	have you get a bite of wind shall burp you how about that
S0525	shall we have er some smile instead eh
S0525	oh
S0517	what
S0525	what what what what what what treacle what
S0517	oh gosh his head's really strong now compare to last time i be hold him
S0525	i know you be a strong boy you be a strong boy
S0517	so cos he's er he's not three
S0525	i think you just
S0517	he's not three months yet be he so erm
S0525	you no you're not and you're nearly giggle aren't you you so want to giggle
S0525	you so want to giggle you're not quite there be you what's auntie do to you little one so you didn't want to be burp do you
S0517	oh well you're still dribble now
S0525	hey
S0517	do you want to lie back down on there you be so
S0525	where
S0517	there you be quite happy
S0517	shall we put you to look at a different way how about that
S0525	oh
S0517	what do you think
S0525	when you talk to me and i'll smile at you
S0517	will you will you smile
S0525	i'll smile a lot
S0517	will you smile
S0525	i be so
S0517	he will as well aren't you a clever boy
S0525	be you happy there look at you settle down again
S0517	aren't you a clever boy
S0517	hey
S0525	he say you're all ignore me you've turn my turtle off and nobody's talk to me
S0517	oh look
S0525	what's that what's that yeah they've go to see the revenant which i think be quite a violent and horrible film i didn't know
S0517	well it's that's the one with the bear isn't it
S0525	the bear
S0517	it's
S0525	leonardo di caprio's in it
S0517	yes
S0525	get a bear in it as well oh
S0517	yes er yeah and i think it's quite
S0517	desolate and bleak
S0525	yeah yeah
S0517	and and horrid want to see it i wasn't so keen
S0525	i think er
S0517	we go
S0525	go to see it with his friends he enjoy it
S0517	do he like it
S0525	yeah but he tell me i wouldn't like it i say i didn't i've get no intention of watch it
S0517	no want to see it we go to see creed you know the er rocky film
S0525	oh be it
S0517	last weekend
S0525	oh be it any good would have like that
S0517	we tell him we be go do you know we have lunch with him last erm sunday
S0525	oh yeah yeah
S0517	well lunch we be just in greggs
S0517	erm he would have like it no it be alright actually it be alright
S0525	i think i'd take go with him to see the dad's army one he want to see that
S0517	oh okay
S0525	and i saw the danish girl
S0517	be that any good
S0525	yes it be we enjoy it yeah saw it er for the red carpet in
S0517	oh in
S0517	sorry
S0525	yeah
S0517	still haven't be to the cinema there
S0525	well it's nice but it's it's they're small screen want to go and he like because it's big screen you know
S0517	yeah
S0525	it be a smaller i think one the big cinema take a hundred people and the small one take fifty
S0517	right
S0525	so
S0517	so it's
S0525	they're not erm but they i think it's nice the seat be comfy and
S0517	yeah
S0525	yes and
S0517	what er you know er compare with his toy you're watch my necklace dangle instead aren't you
S0525	oh be that what you're look at eh
S0517	you watch that we could hypnotise you the way that's swing like that couldn't we
S0525	i think he leave that much of his milk before didn't he up there so
S0517	he do yeah
S0525	leave about see
S0517	be you a bite full today
S0525	so you've oh you've leave two ounces in it oh have you leave three oh no he's a bite fussy you can't tell with
S0517	maybe you're not grow today
S0525	you've probably have a good five ounces didn't you yeah you probably
S0517	yeah
S0525	and too you'll want another one about five o'clock i think i've get one sterilise bottle leave that i haven't mess up
S0517	oh no i
S0525	if we get desperate
S0517	and then and then do we have to get onto wash wash up and re sterilise
S0525	no because that'll be mummy's job when she's home she'll need something to do
S0517	be they go to yours for tea no stop here
S0525	no tomorrow they're come to me i've get a casserole in cos and be come for tea
S0517	oh okay
S0525	yes
S0525	haven't we
S0525	i haven't buy anything for tomorrow yet but i'll go out and do that
S0517	go shop today this morning so who know
S0525	you'll have a fridge full you'll have load of stuff
S0517	we will have a fridge full and a big debt
S0525	mm
S0517	he's so excite about ski
S0525	oh be he
S0517	have book his do you ask him
S0525	no he hasn't as far as i know
S0517	well you're run out of time it's three weeks today
S0525	i know i've tell him i know
S0517	three weeks today
S0525	his mother's constantly on the phone about stuff so
S0517	oh be she
S0525	oh it do my head in she do
S0517	oh dear
S0525	yeah i mean she phone with things like have try to call on his mobile i i don't know do he leave you a message no but it's a number i don't recognise so it must be 's mobile i say well why have you tell him about our phone call we have ten minutes ago i say no i haven't because i haven't see him yet and i tell you he's busy today
S0517	oh no
S0525	he can't come round so it's just constant
S0517	just she just want someone to talk to cos she get no sense out of do she
S0525	i'm gonna stop answer the phone again i know but i it's she do my head in
S0517	oh what a shame
S0525	er and he just in yesterday from cos we be out in then we'd be to meet for lunch then we'd come back here and i'd get home and oh
S0517	so what be her phone call that they'd have
S0525	who'd have
S0525	oh i don't know
S0517	oh i see
S0525	haven't get to the bottom of that i couldn't care less
S0517	oh yeah
S0525	say it wasn't him when he come in
S0517	oh
S0525	she's fill out all the form for the attendance allowance finally she didn't want to do it
S0517	oh for oh for
S0525	mm
S0517	oh okay
S0525	cos she wasn't go to do it because she's not go to give away personal information and say well it's not mean test you haven't get to tell them any of your assets oh they want my national insurance number why do they want that i'm not give them that they could find out all sort of things about me if i give them that i say it's to make sure you're not some polish immigrant that's only be here for
S0517	yeah i know
S0525	two months i mean you've pay up you've be here all of your life you're entitle to it mm and then it be a case of well no because if know cos i have to put down that i'm a carer and if know that i'm be pay he'll insist on far more things be do and he's gonna get really difficult with me if he think i'm be pay for make his dinner
S0525	so i say well don't tell him oh just it's just anyway she's
S0517	he's get dementia he's gonna do be irrational as it be
S0525	then the doctor tell her she's not entitle to it i say oh well
S0517	oh why
S0525	i don't know he say well you'll you'll be lucky so i don't know
S0517	oh god
S0525	so she's fill out the form she want to look at it before she send it off i say okay
S0517	oh dear
S0525	so he be gonna go i dunno when he's go round
S0517	yeah
S0525	cos he's i say he's work that be yesterday and then we're out for that meal
S0517	okay yeah
S0525	i say and then he's work today and he's suppose to be finish decorate my bedroom and he's paint it cos i'm
S0517	oh he say you be do that yes yeah
S0525	erm so and he's just to paint that for me
S0517	my bedroom do you mean our bedroom
S0525	our bedroom
S0517	you're still let him in it
S0525	yeah paint my bedroom for me well he have a small area
S0525	i've start with my en suite cos i'm the only one that use the en suite and that's the bite he's do at the moment
S0517	be nanny mean to your pop be nanny mean to your pop
S0525	he's he re grout he start by re grout the shower which wasn't really on my list of things to do but he say oh i'll re grout that i say oh we
S0517	oh
S0525	thank you
S0517	need ours re grout 's rubbish at that job
S0525	yeah well don't ask my husband i say erm
S0517	oh
S0525	okay well that's it look nice thank you i say presumably you want me to leave it for a few days before i have a shower no no he say it dry in two or three hours so
S0517	oh wow
S0525	so the follow day i go in and all the run out the run out the
S0525	so er i don't think so oh oh maybe it say two to three days and i say do you have your glass on oh
S0517	oh
S0525	no
S0517	that doesn't dry in two
S0525	no of course he doesn't
S0525	so he read the thing again and it it say it do say two to three hours
S0517	oh
S0525	but then a bite further if use in a shower allow twenty four
S0517	well
S0525	hours
S0517	what as oppose to a bath where it doesn't actually maybe get wet around the top
S0525	okay so i say alright then
S0517	maybe yeah
S0525	so he grout again and then i use the shower in the bathroom
S0517	yeah
S0525	and then another day on it say yeah yeah it'll fine to use so i use it and all the grout come out
S0517	oh no
S0525	and i've use it every day since and all it's do be be grout go everywhere he say oh it doesn't really matter because it's quite old i could get some more grout i say why be you even bother why don't you just get on with the job i ask to do which be repaint
S0525	can we just leave the grout alone now so i just come out cover in grout
S0517	oh no
S0517	well that's good exfoliation i expect
S0525	oh
S0517	rub it all over your body
S0525	it's crazy cos it's this chunky
S0517	yeah good exfoliation come out the wall yes
S0525	so er yeah
S0525	so if you need anything re grout i i wouldn't ask my husband
S0517	no alright then well mm
S0525	he's gonna put a new wooden floor down in there for me and then get a blind to fit and he's paint
S0517	oh okay
S0525	but he be gonna paint
S0517	why doesn't he use that one then
S0525	the bedroom he never have it's always be mine
S0517	oh
S0525	cos it's full of my stuff and it's nice it's just my room
S0517	oh
S0525	it's so nice
S0517	oh
S0525	i would never go back to share a bathroom with him
S0517	oh
S0525	oh no
S0525	it's nice to have your own isn't it
S0517	well i suppose so
S0525	your own toilet nobody else use it
S0517	yeah i suppose so
S0525	he clean it all for me
S0517	oh well there we go then
S0525	doesn't go in it
S0517	he's a saint isn't he
S0525	and they've get the other one haven't they er all and then say oh so you're use like mine and 's shower i say
S0517	oh
S0525	don't you even and she just laugh at me and she go oh it's so easy to get to you
S0525	yours and 's shower
S0517	ah
S0525	oh she say i'm not sure if you're allow in there to use our shower cheeky
S0517	do she let her dad use her shower
S0525	i think he go in the bath at about midnight when nobody's around and he only put half an inch of water in
S0517	ah
S0525	he use his bar of soap to wash his hair and everything
S0517	poor old grandad eh
S0525	oh i must erm check the time of the flight because 's gonna take us hopefully to the airport
S0517	oh er i'd love to do erm now i can't remember what it be
S0525	you get at taxi or
S0517	no we're gonna park
S0525	oh yes of course you be cos it wasn't much be it
S0517	it wasn't much it be forty something for the meet and greet which we like
S0525	yes
S0517	it's only
S0525	i know
S0517	mm mind you but 's go to amsterdam tomorrow with his boss
S0525	be he
S0517	for yes for i dunno just for one night
S0525	yeah
S0517	so they've book him a flight and airport park and his airport park be fifty something quid i say
S0525	oh ridiculous
S0517	we're go for a week in half term and meet and greet's less than that
S0525	yeah
S0517	i dunno what they've book for you
S0525	
S0517	so if it's right on the doorstep
S0525	airport
S0517	er yes airport
S0525	they've just book the most expensive
S0517	i know ridiculous anyway
S0525	they've they've probably book the short stay carpark for overnight
S0517	probably
S0525	or something stupid like that
S0517	so he's go he's he's gotta be up at five gotta be at the airport at six or something stupid
S0525	right
S0517	he's be give the itinerary so he's get to be up at er and he want to be up and out really at five o'clock or just after
S0525	yeah
S0517	and then he say on the itinerary we're not have dinner till eight o'clock at night i mean how i say oh you'll be shatter
S0525	well they're an hour ahead as well
S0517	i know that's what i say
S0525	so
S0517	seven
S0525	yeah not too bad
S0517	i say i'd have need about five meals by then
S0525	yeah pop out your snack yeah
S0517	and then they're not home till half nine on i think they land at half nine on wednesday and then he's go to on on sorry on tuesday he's go to on wednesday
S0525	mm
S0517	for goodness' sake
S0525	so it's so that's monday tuesday and then straight out
S0517	yeah yeah and then he's have thursday friday at home
S0525	right
S0517	ridiculous ridiculous
S0517	yes
S0525	so he's look forward to er ski them be he
S0517	oh very much so
S0525	check the snow of course
S0517	oh daily
S0525	what time's the flight then you say you'd look and then
S0517	i do look and now i can't remember
S0525	you can't no
S0517	but i know that we're not gonna get to the hotel till really it's like a a three hour transfer
S0525	what it's not a three hour how many hours that because accord to it's only like forty five minutes away
S0517	from sofia airport
S0525	do you know we'd probably cheaper have a taxi oh but there's the also isn't there
S0517	it's two it's two hours forty five minutes i think that the transfer be
S0525	well tell me wasn't that far er er bansko wasn't far from sofia
S0517	that's what it say on the thing so and i don't think
S0525	oh
S0517	i know
S0525	three hours on a coach
S0517	yeah
S0525	it's a three hour flight as well isn't it
S0517	yes so we're not gonna be there till get on for midnight they're two hours ahead aren't they
S0525	yeah
S0517	so it would be ten o'clock so it would be seven o'clock
S0525	yeah
S0517	so the flight would be be the flight about half past two or something
S0525	yeah i don't think it'll be too late
S0517	half past two half past three half past four half past five so that would be half seven already
S0525	yeah
S0517	so i'm allow half an hour for luggage and eight nine maybe eleven o'clock it's gonna be quite late when we get back
S0525	oh for well i i i can get up any time of the follow day
S0517	you can
S0525	i'm not gonna be rush to get ski stuff
S0517	yes we'll all be get on our ski and go all my goodness
S0525	i'll be er i need some book actually i need book
S0517	but apparently it's really really busy
S0525	what's busy
S0517	er or it will be in half term there'll be like queue for the lift and stuff
S0525	well you know that
S0517	you get that anyway
S0525	you be gonna
S0517	yeah
S0525	that anyway in half term
S0517	yeah yeah
S0525	especially in a resort that's cheap like that
S0517	that's a lovely smile
S0525	he's no trouble be you
S0517	yes and that wasn't tire at all do i look tire now
S0517	no you don't you don't look a bite tire now
S0525	i be just full up and you be try to put more milk inside me crazy idea that be
S0517	have it go down now have it go down
S0525	it's go down
S0517	and and you've get time to smile
S0525	whatever's come up have come up and you're do isn't he yes he's do now
S0517	ah
S0525	he's just happy now so yeah anyway so only three weeks away
S0517	mm
S0525	oh i've not book the restaurant next week actually yeah
S0517	why not
S0525	shall i do it now
S0517	do it now
S0525	oh oh what time be it now half past three
S0517	yes
S0525	erm right i'm do then
S0517	what
S0525	be i book for there's how many of us be there eight
S0517	there's four of us and four of you
S0525	four of us and a baby
S0517	eight and a baby be you come out to tea next saturday night be you
S0525	oh now i bet i haven't get the
S0517	come to tea
S0525	now i didn't store the number i didn't store the number however do i will it be in my recents but it be a long time ago how about how far back do the recents go
S0517	do you not just google the number
S0525	well could do
S0517	you could do
S0525	then i always think that could be a while look back on the old log
S0517	yeah
S0525	oh no i can't that's be use but i
S0517	you could google it that would be as easy wouldn't it or we could just go up there it's just up the road it be master
S0525	yes it would be as easy to google it
S0517	it would
S0525	let's have a look won't be in mail
S0517	tell me
S0517	have you be swim yet
S0525	yeah
S0517	you have
S0525	be under the water and everything
S0517	do you like the water which swim pool be you in do do
S0525	yes
S0517	take him
S0525	yes
S0517	or both of them or
S0525	but they both go last sunday and think they're go again tomorrow they've ask if she want to go
S0517	oh auntie the fish yes auntie 's a good good swimmer
S0517	she be she's like a fish
S0525	ah
S0517	fish
S0525	yes
S0517	or as we're learn on this little
S0525	if you just go call from there do it charge you
S0517	i don't know well i wouldn't have think so would it don't know
S0525	don't know
S0517	so do you like swim do you have armbands and a rubber ring do you and then a little swim nappy do you
S0525	so it's next saturday and it's six thirty he do yes get a little oh have you see the photos do she
S0517	no
S0525	put it on the share
S0517	oh i haven't look on the ipad actually be it on the stream
S0525	have she put i i dunno what what stream be we on the same
S0517	no i didn't see haven't see the picture yet
S0525	be we on the same oh hello there could i book a table please for next saturday the thirtieth
S0525	erm six thirty
