S0327	call what
S0326	autumn leaf
S0327	autumn leaf how nice and romantic how's the other be you still friends with her
S0326	erm yeah i mean she email me the other week i write back
S0327	be she over over here
S0326	she's no she's in erm
S0327	she's in now
S0326	yeah at the at liberal sort of arts college
S0327	oh really
S0326	yeah
S0327	do what
S0326	liberal arts
S0327	what er what be liberal arts
S0326	liberal arts be an american humanities degree i tell her that she probably shouldn't go to that school erm in her email she say you you be right about my school it's kind of crap erm but i just write back say it doesn't matter what school you go to they're all kind of crap
S0327	they aren't you know be they all
S0326	well in to some er er some extent yeah they're not gonna
S0327	they weren't in my day
S0326	well i think they're all they're gonna be crap if you're er if
S0327	i'm mean you're not say be crap be you
S0326	no but it's not you know it's there's things about it that i'd rather that be er not perfect
S0327	like what
S0326	well like the the the the teach and er learn be not be not crap but the town be the the sort of the culture maybe of people there
S0327	the culture of what which people the teachers
S0326	for the the students
S0327	the students
S0326	yeah
S0327	oh well i mean there's nothing the the university can do about that
S0326	yeah i know yeah i know well er there be probably but you know there's
S0327	this be crème fraîche i think erm
S0326	but also i suppose er like if you we're and you've just spend a year be like a successful model then it'd be bore to go to school
S0327	but be a model be terribly bore
S0326	yeah but not she be quite like she wasn't it wasn't i don't think it be very bore for her cos she be work with all the best people and get to er you know they be photographers who be really artists and she didn't have to work that she be just do a few things for lot of money
S0327	lot of money but she have a brain it's a bite of a pity not to use it well maybe your standards be a little bite high or perhaps you're interest in a broader range of things than some of your peer group be do you think it's that
S0326	what be you talk about and i or
S0327	er no er
S0326	well maybe er i dunno i guess it's probably just like sort of the from the age of like fifteen er it be i like my life have be unusual compare to other people's my age
S0327	in what way because you've travel more
S0326	just because the because of grow up in in area in and have friends that be older
S0327	sorry it's a bite of ginger my god that's hot oh dear because of it be because of it be work class because of be racially mix
S0326	no because er no because erm cos of what that's go on there all sort of the interest thing's like er party that be erm the things to go to and the people to meet and then and then travel more
S0327	so do you do you think that most of them have more conventional background than you i suppose yes er you know your parent be not straightforward middle class work in a bank kind of parent erm be it partly class then
S0326	no
S0327	that you have a broader view of things
S0326	yeah probably i mean not like no one very few people go to school like i mean it's not most people who go to like sort of the people from they er tend to be from like
S0327	right and yet from what i understand about when you be there be that it be er er relatively old fashion value in term of discipline and so on
S0326	mm
S0327	cos i know when you know erm when i hear er complain about things well the discipline that he complain about be what be absolutely normal for my generation
S0326	yeah
S0327	you know and you walk down the corridor and you er in single file and there's no big deal and you just do that and
S0326	it's it's
S0327	and you weren't suppose to make a a noise in class and you weren't suppose to you didn't have mobiles to listen to in all those things
S0326	yeah no but
S0327	of course they can't teach now if if they're all if there's all that disruption
S0326	yeah but it be er it be a bite shit like if you forget your pencil and you have a teacher that didn't like you you'd get an you know you'd stay after school for an hour
S0327	right
S0326	that kind of thing that be a bite be what er annoy people i think
S0327	yeah so you well i mean as you know he's now a big deal he's a big cheese now
S0326	yeah
S0327	er and i've read people complain about him but i must say i rather admire him
S0326	yeah i think he be good
S0327	from you know from what i've hear he's er do he stand up for standards mm
S0326	he also put latin into
S0327	yep well i think you lot be incredibly lucky to go to at that period cos who be it be it either or or erm tell me that er you know it isn't so good anymore that now apparently there's some head teacher who's over the top disciplinarian
S0326	yeah that's erm er yeah i remember him he be here when i be there
S0327	be he
S0326	yeah i mean he be like he seem like a sort of sadist you know
S0327	oh really okay well you'll always get those you know wherever you be
S0326	i'm just gonna get some water would you like some
S0327	er no help yourself there's a glass a glass there
S0326	but whilst their their project er 's a bite more it's not not so coherent anymore because er because the school become a a famously a good school
S0327	yes
S0326	so people go er like wanna go there don't cause the same kind of problems as the kid that go there five years ago
S0327	oh really
S0326	well it's in the in the general gentrification like one of the reason why
S0327	yes of course
S0326	that whole area's be gentrified
S0327	yes
S0326	be cos there's good school there
S0327	that's right of course yep i know i mean i've hear this that in fact last time i saw your mum which be a very long time ago she be we go up for lunch up the road here and she say there be no restaurants like this anymore in she say that you have to sit down and have a menu now you know it be just a kebab place
S0326	mm
S0327	but a very nice one which be i find absolutely incredible it's happen so fast and all the house and
S0326	yeah all the erm turkish you have er sit down and have a menu and everything's like eleven pound
S0327	it's incredible
S0326	whereas er
S0327	you can get a perfectly good lunch for six pound
S0326	yeah i know i remember when we move there and we we eat in the turkish every night cos we didn't have a proper kitchen it be like you'd just sit down and er i think it be like four pound for
S0327	yes and all that's change gosh it happen fast i dunno where people live now i mean if they haven't get any money i think it's really really really difficult
S0326	they don't though they're i mean they're move more and more outside of
S0327	yes but
S0326	i don't particularly wanna live in after i like it seem too difficult and not worth it
S0327	i think it be difficult now for for
S0326	you can't live anywhere for er er that close for sort of less than six hundred pound a month
S0327	no i mean i'd miss
S0326	and like all all my friends who be thirty and er they none of them have their own place
S0327	oh
S0326	they all they're all live with their friends because they you you know no one can afford it
S0327	no the only way people can get somewhere to live be er be if their parent die and leave them somewhere to live and as your grandparents be still alive you can't really hold you breath for your parent to die just yet
S0326	yeah
S0327	how be your other granny by the way
S0326	as far as i know she's fine
S0327	er how old be she now
S0326	mm ninety five i think
S0327	that's pretty impressive well you may have a very long life ahead of you
S0326	yeah i wouldn't be i
S0327	even your dad be not that young anymore how old be your dad
S0326	sixty three
S0327	sixty three mm
S0326	yeah i wouldn't be surprise if live to be like a hundred and ten
S0327	er that's ask quite a lot
S0327	there be not very many people that make a hundred and ten
S0326	i know but it's just seem like she seem you know a machine
S0327	she be
S0327	although as my dear friend say the other day when i say something about die he say oh we'll have to shoot you
S0327	and your dad live still mostly in america
S0326	erm yeah he's in still
S0327	and why be you go to
S0326	erm i don't really know just
S0327	you don't know you just want to see it
S0326	just for the want to go somewhere
S0327	oh you're go together right
S0326	yeah we're fly to on christmas day and then stay there hang out there for a few days and then to
S0327	what's the climate in this time of year
S0326	it's hot
S0327	oh it'll be nice
S0326	it's it the country seem quite it kinda depend quite a lot on where you be
S0327	yes
S0326	but it's in it's like holiday season it's like good weather it's not the rainy season
S0327	and i don't know anything about actually be careful young men and young women in er you know it do sound as though it's an incredibly criminalise society don't take any risk
S0326	mm it's it's a dangerous country but also it's pretty it's relatively safe
S0327	i would quite like to go somewhere like not anymore but i would have like somewhere like peru erm mexican art doesn't er pre columbian art i like
S0326	yeah most of two of my favourite things in book be set in erm the er there's that book under the volcano
S0327	oh yes you've mention that before they'd obviously make a big impression on you
S0326	yeah i know i'm read it again now
S0327	be you i never manage it
S0326	er the fourth time so
S0327	really do you think i should try give it a try
S0326	i dunno it depend er it's like the slower you read it the better it be and like the more you read it cos you it's a it's like it's a complicate book and things you er won't won't notice even on like a third go erm there's a really good thing online a companion someone some sort of malcolm lowry fanatic have make it he's quite it's a really good document like basically every sort of line he have explain the reference or if they talk about a brand of cigarettes they're smoke in it'll have a picture
S0327	right
S0326	of the box of cigarettes
S0327	right
S0326	so it's nice er it's fun to read it with that go through with that to explain you can understand everything
S0327	yes i've get a in my book i've get a picture of cigarettes that my mother use to smoke erm i'll get you coffee mm page sixty one very proud of this actually because i
S0326	yeah it look nice
S0327	it's easy to read you know it's it's not it's quite it's about your various grandparents and things no great look i be
S0326	call pass cloud
S0327	yes they be call pass cloud and i be so that be the only one i could find the only packet i buy it for two pound fifty from ebay
S0327	and that be the only answer i have so i probably have the last
S0327	the last cover of pass cloud and then there's one that you i hope you'll find interest which be the
S0326	oh yeah the stamp
S0327	the stamp which i've get there
S0326	okay
S0327	erm shall i dedicate it to you
S0326	er why not
S0327	why not huh everybody else have my name and you can have
S0327	granny instead wrap yes well i need to go to even class in unwrap
S0327	i'm so exhaust didn't sleep well er last night i'm so tire and you' get a free bookmark with it
S0326	oh thank you
S0327	that's what you get if you buy them from the if you get them from amazon you don't get the free bookmark
S0326	what's on at the at the moment
S0327	well there be a kiefer you might be interest in you know kiefer
S0326	i don't think so
S0327	kiefer be this wildly successful er german artist erm rather wagnerian do i have a here absolutely massive work wouldn't fit in anywhere in this house
S0327	erm i have a lot of reservations i mean one cannot but admire what he do erm you know i mean that be something like thirty feet wide and er thirty twenty feet high or whatever have a look in here
S0326	and what erm what years
S0327	he's er he's alive now
S0326	he's alive now
S0327	he's just he's probably a bite younger than me
S0326	yeah it's the kind of thing people go for
S0327	they do i mean the thing be his studio apparently be about ten acres he have er all this amaze amount of space and erm i mean it be big beyond the whole thing be big beyond belief and he's er as he's so go for it erm one have to admire that it doesn't touch the heart with me erm it's too big it's too it's such the ego be
S0327	be almost impossible to understand actually erm i think it'd be worth your go if you want to go and you could go on a friday morning at nine o'clock i can probably always get you in free
S0326	yeah
S0327	er as a i don't er tomorrow in fact i've get to go into the if you could go to want to go tomorrow i'll be there most of the morning and i can leave a ticket or something
S0326	yeah maybe
S0327	let me know before i'm probably gonna be leave here at half past nine tomorrow morning cos i'm gonna work in the library there actually you might like to see their library
S0326	be it good be it
S0327	it be breathtaking it be and there's a wonderful librarian i mean a real scholar that i'm work with he's find all these marvellous book and print and work and i actually hold with my own hand the very last turner etch that he do it be fabulous erm i mean if you want tomorrow morning to meet we could arrange a time
S0326	yeah maybe i'll come i'd like to see er the library
S0327	and i can then take you in it open at ten we could meet at half past ten or something want to do that
S0326	yes yeah i'll just check what i i'm do tomorrow morning and tomorrow
S0327	alright i mean if you could only come later i mean i'll probably be there i if i go half past ten i'll be finish by twelve er you know then i could erm er even go round with you if i could bear to see the kiefer again
S0327	er there be also except you can't see them together there be a wonderful exhibition in the gallery of er moroni who's a sort of er slightly forget erm sixteenth century artist mostly portraits but psychologically so incisive and amaze erm so both those i mean the best thing would be for me to find a way of introduce you to there's this bloke call who arrange these things and then he can get you in any time erm otherwise officially friends be be suppose to get in for nothing only on a friday at nine o'clock
S0326	mm
S0327	but you know i can always do it if i can get hold of alright let me know about tomorrow morning er
S0326	i will
S0327	and i think what we could do be you come up to the library with me then you could go go across and see the the show erm cos you know it's er they do have the most the most wonderful collection
S0326	do they have nice sort of work table at
S0327	the yes i mean i'm sorry i i don't use it more there's a whole bunch of three or four of these artists who that come up in the seventies really but as you see it's get all that wagnerian stuff you know the and they're very physical there's a lot a lot of matter on them
S0326	yeah
S0327	do you manage all your would you like some more
S0326	there be a lot
S0327	you haven't do badly maybe i'll have to eat these myself later mm
S0326	do you know when be back from
S0327	yeah i believe saturday just talk yesterday she seem in quite good spirit which be nice well it'll be nice to see everybody together
S0326	yeah
S0327	erm i mean i'm do ham again and i say to and your mum would i expect you one of you to bring a pudding and your apparently your mum say oh well i've get some of last year's christmas pudding leave
S0327	say that sound like something would say if you want to describe a person
S0327	that he er he look rather like last year's christmas pudding
S0326	maybe will make a cake
S0327	oh
S0326	have you see erm picture of her cake
S0327	no
S0326	should probably show you them they look quite spectacular erm let me just find it just click on this it's easier to see
S0327	be she italian
S0326	no it's her business name
S0327	it's her business name bake a cake design i see that's very grand oh how wonderful hang on hang on hang on cake pear parsnip ginger and roast chestnut i want some
S0326	you should come to the bakery one day maybe
S0327	yeah oh blimey oh look at that one
S0326	that's a wreath
S0327	that's a wreath
S0326	yeah
S0326	this one's cool
S0327	er what's in it that doesn't say look like a yeah oh that's great be that edible
S0326	yeah it's all edible
S0327	gold leaf edible golf leaf
S0326	er something edible gold she do a lot of she's very interest in er erm in garden and flower and edible flower on her cake
S0327	do she go to school to learn this
S0326	no she's erm dunno how she learn it actually she never go to patisserie school or
S0327	that's a wreath as well beetroot parsnip and carrot cake spell and that sound really amaze oh look at the tarts so it's just a it's just a patisserie just a cake shop
S0326	erm yeah er they
S0327	doesn't they don't have anything else
S0326	they don't have bread
S0327	they don't have bread
S0326	they have coffee it's only open on sundays and
S0327	oh it's only open one day a week
S0326	and on in december it's open on wednesday's
S0327	right so she spend all week make them
S0326	well she doesn't really she have a lot of people who work for her now
S0327	do she
S0326	that she's train erm so she kind of just do things like she do a lot of sort of job for like for like fashion company
S0327	right
S0326	and stuff and like get them cake for their party she do a lot of time like go to meet to discuss what to do
S0327	yes
S0326	and then the other people do the the cook the bake
S0327	that's absolutely brilliant
S0326	and she write erm cookbooks
S0327	do she well er you have hit lucky be careful you don't get fat
S0326	i haven't really i don't eat much of them because i don't like cake that much
S0327	oh don't you oh i see
S0326	she make nice er sausage roll that i eat
S0327	okay now er come and see if you can give me a hand in er with the computer
S0326	sure
S0327	if you wouldn't mind it's just one of those little things have actually more or less show me how to do this but i'm not there's certain things i can't do let me quickly show you the the exhibition that i'm this be the idea of the exhibition erm it's go to be call measure for measure the nice thing about that title be nobody can criticise it
S0327	so this er none of this be to scale erm but it's just an approximation of in fact i have that's what i have to do to rescale things so we've get
S0326	and you'll be able to round up originals
S0327	well at at first i think because there's a new erm exhibition erm head of exhibitions call have you hear of him
S0326	no
S0327	he's a very clever sharp probably not very profound journalist art journalist and erm i want to show i want to get something really really great like piero's flagellation do you know piero's flagellation
S0326	no
S0327	which be arguably i mean all of these things be arguably the greatest paint in the world i think i've get a picture here which be in urbino i mean it's a small it's on panel and i say i say well that's what i'd really like and he say oh we'll be able to get that and he say if we don't we can go up the road to the gallery to get the baptism or er piero's baptism or something and i just think oh absolutely wonderous this
S0327	well of course it's all crap you can't you know
S0326	yeah
S0327	er and nor should you those those really great work shouldn't travel so what we've agree be that i will stick to the to draw so that nearly all these be in this country erm that which be such a wonderful erm image be at the louvre and i don't know it's look isn't that wonderful
S0326	yeah
S0327	it's just such a great draw you know so i'm draw attention to the geometry that that's the basis or erm triangle and the stretch outness of the body and so on erm that's and that's so here we've get the classics turner again i don't know if i'll get those two piero might not get those but i would like to get them and of course the thing be it's it's not like me get them have an institution like that behind you
S0326	yeah
S0327	of course be you know that's a whole different thing
S0326	and when and it would be the sort of inauguration of this new space
S0327	i it probably won't be the inauguration i mean it it be very very far ahead erm but it really have to be er they they can't go out to borrow the stuff until there's a good picture of what the exhibition's go to be about erm so so this be this be how it's look at the moment so what i want to do i haven't be able to er i can't remember now i want to get this up and i think i couldn't change the title let's have a look some illustrator
S0326	very secure
S0327	well i'll tell you something i have er all this stuff up here and all my passwords somebody say you can't do that you know anybody can come in and get them so i i put them all in the computer or something and then i lose them
S0327	so i think you know it's if somebody come and steal this it the whole thing will be such a disaster erm i just have to make sure nobody do if i can er wait a minute no i want two page two well that's in preview so i want to put it into illustrator get all the instructions here mm oh okay now if i want to move this i click on it and i can move it
S0326	mm
S0327	if i want to click on that and move it i can't why not
S0326	erm you see i don't use this program but i can probably figure it out
S0327	i'm sure you can
S0326	how do you make the box
S0327	ah you just click and drag it across
S0326	er so these be the instructions
S0327	yes look i've drag it across oh wait a minute i've get to click on that okay and then it should
S0327	it should move well it be move there so maybe
S0326	but not up and down
S0327	but not like that and i've not grasp layer oh it's go back to oh no wait a minute
S0326	mm
S0327	it's gotta be on t for type
S0326	erm why you what do you wanna do what exactly er you do you wanna do to that text
S0327	i would like to put it on that level there
S0326	yeah
S0327	i'd like to be able to move it where i want
S0326	then you just have to make sure you're on that to move it
S0327	i just have to make sure i'm on that
S0326	and if you wanna change the text
S0327	oh yes
S0326	then you'll be able you
S0327	then i just well you er that's solve it and i want to make this smaller and how do i keep it in proportion
S0326	erm you should have go from the corner
S0327	ah
S0326	so if you do apple z maybe it'll undo that
S0327	yeah probably wasn't right to begin with go from the corner that's right no it didn't do it it didn't
S0326	oh no it didn't erm you could
S0327	no i think what i have to do be there
S0326	yeah you can do it up there too
S0327	do i click it like that so it's fix
S0326	yeah it's fix
S0327	like that so then maybe
S0326	no then you do it from here you click er new
S0327	oh do i
S0326	i think so
S0327	ah okay so
S0326	as long as they're fix they should stay erm
S0327	yes okay so
S0326	they should move together yeah see they're they're move together
S0327	they're move together okay it's a pity the original be not right but okay that's very that's helpful let me just see if i can er then i can get i think i've get it
S0327	i think i've get it now this one let me just er i'm not sure what that be then click on that and then i put t for type and then and do a question mark okay i've get that now if i want erm the two page be ask too much for me i think if i want two page together erm
S0326	sit them side by side
S0327	yes have that
S0326	you
S0327	it's gonna come up in preview so i've gotta do it in illustrator as well haven't i
S0326	yeah if you drag it into
S0327	you drag it into illustrator i have learn a bite but i cannot hold it in my head
S0327	i cannot it's terrible okay okay so i can get this er now what do get serious with me cos i
S0327	keep click what have i do here
S0326	i dunno erm
S0326	i dunno what this this erm black screen be
S0327	it's suddenly save unsave so put that again into illustrator okay
S0326	so this be part of your proposal
S0327	yes er er i want to get this er so now i want to make sure i want to move this to the the whole thing now
S0326	you er need to hold it at the top on that grey bar
S0327	okay
S0326	maybe you i don't understand this
S0327	oh god just put it
S0326	click here double click
S0327	well what er it honestly it drive me barmy oh
S0327	erm so i'm but if i want to move the whole thing
S0326	the whole thing
S0327	apple why isn't it
S0326	where do you wanna move it to
S0327	to the leave here so
S0326	oh that's not to do with that that's just to do it like this erm although your computer's quite slow it's stick on that erm if you just
S0327	okay well i don't want to fiddle with it if it's if there's er any problem it's just so that i can then see the two side by side if you see what i mean
S0326	yeah that's what i'm do but i dunno why it er keep do this black thing
S0327	no nor do i oh i hate computers
S0326	these be in the way but if you see those two arrows
S0327	there there be two of them look there's there it be underneath
S0326	er
S0327	well let's get rid of that that okay we've get that go there and then that go there so i i want to sort of match them up in term of size yes i can do that so if i want to change i want to change ah that's not come up now now why can't i change that
S0326	erm mm what click on it where do you wanna you wanna move it
S0327	yes can't
S0326	it must be in er the
S0327	i think i'd better leave that one then i daren't
S0327	i daren't it's er you know save change don't save i'll just er work on this
S0326	yeah i think that one might be the file be be not in edit mode
S0327	be not not but it say editable pdf i'll i'll i'll sort that at some point i have notice every time somebody else do something of course then something go wrong and then erm so i'll leave that at the moment
S0326	okay
