S0327	alright thank you very much erm let's have a look at the diary now for these various things erm so tomorrow we meet or we don't meet er so tomorrow be out and then friday saturday morning be there a chance of you come sunday
S0326	i do sunday
S0327	okay it doesn't have to be too terribly early i mean say ten o'clock
S0326	yeah ten o'clock
S0327	oh that'll be really wonderful i you see what i want be for the remember those big board
S0326	yeah
S0327	i might be able to do two at a time but there be three that i want to do so maybe i might also ask you to come maybe on the tuesday as well
S0326	yeah i can do the tuesday i can't do the monday
S0327	okay let's say ten o'clock okay that's absolutely great for those two days
S0326	so er sunday sunday and tuesday
S0327	sunday that's absolutely brilliant and i mean there's only that amount of work if you fancy do some other work i can probably find something i mean leave his erm if you feel like do some physical work there's er the clean the terrace at the back if you fancy do that
S0326	yeah i don't mind those
S0327	alright be good for you to do some physical work what do you do physical
S0326	erm
S0327	any sport
S0326	no i walk around do a lot of walk
S0327	cycle
S0326	no it's more effort to walk than cycle
S0327	well walking's very good but i feel that you should
S0326	dance
S0327	yeah well that's that's that's
S0326	nightclubbing
S0327	that's that's that's move around isn't it okay that's absolutely great thank you
S0326	right i'm just gonna put those in the
S0327	oh well what now what do you think about tomorrow then will you kindly remember i'm er get very absent mind
S0326	yeah no i will just you er do you have a mobile phone
S0327	i've get your
S0326	i'll i'll send you an email erm
S0327	yes but don't er don't ever i never use my mobile
S0326	yeah okay i
S0327	it would have to go here but i mean i've i've say tenish so ideally would be to meet there around ten and then i go we go upstairs or say or
S0326	yeah
S0327	ten fifteen in the entrance i'll put query
S0326	cos i have a feel there might be something tomorrow but i can't remember
S0327	okay well just let me know one way or the other
S0326	yeah
S0327	erm if you can or you can't and if you can't well then we're come up to erm i don't how how long they otherwise you could think of a friday and then i can let them know you're come
S0326	yeah
S0327	good alright
S0326	alright
S0327	that's absolutely great do you want a bag for your book
S0326	erm i've get a bag actually
S0327	you've get a bag
S0326	thank very much for lunch
S0327	it be a pleasure it's not a problem now i just have to drop out of the front if i drop to the right i've get the the co op
S0326	yeah
S0327	if i drop to the leave i've get my health centre
S0327	it's so convenient okay well i'll er
S0326	need to put this in here
S0327	see you on the twenty first when's come
S0326	i'm not sure when 's back
S0327	be nice to see him and catch up
S0326	but everyone'll be here for christmas
S0327	i think everybody'll be here on the twenty first
S0326	yeah
S0327	and you're go to on christmas day
S0326	yeah to
