S0327	which be together with talent which be very important
S0326	yeah so when i write the essay i really just it take me sort of three and a half days of solid work
S0327	yes
S0326	and then i go come to for a few days
S0327	okay
S0326	for the weekend
S0327	and what be the subject now
S0326	erm now i'm mainly do er greek and latin literature and philosophy and art history
S0327	gosh so it's gonna be quite demand isn't it art history from what period
S0326	erm it's from from archaic greek to late antiquity so it's sort of eight hundred bc to six hundred ad
S0327	so er at some point you'll cross over with a little bite won't you
S0326	yeah she always say that she be do a lot of roman britain art
S0327	i mean i do she send me her essay to read sometimes to read through for you know typos and so on and i mean it's so academic what she's do
S0326	yeah
S0327	i do really admire her i mean i actually think your subject be more interest in a way
S0326	well she's do erm archaeology it's it's gonna be a bite like that
S0327	but she doesn't seem to mind i haven't mention that i find it find it a bite bore it's heavy
S0327	i mean so be yours so be your subject erm so it's of course it's ancient greek philosophy and everything
S0326	yeah i mean what i like about the erm work i've do this year i'm just i try basically hard to just have my own ideas i don't do too much secondary read i just look at the text
S0327	that's that's very demand that's er that's interest cos tell me that she er be tell that they're look for er you know originality and i think how do you do that with archaeology you know it's almost impossible to have an original view
S0326	yeah
S0327	on subject that have be beat to death
S0326	although although it's it's surprisingly people there's a famous example or famous in term of archaeology where they have these coin sort of persian coin and no one could understand what be show on the coin they come up with all these different ideas and then a student at university girl at university it's quite obvious that this be a map of persia and no one have notice
S0327	good lord be that right well of course one forget that even the cleverest people be mostly silly as well
S0326	yeah yeah
S0327	it's worth bear in mind i've never meet anybody clever all the way through
S0327	either they're clever intellectually stupid emotionally or they're clever emotionally and da da da da erm that's just how it be coffee and actually the pizza's ready so we might as well be you hungry enough for a pizza
S0326	yeah i be quite hungry
S0327	good
S0326	i didn't eat yet
S0327	okay erm
S0326	i see you've get your pease pudding stash up
S0327	well i buy quite a lot them and say whatever however much you buy she say double it
S0327	so i go out and buy a a whole lot more milk
S0326	thank you
S0327	tell you what you help yourself to milk erm and what haven't i get i need to put the kettle on for me i have erm and because i i do have a brief email from which be nice not very communicative i have to say
S0327	erm
S0326	do you get one sentence
S0327	i think i get one and a half sentence which be not bad but it sound as though he be okay
S0326	yeah i i i run into him in at home in
S0327	er do you by chance
S0326	by chance cos no one's really in that house so run into him and he seem to yeah he he like a lot
S0327	oh well that's good oh well
S0326	he like the sort of like the lot of friends that he meet
S0327	really
S0326	or people he like
S0327	cos you haven't or have you now
S0326	well yeah not i mean
S0327	not to not to match your friends
S0326	not no not not at all
S0327	nor have oh i'm glad at least erm have why why be that
S0326	erm i dunno it's probably the mm sort of er not so much the people at university it's the way that me and be and the way that be
S0327	so you and be rather snooty and your friends have to live up to certain standards
S0327	and be a bite more open be that what it be
S0326	well or i dunno 's always have his friends have always be in his peer group whereas my friends have not really er they've always be sort of even at school my friends be lot not lot of them be not in school
S0327	right
S0326	but all 's friends have always he's always be er accustom to be friends with the people who
S0327	do that mean that you feel a bite isolate down there
S0326	erm not really i don't really not really because i'm either in or i'm do the work or i or i be in with my friends that i do have
S0327	right okay i'm go to have a bite of leftover extremely bore noodles
S0327	that somebody have to finish there erm and do you have any more ideas as to what you might do later or not
S0326	mm i wanna do er like as little as possible really
S0327	what do that mean
S0326	i mean i don't wanna have i wanna be able to think i er wanna i like i think very i felt like i be think very clearly when i have a year out so i think it's like er it's maybe do some job and get some money and go somewhere and do some work or something go somewhere cheaper to live
S0327	do you mean write
S0326	yeah or or yeah or or or just like also think about what to do
S0327	right erm i assume you don't want bread with that but if you want some
S0326	no i'm i'm fine thank you
S0327	you're alright erm okay well er you know if you're will to work you can actually on that subject i don't suppose you've get a couple of mornings you can work for me have you
S0326	definitely i mean i just
S0327	oh that would be really wonderful
S0326	i should do i just i've just like ask about a job but if that doesn't happen then i would be able to do those mornings
S0327	i mean i it's just i need to it's a question of sort of put down board that i haven't get the strength for
S0326	yeah
S0327	well we'll look at the date probably be in a few days' time er knives and fork
S0326	before christmas
S0327	before christmas
S0326	cos i'm go away
S0327	i'll look er i'll look at the my diary and i'll look at the work and see if you can probably need the car tomorrow maybe sunday or monday that would be that would be really good fifteen pound an hour
S0326	that's a lot
S0327	that's what i pay the professions so probably a week's work if if you want to do other stuff
S0326	yeah that's good
S0327	right that's that that's
S0326	try to make money
S0327	well i suppose you have to erm
S0326	yeah i've be i've be i be be work in a in a bakery
S0327	oh have you
S0327	do what
S0326	erm mostly erm make coffee and cut piece of cake
S0327	well that's quite good that you get that
S0327	be that in
S0326	erm yeah
S0327	and how much do you get there six pound fifty
S0326	eight
S0327	eight pound okay well you're not gonna become a millionaire with that
S0327	it's better than better than nothing erm and i think 's get a job
S0326	yeah i bump into him in his dishwashing
S0327	oh yes
S0326	on the street
S0327	i think he's quite enjoy it from what i gather
S0326	yeah i think he would do i mean if cos what i don't know what he's be do before since up to then
S0327	i mean the thing be those job be fine and fun oh i i want you to help me change some text on my computer
S0326	okay
S0327	as long as you er as long as it's not for life
S0326	mm
S0327	don't you think you don't want to do dishwashing have salad if you want erm what's that like that that deep one i think that might be
S0326	it's good
S0327	be it co op
S0327	now i don't have to go anywhere for the things
S0327	erm remind me also to give you a copy of my new book
S0326	oh yeah be that the bigger one
S0327	no it's the little one
S0326	like be it the that one there
S0327	mm have you see it i i send your mum one that as er of the well the she be send one of the tls it's all about the family really so it's a bite of your history
S0326	yeah cool
S0327	yes well spot
S0327	i have my friend be here the other day and he have the book in his hand he be stand like this and he say well where be this blue cupboard
S0326	you should have send him look for it
S0327	exactly he's be here several time before some people just don't notice it erm okay what else erm do you see any of your tutor out of hours
S0326	erm no
S0327	you don't
S0326	they're all very old
S0327	be they what like fifty
S0326	no like like well er that and above one's a bite younger but he's still push forty
S0327	even old people have a mind sometimes
S0326	yeah i'm not gonna see them in a in a club
S0327	no you're not gonna no quite
S0327	course you're not and the level of of lecture and everything be really top notch be it
S0326	yeah
S0327	well that's what you're suppose to think isn't it mm which be nice do you still have good food there and everything
S0326	erm yeah the food in the hall be be good and i get a bursary so it's basically free
S0327	how come you get a bursary
S0326	cos the house only cover
S0327	oh that's handy
S0326	er for their standards yeah
S0327	that's very handy and you get help from your dad
S0326	yeah a bite
S0327	okay that's nice well he must be please with what what you're do
S0326	yeah and when i i send him the philosophy essay that i write
S0327	do you and do he do he criticise them do he or do he just
S0326	erm
S0327	do he help you
S0326	he can try and criticise them
S0327	do you argue with him
S0326	well he i think i he doesn't really know this this this branch of philosophy as well as i do almost
S0327	right
S0326	erm
S0327	what be his his what be his period
S0326	i don't know but it's definitely not pre socratic
S0327	you're do pre socratic philosophy
S0326	yeah and also
S0327	plato
S0326	no plato's
S0327	plato's after
S0326	yeah it's
S0327	so who be pre socratic
S0326	it's people the famous people be people like heraclitus
S0327	oh right yes okay
S0326	erm parmenides
S0327	oh right they're before
S0326	they're very and and more interest i think cos they're all sort of mystics in a way
S0327	yeah
S0326	mm and their their their philosophy be collect from so so one might just have sort of forty one liners leave or they write it in a poem
S0327	actually it's astonish isn't it that it's leave er that er that we still have it it's absolutely startle when you think about it
S0326	yeah
S0327	you know when i think of stuff that i've lose from not only my own parent or grandparents but my own early life forty fifty sixty years ago and then we have oh you've get a you've get a tattoo
S0326	oh yeah
S0327	a leaf okay that's not very dare but it's very pretty
S0327	do it symbolise anything
S0326	erm i get a i get match tattoo
S0327	oh where's the other
S0326	no with er someone else
S0327	oh i see
S0327	a girl
S0326	with a girl yeah
S0327	have you get a girlfriend
S0326	yeah
S0327	you've get a girlfriend and be she in or in
S0326	she's in
S0327	oh the girl who in a cake shop still the same one
S0326	yeah
S0327	excellent what's her name
S0326	er
S0327	
S0326	yes useful
S0327	terribly useful my friend all her up to a certain point all her boyfriends be call
S0327	and so we we all say it's very convenient we'd just say how's and it didn't matter we'd get it right
S0327	fancy that and be that her profession work in the cake shop
S0326	yeah she own erm bakeries she own
S0327	mm
S0326	she own one in and she own one in and some in
S0327	i see you're you're go out with erm how do one put it a proper business
S0326	yeah she's a businesswoman
S0327	a businesswoman well that's probably very good for you i would imagine because there must be a touch of real life there
S0326	well sort of
S0327	not not just ancient greece and you get cake to match
S0326	yeah
S0327	mm
S0327	some people have fall on good time haven't they
S0327	well that sound brilliant i mean i don't know whether i should ask you about your mum's new boyfriend cos she i haven't hear anything from her
S0326	well he's call he's call
S0327	he's call yes that's also handy yep
S0326	erm
S0327	and be he nice
S0326	yeah he yeah he's nice i i don't know him that well but he seem nice
S0327	he's a painter
S0326	yeah he's an artist
S0327	what kind of
S0326	what kind of
S0327	mm
S0326	erm you'd have to you'd have to have a look erm come round and saw some of his paint on the wall he like them erm it's sort of abstract paint
S0327	and why do he not sort of show or anything
S0326	i don't know i don't know what he seem to i don't know what they erm he do with his time really if he's like if he's work towards a show or
S0327	anyhow your mum's happy
S0326	yeah
S0327	that's the main thing and he's a proper age not a child
S0327	oh well that's all excellent
S0326	child
S0327	well don't forget from where i stand er anybody under fifty's a child and as i have yet to meet meet a grow up man in my life erm
S0327	i'm certainly i have yet to meet a grow up artist
S0327	yeah there be a big meet at the yesterday which be a general assembly and i actually didn't sit it out cos i can't sit there for sort of six hours or you know but i know that you know erm be go to bring up the fact that he's very upset that the accept money from the tobacco company which be true we get apparently four four and a half million from them and i you know i i leave message to be read out at the meet after i leave whether or not they be but bite sarcastic i say first of all you know will you thank for draw our attention to the fact that smoking's not good for you erm
S0327	and secondly erm if we turn down the money from tobacco company then surely we should turn down all money because where be clean money what be it what be clean money and can he suggest some because if he can suggest some i'd like some myself
S0327	erm and that most money that any of us touch er certainly through the bank come through armaments one way or the other cos it's the biggest world trade we have isn't it
S0326	mm
S0327	i think so i haven't hear any he doesn't get up till late so i hope he's not too cross with me
S0327	just think it be a silly thing to do
S0326	should get try and get some free fag out of them
S0327	now that hadn't occur to me i don't know how you do that
S0326	be like
S0327	write to them and say look i've be defend you i mean i'm not defend i'm not defend smoke
S0326	you could be their you could be their erm sort of lobbyist in there
S0327	i'm not go that far i mean i you know you do have to be an idiot to smoke it's not a good thing on the other hand and you know you can get lung cancer but all drug have side effect and because smoking's so dangerous the side effect be good i hope you don't smoke
S0326	not properly
S0327	no try not to because you it's very easy to get addict like me quite apart from anything else the cost be horrendous
S0326	yeah i smoke roll up
S0327	but you know they're go they're go to erm give their four and a half million to somebody else if they don't give it to the
S0326	what be they give it for what do they get back
S0327	acknowledgement
S0326	so you put it in er
S0327	they put it in like you know erm advertise exhibitions and things like that i mean the 's a big establishment now i mean actually i'm organise an exhibition for them which might interest you a bite erm not until the new build be build which'll be maybe not for three or four years so who know maybe i won't be alive in three or four years or with a zimmer frame or whatever so i'm try to get it organise now but i'm pick out great work er that be to say great draw from the great artists from the past and connect them to contemporary stuff that's be now be do now
S0326	er just any sort of contemporary art or just draw
S0327	erm no anything erm but i'm also base it in erm ideas of geometry and proportion erm and measurement dimension so i'm try to make these connections between the past and the and the present so it connect a little bite to you know to to what you're do
S0326	yeah
S0327	cos all those initial ideas of proportion come from the greeks didn't they
S0326	yeah and plato have above his school mm don't come in unless you know the geometry
S0327	yeah but he must have be a very er disagreeable person to work with if you if you be an artist of any sort
S0327	he be so against art or have we misinterpret that
S0326	no he be more or less more or less against it he just er he think cos he can't free it from er it's always gonna be sort of er i mean the two problems he have with it be sort of the sort of unreliability of sort of phenomenal world or what you can see with your eye so that's anything you can see with your eye only have a limit amount of value anyway erm and then he think if he can't really separate it from it have a didactic purpose so if you have all these myths about gods castrate their father he be they shouldn't tell that to children but that's i don't i suppose he would he would be he if if he believe that erm through art you could get closer to understand other form then he could see a a purpose for it which be more or less what i think artists be try to do in some way point towards something that you can't express
S0327	well what i'm try to look at i mean i'm only really so that i can find out myself i'm not it's not academic in the sense that i know something i'm try to teach it's that i'm basically i'm try to understand what i've be do for the last fifty years erm but what i don't understand about the little bite i know about what he say be why he doesn't understand that that be a fundamental it be a creativity be a fundamental part of human nature whatever form it take i'm just read this book actually which i won't lend you because i keep refer to it's really really interest call the art instinct
S0326	mm
S0327	erm he you know he put up er put a very good argument up for the fact that it be more to do with the heart than the head
S0326	yeah
S0327	which be what i certainly believe and that it be inbuilt
S0326	it's very it's interest when erm when people look at the differences between homo sapien and neanderthal societies the only real difference be that neanderthals didn't erm have a sort of culture of figurative art or symbolic think they didn't do any like cave paint
S0327	do they not
S0326	no and so and people just can't can't work out why er that should make a difference but it seem to have make some sort of difference to survival
S0327	but but cave paint start i mean we we know of cave paint at least thirty thousand years ago so who be they
S0326	yeah but there there be erm that's they er they exist together at the same time
S0327	i think i read about that somewhere so these two kinds of human species
S0326	yeah er protohuman species
S0327	they don't really know do they i mean er
S0326	yeah
S0327	they don't know how we appear i mean from everything i've read it's just almost as though we appear ready make and i know quite how that fit in with darwinian
S0326	yeah well especially when you think about a hundred thousand years ago it's not that long
S0327	it's not that long it's amaze
S0326	yeah everything that's happen in the last two thousand five hundred years
S0327	yeah but you see if you look at some of those cave paint and i've be to lascaux the sophistication be so great the intuitive sophistication they have that one have to think that they weren't really all that different that the only thing that's change be technology and our learn but the actual way they be constitute as human be wasn't that different
S0326	and so he's and this book be about the sort of natural drive
S0327	it's about the natural drive
S0327	and erm i actually read it before but my memory now my memory be just unbelievably bad which be useful it mean i can read book again and erm you know it go into you know the mean of aesthetic value and aesthetic problems and erm forgery erm use of fiction i see i've mark a few things natural selection i mean basically what he's argue be a kind of natural selection in art as well erm i mean i can only read it rather slowly and carefully but you might you might just find it interest but i mean who who be those human be who first measure a pillar
S0326	yes i mean there's this there's a good erm do you know that woman camille paglia
S0327	yes yes i remember her
S0326	she like yeah she write a lot of like nonsense some of the time but there's a she have a book call sexual personae a sort of art history book go from ancient egypt to emily dickinson and the first chapter be it's really good about sort of think about where art come from and why people make art erm it's sort of like a reaction to a sort of primal anxiety about nature and what they can't know in the dark and so she have ideas about why people have pillars and pyramid and a straight line a straight line be erm sort of a symbol of man's try to er emancipate himself from from nature erm and yeah she look at like er she compare egyptian free stand statues to their do you know the venus of willendorf sculpture that sort of bulbous yeah
S0327	yes yes i know yeah
S0326	and sort of the this be erm sort of chthonic primal art and then the birth of the western eye be what you see when er in in egyptian culture
S0327	i do remember read some stuff of hers which be simply over the top
S0326	yeah she i mean she go on she's
S0326	she'll er she'll like go on and on say a lot of things that without stop to like
S0327	yes
S0326	about without an argument
S0327	adore her work when it first come out i actually couldn't cope with it erm it's too much like a rant to me
S0326	mm
S0327	erm i mean what i'm in fact i might
S0326	well the it's just the the first chapter be good er the first three chapters of that book be be be interest at least
S0327	yes er well what i'm try to do in this exhibition erm i might even let give you the draft of the mm the introduction would you be able to do that for me
S0326	mm
S0327	at some point it's not long it's a couple of thousand word er well it's partly i mean this none of this be original but you know be to be to talk about all the dimension come from the body that even even the most abstract artist it have to come from us because this be the only tool we have really
S0326	yeah
S0327	to measure things and you you see it very clearly in art
S0326	oh right
S0327	erm
S0326	i do actually write an essay last time about erm the naked male body in art and i spend most of it try to work out why people be er fixate by use the naked male body in greece and but people do say about columns sort of doric columns and er ionic columns and like the sort of vitruvian theory about male doric columns and and base on the male body er
S0327	those be all good theories i mean well i don't suppose we'll ever know erm but it seem to me perfectly obvious that that this be the way any creature relate the relate to the world you know if you're an ant presumably you have a very different understand of the world of the size and the scale erm assume they have brain and things like that which i dare say they don't erm you know and if we be if we be giants we would see it all scale be incredibly important i don't mean size
S0326	yeah
S0327	i actually mean scale which be the relationship of large and small erm jacquetta hawk i seem to remember in a book one of those first book that come out in the fifties or sixties don't eat too much cos i've get a big pudding for you
S0326	okay
S0327	erm
S0326	it's nice the salad though
S0327	it's delicious isn't it i eat this every day and i er i i think it's very very good to eat it's just pickle vegetables i just shove in whatever i erm whatever i can get hold of er image i seem to remember of sheaves of corn so when you've get the corn tie together and then it spring out at the top and the that be originally how the dwell be be erm construct and so it be just their theory i seem to remember i can't remember it's a very famous book that i remember give to my father for christmas erm fifties er in the fifties i would've think erm what be it call jacquetta hawk and
S0326	not a novel
S0327	no no no it's an a book on archaeology erm and so er you know they make the same things except in stone and so they gradually they gradually emerge but i suppose they will and of course the egyptians do come first didn't they
S0326	yeah what be very strange about only about the egyptian sort of visual culture that it doesn't change really once it's there it stay the same for three thousand years
S0327	that be interest isn't it
S0326	when you look at greek visual culture within two hundred years it's totally transform
S0327	yeah well it's the same er thing with islamic art actually you know that they won't allow that to change erm i notice when i be in morocco that you know it's well it's really be downhill all the way since about eleventh or twelfth century i remember in in marrakesh there's a a wonderful build i can't remember what it's call now erm all that's leave be just stone one portion and bite by bite you know the ottoman's come and that be lovely all that stuff
S0326	yeah
S0327	er and now they don't know er of course they haven't a clue what to do now now modernism have take over erm they're still not suppose to do anything figurative everything's hold back so those cultural comparisons be be terribly interest but i know that you know i think i'm not one that's always ask myself what be it one's try to do cos as an artist you never really honestly know because as i say
S0326	thank you
S0327	i don't believe the brain have much to do with it erm and so i think a lot of a lot quite a lot of art be always try to go back to to the origin where you know where it all come from it look a bite different because we're all creatures of circumstance and we can't escape our time now i've get but i too fussy
S0326	i haven't show this tattoo yet to my mum
S0327	oh what do you think she's go to say
S0326	she won't mind i just haven't haven't actually wear a t shirt that's why probably
S0327	have another look i need to find my glass where do you get it do
S0326	erm some place in
S0327	it's very pretty actually
S0326	it's cos erm
S0327	it's quite delicate
S0326	er we have erm and i be we have we make up in the summer play a lot of pool erm and we make a pool team call er autumn leaf i can't remember why so that's what it's
