S0037	i mean i don't know that much about box except for tony jeffries obviously
S0115	amir kahn seem to be reasonably reasonably well behave doesn't he
S0037	yeah
S0115	um but uh no it's a bite it be a bite bad when sport people behave like that isn't it the sort of behave in a really sort of uncivilized way
S0037	i think it's bad like it like that thing as well on um the at the man u match like when like he wouldn't shake everett's hand everett wouldn't shake thingybob's hand
S0115	who wouldn't shake whose hand
S0037	so um i'm terrible at remember detail so like there be a man man u
S0115	no you're not you're really good at remember foods and uh part of the body
S0037	that's me specialist subject
S0115	anatomy and anatomy and food term
S0037	but that's that's cos i like eat
S0115	like pancetta i always forget what pancetta be i think it's bacon isn't it
S0037	yeah it's like a
S0115	i've remember that but yeah
S0037	no no so um man u's get this um player who's black and then um a few months ago i can't remember who they be play anyway this one guy um racially abuse him be report and he be fin and he be ban
S0115	there's a lot of that in like yeah
S0037	he be ban for however many months anyway last week be the the first match that he have back after his ban and they be play man u again and they go down the line you know when they shake hand and the black the black guy have his hand out like that to shake his and he just go like that and wouldn't shake his hand and then the guy grab him as if to say what be you do like shake my hand and then he wouldn't so like
S0115	what be that one's name again the one who wouldn't shake his hand
S0037	i can't remember one of them's call everett and i can't remember which one which one's which i think everett's the
S0115	isn't everett isn't that one isn't um one of them like notoriously bad like thugs or something or be that someone else
S0037	i don't know but
S0115	like two brothers like
S0037	no
S0115	the brother be like in prison and
S0037	i don't know
S0115	do he use to play for newcastle batty
S0037	barton
S0115	barton
S0037	yeah he's horrible
S0115	they're their family's like they've get a just a
S0037	they're chavs
S0115	just a bad family haven't they wrong 'uns
S0037	ah no but no they be wrong 'uns but uh
S0115	wrong 'uns
S0037	no but this be really bad cos like it's a really bad message
S0115	it's it's it's a there have be a bite of that hasn't there like with the the racial abuse so the like the john terry one's quite quite well know here uh
S0037	yeah
S0115	bite of uh
S0037	bite of sing
S0115	action over there
S0037	i be read something in in the uh paper this morning where they be say like on the subject of like racism and football under some like committee you know association for not be racist and homophobic in football that's not its name obviously
S0115	yeah
S0037	um and they'd like send out load of information to all the premier all the club in the top three divisions in the uk like say um this be what you can do here be some ideas about how to prevent racism and homophobia and only six club have reply to them say like yeah we'll do it like
S0115	right
S0037	i mean people just aren't like they're not really tackle it so
S0115	yeah the i mean there be some the football's always be an area some of the unpleasant part of society sometimes uh you know
S0037	yeah
S0115	rear their head like in the the crowd obviously hooliganism and violence organize fight uh
S0037	just so stupid
S0115	obviously various uh extreme uh opinions such as dislike of gays or dislike of women or dislike of uh people with different skin colour and stuff like that in football
S0037	it's just stupid isn't it i can't understand it at all
S0115	but uh at least i think it's improve though but i think it's worse in other countries isn't it like uh
S0037	yeah
S0115	i think think we britain's better than i think perhaps some of the ones where i dunno if there's many players with darker skin
S0037	yeah
S0115	and therefore if they see someone with dark skin they would shout various abuse at that person like sort of happen in one of the game we watch last week actually in be it the spain one with porto
S0037	yeah
S0115	um they be shout abuse at like um the uh in uh players from uh who be it who play porto last week
S0037	i dunno i'm terrible
S0115	hold on be it man city do they beat them
S0037	oh yeah that's right
S0115	they beat them uh we watch obviously we watch arsenal and inter milan which be a c milan which be uh
S0037	that be a good match
S0115	which be a really great match uh milan be like the performance be really really good
S0037	i know sunderland would win you know i know they would
S0115	i mean um
S0037	i really think that they would win
S0115	but yeah that game be between sunderland and arsenal be a result but i mean but very bad if you're an arsenal because of the the sort of lacklustre that that arsenal do they often advance by pass backwards
S0037	yeah
S0115	uh which be like something that um
S0037	i i really think they would win
S0115	but often the pass you know right back to the defenders and the goalkeeper um
S0037	maybe they can win the whole cup that'd be good
S0115	uh yeah course they say there's a statistic wasn't there um might go to the
S0037	okay i'm alright i don't want one but shall we press pause
S0115	bar if you want one uh oh good idea
