S0189	but luckily like it be kind of comfy there and it be cheap and like the toilet be good so it wasn't too bad
S0192	do you have air con
S0189	yeah i do
S0192	course you do
S0189	yep
S0192	it wasn't so bad in cambodia without it though be it
S0189	no cos the fan be massive but in battambang it be horrible
S0192	yeah
S0189	er but yeah i have air con in the dorm there and it be need cos chiang mai be quite hot
S0192	yeah
S0189	and after i start take the antibiotics like on the day after i be much better
S0192	do you do er that after i tell you to cos i tell you to take antibiotics didn't i
S0189	no
S0192	i recommend a few antibiotics to you and then the next thing i know be that you'd be take them
S0189	yeah i use i use your suggestions
S0192	yeah good stuff
S0189	and find that ciprofloxacin
S0192	the ciprofloxacin yeah
S0189	yes
S0192	i do that when i've have it for like four or five days now it's time to take some antibiotics
S0189	yeah
S0192	and usually within two or three days it clear up again
S0189	yeah within within the day it felt so much better like for the first time i wake up and didn't need to immediately shit
S0192	yeah just don't get into the habit of take them every time you get sick you know cos it's there's not much you could do probably
S0189	yeah
S0192	but erm i'm glad you do cos you start talk about go to the doctor and i be think no no no you need to at least try a course of antibiotics on your own before you before you do that
S0189	mm
S0192	if that doesn't clear it up then go to the doctor
S0189	yeah but that sort me out and then i i go zip line
S0192	oh sweet
S0189	erm
S0192	be that fun
S0189	yeah it be good i do a cook course
S0192	it wasn't like that episode of south park
S0189	no
S0192	have you see that one
S0189	yes
S0192	little do they know that something or other be fun
S0189	erm i do a cook course
S0192	so i'm not go to keep all this fat erm i'm gonna put a bite in here
S0189	yeah
S0192	sweet flavour
S0189	and i do like a two day tour where i saw the erm national park and like the temple on the hill
S0192	okay
S0189	so yeah of
S0192	you you do elephant something or other but it wasn't the same as what i be talk about be it it be like
S0189	yeah it be different have you see this picture
S0192	the one of you rid on its head
S0189	no this one
S0192	oh the one that you get mum
S0189	yeah
S0192	yeah i do see that
S0189	that be in chiang rai that be like a cultural
S0192	heritage place yeah
S0189	thing and there be a bunch of dancers like in front of me
S0192	this be a bite random
S0189	yeah er i enjoy that
S0192	sound good
S0189	yeah
S0192	i'm glad you have such a good time travel
S0189	yeah i do i have a really good time and after that i
S0192	you can see why i've be do it so much
S0189	yeah it's amaze
S0192	yeah
S0189	i'd kind of be i'd be will to go on my own again definitely
S0192	yeah good
S0189	erm
S0192	just bear in mind that some place aren't quite as easy to travel
S0189	yeah
S0192	as those part of the world but as you get more and more experience it will be easy
S0189	yeah er then i get the bus to pai which wasn't that bad i'd hear horror stories about the little mini van
S0192	yeah
S0189	but it be
S0192	what from me or from other people
S0189	just from other people like oh my god you nearly die they speed all the way there and the roads be really bumpy and people be be sick
S0192	i mean people be pansies sometimes
S0189	yeah the the people on the bus have to take their sickness pills but i be alright
S0192	yeah
S0189	it be kind of just fun erm it be fine it be quite nice view go up there
S0192	and you motorbike back from there didn't you
S0189	yeah
S0192	which be pretty fun
S0189	oh do you see my hotel i get in pai
S0192	no
S0189	it be outrageous it be all pink
S0189	it be a hello kitty hotel
S0192	oh i think i do see that
S0189	yeah
S0192	i be like what
S0189	it be a hello kitty hotel it be actually a nightmare
S0192	why
S0189	stay there erm i only stay there because like i be look when i be in chiang mai
S0192	it's a bite of a random place to stay in pai isn't it it's not
S0189	yeah
S0192	i think i'll stay at the hello kitty hotel
S0189	when i be in chiang mai i be i er know i be go to pai the day after so i be look through agoda and like i saw this ridiculously pink hotel so i i be show the er spanish girl and she be like oh my god you have to stay there so i be like oh i'm feel completely crazy at the moment so i might as well
S0192	yeah
S0189	so i book a couple of days there and i get there and oh my god it's all pink
S0189	like the whole build be pink
S0189	and inside be pink and the bed sheet be pink and you've get hello kitty bed sheet and alarm clock and but like the first room they give me be it stink of mould
S0192	oh no
S0189	yeah so i like go and complain and then obviously they don't speak very good english so i have trouble try to actually converse with them and then they stick me in some shitty other room where i go in and there be like a frog let me get this what be you try to do this one
S0192	that yeah be it that one
S0189	yeah you won't get that on
S0192	they stick you in another room and there be a frog
S0189	there be like a frog jump around there be erm oh there be lot of bug in there there be erm like worm come out the drain
S0192	ugh
S0189	and the shower there be a a line of ants that go up the wall and go under the bed
S0189	it be pretty bad
S0192	so it be classic
S0189	yeah and there be tons of mosquitos as well and the door didn't properly close
S0189	and you have to use like erm a padlock erm er
S0192	your own padlock
S0189	no a padlock they give you but er it it the door would like hang out and then it be just a padlock kind of which obviously the mosquitos just come in
S0189	so easily
S0192	not good then
S0189	anyone outside would have just hear me like er ah
S0189	yeah
S0192	do you have the uhu
S0189	no i didn't have that
S0192	uhu
S0192	yeah
S0189	see the islands in the south part
S0192	pai be nice though isn't it
S0189	yeah
S0192	i imagine it's change quite a bite now from how it be
S0189	yeah
S0192	when i be there
S0189	but i wasn't happy with the room again cos it be shit and it be actually not that cheap
S0192	no
S0189	so i be like well i'm pay the proper rate here for a crappy room erm
S0189	so i go and complain again and i end up have to phone up the manager and like argue with him and say look i want my money back i'm gonna write you a bad review
S0192	right
S0189	and eventually they give me a better room and that one be okay
S0192	oh fortunate so complain work
S0189	yeah
S0192	i normally don't complain i just leave find somewhere else
S0189	i felt like leave but i be out of money
S0192	yeah
S0189	and my budget be spend and i be over budget already
S0192	through your own fault
S0189	yeah
S0192	well you do choose to go to hello kitty hotel
S0189	yeah
S0192	surely the guy at the end be like why be you here
S0189	yeah it be full of like chinese guy but not like on their own they er just come as pack families and things like that so like no one would like talk to me
S0192	no
S0189	and like i'd i'd be get pick up to go on like erm that elephant trek and erm like they they pull up outside the road in a in a a pickup truck with people just hang out the back for you to get in and like everyone be just star in awe at this pink hotel like i come stroll out with my shade
S0189	and i'm like er you can see them all look at me and i don't know laugh i'm like you should see inside my room it's even better
S0192	yeah
S0189	so it be quite funny
S0192	so it be worth the experience
S0189	yeah
S0192	random why do it take you so long to get back to us mum and i be a bite like
S0189	oh
S0192	i presume you be just busy or something weren't you
S0189	er what do you mean when i be in pai or chiang mai
S0192	yeah you be sick in chiang mai and we didn't get a reply from you for age and it like worry the crap out of mum and then
S0189	oh like i be just the same there wasn't any turn like i wasn't get worse but i wasn't get better
S0192	yeah
S0189	so i didn't really see any need to update
S0192	it's just cos you scar mum cos you'd send a really short message to say i'm still sick and that would be it so she's like oh my god be he alright you know what i mean
S0192	it's just send such a short message yeah she do she worry less as long er when you go on longer
S0189	yeah but pai be so cool i have rent a bike for like every day i be there
S0192	yeah
S0189	and i just go explore on the scooter
S0192	that's nice as well
S0189	they give you a map now i don't know whether you have one of those
S0192	i don't think i do
S0189	there be so many like different place to go it piss me off though when i get there that i rent the bike down the high street and like no one tell you where the petrol station be so i'd assume it be just like the south
S0192	mm
S0189	where any direction you go there'll be er little petrol pump
S0192	yeah
S0189	to use and people sit on the roads on the side of the street no so like i pick a direction after i pick up the bike and i'm like okay the fuel tank's pretty low i need to find petrol so i'll go that way and i'm sure i'll find some no no petrol
S0192	nothing
S0189	so i start to panic and i go another way and i'm like shit okay i can't find any so i head back
S0192	into town
S0189	yeah and like the bike die on the way
S0192	oh no
S0189	so i have to start fuck push the damn thing
S0192	how far
S0189	and ask people like where the hell be the damn petrol
S0192	how far do you have to push it
S0189	oh probably about ten minutes not too bad
S0192	oh it wasn't too bad
S0189	no
S0192	yeah normally it just people with like coke bottle or something
S0189	yeah
S0189	keep go on the potato
S0192	quicker otherwise some's gonna be boil and some's not gonna be boil
S0189	i'm really slow with potatoes
S0192	i haven't decide yet do you think it's better to cut these in half or to just have them stand up
S0189	they look nice like that
S0192	you reckon
S0189	yep
S0192	do you ever do stuff pepper
S0189	no never do them
S0192	you can do what my friend use to do you can't i haven't do it since cos we don't have it it's stuff erm marrow and marrows be really big so like it's good you stuff it with load of meat and potatoes and egg and whatever
S0192	whatever you want yeah it's not too bad if you're feed quite a few people
S0189	i'm sure you can have a stuff sour gourd that'd be nice
S0192	that be horrible
S0189	it be
S0192	whatever that veg be i couldn't really eat it it gross me out
S0189	sour marrow of some kind
S0192	i don't like bitter anyway it's a bite of a weird thing to give us
S0189	yes
S0192	i guess they just want us to try some of the local food
S0192	the problem be like some of these aren't gonna stand up like this one
S0189	after erm be in thailand right i didn't find the cambodian cuisine like amazingly interest
S0192	no it's not no it's not so i mean the philippines be really bore i think their food be terrible
S0189	mm
S0192	what bake pan do you have what things can i put all these pepper in at the end
S0189	okay
S0192	so be that big enough oh there's two of them i'm tempt to cut the pepper in half so i can lay them down i can get one two pepper three pepper four and a half that'd be fine i think i'm gonna cut the pepper in half
S0192	oh we've get trap quicker
S0189	you do know it's on lowest right
S0192	yeah i'm talk about that
S0189	yeah you do know it's on its lowest
S0192	that's fine i'm not tell you to boil quicker i'm tell
S0189	oh
S0192	you to do it quicker
S0189	do i need to do any more after this one
S0192	maybe
S0189	oh right
S0192	what do you think
S0189	i don't really want to do any more
S0192	tough sous chef do want them so
S0189	we need a potato peel machine
S0192	yeah it doesn't matter if you get a bite of skin on them it doesn't have to be perfect
S0189	i'm kind of tempt to get a rice cooker for in here
S0192	do you know what's better than that
S0189	what
S0192	be a knife
S0189	no i'm no quicker with a knife
S0192	oh mate where's a knife where's like a small knife
S0189	er i've try it before i know better
S0192	where be a small knife
S0189	in there
S0192	show me a good one there's gotta be a small knife here
S0189	no none of them be good
S0192	what's the name of the small that that's here
S0189	i don't think it's gonna fit any more in there
S0192	you could
S0189	maybe one
S0192	if you can get it like this you know kind of pick it round
S0189	god that's so much quicker
S0192	it be isn't it
S0189	but i can't do that
S0192	why can't you do it
S0189	you're lose a lot
S0192	yeah that's right
S0192	i'm i'm rush it but if you do it quicker and you get better at it you lose less potato do you want to give it another try
S0189	no i'm alright i'm do with potatoes
S0192	oh you're do with them
S0189	yeah
S0192	i see give up so you're not gonna have cheese be that what you've decide
S0189	yeah no cheese by the time i finish this i'm gonna have to start cook so i can eat so that i can go to kickboxing
S0189	this be bullshit
S0192	well you could just eat this now you could eat yours now
S0189	that's probably good
S0192	yeah we can just put yours in the oven yeah
S0189	yeah
S0192	and then and i will eat ours later
S0189	yeah
S0192	yeah i do take big chunk off but it's not exactly like you be you weren't do the same with the peeler
S0189	you can't take massive chunk off with the peeler
S0192	you be take some pretty big chunk off
S0189	oh maybe
S0192	i mean look at that you do that
S0189	ah what one no that one's yours
S0192	whatever all these bits chunky chunk that's yours
S0189	well i don't think it be cos it doesn't fit through the peeler so how do i do that it's yours
S0192	yeah do you just want to eat this then before you go
S0189	that'd be good do you reckon that's enough potato
S0192	mm don't know we're three grow men i can't believe you've be use the peeler i hate those peelers
S0189	oh well i should really learn to use a knife
S0192	yeah you get better at it i'm not always terrible like sometimes you can go just below the skin but i rush that one
S0189	mm
S0192	and to be honest i haven't peel a potato before you've gotta just hold it with your thumb like that and hold the knife in front of you
S0189	yeah just practice i guess
S0192	where be you off to do you wanna clean up a bite and then we're do pretty much
S0189	where be the nice apples
S0192	in the fridge you say nice apples but i didn't get a nice one
S0189	i think this one's nice
S0192	i'll put that back
S0189	that bite go on here doesn't it
S0192	yeah and erm just clean up and then we're do
