S0115	uh for an individual without actually do any labour
S0037	yeah
S0115	um but the reality be that the individuals and investors do tend to they will choose lower tax over high tax a lot of them but it's more complicate though because
S0037	well i mean
S0115	it's a bite like uh you know if you wanna britain and america that the so call anglo saxon system be to be more liberal and like lower the tax and like um allow the the free business whereas european model who be like germany and france would do uh more supposedly more like statey
S0037	yeah
S0115	and more like regulatory and i think a another example be the bank um regulations cos there be a big fight over this there be a big bust up within the eu in between you know it be when cameron veto it and um
S0037	yeah
S0115	and then for example you know mr wetherspoon put like pro cameron like in stuff in in wetherspoon's so mr wetherspoon be an example of these type of people who want like he's not call mr wetherspoon he's call he's call tim he's call tim martin and uh and he be an example of the sort of person who want the anglo saxon model and they want lower tax you know lower they want less red tape they want less state interference
S0037	i know he's not i like i like his name
S0115	i mean he's it's not a coincidence that he's that his pubs be base on george orwell's idea of a good pub and you know he he will have read george orwell presumably because he dislike state interference
S0037	but one of the best things yeah one of the best policies that i read though be about like in norway i think it's norway one of the scandinavian countries where like it's they set it so that it's not possible for people at the top to earn
S0115	yeah this be the redistributive redistributative um redistributional uh model
S0037	okay well it's not
S0115	in the in the scandinavian countries yeah
S0037	yeah so it's like they set it so that wag at the top can't be i can't remember how many time like
S0115	yeah
S0037	eight time or five time or something more than the minimum wage like
S0115	yeah i mean that's kind of yeah that that's sort of point that i be that i be gonna mention before
S0037	that mean every uh that drag everyone up like that seem like a better idea
S0115	well yeah i mean like those kind of countries be what might be call socialist by american um like americans
S0037	that seem a bite more marxist
S0115	but yeah that be the point i be gonna make it's like i be talk about the european bust up and like uk be like germany be gonna be try to force and like eu be try to force england to to to you know reel in ring
S0037	to what
S0115	reel reel in its bankers a bite like to to restrict its its bank
S0037	ah reign in
S0115	yeah i be try to come out with some word there uh yeah the eu want to impose like certain restrictions on bank and you know on trade but britain be get all like classical liberal you know adam smith about it and say you know you can't interfere with the banker cos you'll scare them off and they'll all go to america and you know london blah blah blah be the world's one of the three so call financial hubs or whatever they're call financial centre of the world along with tokyo and new york like if you if you start to you know put red tape in now like you're gonna drive all them they're gonna go out of london and you know leave the gherkin and leave the canary wharf
S0037	yeah yeah yeah capital yeah yeah yeah yeah i know what you mean yeah ah empty gherkin
S0115	you know that's what we but they're gonna leave the gherkin leave the leave the canary wharf leave the citigroup
S0037	yeah
S0115	whatever they're all gonna they're all gonna go uh to gonna go to america and shanghai and they're gonna make us look like a right bunch of losers uh compare to germany but the yeah the point i be gonna make be that germany have a quite a big bank and company and capitalism industries itself
S0037	yeah yeah
S0115	even though it have more tight regulations so like it's not uh always as simple as like just say
S0037	yeah yeah
S0115	if like there have to be a kind of national pride amongst businesses within countries like in like if you want good investment a lot of it's gotta be there's a an element of nationalism about a lot you you've get uh like german bankers that be stay in germany rather than go to london perhaps
S0037	yeah but i think that's more loose here like do you see that do you see that mary portas programme
S0115	there's it's company cos they they're proud of their country you know what i mean i don't know who that be
S0037	you do man she's she's a lesbian she's get ginger hair
S0115	ginger lesbian
S0115	well i know one ginger lesbian i know the the woman from uh sex and the city
S0037	no not her
S0115	she's uh uh a ginger haired lesbian to to put it rather bluntly
S0037	no not her she's um she's get like a very distinctive haircut very gingery she's quite tall sort of slim she go round and like tell people who've get shop what they're do wrong
S0115	oh right be she um i didn't realise
S0037	be she what
S0115	oh yeah i know her she have one of those those harsh uh
S0037	oh my phone's ring it's
S0115	okay um
S0037	d'you wanna
S0115	i'll just pause this then
S0037	hello hi how be you yeah fine thank fine thank nice to hear from you ah it's no problem yeah yeah
S0037	yeah yeah
