S0644	yum yum yum oh that old dog
S0607	oh actually i be gonna look at the map while we're here cos i want to see where be
S0644	that
S0607	yeah that's what i be think be that before or after where we're go
S0644	we're do quite good for time today
S0607	yeah if i be like on the thing i would burn half of this map
S0644	would you what cos you've do it
S0607	cos she's carry all the stuff on her back
S0644	really
S0607	everything she's read she burn at night
S0644	really
S0607	cos it's less weight and i be think i could pull out the page of her book that i haven't read
S0644	i love set fire to things
S0607	i mean that i have read not that i haven't read okay so
S0607	where be it
S0644	there's
S0607	oh yeah
S0644	river then it's like we've go up to
S0607	we go past
S0644	
S0607	you think that's where we be so
S0644	oh no we're in that's there
S0607	oh be we already
S0644	yeah
S0607	okay so be before where we're go to
S0644	be it
S0607	we're go up to oh crap too far where we're go or be it er but be that or be it oh there there
S0607	so mm there's
S0644	oh we go past
S0607	where be we here
S0644	yeah be there
S0607	and now we're sort of here
S0644	mm
S0607	okay so maybe we're like a third of the way
S0644	mm
S0607	excellent
S0644	there be no real erm long distance that we cover where there be nothing there be there do you know what i mean you know like when i first think we're do this
S0607	there's always something
S0644	think we be go in remote coastal wilderness
S0607	i do as well
S0644	where there weren't any stop and there weren't any
S0607	i think we probably have to be in do that other trip to get that you know the texas type one
S0644	yeah
S0607	even if i really can't be bother when we get there i'm definitely gonna try and make myself have a walk
S0644	yeah
S0607	cos sometimes we get there and i erm just think oh no
S0607	awesome thank so much for spot that
S0644	that's alright
S0607	eagle eye
S0644	shall i invoice you every time i see one
S0607	that might take away from the get the cash out for free thing but yeah
S0607	might as well just use another bank right but anyway so you be say about erm there be there be a bite that we miss and it be about your course the human be erm we we get erm side track and you be tell me about your course do you think you can remember or
S0644	oh just the reason i cos you be talk about private school and one of the lecture one of the lecturers we have he be brilliant he be call and he could just speak for an hour on a subject like no note no reference no book just speak
S0607	yeah
S0644	very eloquently for an hour on something easily anyway one particular one there be load one particular one be erm about this woman mp english woman who's an mp and she be like i think she must have be in the labour party right anyway suppose to be or profess to be erm against the idea of private school because you know she say it's the argument be that it's inherently unfair everybody should have the same opportunities blah blah blah blah blah then she send her kid to private school
S0607	yeah this happen a lot
S0644	well this be it and so the discussion be be she a hypocrite or not and
S0607	oh interest
S0644	be she a hypocrite so one girl say an unequivocal yes
S0607	yeah
S0644	because you know she spout all this and i i say well here's the thing see what i think be what we
S0607	she didn't have kid when she have that opinion
S0644	no that's no good either
S0607	no
S0644	cos that just show you can't think outside your own
S0607	yeah
S0644	erm sort of what's the word
S0607	yeah i know what you mean
S0644	you know what i mean can't think like past your nose
S0607	outside your yeah
S0644	past your own nose erm oh i like these little shop things they have yeah so everyone say if she have say erm hang on what be it how could i have forget that that's my main point
S0644	if she have say i would send my children to private school but i really think all school should be erm
S0607	yeah
S0644	of a of the same level that they should be
S0607	but give that they're not i'll still send mine
S0644	yeah because i wouldn't i would want my children to have the best education
S0607	if i can afford it mm
S0644	and i but i really think that as a rule we should try and phase out this or all school should be of this or that or the other but she didn't say that she say they're a bad idea
S0607	no one should do it
S0644	no one should do it and then she do it so you can't that's that be hypocrisy
S0607	yeah
S0644	erm
S0607	what i think be that how be it any different to how people with more money can get more things in all their areas of life people who earn more get more stuff include i can afford private school i can afford a big car i can afford a big house
S0607	i can afford a better holiday than you my kid can go to a better school i just don't see how it's any different
S0644	well i'll tell you if you like
S0607	cos otherwise you're gonna have to be a communist
S0644	yeah this be this be kind of erm the problem be it's it's the question of what kind of society do you want to live in do you want to live in so for example erm imagine if just take this this er imaginary scenario imagine if erm let me think here at the bottom line of it be that they would say there be certain things that everyone should have a fair start in and er an equal foot in those things should at least be health everybody everybody should be entitle to good healthcare and everybody should be entitle to a good education and what you do with that thereafter cos they're they're sort of whittle down as two of your basic requirements
S0607	mm
S0644	in life so you've get communism obviously which never work and then you've get er not that i know what i'm talk about particularly cos i've forget it all i use to know all about this stuff cos i do sociology anyway erm would say cos she's very kind and and fair and all the rest of it she'd say well everyone should have these basic tennets from which you like platforms from which you can then do what you want if everyone have the same healthcare erm
S0607	mm
S0644	and if everyone have a good education then you're start from a fair point in society and then it's kind of up to you
S0607	mm
S0644	to work harder
S0607	make make you can
S0644	make the most of it yeah whereas if you just say well erm er i've get more money than you so i i can i'm gonna have this and i'm gonna have that things like a car well you might say well that's not a necessary part of be well in life it's not it's not the main it's not the be all and end all
S0607	mm
S0644	but an education be a little bite more important than that and so's be able to have the drug or the operation or whatever be
S0607	mm
S0644	would of course be erm in favour of that
S0607	i mean we be lucky in our country cos we have the nhs which i for so many years didn't realise that everyone didn't have their own
S0644	yeah
S0607	national health system
S0644	i know
S0607	and that obviously everyone's always complain about it but it's actually free health system and and
S0644	yeah
S0607	where we be now in america they don't have it
S0644	no bang in trouble if you get ill here
S0607	be they still in the middle of be they get one
S0644	i dunno what they i don't really understand it cos
S0607	no
S0644	sometime you can you can call an ambulance and people will turn up
S0607	yeah but i you know on my er program which be all base on real life
S0644	yeah
S0607	so like on grey's anatomy which be obviously a really intelligent thing to bring up
S0607	i do wish that i could have these conversations like go yeah but on the good wife
S0607	well yeah but on grey's anatomy this bloke right
S0607	but it's true on grey's anatomy this guy come in need emergency treatment have no insurance and they weren't able to do it so he die
S0644	oh
S0607	although there be one time when one of the surgeons just like pop his top what do you call it blow his top off
S0644	yeah
S0607	do it anyway but then he get into trouble erm
S0644	yeah
S0607	who be gonna pay for it cos it be like twenty thousand pound surgery and all this stuff so
S0644	yeah
S0607	and it be a bite like seriously they're not gonna save your life
S0644	yeah
S0607	cos you haven't get insurance
S0644	yeah well that's the extreme of it isn't it that's where you're go if you're not careful with private healthcare and private school and all that sort of thing if you're not careful with it it end up it will end up be like that that's what the whole problem be with the nhs at the moment be that they're try to sell off bits of it and i saw a documentary on it and i can't remember a bloody thing
S0644	about it but it be the impression i be leave with after watch it be that you can't believe that's what they're allow to get away with and it be all about how erm yeah basically it's be sell off part of it as a business for example erm so she work in the mental health part and erm they they make so many cut that they can't treat all the people that that need treatment and she say it's really have an effect it's really and they get absolutely nothing for free like everything's just so budget and make huge cut and it's no good it's really really no good but then on the other hand you see the benefit if you're gonna get into all the benefit side of things
S0607	mm
S0644	i don't think it help people that much either to give them stuff
S0607	no i don't
S0644	because it it actually just apart from that's unfair as well on the people that be pay to for everyone else to be give enough of everything for free
S0607	yeah
S0644	at the same time it doesn't help those people if you be naturally a little bite incline to sit on your arse
S0607	oh yeah you can totally afford to
S0644	and then someone say here you go you don't have to work you're not go to and then
S0607	the worst be when you hear about people who could get that job but they'd be better off on benefit well
S0644	but
S0607	i think the benefit should be less in that case
S0644	course it should course it should
S0607	for goodness sake
S0644	that's the thing but that's when there's something wrong with the system and the other theory be that they're try to do a population poll cos there be too many people
S0607	mm
S0644	so which i can actually believe we
S0607	help them
S0644	well we're not so sure we don't devise these social policies but yet i can see that what's happen with these people that won't go don't go to work they're not educate erm they're all breed like rabbit
S0607	god
S0644	those children then have children they're all into drug and gang and
S0607	benefit
S0644	all get like stab and and
S0607	the scrotes breed scrotes
S0644	oh god but what happen be and i read this er cos i be think it and then i read it in an article it say like there'll basically be a mass decline of population cos sooner or later if you've get there's ill health it follow suit like
S0607	yeah
S0644	if you've get unemployment then there's ill health and then then there's drug and alcoholism and all that sort of thing that go with it and then there's gang and it's just a mean of kill people off
S0607	yeah
S0644	and it's almost as if that's be facilitate by this because you cannot like let a a population like that breed and then there's no consequence to it
S0607	yeah
S0644	but then it's all part of the theory of everything so it doesn't
S0607	mm
S0644	in the in the great scheme of things everything's all unfold as it's go to anyway there's not that much of a difference do you see what i mean
S0607	yeah i be wonder back to the health thing when everybody everybody should have the same just go with the health not the education for now
S0644	mm
S0607	in order for everybody to have the same healthcare what have get to happen have the government get to make the nhs better so that nobody need private healthcare because for example mm somebody need an urgent operation but they've get to wait three months
S0644	yeah
S0607	erm if they can afford it they can oh my goodness
S0644	oh wow
S0607	if they can afford it they might decide to pay for it because they might survive then or no i don't know
S0644	yeah
S0607	erm so in order for this to stop need to happen the government have to improve the nhs right or
S0644	i have now decide that's gonna be one of the first things i thoroughly read erm when i get back home because
S0607	it's in the top
S0644	it be
S0607	read about stuff or know stuff cos i feel like i don't know anything
S0644	it's murder well there's always more to know see my
S0607	where should we start
S0644	private health care
S0607	no but i mean in general if i wanna know more erm cos i don't only wanna know more about stuff i'm interest in i want to be able to have an intelligent opinion when i vote and stuff like that
S0644	yeah it's constant
S0607	so and then so one thing be the newspaper but you get wrap up in news but they do
S0607	it be informative as well
S0644	mm
S0607	but how else could you do it maybe you do a bite of news how how else i mean do you have to read like factual book basically cos this might be a struggle for me
S0644	erm
S0607	ted talk
S0644	yeah
S0607	have you see ted talk i've only see one
S0644	yeah yeah yeah yeah they're good
S0607	so i'm not let you say anything i'm ask you and then carry on talk
S0607	so so how can we do it how can we become
S0644	you do just have to read and read and read i one this lecturer that i have be really good he say about there's nothing worse than have an opinion if you don't know he say we all do it he say but there's nothing worse than have to listen to people that know a little bite about a massive subject and don't know the whole thing there's nothing else yeah
S0607	yeah so they rant on and on and then
S0644	he say there's nothing else for it you just have to read and read and read and read and read and it's true
S0607	cos it be embarrass like if we be in the car with someone who actually know load of stuff sorry i don't mean that i don't mean that you but
S0644	that's usually me yeah that's usually me with and
S0607	and then
S0607	you'll be there go i think nana na na na na na and they'll go erm but didn't you know that blah blah blah and you'll and then you feel like a complete idiot
S0644	yes and no right because it's a massive subject even just this right because here's the thing say and they're much much cleverer than i'll ever be but sometimes well obviously everyone's entitle to an opinion and sometimes it just come down to how nice you be as with i say to at one time cos we be have a heat discussion about this thing which can i tell you about it now
S0607	mm i'm so glad cos i be worry the other day literally worry go we've forget all the topics and i be get really mad that we hadn't write it down
S0644	no
S0607	you know in
S0644	this be the sort of thing that i say would happen
S0607	in the middle of the night it be like but that's a whole topic but you should have write down every time we say it's a whole topic because
S0644	oh yeah we can't it now yeah
S0607	now everything we've calm down and forget what they all be
S0644	no this be but i know this would happen cos we'd be talk about stuff in general and then something would come up that would remind me
S0607	yeah
S0644	erm on the subject of private healthcare i've just gotta tell you quickly cos my grandad be very very very erm socialist and there be a time when he be ill
S0607	be that a ladybird
S0644	yeah anti margaret thatcher basically i'm sure there's more to it than that but he be very anti margaret thatcher anyway he erm be very ill and he could totally afford to have this operation but he refuse on the principle he say why should i push in front of somebody who's wait wait longer if it be me he he'd do it do you know what i mean he would pay for it and he wouldn't think twice about it but for himself my nan always say that like if it be for somebody else he'd do it but he have his principles
S0607	mm
S0644	and he say why should i push in front of somebody who erm and then there be an argument that it reduce the list because there's a
S0607	you're do
S0644	you're do and this private one be it's be do privately so it's off the the general list
S0607	i wonder how it work if in the
S0644	but someone say
S0607	the private guy's gonna be busy no matter whether it's your grandad or some or someone else or be it that the private guy also doesn't the nhs stuff and therefore if your grandad isn't on the private no but then your grandad's still on the other list
S0644	what i be gonna say
S0607	but we don't know how it work do we
S0644	i've forget now
S0607	yeah
S0644	yeah no so someone say that it take him off that massive wait list
S0607	yeah
S0644	but then somebody else say would say do you think there's a load of surgeons sit round like twiddle their thumb just wait
S0607	no
S0644	for someone like they're all take up all the time and it's just really push i don't see this be why i don't know cos i've gotta find out
S0607	yeah we need to find this out
S0644	ye
S0607	also cos i've i sort of understand that maybe it's like i'm not sure this be always the case but i know that it's sometimes the case that it's the same surgeon whether you're private or not
S0644	yeah yeah
S0607	but it but it's when you have it so you'll still be get i don't this be probably not always the wow that better
S0607	erm it's probably not always the case but i do understand sometimes that it could be the same guy so he have to divide his week between er the private and the nhs
S0644	yeah the private
S0607	on the other hand i think it could also be the case in some scenarios that if you're private you could insist on have the top guy
S0644	yeah
S0607	erm and then you might have to wait again er i'm not sure if that's true though whether you can say i want the top guy or
S0644	mm
S0607	even when you're private maybe you still just have whoever's go because er what i don't this i don't if this be a good example cos it's in germany though but erm so with my job because we're all like european not diplomats but we're like european institution employees
S0644	mm
S0607	so we all have erm health coverage because we're not german so we can't have the german health thing
S0644	yeah
S0607	so we have basically private
S0644	mm
S0607	erm but it's also europe wide so which cos everyone's from twenty eight different countries so you can actually be at home and still do it
S0644	mm
S0607	so i have to have this mole remove
S0644	mm
S0607	and erm i've have i'd be to all i'd be to a few different dermatologists about i can't remember what about though yeah mainly about moles
S0644	mm
S0607	so and they would just go so one dermatologist go so in england i'm use to have more check
S0644	mm
S0607	and then at one time it be really it be really great on the nhs they do photos of my moles because one of the main things about melanomas be when your mole change
S0644	mm mm
S0607	and if you can't really remember
S0644	mm
S0607	well especially on your back
S0644	mm
S0607	so take all these photos horrendous never look so i look like a corpse
S0607	i'd be out the night before and get drink and i'd get spot as well and i try to cover them up with a bite of foundation
S0607	and this woman's get the most clearest camera ever in the world obviously
S0644	oh how upset
S0607	so not only do she get the moles in in the most amaze way she also get like the pore
S0607	and the the bite of foundation there and like the spot there
S0644	ah
S0607	and then my toe look like look like an ogre and
S0644	ah
S0607	but anyway and that be back when i be gorgeous
S0607	so anyway so they take all these picture and i think that be really clever and in england nobody have ever say tell you what we're gonna remove that one it be always like we're gonna keep an eye on that one and that one i have a couple that be always a bite odd
S0644	mm
S0607	so anyway get to germany come to my yearly check up time so i think right i'll i'll find a dermatologist get my moles check immediately he's like we'll remove that one and maybe that one as well so i be like that one that one's never even be a thing like the one that they want to remove it's always be the dodgiest one
S0644	right
S0607	and in fact it annoy me now cos in england they use to go give where it be we'll we'll keep go with it we'll try and not remove it whereas i actually think later i don't give a shit what it look like because it's here
S0644	yeah
S0607	i don't know if you can see it the scar
S0644	oh yeah yeah yeah
S0607	yeah there's hardly anything
S0644	right
S0607	cos it be there they be like mm most people wouldn't wanna have it remove because in case there's a scar and then maybe you get marry and like there's a scar and and i just sort of go along with it but i actually think if there's any doubt that that might be a melanoma just get rid of it i don't care about a
S0644	yeah
S0607	okay it might be different if it be on my face i dunno so anyway
S0644	mm
S0607	everyone be like this one we'll really maybe we'll check this one every six months sort of thing get to germany we're have that off
S0644	right
S0607	but we're also have this one off this random one on my leg so i know
S0644	yeah
S0607	already i know something be up now there's a problem with this private insurance that we have at work which be that if because you're privately cover they do more things than what you need and it's terrible terrible terrible so they'll be like oh you've get a cough we'd better take some blood and do some test
S0607	and then it cost like three hundred and fifty euros which your private insurance pay for
S0644	have pay for
S0607	erm and at first you don't realise cos you're new and you kind of like go oh we need to do a blood test bloody hell
S0644	yeah
S0607	erm then the third time you're like you need to take more blood
S0607	no you don't so i start say
S0644	rip off
S0607	i've already have blood take two months ago so i'll get you the result of that then i would just forget erm so the point be i've get to try and like hurry up the point be that so i i know something be odd about that mole because the one on my leg do not it be like a totally normal mole
S0644	right
S0607	so i go to a second dermatologist
S0644	yeah
S0607	to get a second opinion
S0644	yeah
S0607	and he screw me over as well
S0607	but i be stupid cos i go in go i need a second opinion cos i'm pretty sure i'm be screw over but i shouldn't have do that i'm so stupid
S0644	why
S0607	i should have go in just and not tell him anything cos he be like
S0644	yeah
S0607	oh really who's screw you over
S0607	and he's desperate for me to tell him the name and be a i'm really disappoint with myself because i didn't hadn't do do my assertiveness course so i didn't know to pause and think
S0644	yeah
S0607	i just say the name and i didn't wanna tell him the name
S0644	yeah yeah yeah
S0607	cos this guy be clearly an arsehole and he be rub his hand with glee
S0607	go erm and be his english not very good
S0607	you know and all this stuff so anyway this guy when i get my bill
S0644	yeah
S0607	erm so he i can't remember what he'd say now about the moles because it all get overtake by the fact that he send me a bill and on it be this thing say take culture and send to lab well he didn't
S0644	mm
S0607	he never take any culture so i call up go what culture you didn't do any culture and and he be really awkward on the phone so anyway
S0644	oh
S0607	i be like right now i'm totally screw so do you know what i do i remember that the dermatologist that i'd see in england
S0644	yeah
S0607	be german
S0644	yeah
S0607	so i actually call him my mum be a bite like oh don't bother him but i call him and i say listen dr
S0607	i'm in germany now and i just can't seem to get anybody trustworthy
S0644	yeah
S0607	what would you do and he say well at first he be a bite like cos these er dr have tell my mum that he's gonna have to retire early cos he's so stress so you can imagine the sort of
S0644	ah
S0607	be i in the be i in the be i in the right bite of the road
S0644	oh
S0607	get onto that lane as soon as i can i think it be one of those where it like yeah
S0644	yeah yeah yeah you be actually but
S0607	erm
S0644	it's a bite tricky that weren't it
S0607	so he be a bite like stress out but then he say look i don't know any dermatologists in frankfurt but there's one thing i do know be that if i be in germany i would go to the university hospital
S0644	yes
S0607	so i be like oh dr you have really help me cos he be like i would say that they be reliable so after that i always go so by by this time i've be to two dermatologists my private health never say anything about all these like opinions
S0644	mm mm mm mm
S0607	go to the proper hospital and they do indeed remove that mole erm but i just suddenly felt like i be be see by cos this university hospital i'm not really sure how it work but it feel a bite more a bite more like nhs where they're really busy and they're not gonna remove it if you don't need it
S0644	can i just tell you this be what the problem be when you've get private because all of a sudden there's a buck to be make and then
S0607	yeah but you see i never have i never think that before i go to germany
S0644	mm
S0607	it be like as if people be like you could see us come ten miles off i i don't know how to explain it
S0644	yeah that that's probably cos you there's this huge private erm
S0607	but do you know what the key thing be you don't have to be refer
S0644	you can just go
S0607	you can just bugger off to any specialist you want whereas in england it's really good you have to be refer even if you want to go private
S0644	mm mm mm
S0607	so you can't just be have load of things do
S0644	turn up
S0607	and i just believe i really believe this and it's not just because i'm bias against germany
S0644	mm
S0607	i really believe from my experience
S0644	mm
S0607	cos i have do have some private things do in england cos i've have several job with private stuff
S0644	mm
