S0607	i really believe they don't do it if it doesn't need do whereas in germany
S0644	mm they
S0607	i've talk to a lot of people and we and we come to the consensus that usually blood test things
S0644	yeah
S0607	erm they they will do it unnecessarily and i find that to be so horrendous
S0644	mm
S0607	and and i genuinely don't think it happen in england now of course it might happen sometimes but i think we've get a really good system cos you have to be refer so you
S0644	mm
S0607	know how well i me and your friend please can you refer me to the cardiologist
S0607	no yeah but honestly i think there's something wrong with me you can't you can't get rid
S0644	yeah
S0607	and even if you go private you can't
S0644	yeah
S0607	you have to have a referral so you can't just wave your money around
S0644	yeah
S0607	and go i want to see a cardiologist your gp have to decide it's necessary and i think this be a really important safety net because you know someone like me
S0644	mm
S0607	there i be at the doctor and they're go
S0644	mm mm
S0607	i reckon i should do load of blood test well i'm gonna get nervous cos i'm think maybe it be necessary or be it you know how you should be able to trust them
S0644	mm
S0607	and i think it's really outrageous but anyway so i end up at the university hospital it felt much more like nhs type place
S0644	yeah
S0607	where they're really busy and they wouldn't be do it if it didn't need do
S0644	yeah
S0607	so i be so grateful that i find that
S0644	yeah
S0607	and actually over the last five years i've have three moles remove there
S0644	oh
S0607	erm and they be a bite more preventative i think cos but they be the three major moles that in england they be always like gonna have to keep keep keep an eye on that one in germany they're a bite more like we need to get rid of this cos one day it's gonna turn erm
S0644	well i think why not why not just get rid though in in the first place
S0607	yeah i get rid of them and now i'm i feel better because they be my major ones
S0644	yeah
S0607	i've still get a few other big ones i've get so many little ones that
S0644	yeah
S0607	but the the whole point be erm it's so bad that you can just and you can't trust them
S0644	but that that's what i think be half the problem when there's money involve with things
S0607	yes
S0644	it just like anything like once you start introduce a buck to be make but then
S0607	but i i genuinely do think that maybe we could find out for sure
S0644	yeah
S0607	i genuinely do think in england
S0644	have
S0607	we've get a safeguard in place
S0644	have spout about it now for half an hour i realise that i really do have to go and read about this properly cos i don't know anything about it all i know be the nhs be a god be a be a fantastic thing
S0607	yeah
S0644	and we should keep it and it's this thing call tpp or ttp that's try to corrupt it basically there's a whole documentary on it that's really good erm and that's why hospitals be go down the pan a bite as well because yeah anyway can i just tell you then about this thing i be die to tell you so all the moles be alright now
S0607	yes
S0644	good
S0607	i'm i'm surprise i haven't show you the latest scar
S0644	mm
S0607	cos i actually find it a really big thing have them off cos it's not a major operation but it's still i find it terrify but anyway don't let me go on about that cos that'll just be me again now
S0644	best to have it do though i think always best to have it do
S0607	yeah well if there's i i think i would with the mole
S0644	mm
S0607	i would rather do the preventative thing and if i'd say in england age ago i don't care about the things what she keep say
S0644	quality
S0607	and you know if you ever get marry you'll wish you hadn't get that scar i wish i have say no just remove
S0644	i don't care
S0607	i actually don't care that much about you know
S0644	isn't it funny what some people say with things like that
S0607	mm but anyway er yeah but just oh no i'm go on for too long but there be just one other thing which be that possibly also in germany they're a bite more scissor happy anyway so
S0607	apart from the money thing i go about my knee
S0644	mm
S0607	cos i go ski and my knee be play my knee's have be exist problem for years and years and years
S0644	mm
S0607	and it have really really swell up and like go rigid it's cos i hadn't
S0644	mm
S0607	it's cos i hadn't erm sorry it's cos i hadn't exercise before i go go to the knee guy in germany and he be like let's operate and luckily i know about my knee so i be like
S0644	mm
S0607	er er
S0644	no
S0607	hang on a minute and then i just wait till i be next in england and i go to my old knee guy who
S0644	mm
S0607	saw it when i first do the injury when i be sixteen
S0644	mm
S0607	and he be like i wouldn't operate erm you've just aggravate it and again if you operate now erm he say i would only operate on it if you say to me i'm i'm a serious athlete and
S0644	yeah
S0607	this be cause me a problem
S0644	mm
S0607	and he say otherwise if i operate on it now i could make it worse and it's much better for you to just carry on make it worse
S0644	mm mm mm
S0607	and i be just like
S0644	mm
S0607	what if i'd just go oh okay operate on it didn't need do okay now i'm shut up you carry on about your thing
S0644	no i see the point i i do see the point the of it all and it's a bite like religion in that respect because it's almost as if erm there ain't really one somebody else might think well yeah if i can have it do i'll have it do i can do it
S0607	yeah
S0644	whatever it be do it but then there's other people who think why would i wanna have an operation if i don't need an operation
S0607	exactly yeah
S0644	and not only that but the two doctor may genuinely think you don't know it sound a bite like they're they're up to no good in germany but
S0607	yeah
S0644	two two different people might honestly think
S0607	exactly yeah yeah
S0644	that thing and they're do what they think be the best thing as long as they're do what they think be the best thing it's fine
S0607	yeah and it's the doubt over that that's the worry
S0644	yeah yeah yeah yeah yeah yeah and when you introduce a quick buck to be make that's when you don't really know like what what's go on erm
S0607	anyway now tell me the thing
S0644	well what i be gonna say cos we we be talk about how much we don't know about anything and it make me think of this occasion which i will now launch into
S0644	cos the moral of the story be me and and all sort of disagree mostly disagree with me which be fine but they disagree not because one of us necessarily know more than the other i don't think it's just that they're nicer than me if you see what i mean so there wasn't really a you be definitely right and you be definitely wrong it's more like who who be the nicer person
S0644	which be them but that doesn't mean that she'd be cos there might be right i'll tell you this story then it might be clearer
S0607	that's interest yeah
S0644	then it might be clearer so in one of my job erm be in wherever it be and at lunchtime i find that there be a a court nearby and i love court and go and listen in the erm
S0607	oh yeah you tell me
S0644	do i tell you
S0607	you keep go in and listen
S0644	oh it's probably something i mention to you age ago cos i want to tell you
S0607	be you allow to eat your sandwich when you're in there
S0644	no no no
S0607	no
S0644	well i don't think i don't think mm i dunno actually erm if you see a loo
S0607	yeah i be just think
S0644	it's not urgent for me
S0607	we might be in an area where we could actually go to the loo
S0644	state park at night it's nice this place
S0607	i be also think about you know bag
S0644	oh yeah if you see any handbags and souvenirs
S0607	if we be at home we'd know just where to go and get a little holdall wouldn't we
S0644	yeah oh but one's bind to turn up so anyway i go to this court and it's a criminal court so the first place i go into now i sit down i walk in and there be only a lawyer who i think be a lady possibly and so i go to go and sit in the public gallery bite and there be another chap who be the solicitor and then there be this man in there now this man as soon as i walk in he be like smile at me look at me like that and i'd like
S0607	in a worry way
S0644	well just like erm inappropriate not not to the extent that it would be frighten or anything but there be only three it's a room where you can you know what everyone else be do cos there be only a few of us so basically what i'd what have happen i'd walk in the during the recess and we be wait for the jury to come back in and for the the person on trial to come back in and the judge to come back in so i be wait for that so in the meantime there be only me and they're people do think like why be you sit in there what's what's which be wrong be wrong really cos it's a public gallery you can go and see it
S0607	be it be it can you do yeah yeah
S0644	yeah anyone can go in that's the whole point
S0607	yeah cos sometimes the judge shut it off when it's really
S0644	yeah
S0607	everyone's shout and yell
S0644	yeah well you've get the jury
S0607	get on tv
S0644	and then it's where the family wanna sit if they wanna sit in on it or where journalists wanna sit if they wanna sit in it or public gallery anyone's allow in so in i go and this man be go i know you can't watch but you can feel my eye
S0644	and he be go
S0607	and be he in the public gallery as well
S0644	no it turn out he be the translator
S0644	so and he be go
S0607	you see i get enrage when people do that and i get like do you mind
S0644	well i i think to myself as much as i'd like to think it's cos i'm look really stun
S0644	it be more and i just think you know not to do that i think even if i be look really stun you
S0607	he shouldn't be look at you like that because it's
S0644	well especially in a court right because there there be basically there be him me another person and another person and everyone can see what everyone else do you know want i mean so it be sort of obvious erm if there's four people in a room you know you can see what everyone else be do you can you can see what everyone else be look at what everyone else be do of and so it be just more like you now this be where it's gonna sound a bite like fascist but the only time people do things like that be in pubs or club or
S0607	yeah
S0644	erm
S0607	you wouldn't
S0644	in an office or
S0607	no
S0644	anywhere professional where you have to act professional you wouldn't do that
S0607	presumably not in a court either
S0644	well you'd think so i i be think to myself and in the end i just didn't like look i be just not look but every time i look back it be
S0607	if i turn leave it's because i'm gonna take us to a toilet so just
S0644	oh okay
S0607	yep
S0644	there's a casino why don't you go and spend some money
S0607	so you stop look at him
S0644	right so you get the idea and it's really like
S0607	mad with this kind of stuff
S0644	well normally i don't if if it wasn't in a
S0607	really intrusive
S0644	i don't think it's that it's more just inappropriate it be more like inappropriate because most people know not to do that in certain place
S0607	yeah
S0644	do you see what i mean erm i reckon we could have go into the casino hotel
S0607	do you
S0644	yeah to use their loo just
S0607	oh i never think of that ah
S0644	don't worry now go to the next one there'll be more there's always more than one casino
S0607	i be gonna it be there be erm
S0644	it's not
S0607	it's not very good where i be take us either in comparison i be gonna it say kfc leave and i think that's the kind of place where you can sneak in a new use the loo without them notice whereas i'd see a best western and be think probably with our accent they'll let us use the loo
S0644	if you go in and say excuse me
S0607	excuse me but be it possible to use your toilet
S0607	then they
S0644	oh there's one
S0607	a best where where
S0644	hotel
S0607	hotel where
S0644	oh it's a bank sorry it's a bank
S0607	right okay
S0644	look hotel don't it
S0607	probably not in the bank they're gonna let us but now have see this kfc sign again probably the casino be the best place shall i go back to the casino
S0644	it's up to you
S0607	let's see if there's somewhere to turn round
S0644	oh we're come to now we're come into
S0644	furniture
S0607	that kfc thing be one of those where there's a sign it tell you that it's come up and then it doesn't tell you when it's actually there
S0644	we're still on the one 0 one excellent i just wanna be
S0607	cos actually do you know what we could do if we
S0644	what
S0607	like keep go for like ten minutes there might be a diner where we could have a cup of tea or something
S0644	a coffee
S0607	i mean do you fancy one
S0644	sure thing we're suppose to be like take in the
S0607	oops
S0644	well do we're suppose to be take in the american culture
S0607	yeah which be basically diners
S0644	yeah and kfcs
S0607	okay anyway so
S0644	right
S0607	he be look at you and you're like ignore him
S0644	so you get the gist well it be more it wasn't scary or like it didn't make me angry but i just look it's really inappropriate like most people would just
S0607	yeah
S0644	know not to do that and he just shall we look out for a diner
S0607	yeah
S0644	be there anybody in
S0607	motel
S0644	house it's properly fall apart
S0644	oh i love these cherry blossom tree i love them i
S0607	ah ugg boot bike shop centre i think be where everybody do white water raft and stuff
S0644	oh really
S0607	but i could be make it up could be make it up so
S0644	we're go over a bridge
S0644	look at that
S0607	oh no be this that bridge
S0644	be it what bridge it be a bridge
S0607	oh god okay let's stay calm there be a bridge i saw on a photo and i be hop we weren't go on it
S0644	oh look hop you wont go on it
S0607	it's a really it's a really tall bridge
S0607	it might not be the one i saw
S0644	oh
S0607	actually when you're on it you can't tell
S0644	it ain't that high up though
S0607	but we need to check later to find
S0644	if it's that bridge
S0607	a picture of the bridge but i think the one i saw be at a different place i i can remember the name if i think hard enough it be somewhere else
S0644	oh look
S0607	excite
S0644	look love to go for a swim in that provide there's no shark or crocodiles
S0607	be it too much of a pain for you to carry on tell me because now we're on high alert
S0644	oh what for erm sorry no i will cut to the chase of this of this erm story right so man come in and it transpire that this man the ogler be a translator
S0644	and it's horrible but i have to tell you it be it be a rape case or an attempt rape case
S0607	oh no oh no
S0644	and the solicitor god
S0607	yeah don't look
S0644	so i'm listen to it all and it be horrible and erm the solicitor be ask question and without go into too much detail erm i deduce
S0644	from this fact erm hang on so the way the bloke be talk about it the solicitor get him and it there be no question of him not understand cos the the translator be there
S0607	yeah
S0644	so there's no question of him not understand properly and the solicitor be so good and it make me think about how if you be a solicitor you have to be erm me and be talk about it after and it's a battle of wits like you can't lose your temper
S0607	yeah
S0644	you can't start call name
S0607	you just have to be clever
S0644	you have to be very very clever keep your cool at the same time maintain a tone that let you let them know what you think of them basically cos you're you're try to prosecute them
S0607	yeah
S0644	erm and it's so be this true and be that true and in the end and the bloke what it really really seem to me like be like he be try to make out he didn't understand but he couldn't do that cos he have the translator
S0607	yeah
S0644	and it make me think do people do that a lot like pretend that they don't understand
S0607	yeah
S0644	anyway erm it come down to some detail about something because what they be try to do be escalate his charge from sexual assault to attempt rape which be obviously more serious and they get longer
S0607	yeah
S0644	for it and plus it it be that by the sound of it totally be so that's what they be try to get him do for
S0607	yeah
S0644	erm and the bloke be ask him the question and in the end he he say something like cos the translator be be erm he be speak it all the bloke be talk but obviously the translator be
S0607	mm
S0644	the translator at one point he say take it alright assault her i sexually assault her take it take it in other word he be like i'm feed up with the question yeah i do it alright he he be he be so and he have this look on him of like the whole time
S0607	bloke the bloke
S0644	the the one who'd be charge
S0607	yeah
S0644	yeah he have this look on him that be like you know when you've you've be accuse of something and you've do it and you don't and then you look piss off cos you've be catch
S0607	you just yeah yeah
S0644	it be like that now i think if someone have charge me with do something that i haven't do i would be look the whole time at the he wouldn't he didn't really wanna look at the the solicitor he wouldn't look at him erm and he be just very
S0607	and you would be you would be like
S0644	no this happen no that happen
S0607	yeah
S0644	no and i know that cos i've be in court plenty of time
S0607	yeah
S0644	so you can't use that as a as in he's intimidate by the the you know what i mean like he
S0607	yeah
S0644	i dunno i dunno so if you haven't do something and this again come down to vibrations a bite
S0607	yeah
S0644	because i just think his whole demeanour be be guilty
S0607	yeah
S0644	and isn't that a bite like you can't trust that cos that's just your interpretation of their demeanour you can't judge people base on you think oh yeah he's do it but
S0644	people if you can't look at someone there be a reason why you can't like body language have be study to
S0607	yeah
S0644	show that it it happen for a reason it it's base on i can't stick to one subject ah
S0644	but so the bottom line of it be and the so it seem to me like he's go yeah whatever i do it i do it i'm feed up with be question you know like how you would say if you be guilty be find out guilty
S0607	yeah
S0644	and then you you just feel like have a tantrum basically he be horrible he be horrible he be horrible
S0607	ah
S0644	and the story be so poor like his and it there be no chance of it be misinterpret because he have the translator there be no chance of
S0607	yeah
S0644	maybe it's lose in translation
S0607	yeah
S0644	cos he have this this translator who be there now erm apart from the rest of the issue that be about this i say to the girls when we be talk about it i say i think that's a cultural thing because i say oh that be it at one point he say something stupid like erm i do i i have a mother i have sister or something something like that as in
S0607	mm
S0644	as if he felt like by say that he be gonna get himself some erm
S0607	yeah
S0644	leeway by say that as if you could just say that it as if he be
S0607	yeah
S0644	it matter so little really but if i at least pretend to show a bite of remorse then people will buy it
S0607	yeah
S0644	and then that's good enough for my country that's what it seem like so i think he be middle eastern
S0607	mm
S0644	by the lingo and i think to myself i think that it's things like that can be cultural as well as just be an arsehole
S0607	yeah
S0644	it's a cultural thing where that's just a little bite more acceptable
S0607	yeah
S0644	where you come from it's just you may have a mum and a sister but
