S0456	might be years
S0457	apparently like he's already get permission
S0456	yeah
S0457	have permission years ago
S0456	erm yeah i remember you be say that
S0457	er mm yeah
S0458	mm
S0457	so mm and apparently like erm 's grandad didn't even see the for sale sign
S0456	mm yeah
S0458	it weren't obvious be it
S0457	yeah no
S0458	cos like he didn't want to sell it
S0457	and then all of a sudden he he realise it be for sale
S0458	too little too late
S0457	and er he want to buy it it's too late it's go now
S0458	he be be funny the for sale sign be there for months
S0457	he he probably yeah cos it be it's not actually stick out it be
S0456	yeah yeah
S0457	it's flat on the window so if you
S0456	well even i notice it so
S0457	i know but he drive in the car doesn't he mr he's old
S0458	i've see him walk down the street before
S0457	me too
S0456	i see now he realise if i walk i might see any for sale sign
S0457	yeah too late yeah it's go mm never mind
S0458	no mm unless he can find out who's buy buy it and have a good
S0456	make a better offer
S0458	it's never too late be it
S0457	mm
S0456	mm yeah i think by the fire station they're build something because i saw them remember opposite you know the fire station and gym
S0457	yeah
S0456	and there's a bite of waste grind and the old ruin of a pub
S0457	oh i know yeah
S0456	and it be just always fence off
S0457	yeah
S0456	and just waste grind but today when i go pass they be dig it up so i think they're they're lay foundations
S0457	oh be they
S0457	i wonder what that's go to be
S0456	be more flats cos obviously they've get two row of flats
S0458	yeah
S0456	and then the new ones further down the road
S0457	yeah court
S0458	yeah mm
S0457	mm
S0456	yeah that be always a horrible spot anyway so
S0457	mm
S0456	kid throw stone at you just climb up before they put the fence round it
S0456	yeah and they say they we can't do anything about it because it's all the house be council house but the pub belong to whatever and then all the breweries et cetera change ownership
S0457	yeah
S0456	so nobody could trace who actually be in charge of the build and therefore could be make liable and i think either it be a change of law or if you can say that it's be not care for for so many years and the council can step in and that's when the put the fence up
S0457	yeah oh i see
S0456	but it take it take and obviously load of people must have complain
S0457	you walk down there with and you get do you do you someone throw something at you and
S0458	yeah two little shit they weren't even bother they be just chuck stone at us
S0456	yeah yeah
S0458	they soon bloody complain when we start throw them back
S0457	to them
S0456	well especially if you hit them
S0457	yeah
S0458	well not cos they'd be throw stone to hit us you know what i mean they should bloody get their aim better
S0456	mm
S0457	mm
S0458	yeah and they start swear at us then i say see you later have a nice day it wind them up more doesn't it though when you're not be nasty to them
S0457	yeah
S0456	yeah
S0457	mm
S0456	well as i say when once the fence go up that that seem to quieten down and it use to be a lot more you know the kind of stuff that i get throw at me be like the the worst one once be a pie
S0457	a pie
S0456	yeah it half miss me but it just get me
S0458	no
S0457	what kind of pie
S0456	a meat pie
S0456	good thing it didn't land in my face
S0458	imagine
S0457	yeah open it
S0458	could have be one of them
S0457	yeah put a bite of sauce on it next time
S0456	yeah chicken next week
S0457	chicken next week
S0458	i know they'd have all the tramp walk pass won't they any pies mate any pies
S0457	no a pie oh gosh
S0458	that's really random
S0457	mm i've have a egg throw at me and it actually get me a few years ago when i be young i be run round to my nans and this other girl throw an egg at me right on my head
S0456	apparently it be good for your hair
S0457	yeah and all my cousins run after her then she go ah i didn't know be a baddy
S0458	it doesn't matter they'll never be consequences
S0457	she try to yeah she run off to the flats absolutely petrify and and be all run after her
S0458	oh god she could always tell a tale
S0457	yeah mm gosh
S0456	yeah when be here he get throw we have egg throw at us down at the corner cos it be halloween be it
S0457	oh
S0458	oh yeah halloween doesn't count
S0456	yeah
S0457	oh for halloween can't stand it
S0458	it's not that bad nowadays though
S0457	it mischief night's the worst isn't it
S0458	i we it's not be too bad the last really
S0459	i be there last time and nothing happen
S0458	no them
S0457	mm
S0458	nothing happen
S0457	mm just say that everything could happen
S0456	yeah
S0457	you'd get egg the car would be
S0458	no but for years
S0457	mm
S0458	i think it's not cool any more be it really
S0456	but you don't even see penny for the guy
S0457	no
S0458	you do
S0456	mind you a penny would be not really good would it yeah there you go
S0458	a pound for the guy
S0457	yeah a pound for the guy
S0456	a tenner for the guy yeah you must be joke
S0458	you see tenner for the guy's wear more like fancy clothe than i be
S0457	yeah
S0458	i might just sit next to them
S0457	ah god
S0456	but yeah it have it have calm down hasn't it yeah there's not people burn down every single piece of wood or any little
S0458	no even bonfire even in bonfire night's now the streets be full of fireworks remember erm
S0456	yeah yeah
S0457	everyone go to the park now don't they
S0458	yeah
S0456	yeah
S0458	but remember the we use to have to make we use to do them ourselves
S0456	i know too expensive
S0458	mm
S0457	mm we stand in 's loft now and see them
S0456	yeah you say
S0458	yeah it's amaze
S0459	have you see have you see now
S0457	pardon
S0459	remember
S0458	oh yeah
S0457	yeah
S0459	he's put weight on
S0458	have he he's always be dead skinny as well
S0459	i know
S0458	how fat's he get
S0457	i haven't see in for age
S0459	quite a bite
S0458	really mm yeah but he's always be proper thin hasn't he
S0457	yeah
S0458	always i didn't know he be capable of put weight on
S0459	mum can i go out then
S0457	no
S0459	why
S0457	no
S0459	why
S0457	no cos you've be out enough
S0459	i haven't
S0457	you have
S0459	i'm off school
S0457	i know
S0459	yeah so exactly
S0457	no you stay out last night with your cousins you stay out
S0459	didn't even want to for the last couple of weeks
S0457	you stay out a couple of nights ago
S0458	you couple now not a be you
S0457	rather than back a work i come from
S0458	well you should have get back early then shouldn't you this be what it's like in our household on a daily basis
S0457	yes mm
S0457	oh
S0458	don't have kid well
S0456	yeah
S0457	it's too late now
S0456	don't look after them
S0457	well yeah
S0458	yes
S0457	yeah
S0456	yeah but know what you hear from say that she hasn't even get a camera she's say there'll be fewer photos now so
S0458	oh
S0456	mm i say cinderella and she say yeah that's what it be
S0458	oh
S0456	cos you know with the little baby obviously you can see the baby come first
S0457	yeah
S0456	but you know it's it's yeah her grandmother look after her bring her up and then come to look after her because seem to be
S0457	do you go on the computer to her
S0456	yeah because look doesn't want that it's mental
S0457	she doesn't want it
S0456	so so she must have se you must think she's stupid erm she say oh don't write
S0457	don't write
S0456	like will yes there's there's phone and there's there's there's email so email take her months to figure that one out
S0458	really
S0456	and then
S0458	oh
S0456	yeah no access to the computer can't use it computer if you use it at school erm i'll report the teachers which be like seriously bad and it's like well how stupid do she think they she be in the unite state you go to a public library they've get computers you've get friends they have computers
S0457	yeah
S0458	yeah
S0457	yeah
S0456	so that's what she do
S0457	so she still talk to you but her mum doesn't now
S0456	which be the irony because her mum contact me can she write you a letter but and yeah it it be the whole thing that must have try to make me think that the child be in china
S0457	yeah
S0456	and then the letter never get there because chinese post be rubbish
S0457	mm
S0456	erm but you know again that's shortsighted because sure enough would have write oh i'm not in china i'm in the unite state i've be there for years so
S0457	yeah oh
S0456	i don't know and she doesn't answer email so
S0457	mm
S0456	and yeah
S0458	people be weird
S0457	no well the main thing be like she keep in contact with you doesn't she
S0456	yeah so she's she get her dad talk of the week you know learn how to write
S0457	ah
S0456	she sound like a little american anyway
S0457	oh do she
S0456	yeah yeah it's all tell me this yeah
S0457	ah
S0458	ah
S0456	they have they have a europe day so erm you know all the european countries have like you get pasties or whatever on the french stall and they have be it brighton rock all kinds of things that be british tea brighton rock brompton bicycle erm just fun
S0457	mm
S0458	we have a guy come over from singapore who work for us he's never be to england before and he he be a bite older than me but i'm one of the youngest in work so everyone be like oh you can sit with you know and he be like so do you like tea no but you're from england you must drink tea all the time no i don't like it
S0456	you only that's why
S0457	no
S0458	he think we have fish and chip with our breakfast he think we eat fish and chip constantly
S0457	yeah
S0456	for breakfast
S0458	yeah i be like no
S0456	no no we have cake
S0457	yeah cake oh
S0458	he just think that that's all we have just fish and chip
S0456	where be he from
S0458	singapore
S0456	oh dear
S0458	and i be like so all be that all you eat be noodles and he's like no i be like well there you go
S0457	mm
S0456	yeah yeah very strange specially singapore you know
S0458	i know but he he'd never be to the uk or anything before so
S0456	oh
S0458	i know bless him
S0456	bet he's come with load of fish and chip yeah he bring them
S0457	and load of tea
S0458	mm ur i like fruit tea i like chinese tea as well
S0456	well you can have chinese tea i have load
S0458	or fennel tea
S0456	green tea
S0458	mm yeah i drink green tea chinese tea fennel tea be really nice
S0456	yeah yeah fennel be nice
S0458	fruit tea anything bar normal tea
S0457	no i don't like tea i don't like tea full stop
S0458	i only dip my biscuits and then i have to bin the tea because the smell make me feel sick after i dip my biscuits i can't have biscuits and coffee it's too bitter for the biscuit
S0457	i like coffee
S0458	mm i have one one proper coffee in the morning and then i have a decaf in the afternoon
S0457	mm
S0458	and that i'll either use the blue no the blue top milk or coconut milk coconut milk be lovely
S0456	be it sweet
S0458	yeah
S0456	oh right
S0458	coconut water be even have to try coconut water
S0456	i think i have
S0458	that's it's really nice
S0459	there we go hang on what do i switch on the wrong one
S0456	no i switch them over oh i'll just do that one sorry since i've put the computer here and this be these be the only bits of
S0458	power
S0456	power that you have in this room
S0457	really
S0456	yeah so this be i've get the extension it's go round and that connect to there
S0457	oh okay
S0456	erm and the light switch for that one be there
S0457	what about there have you get no plug there
S0456	no no there's two here two there
S0457	cos we've get two there and two there
S0456	yeah your house be more modern
S0457	yeah haven't we
S0458	and we've get two lot in the other in
S0457	and two lot in the other room
S0456	yeah it's just these two and then two on the opposite side in the next room
S0457	so i've get eight eight sockets downstairs two two two two
S0458	in the live room
S0457	yeah both on the that wall
S0456	yeah that be the first thing that i notice that it's like extension lead everywhere and usually i have get the computer so i have get one for this and then one for the extension that go out for that other thing
S0458	when you buy the house they're not go to just
S0457	france
S0458	i don't think have have much a need for electric do she really
S0457	no no no no
S0458	cos i remember she be pretty old school weren't she
S0456	and so's the house
S0458	mm
S0457	your floor's nice though
S0456	it be isn't it it's lovely
S0458	where's that from
S0456	it's from
S0458	oh yeah you should know mum
S0457	it's nice that wood
S0456	yeah because they they say yeah you can have these and these and these and blah blah and the guy who do the floor be actually from birkenhead so he do it in a day and it be great they come one even
S0457	do he have red hair and a white van
S0456	can't remember
S0457	the other one have dark hair two men mm
S0458	ooh you've get the harry potter book
S0456	yes
S0458	i'm read them for the third time now
S0456	it's the it's i be amaze how much i forget about the first book because they do that then they do the the christmas one remember stephen fry be read it over christmas the whole book take eight hours so you could just listen to bits and piece
S0457	no i didn't watch that
S0456	and when the last book have come out and i read it i think i'll read the whole thing again as one
S0458	or listen to it yeah well i've never i read them all when i be at school and then i read them again at secondary school when deathly hallow
S0456	yeah
S0458	no goblet of fire come out
S0456	yeah
S0458	no goblet of fire deathly hallow be it
S0456	yeah
S0458	part one
S0459	wouldn't you rather just watch the film
S0458	well i've never i've only watch the first four film and now i've get them all i've read all the book and buy the last book
S0459	yeah
S0458	so i've nearly finish the second to last book and the last book arrive in today's post
S0456	well that be the other thing i say we i say to er cos say you know i'm not mean to complain or sulk or anything but i will complain and i will sulk and i say well for a start your parent be great sulkers and erm you can always tease your mum you can always say well yeah what do you think you're not afraid that hagrid come and just take me away
S0458	translate the harry potter book didn't she i think
S0456	she didn't she use the translations and she look at the translations how and how they be compare to the original so you know the harry potter reference should definitely work for her
S0457	oh
S0458	mm love harry potter i don't know what i'm go to read after i've finish harry potter
S0459	read them all again
S0458	mm
S0456	philip pullman that's harry potter for adults well it's for older children you know the the dark dark materials
S0458	oh okay ah i'll have to have a look into that
S0456	there's the dark materials and then there's the lucy i keep forget it be the they do it on the bbc er this be probably not the first book no it's definitely not the first book erm
S0458	i prefer read a book before i go to bed rather than watch the telly
S0456	yeah okay
S0458	i wear i get the train down to last weekend and the train look me
S0456	sally lockhart
S0458	sally lockhart
S0456	it start with the ruby in the smoke and it erm the amber spyglass and again that's a film with the jam bond guy and it's call the golden compass cos that's the
S0458	never watch jam bond
S0456	yeah the guy what's his name he's from heswall or hoylake
S0458	the guy who play jam bond
S0456	yeah
S0458	i don't know
S0456	anyway
S0458	i've never watch that or lord of the ring
S0456	but yeah there be the film that be call the golden compass but it's it's philip pullman he's write for very little children as well and you can tell the book be really different
S0457	god
S0458	well when you read the first harry potter book you can literally read it within like half a day like that
S0456	yeah and it just
S0458	and then it go that that
S0456	the second one be slightly more and then you have a doorstopper in the end
S0458	no but the the goblet of fire be like that as well
S0456	yeah yeah
S0457	mm
S0458	massive book that
S0456	which one be your least favourite
S0458	erm i think it's probably the one i'm read now the second to last
S0456	be it harry potter five
S0458	it's second to last
S0456	yeah second to last
S0458	be it four five no one two three four five six
S0456	six oh
S0458	yeah hold on
S0456	be it six hang on let me check i always think it be number five that i didn't like
S0458	number five be
S0456	erm be it the order of the phoenix
S0458	yes
S0456	yeah
S0458	that's the one i'm read now
S0456	that's the biggest
S0458	it's the one i'm read now but it's a bite
S0456	yeah because nothing happen really
S0458	it just stretch on and on and on i'm at i'm at the end i'm at the end of it now and it's a bite like there's no action whereas all the other ones be action pack
S0456	yeah i felt this one be she get too influence by the film that's what it felt like
S0458	yeah and that umbridge do my head in
S0456	well that's the whole idea isn't it
S0458	i hate her in real life she's only a character in a book
S0456	she be she be model on maggie thatcher
S0457	oh mm
S0456	but yeah but i mean that's the kind of teacher you certainly do not want it's like ah ah
S0458	i know it's mad isn't it i don't know how she get away with it it's the only book that really really annoy me
S0456	yeah and then of course she come back
S0458	mm i know i can't i can't really remember read the last book
S0456	mm
S0458	i have do but it age and age ago and i can't remember that's why i'm read it again and then i'm go to watch all the film
S0457	mm
S0458	cos i've now never see the last film before
S0457	haven't you
S0458	no
S0456	no it's two part as well i i only
S0458	i've see the first part and dumbledore die and i never get i never get the second part
S0457	do you like harry potter
S0459	what
S0457	do you like harry potter
S0459	i watch the film i never read the book though
S0458	i remember when i be in primary school my dad take me to the asda erm after school and get me the first box set
S0457	oh yeah i remember that
S0456	mm
S0458	and erm i be in 's a few week well two weeks ago and see harry potter and i think oh gosh as i remember i have harry potter i say i remember my dad talk me to the asda and he get me them for like fifteen twenty pound for the whole book set and i remember write in every page and i go home and do you know what i'm go to read them all again they be mine make me put my address on and my dad harry potter and the philosopher's stone then the chamber of secrets prisoner of azkaban he'd have them all on every book
S0457	i know he be to give them to or one of the girls
S0458	yeah but it be just mad cos we be talk about it and then i see them on the side and i be actually i'm go to read them again and i say i don't know what i've do with them i think i've give them to charity or bin them and they be mine and i be like ah these be mine i'm take them back
S0457	yeah
S0458	yeah it it be just like find like an old piece of treasure
S0457	yeah
S0458	now i've get them back again
S0457	mm
S0456	yeah it's nice
S0457	oh excuse me
S0458	you tire
S0457	mm
S0456	oh dear
S0458	be here till late last night
S0457	i know
S0458	i say go go and tell your dad to hurry up and i'm go to fall asleep here
S0457	this be my sister's partner he can gab for england can't he
S0456	bite like
S0457	forever we be talk about go camp and he's go well what you do be when you get on this road and he's tell me all about this road and i go i won't be drive
S0457	he'd describe every bump in the road or every traffic light i won't be there i i'll be there but i'm not drive
S0456	yeah
S0457	oh oh he's and he's get ocd hasn't he
S0458	yeah
S0457	oh he's obsess when he live at my mum's my dad be the caretaker at the school at the time and he's and he be in the bathroom that long that my dad have to run round and open the school on the saturday to go to the toilet
S0456	oh god
S0457	and then security ring my dad say how come somebody have be in there and my dad just say i think someone i see someone climb over but he's clean his trainers with a toothbrush in the bathroom
S0456	they must be very clean
S0458	i won't be a minute
S0457	won't be a minute
S0456	i'll just see when it's ah look at this perfect
S0457	oh cool
S0458	mm iphone he's get an iphone as well
S0459	yeah
S0458	what be you on on clash of clans
S0458	mm
S0457	obsess with these game
S0458	only that one
S0457	mm
S0459	i pay one fifty for it
S0458	i pay fifteen
S0456	yeah
S0458	mm
S0459	what's the world come to
S0458	i don't know i really don't know
S0456	don't work
S0458	can't beat a good game of monopoly
S0457	yeah see the lad over the road's get marry you know
S0456	oh be that what it be because i notice they have lie big celebrations or something the other day
S0457	oh right there he he get marry a while ago but erm they must there be a wed the other day it must have be a relation be it the lad who drive the car
S0459	yeah
S0457	he get marry a while ago now but
S0458	do you know his dad's a doctor
S0456	no
S0458	and his mum
S0457	yeah no not his mum
S0458	yeah
S0456	be his be his dad the one who wear the hat who sometimes drive the car
S0457	yeah yeah yeah he's a doctor
S0459	and you're say he's a doctor
S0458	i'm sure they're both doctor
S0457	no he's a doctor the dad and
S0456	this be the doctor corner
S0457	yeah he he's erm he be in university the lad wasn't he he's
S0456	didn't he do engineer oh no that's somebody else
S0457	yeah no no
S0456	he yeah
S0457	he he go to university and i know his sister's a nurse they're all to do with the hospital and it his sister who's marry now who live there who's get the little girl her husband's a doctor in the royal yeah
S0456	well this be this be definitely a healthy street isn't it
S0458	they're lovely aren't they
S0457	very healthy
S0456	we've get as a nurse
S0457	yeah but she work in the women's doesn't she so
S0458	yeah
S0456	well she's down road now
S0458	oh have she move
S0456	yeah
S0456	be it er yeah or i don't now
S0459	pretty far from here innit
S0458	i don't know where it be
S0458	be just off street
S0459	yeah road be where i go
S0457	be she there
S0456	can't remember it's it's it's not
S0458	somewhere in liverpool essentially
S0457	mm mm
S0456	might be just because of the hours
S0458	yeah
S0456	mm
S0457	well every time the lads go away back home to yemen
S0456	yeah
S0457	they come over with present for us don't they
S0456	yeah
S0457	all of them be lovely i've have two necklaces off them a key ring
S0459	the quality street and all that
S0457	yeah charm to go on your key and
S0458	and like the basic holiday stuff but it's always really unusual and different it's not like a yemen you know it's not like a key ring with the yemen on it
S0457	oh yeah
S0456	yeah yeah
S0458	it's always sort of different
S0457	unusual isn't it
S0458	yeah
S0457	mm well they're lovely
S0458	mm
S0456	yeah yemen be a dangerous place
S0457	mm
S0456	violent
S0457	be it
S0458	everywhere be though
S0456	well not not quite as much as there
S0457	do you hear what happen to us the other friday well a couple of weeks ago wasn't it now we be come back from 's mums and we be in a taxi all the eight and we pull up outside here and there be two somalian guy walk up and one come over to the taxi so the taxi man put the window down a little bite we be just sort of like by the end of our car and the next minute he say he be go to rob the taxi erm and the taxi man say yeah whatever i've get customers in the back mate do you mind
S0457	and then he be go on about fly the somalian flag you will know about it and so the taxi men be say well yeah whatever that that he'd break his jaw and all that and the next minute he run round and he try to get in the driver's side and he be go on about the london bomb
S0456	do he know the taxi driver
S0457	no i be go drive on drive on so we drive down the street and he drive back up street and he turn round and the taxi man say oh go on now love just go in and shut the door well that's an unusual thing to happen here isn't it
S0456	it be yeah
S0457	you wouldn't expect them i mean i've always felt safe and secure
S0456	oh yeah
S0457	and it be just like something what you'd hear in london or you know somewhere crazy isn't it
S0456	yeah
S0457	it's just like out of character really
S0456	mm
S0458	mm
S0457	mm frighten
S0456	yeah doesn't bear think really do it
S0457	no it's like they're brainwash
S0456	well that's what it be it's it's it's there be only one way of think and it doesn't go with the mainstream
S0457	no
S0456	erm and the the thing be they you know the it's you know if you look at isis they say the isis they they use basically all the people who come from abroad and
S0457	mm
S0456	mainly from the uk and and france they use them as cannon fodder they're the ones who become suicide bombers all the locals they do the stuff where you don't get kill
S0457	yeah yeah
S0456	it's just they're just naïve
S0457	sad
S0456	yeah it's one very odd interpretation of the book
S0457	mm
S0456	mm how do we get to that one then
S0457	me
S0458	doom and gloom over here
S0457	yeah oh mm
S0456	mm on that note
S0457	yeah what can we talk about now
S0458	dunno
S0456	holiday we've cover
S0457	mm
S0458	anything spring to mind mother
S0456	how be your dad anyway i i've see him obviously
S0457	who my dad
S0456	yeah
S0457	he's not very good today to be honest erm he's go out a buy erm like a a machine that like purify the air
S0456	oh yeah
S0457	it bring all take all the dust and things like that erm he's get the hospital soon and i think he's really worry about it
S0456	what have he have he difficulty breathe at the moment
S0457	yeah he's get erm emphysema
S0456	oh
S0457	so your lungs have get like little sub things on it so all my dad's
S0456	which make your lungs basically have very small
S0457	yeah my dads have all die sort of thing so they want to cut the top of his lung off but then he's worry about go under anaesthetic the way he be erm
