S0458	and be in hospital
S0457	yeah and be in hospital because if he catch anything he's get no immune system whatsoever now he can't really he walk from my mum's house to mine and then that's it he's gasp for his breath he come round the other day and he sit on the doorstep before you you can't speak to him because he's
S0456	he's out of breath shock
S0457	and it's awful because i mean he's work all his life and he have to buy his own nebuliser his own like breathe machine what he put his tablet it he have to buy that it's so wrong
S0456	yeah
S0457	so he's he's like he's get really wind up about the hospital appointment because he think he's get use for a guinea pig
S0458	it sound like he be
S0457	yeah they've never do this this operation they want to do on him be new
S0456	mm
S0457	and he's say
S0458	so he be a guinea pig really
S0457	yeah he's say basically he's worry about it and if i do if i go in and erm they'll stop all my money because you have to tell erm you know where he get his money from well he doesn't get load of money like some people get all kinds don't they he just get like the basic wife sick pay and he say you have to tell them and they stop your money and you start all over again well mum and dad be no good at paperwork and
S0456	no yeah
S0457	apply for this and apply for that
S0458	it's all on the computer now isn't it anyway
S0457	well he can't they can't really use one can they so that's another big thing so and they have to come out so as to reassess you again you have to go through the process
S0458	i don't think it's worth it
S0456	yeah
S0457	i know but he be he be get worse
S0456	yeah
S0458	yeah but it's not like he's fifty will he see the benefit from it
S0456	that's the thing have have have a massive operation
S0457	he's seventy two now
S0458	i say to that to my grandad i say will you be with it be your age be you be you definitely guarantee a benefit because you're not do brilliantly now but you're not do as bad as you could be
S0456	that's what i mean with a with a massive operation like that the
S0458	be it worth the worry
S0456	they would really think you know we we do that with a younger person but not with
S0457	he get so frustrate because my dad's always do his own things and he's quite good on diy and and because he can't do his own things now he get frustrate
S0456	well you can you can just imagine what it must be like i don't want to think about any of that
S0457	he be always a mechanic my dad so he always work in like factories on the you know the remember the old scofield wagons and
S0456	yeah
S0457	things like that be my dad's job he be a mechanic and then he work in ford's leyland's he's always work
S0459	mm mm on cars and that
S0457	yeah on cars and that and then years ago my dad use to smoke as well
S0456	mm
S0457	so probably the combination of the two
S0458	i bet you the place be full of asbestos as well
S0456	yeah the dust and
S0457	yeah yeah have like kill his lungs basically and they're say this operation they want to do something about your valves as well inside you
S0458	oh yeah they're
S0457	try to enlarge them
S0458	they enlarge the valves
S0457	the but my dad say how will that erm be beneficial to me he say because my lungs have like go
S0458	mm yeah
S0457	so it doesn't matter
S0458	but they can take him the oxygen round now
S0457	i just have to say to him dad don't be get yourself all stress out wait until you go there and then you and my mum can ask the question what you want to ask and then think about it
S0456	yeah but you can imagine it's it's it's like
S0457	and i feel sorry for my mum because like today i go round and he be so like moody and she say oh i've be in here three days and he's be like this i feel sorry for her and then i feel sorry for my dad because i ring the bell and by the time my dad have get move for it wherever his be from to the door he couldn't even breath
S0458	he be well
S0457	and he say he can't even go up the stairs like the last couple of days
S0456	mm
S0457	and i have antibiotics leave and my dad's terrible he have his own antibiotics in the house the doctor give him them and say you've always get to keep them in he'd use all his ones and i say well go back dad no give me your ones let me use that
S0456	but it might be a different prescription
S0457	no they're the same
S0456	oh they're the same
S0457	yeah and i say i know but you shouldn't be take all them you should go back while your bad so the doctor can see that you're bad and you've be take them all
S0458	he might need stronger one
S0457	yeah i'm feed up go there and i feel sorry for him he's just sit there in the chair like i come out and i be like nearly cry myself walk down home i felt so sorry for him
S0456	yeah yeah well if if you're active and you're suddenly stop and there's you've get no control over it because what can you do
S0458	yeah but he's have a really good life it's part of get get old mum
S0457	mm
S0458	we'll all be like that one day
S0457	my dad's never be out the country
S0458	no but he still have a good life all the adventure he's be on go up scotland on motorbike and stuff go down kent
S0457	yeah that be years ago but
S0458	parent be get old though
S0457	i know
S0458	we'll all be like that
S0457	it's hard when it's your dad though isn't it and you see him like that struggle to breath it's it's awful
S0456	mm
S0458	the other way your more worse off you'll be a hundred
S0457	mm
S0458	still not dead yet
S0457	oh look at that sky now doesn't that look lovely
S0458	there's a
S0456	yeah that mean
S0457	it might be nice tomorrow
S0456	sunshine tomorrow yeah red sky at night
S0457	i know shepherd's delight
S0456	better than shepherd's pie fly into you
S0457	mm
S0458	er you never know take a walk down there tomorrow
S0456	i be on my bike as well
S0457	oh
S0458	oh on your bike
S0457	oh
S0456	sometimes things go really wrong
S0458	you need one of them er catch gloves like you see in america
S0456	yeah
S0457	yeah mm
S0456	no i remember once i be on my scooter and at one point there be this place they shout at you when you're on your bike and of course you go duh and fall off your bike but clearly that's this guy be stupid because he'd go for anybody with sort of two wheel but if you wear your helmet you don't really hear anything
S0458	no
S0457	no
S0456	so i could just see somebody
S0457	shout something to you
S0456	but i just like
S0457	yeah and carry on
S0456	but i remember on the scooter as well that be that be a classic erm
S0458	i don't remember you have a scooter
S0457	i do
S0456	yeah i only have it for a year like
S0458	oh so it be
S0456	mm i think the main thing be in that time opposite the guy who have the scooter
S0458	scooter boy
S0456	yeah and his his brother's scooter they be always park outside and the other one be store inside i always take mine round
S0457	round the back
S0456	and it become such a such a hassle that in the end i leave it
S0457	no
S0456	but erm i be on road and stop at the traffic light and there be this couple this little boy on and i have like old vespa and he sort of look at my walk straight into the traffic light
S0457	ah
S0456	and his dad tell him off he must have be like oh sorry
S0457	oh
S0456	but it be like slapstick you could see him look look one way walk the other
S0458	oh no
S0457	ah must have hurt mustn't it
S0458	that's funny
S0457	ah
S0458	again i bet he hat vespa's after that
S0456	well the good thing be that the traffic light's change and i just zoom off
S0458	giggle
S0457	oh 's motorbike be break
S0456	that's what i think because it be always
S0457	yeah no he's get erm a pipe on it and it's like split so when he go out the other day on his bike he come back and he just look at me
S0458	overheat hadn't it
S0457	yeah he have like all oil or something not oil but like
S0458	coolant
S0457	yeah on his boot so 's boyfriend order the part for him or something erm
S0458	no my dad's just get it off ebay
S0457	oh have he
S0458	i say it'd be cheaper off ebay
S0457	oh
S0458	cos he'd have to do it the same so they can just
S0457	no he's do it
S0458	he say it'd be cheaper for him
S0456	well as long as it get to him
S0457	yes well we'll have to make track soon or i will go and see your dad
S0458	mm
S0456	yeah i've get i've get more than load but i just have to ask you to fill out this form that i mention
S0457	do more tomorrow
