S0690	it's the one she do in the car yesterday to make sure they work
S0688	they do
S0689	yeah i think they do
S0690	but we didn't test it
S0689	what it's not you don't
S0687	have be listen to them this morning
S0689	the ones that the ones that i've send across to 's laptop have all be fine the one on the train be a little noisy but part
S0687	you could still hear it
S0689	you could still hear it yeah but the ones in the car i've send to my email and they've not come through yet and i've do it like four time so
S0687	they're not sit comfy on my face these
S0688	leave them off till we get
S0687	it's just uncomfortable squint
S0689	do you see that motovun film festival
S0687	mm it's in july can we open the windows or air con guy
S0689	air con
S0688	we shouldn't have the window open for that
S0689	air con work better though
S0688	i don't like it though it's but if it's really it's not fair
S0687	there look it just it wasn't turn on yet
S0689	oh dad you wanna just go nip into this shop to get some match or a lighter
S0690	no get some in porec mate don't worry
S0688	do you want me to close this be that what you want
S0687	well either
S0688	well
S0687	either well i be just gonna say we should either have windows down or air con cos there's no point in both gosh it's busy
S0688	you're get up into the town
S0687	yeah
S0688	it's like that i be gonna say it's not be use or anything
S0687	mm
S0689	i be read in the bulletin in the news apparently some bloke be fly his helicopter and then a seagull crash through the foot of his erm you know windscreen
S0688	yeah
S0689	and erm apparently like it say it die on impact but he say that he have it say that like the bloke have to put his foot over it to stop like flap about and make him
S0688	well what dead
S0687	the
S0689	the seagull
S0688	yeah
S0689	and he and it say like he he stick his foot on its head basically to stop it fly around but so it say the die the bird die on impact but if it if he stick his er you know his foot on it then it doesn't really make sense do it
S0688	no
S0687	where be that
S0689	in
S0687	didn't know there be many
S0689	well it might it might have be in the even news
S0687	didn't know there be many people with helicopters around
S0689	it might have be in the even news i can't remember i read both of them
S0688	that could be dangerous a er if it get stick in your in your propeller
S0689	no i don't think it would make a big difference
S0687	do you know it would
S0687	that's why they have airports like when they be first do when they first kind of start to fly they have load of problems with bird get suck into propellers and it cause the the propeller to explode and it crash
S0689	really no but
S0687	yeah that's why at airports they have cars that drive around with like loud whizzers on them to drive away bird
S0689	oh right
S0687	the runways
S0689	see i think yeah but if a propeller it it go so fast it'd just chop it up do you not think
S0687	well you would think so but it it i'm right aren't i dad there's be case where the
S0690	there have be case yeah
S0687	the bird have get into propellers and the plane's crash
S0690	but they can actually destroy jet engines believe it or not cos there's hundreds of fan in the middle er on the inside of a jet propulsion engine spin around incredibly fast
S0689	it must be a lot of force to get a like thousand be it or normally tonnes it's probably a couple of plus all the
S0690	yeah
S0689	baggage and all the people
S0688	be that the railway line there
S0687	i'm not sure
S0688	the sign
S0687	it's not a proper railway
S0688	no
S0689	really muggy
S0688	muggy
S0689	i be gonna say
S0687	oh right
S0689	but that's a bore word
S0687	well he's on
S0690	what to
S0687	no to porec
S0690	okay
S0688	i think i'd rather
S0687	mm
S0687	it be quieter later in the day wasn't it
S0690	might be a bar up there
S0688	when we arrive that be what five ish
S0687	yeah but there be less cars than there be there then i think
S0688	well
S0687	can you sit your drive theory when you're still sixteen not sure or do you have to be seventeen
S0690	think you'd have to be seventeen take that on your seventeenth birthday now can't you
S0689	yeah i guess so
S0690	that's not a bad idea do that through your summer through your your christmas holiday mate
S0689	yeah but i'll have mock straight after christmas
S0690	have you
S0689	yeah i think i'm right in say that aren't i
S0687	yeah i have no idea how it work now even
S0688	be we record now
S0689	yeah
S0687	yeah
S0688	oh the sunshine do you say tomorrow
S0687	it say it be like you know the picture with the cloud and the sun
S0689	i mean i be think do have something like a couple of cos he's gonna need a couple of isn't he when he start
S0687	i think he's get two but he's not gonna get he doesn't need any more for the next two years cos he's gonna be study for the next two years and he get it after that
S0689	oh i think it be only a one year course
S0687	no two
S0689	oh
S0688	i be say this to
S0689	i could have swear he say it be one year
S0687	it's one year to do his lpc and then another year do his gdl
S0689	sorry so the the the
S0687	the first year be the like law conversion
S0689	yeah
S0687	the second year's be the graduate diploma in law which qualify you to practice
S0689	right crikey that's a lot of education isn't it
S0690	but he's get a salary this year isn't he
S0687	no
S0690	oh right
S0687	they give him a live allowance but he doesn't start get a salary until the third year when he's actually work for them
S0689	so he's gonna be like mid twenties isn't he like by
S0687	he's like he'll be twenty three this year
S0689	amaze
S0688	watch out for the deer
S0689	yeah let's not have a deer through the front windscreen please yeah so er
S0688	do they make cars in croatia
S0690	i don't believe so
S0689	would have think so yeah but it's get kilometres an hour instead of miles per hour so they must make erm
S0687	yeah but croatia's not the only country that
S0689	yeah i i get that i know alright alright
S0690	no i don't believe so
S0688	most countries be kilometres per hour aren't they
S0689	really
S0688	we're the america i think america and england be miles
S0689	the correct way
S0687	pardon
S0689	the correct way
S0688	i remember when i be ten or eleven at school them say we'd change from imperial to metric there wouldn't be any more miles or pound or ounces
S0687	what that's what they predict
S0688	yeah
S0689	well we've not get pound and ounces any more have we we've get grams and kilograms
S0687	of course we have we have both really
S0690	do you work in grams
S0688	you work in pound and ounces and i work in grams
S0689	yeah absolutely i work in grams and kilograms yeah
S0690	yeah yeah
S0687	i'd far better know what a kilogram be than an ounce what's that with all those cars park up
S0689	where oh here don't know
S0688	think that's where the police be before
S0689	yeah
S0687	it be yeah
S0689	what's it's no be gonna say it's a car park but it can't be
S0690	can i go on the
S0687	how we gonna get there then
S0689	can't get across there oh no what's
S0688	sure you can
S0689	yeah you can
S0687	i didn't see a sign there for a
S0689	it do say pula
S0687	yeah we're not go to pula
S0689	be we not
S0688	just turn the air con down a bite please
S0689	mirna i wonder if that's river
S0687	no it's the name of the river
S0689	oh okay
S0690	how many days be it till the eu vote
S0687	thursday
S0690	oh right
S0689	so you know your postal vote
S0687	yeah
S0689	will they be they like count now or be they count like along with
S0688	i think they count them now
S0689	so realistically you can have an inclination of what the populace be
S0688	mm
S0687	no well not really cos it's a very small number of people do postal vote
S0689	i can't really remember how it all start to be honest with you it's a bite like
S0687	what do you mean
S0689	like the whole eu referendum thing i i just remember it be here do you know what i mean
S0687	it be it be the tory's campaign
S0688	it's the
S0687	it be the tory's whole election campaign
S0689	see i can't even remember what that they be gonna go out
S0687	no that they would offer a vote
S0689	i can't remember
S0687	essentially they say they think we that we should go out except now they've backtrack and say we should stay in cos we've get this amaze deal that david cameron's negotiate
S0689	well think about it you vote to stay in so that's a bite kind of like
S0687	i'm like be sarcastic
S0689	i know i get that
S0687	so i'm say it's hypocritical because they they be say we'll offer a vote and give people a chance to say that no that we're that we didn't have a good deal and then
S0689	yeah i get that but then
S0687	he's he's he didn't negotiate very much at all
S0689	i don't even know
S0687	do he dad
S0690	erm
S0687	i don't actually know the exact
S0688	the only thing i've hear be people come here can't claim benefit for four years till they've work here for four years
S0689	which be fair enough to be fair
S0687	all i hear that be that that there would be no pressure for us to join the euro or anything like that but what do you mean dad
S0690	i can't remember it wasn't too much to be honest with you
S0687	nothing interest
S0690	no
S0689	i watch a really interest thing it be like a you know like a bbc not well not a documentary but you know they do those like piece where they like go and talk to the public and have a little walk and talk to the camera and erm and they be say that like nobody really know anything about the eu but if you mention immigration everybody's like get an opinion and it be really really interest like they talk to all these different people like all age and all genders and like everybody's like oh i don't really know like i don't know what it's all
S0688	see that's that's the that's the entire point
S0687	that's the concern they're concern about immigration and
S0690	ignore the politics and ignore the fact that it's good for the economy be in the in the eu and just concentrate on a single
S0687	the
S0690	stupid
S0687	yeah people be look at it from one
S0690	issue
S0687	perspective
S0689	yeah grant but it's not really good for the economy be it dad because how much do we pay into the eu weekly it's like lot and lot of money that could be use elsewhere
S0690	well
S0689	hospitals
S0690	we shall we'll if we vote out we'll spend the next ten years renegotiate trade deal and lose trade leave right and centre and the economy will go downhill
S0688	no you've get you've no evidence for that
S0690	well i have
S0688	just
S0687	have
S0688	honestly you're just you've just
S0690	okay why
S0688	listen to the rhetoric
S0690	well i know that we'll
S0689	if right
S0690	have to renegotiate all the trade deal so that be fact
S0687	well not all our trade deal be trade deal with europe
S0690	no
S0689	but people
S0690	our trade deal with the rest of the world as well
S0689	yeah people
S0690	cos all the trade deal with the rest of the world be base on our on our trade deal with europe we have to go and renegotiate every trade deal throughout the world which will take years of negotiate and cause enormous upheaval in in business when they should be focus on sell instead of deal with that
S0688	well yeah but that can't be true because otherwise we wouldn't export a thing for ten years
S0690	well
S0688	if what you're say be true
S0690	it's i'm not say you can't export a thing for ten years but i'm tell you it it'll it'll add
S0688	well how can we export if we haven't get a trade deal
S0689	dad you're snort but
S0690	there'll be
S0689	that's mum's opinion
S0690	interim because there'll be
S0689	like
S0690	interim interim measure but it'll take years of
S0688	i don't think the fact that it would take
S0690	people's waste
S0688	i don't think the fact that it would take ten years to sort out mean that it shouldn't be do i don't think that's a good enough reason
S0690	well
S0688	because you could say
S0690	in the
S0688	no we're not gonna go to war because it would be five years of blood and you know people die but you know you know you can't
S0690	well in those ten years
S0688	you can't that's not a good enough reason be it
S0690	our competitors in europe will have an unfair advantage against us and will trade win trade against us and we'll lose out massively and all anyone's interest in be a few pole because that's all they think about
S0688	well it's a bite more than that really
S0689	i no i i i think that immigration have to be sort like i don't believe that people should be able like under the eu free travel and it you everybody can come in and i say everybody that's a that's a general statement but people can come in and you know they know how to work the system then that's not fair at all like it's it's depress to think that
S0690	okay well
S0689	when i start work i'll have to pay thirty percent of my wage but people other people can come in and use my money to have five children and then live off that money that's not fair
S0690	okay but have the syrians and the calais border be absolutely nothing to do with the eu referendum
S0689	no i'm not say that
S0689	i i didn't mention that
S0688	hasn't mention
S0689	i didn't mention calais at all
S0687	and syria's not even in the eu be it so that's get nothing to do with it
S0690	okay well the the the immigrants the so call immigrants that be swamp the country bollocks that people talk about be we'll have no significant difference whether we're in or out of europe the issue be still there
S0689	dad you you're go off you're go off you're go off now dad
S0690	well
S0689	first you be talk about syrians in calais which nobody mention
S0690	okay but the issue of immigration will not change dramatically whether we're in or out of europe
S0689	it well it will because of free travel
S0687	well i think it would because if we be out of europe we wouldn't have to we wouldn't have to adhere to the to the rule of let people from within the eu in it would still be our decision what we do about syria and place like that that aren't in the eu
S0689	absolutely i'm i'm not don't get me wrong i'm fine with take skilled people on like happily i'd i'd take you know if you've get a diploma in engineer and we've get a shortage of engineer come on in
S0689	an engineer engineer sorry come on in but i'm not i'm not happy when bob who's come from romania with
S0687	i don't think dad
S0689	no high school degree and a you know it's
S0690	well
S0689	not fair
S0690	up from romania without a high school degree be work in the field that no english will do the job
S0688	they're not
S0687	it's not true dad
S0688	look down road it's full of hungarians who be
S0687	not work
S0688	not work
S0687	i i i don't think i and you know i would feel the same if i move to poland i would not expect to receive anything from the state until i have contribute and i don't think people should expect the same wherever they go i think people should have to pay into the system
S0689	yeah
S0687	for so many years before they can take out of it and i don't think that's racist at all i think that's just
S0689	no it's not
S0687	common sense isn't it
S0689	it's just fair yeah
S0687	it's fair and if i go to poland i wouldn't be able to access the same benefit as if i be a pole and i come here and you know it's suppose to be a free market and an equal market but that it isn't cos people can get more in certain countries
S0688	pregnant women go back to poland because they do a scan every month they fly back when they're pregnant and have a scan every month as well as the scan here
S0689	with with with i mean the systems we have in place the nhs be nearly at break point the education system be
S0687	well it
S0689	in a bad state
S0687	it's in a bad state cos there's primary school where look at 's primary school something like sixty percent of the class english isn't their first language so although that poor forty percent who have to put up with the teacher try to communicate with children who don't speak the language well
S0688	well there's a group be set up hasn't there next to children's centre where they're suppose to go and learn the basics before they go to school
S0687	but still even if a child who know the basics that teacher's gonna have to spend more time with those children you know get them to understand and teach them and then the other children be
S0689	miss out
S0687	be leave by the wayside but like even if i i i think anybody who hasn't contribute regardless of whether they come from abroad or not in fact you know i don't think should be able to turn eighteen and go on jobseeker's i don't think that's fair because he's never pay in
S0689	i didn't even know i could get jobseeker's when i be eighteen
S0687	of course you can
S0688	but his parent have
S0687	yeah his parent have but regardless he hasn't i don't think people should turn eighteen
S0688	well
S0687	and that be an option to them cos if it wasn't an option
S0689	they'd have to work
S0687	people would go and get a job i've not work now you know i could be on jobseeker's
S0689	we need a huge huge overhaul but nobody's get the
S0688	i think the the real issue be address how politicians in europe abuse the finance there
S0687	well that's a whole different area that
S0689	yeah
S0688	well yeah but how much money have they save
S0689	yeah but if we get out what's the what's that you know leave them to it
S0687	i'd be happier vote in if we if we'd you know if we'd manage to get a better deal where we have more autonomy over
S0688	what do you vote then
S0687	i vote in but i'm say i would be more i be say i be a bite on the fence wasn't i i'd be more happy about it if if we would have more control over what we do as a country
S0689	i know that's that's one of the big stick point for me i don't like the idea of somebody who's who doesn't live who doesn't live in the country who doesn't really have an idea of what the country's all about decide our rule that's just not fair
S0688	that's not even touch on all the displace refugees
S0687	what do you mean
S0688	well you know they'll er they've take on like refugees
S0687	from syria
S0688	yeah
S0687	yeah
S0689	i know i know it sound awful but if we're take in like if we take if we if we open our arm for refugees the the nhs be gonna be but er more er like at greater risk than it already be the education system be gonna be put at greater risk than it already be
S0687	but like if you're gonna be in the eu it you know in some sense it's not fair that germany should take millions and us take none surely it should be split pro rata between all the eu countries depend on their population and then germany wouldn't have so many you know countries like croatia and england who've totally ignore it would have their fair share and it wouldn't be such a pressure on certain countries who be take more in because that's be their decision
S0689	that's true yeah
S0688	and if you reattribute some of the money that's be waste in europe you'd have money to put back into a systems that would suppose those people when they come
S0689	yeah but it boil down to this thing whether somebody's come in to abuse the system or
S0688	they take forever and a day don't they to decide
S0687	to decide
S0688	anything
S0687	people have be in the country for ten years on asylum as asylum seekers because they've not make the decision yet
S0689	sorry who's not make the decision
S0687	the government
S0689	right
S0687	the system
S0689	yeah
S0687	meanwhile that person can't work because they're an asylum seeker they have no right to work so we're pay for them to be there for ten years whilst we make the decision whether they can stay or not
S0689	yeah
S0687	this caravan's a bite of a slow mo i wish we could overtake a bite whoa careful
S0688	whoa
S0687	jesus
S0688	what be you look at then
S0690	the road
S0688	which one
S0689	the one over there
S0688	we need to decide what we're do about this car don't we
S0687	yeah
S0688	can we speak to this guy
S0687	leave you his number she give it to you
S0689	you you best be call on skype though or else it'll cost you a fortune all the
S0687	i've no idea but do you remember
S0688	she do give it me
S0687	she give it you on a receipt it be on the receipt erm
S0688	she do i don't know what i've do
S0690	paperwork's in there
S0689	sorry
S0688	what
S0690	the paperwork's in there
S0688	i don't i didn't put it in there
S0689	there's in there
S0690	there be there's all the hire car paperwork get
S0687	it's a tiny little receipt i saw it on the table in the house
S0688	do you
S0687	the other day
S0690	the hire car paperwork be in the car somewhere
S0687	yes but it isn't with the hire car paperwork it's a separate receipt
S0690	oh be it
S0688	dad's say there might be a form though
S0690	the contact detail for the
S0687	okay
S0690	hire care will be won't they
S0688	slow this i don't think this green car's brake light be work
S0689	a lot of cars don't seem to be work do they their brake light not that er no it's not in there
S0690	it's it's definitely in the car somewhere the hire car paperwork
S0689	where's this green car go
S0687	the green car's think about overtake there's too many cars there's about seven cars in front
S0688	well we're not in a hurry we should just keep our distance and drive
S0689	he's swerve all over the shop this fella do you know those that be like
S0688	what's this
S0689	there're like they're like mini church aren't they like i don't know they're not mini church but you know what i mean
S0687	like shrine
S0689	yeah like
S0687	at the side of the road
S0689	in the church call that staple of the no you don't what i mean don't you i don't understand what they be though be it like
S0688	what be he what he say
S0687	they're little church they're shrine
S0689	yeah i get that but i'm say be they like a memory of somebody who's die or
S0687	no they're religious
S0689	yeah i get that
S0688	but it's like it remind you cos you're suppose to say so many prayers a day aren't you so you could i i think
S0689	to remind you to say a prayer
S0688	yeah or send a bless to something your nana's get this little prayer in her purse she get out on the plane and start say
S0687	bloody hell what be it
S0688	i don't know
S0689	oh she tell me she pray for me every night don't she i i've pray for you all i've pray for you all thank nan cheer for that
S0687	i know she's not even religious really be she
S0689	no
S0688	she do grow up go to church
S0687	yeah but so do we
S0688	but that's cos it be like the social gather
S0687	come on person behind the caravan
S0688	chill out
S0689	it's not the person behind the caravan it's the caravan
S0688	what's your problem
S0687	it be the person if the person behind the if the person behind the caravan overtake then the person behind behind the caravan could overtake and we could all get on with our live too slow
S0689	do you know the red car and the black car do that mean you can't overtake or you can overtake
S0687	you can't
S0688	please don't want you to break the rule
S0687	his brake light be work
S0689	wheel be
S0688	look a bite
S0689	the wheel look really thin on that car
S0688	it's an old car be it a fabia
S0689	i can't even see
S0688	i don't know what it be it's call a skoda fabia i think
S0689	something's bounce around in the bottom of his car and all like
S0687	our
S0689	oh do he
S0687	he do yeah
S0689	oh
S0687	you know who use to work at 's
S0688	who's she go work for
S0687	she's work at
S0688	that's right
S0687	this green car's desperate to overtake isn't it
S0687	i can't imagine it's get the horsepower to do it
S0689	i know this may sound really really stupid but i be think do they call it horse do they call it horsepower because a horse you know the mode of transport use to be a horse and cart so like the horse the the higher the horsepower the more horse you have so the faster you'd go
S0687	i think that's where it's come from that
S0689	see
S0688	yeah
S0689	just
S0688	it's an old english term isn't it
S0689	einstein just eat your heart out
S0688	in fact i think it come from shakespeare
S0690	i doubt if cos engines weren't invent in shakespeare's day
S0687	i can't hear a word
S0688	no no horsepower be though
S0689	do you know that they find erm marijuana in erm
S0687	marijuana
S0690	marijuana
S0689	oh
S0687	i think you say
S0688	he be take the mickey
S0687	i know he be but i didn't understand it take me a minute to work it out
S0689	so yeah so they find oh marijuana in shakespeare's like pipe in his grave so perhaps so they think
S0689	so you know why you know like the midsummer night's dream be like a bite whacky you know like fairies and
S0688	who tell you this
S0689	i read it on facebook a while ago and there be like a link to an article whether it's true or not i don't know but
S0690	so shakespeare be a smack head be he
S0687	that erm chinese restaurant that me and go to last friday be it you know i tell you it be like beautiful old pub that they've do up but
S0688	have they do it nicely
S0687	er yeah it's nice yeah they've get rid you know there's nothing traditional about it inside now it's just all tile and but erm it's be it's be derelict since twenty eleven and all board up because it have be run as a marijuana farm they'd be like grow weed there
S0688	marijuana
S0689	really
S0690	marijuana
S0687	they they raid it and then and then
S0688	close it down
S0687	just close it down it be just all board up for a couple of years
S0689	see i be i read though on it oh what be it i be read that like the chief constable have say now that like they're just ignore marijuana and like not
S0687	what in
S0689	i can't it might have be in or it might have be in i can't remember where it be and they be say that like basically that they're stretch so much that they're just it basically ignore it and not like
S0687	they don't have the resources
S0689	yeah they're just say we we're basically focus on other things
S0690	resources to sit in cars sleep half the night
