S0687	erm off the topic but i just saw a sign say naturist camp this way
S0689	be that
S0688	yeah no it say porec have a
S0689	isn't that nudist
S0687	yeah
S0688	a big nudist colony
S0689	oh have you see that aa advert where the aa fella have to go the nudist camp
S0688	no
S0689	have you not see that the this bloke walk
S0688	aa as in the car company
S0689	yeah this bloke lock his key in his car and you just see the aa bloke pull up and he's like it's oh er there's like you know like the bush be place to like hide like the bits
S0687	the part
S0689	yeah it's just really funny
S0688	they're do an adam and eve
S0689	yeah what's what's a hypermarket
S0687	it's a bite chilly isn't it for that
S0689	what
S0687	naturist
S0689	i i just i don't i don't know why you'd wanna
S0688	no need be there
S0689	no there's not i mean we
S0688	it look like there's lot of resort here
S0689	well we're a we're a very we're a very develop race we should we be mentally develop we need to keep our clothe on there be something about the european union back there
S0688	job number one a for
S0689	i'm thirsty now
S0687	thirsty well do you want some water here
S0688	water
S0689	oh no thank
S0687	it's fresh it's bottle
S0689	i'm alright thank
S0688	it say it's disappoint when you first arrive
S0687	it's disappoint what a bite touristy
S0688	yeah a lot of in er it be the city for er the capital city for
S0689	it be the city for a capital city
S0688	for years
S0689	what
S0688	it say centre leave
S0690	do it
S0688	yeah
S0689	but while
S0688	this be porec north definitely say leave
S0689	so be istria part of croatia or be it like a separate bite
S0687	it's like lancashire it's like a region
S0689	oh right
S0688	yeah it say it be there be a lot of industry
S0690	so where do it say centre
S0688	right
S0690	it doesn't
S0687	what say
S0688	it do on the other side
S0687	be you sure mum
S0688	it be er
S0690	i'm ninety percent sure it's that way
S0688	well just go round this round er honestly but as we approach that roundabout it say leave and porec north n o r d
S0690	well i
S0690	i definitely saw it say porec straight on
S0688	it say porec centre this way
S0689	go round the circle roundabout
S0687	go round the circle round
S0688	you'd have to go to the other side to see the sign
S0687	well you wouldn't cos it say on every exit er dad this isn't right i've pass it
S0690	i know it's not
S0687	it's go away from the coast
S0689	mother i'm as the decide factor i'm gonna go with the majority
S0688	well do that i'm only say what i saw on the sign
S0687	say what you see mum
S0689	say what you see
S0687	on the plus side it say station up here so there might be a do you need your glass on dad you've get your readers on there and i can see you squint you're gonna have wrinkle
S0689	he's get wrinkle already wrinkle don't
S0687	definitely nothing this way here look fontana and vrisar nothing about about what's in here
S0688	well porec centre do you see that
S0687	no i didn't at all
S0689	i'd have say that you're make it up mum
S0687	we're head like inland here i promise you
S0689	excuse me
S0687	do we need diesel
S0690	no i've get
S0687	get about a third of the tank
S0688	do he answer me then
S0687	i don't know
S0690	yeah i do
S0689	he he keep talk really quietly i don't know why it be
S0687	circle round so we'll see right how much be we bet guy
S0689	i'm gonna put that forty quid on
S0687	be you gonna put that forty quid on
S0689	yeah
S0690	yeah your forty quid's gonna turn into eighty mate
S0689	do you wanna bet mum well i'm not if i'm not win anything then i'm not put it on
S0687	well there's a veterinary hospital don't take her there
S0687	right i'm wait to see this sign now
S0688	it say right it's just say it
S0687	where it say nothing
S0688	centre
S0687	no it say
S0688	yeah
S0687	of fontana and we're head towards pula this be not right mum i promise you
S0688	it say porec honestly
S0687	where do it say porec there
S0688	it doesn't there
S0687	it doesn't
S0688	but it do on the other one
S0687	that say service on porec which be probably the industrial part
S0689	waterfall
S0688	there's a lidl there
S0689	oh can we go to lidl lidl let's go lidl wanna go lidl
S0687	get a konzum a kaufland
S0689	oh let's go to let's go to kaufland dad can we go to kaufland
S0690	if you want
S0689	yeah let's go to kaufland then
S0688	it's that way
S0689	it's that way go round the roundabout
S0687	why be we go to kaufland
S0689	go to kaufland go round the circle roundabout
S0687	the circle the circle round not circle roundabout as oppose to square roundabout oh be it porec this way mum
S0689	oh i want to go to kaufland
S0687	oh ah ah that hurt i'll get you back
S0689	you never be good at like geographical navigate you can't use you're use to have your satnav that's what it be
S0688	whoever's gonna be listen to this be gonna think that they be so mean to her on that
S0687	oh yeah there'll all be slap the i'm gonna send them the photo of my eye they'll take me into social service
S0688	a twenty year old
S0687	yeah they'll put
S0688	you'd be in barnardo's yeah
S0687	see i've get i've get erm i've get evidence of that slap sound i'll say that's where you hit me in my face and that's why
S0687	it's all swell
S0689	chuck us a
S0688	there you go
S0689	chuck us a and then i'll second you case
S0688	and i've get a picture of what it look like yesterday
S0689	i've get something in my eye
S0687	yeah and you hit me yesterday as well
S0688	what's that
S0687	eight point five that's alright isn't it less than a pound a litre
S0688	get a
S0689	that's a weird motorbike
S0687	oh
S0689	the the volleyball competition i've see all the posters it's every two lampposts cannae miss it
S0688	be that what we've be watch on tv
S0689	no that be handball we be watch
S0688	they be so predictable those show off do that twirl weren't they before the
S0689	yeah i didn't i didn't get why they do that
S0688	no they be just show off
S0687	look leave on this roundabout towards porec
S0688	what what
S0687	what do he just say
S0688	get off my leg you're hurt
S0687	don't be stop slap me see i've get more evidence now
S0687	good they'll want to hear it you'd have be clean car
S0687	never trust mum's navigatory skills ever
S0689	could have tell you that before
S0690	yeah absolutely
S0689	can you imagine mum like in the outback like have to work out bear and the like
S0687	can you imagine her with bear grylls
S0689	innit
S0687	bear grylls would eat her instead of
S0688	i'd kill bear grylls before he
S0689	now we're gonna have to drink our own urine
S0688	he be awful isn't he
S0689	it's what he do don't he we've we've run out of water so we're gonna have to drink our own urine
S0687	instead of just ask the camera crew to give him a cup of water
S0689	innit i i bet he like he he get like domino's order don't he like right we've scale that cliff domino's time sunshine let's have it he do one with barack obama didn't he
S0688	he do i didn't see it that one with jonathan ross be a good one
S0689	oh where he have to eat the
S0687	i think he's funny
S0688	he be yeah where he'd take his cigars with him
S0687	no not jonathan ross i like bear grylls
S0688	oh no he's awful
S0687	i don't know why he offend you
S0688	he's full of you're like sort of his own self importance
S0689	i know what you mean mum
S0688	he be isn't he
S0689	yeah
S0687	so be everybody
S0688	no actually terry wogan be a very modest man
S0689	god rest his soul he's look down on us we we can see you up there terry
S0689	you're dance with angels now you're dance with angels
S0687	oh dear
S0688	i can just see him now do this to you
S0687	what
S0688	like you know tip his head how he do
S0687	top of the morning
S0688	that's why i want to go to that concert in september as well because they're do a tribute to him maybe they'll like televise it we try book ticket but we couldn't 's laptop
S0690	spend more time in bloody than you do in you
S0688	pardon what do he say
S0689	you spend more time in than you do in
S0688	you'll be spend a bite more
S0687	why
S0688	where go
S0687	what do that mean you wanna spend a bite more time in
S0689	i be just think
S0688	well i haven't see you
S0687	well
S0688	you cheeky monkey
S0687	i live with you if i'm go see for the weekend i don't want you trail along
S0688	cheeky
S0689	with your lead come on mum come on
S0687	now dad i think we need to go right at this
S0689	where where shall we go mum which leave right
S0687	roundabout circle round we're go right at this circle round and then leave at the next circle round
S0689	they do make cars here look volvo
S0687	what do you mean yeah volvo aren't make here you fool
S0689	how do you know
S0687	how do i know because
S0688	stop be so rude to people
S0687	volvo be french aren't they dad
S0690	no
S0688	no they're not they're german
S0689	oh they're french
S0690	no they're not they're swedish
S0687	they're not german
S0689	be they german be they french
S0687	swedish
S0689	french german swedish
S0687	so they make the car there
S0689	yeah
S0687	and then they bring it here
S0689	really oh
S0688	just so patronise
S0689	innit you're so patronise
S0688	condescend obnoxious
S0687	anything else
S0689	up your own backside
S0687	anything else
S0688	yeah that's a bad thing to like bear grylls
S0689	innit that's why she like him don't they cos they're both up their own bottom
S0687	you'll be apologise soon enough when you want something
S0688	who will
S0687	and you look at these caravan
S0689	caravan
S0688	it's almost the sea
S0689	the sea
S0687	so what's suppose to be here
S0688	i'll get my book out do you pick it up
S0687	it's in the inside of the
S0689	er yes
S0687	thing yeah
S0688	i felt like we have with us then
S0689	he's not here i'm afraid
S0688	he's give it
S0689	he's probably give it yeah
S0688	's a little
S0689	and if we don't
S0688	oh do you want a bag for life from lidl
S0687	i don't know but i hope it get a bite prettier than this cos this look a bite bore
S0688	it's er i just say to you he say it's disappoint as you arrive
S0689	could i just go and spend the day in there
S0687	no
S0689	it's get five star cos they've overdo it with these posters haven't they oh right this be must have miss this be must oh i can't even talk this be this
S0687	be that where they're do it
S0689	this this yeah that
S0688	it must be
S0689	yeah that yeah this must be where it be i be gonna say this be where it must be but er get this must this yeah that mix up oh
S0688	so there's your dinner a sun burger
S0689	oh yeah i'd be tempt to park here wouldn't you
S0687	uhu
S0689	i'm not a fan of these tts but you know when they're like
S0690	how do you get to that car park there
S0688	what be the little think on there
S0689	can't even see that no i mean with the like little you know god i can't think soft top
S0689	no with the soft top
S0687	why not
S0689	i don't know it just er it's that and it's like it's bubbly do you know what i mean it look very bubbly
S0687	what this tt
S0689	yeah
S0687	this be an old one
S0689	look
S0687	it say park to the leave there dad yeah that might be how you get in
S0689	excuse me
S0690	that's the old town there to the right yeah
S0689	i should think so too it's busy
S0688	they've all come for handball
S0689	netball er
S0688	netball
S0689	volleyball
S0688	volleyball softball it's all ball to me
S0689	football
S0688	one all the way from holland
S0689	sorry what be that a car do you say
S0688	pardon
S0689	do you say the car have come from all the way from holland
S0688	yeah
S0689	mm
S0687	belgium slovenia and denmark
S0689	how can you tell that oh yeah
S0687	slovenia
S0689	hungary
S0688	hungary where do you get that from
S0689	it say hr
S0687	italy hr be croatia
S0689	how's that even make sense
S0687	i don't know but it be
S0689	i think hungary be but i think hr be hungary
S0687	no
S0688	it's busy isn't it
S0687	mm
S0689	yeah it's really busy excuse me it's you wake me up early this morning
S0688	well it be only nine o'clock wasn't it
S0689	no it be like half seven
S0687	it be quarter to nine
S0690	park over here then
S0689	be it just one hour ahead here
S0687	uhu
S0687	it really doesn't no
S0688	i hope it's a bite nicer when we get out of the car
S0687	you can get in there dad
S0690	one hour six kuna one day fifty kuna actually it's alright innit about five pound for and you can park all day
S0688	we're not gonna be here all day be we
S0690	no but can you put two hours on then or
S0688	no
S0690	you can only put a single hour on
S0688	i think so
S0690	that's bloody just a rip isn't it
S0688	why don't you try that other one over there they're probably the same
S0690	be the same it's the same as it be yesterday
S0688	more space here
S0689	well well you what brand be that car
S0687	i think it's a ssanyong
S0689	okay
S0687	it's hideous
S0689	a ssanyong
S0687	a ssanyong oh no it say but it's not be it
S0689	it's not no
S0687	it's a ssangyong
S0689	be that like a chinese brand or
S0687	i think it's
S0690	it's korean i think
S0687	yeah something like that
S0689	ssangong i have honestly never hear of that car make in my life
S0687	you've get good reason not to have do
S0688	pass the book
S0687	can i have my telephone back now please
S0689	yeah
