S0328	apparently it's really good for bake so
S0466	really
S0328	yeah
S0329	but why what be it
S0328	i i didn't actually get that far i
S0326	it's be bless
S0328	erm but maldon salt isn't kosher so there must be something about it yeah it might've be bless but it be like big flake and crystals and like not unprocessed you know but
S0329	so maldon salt be not that's sea salt
S0328	mm
S0329	yeah
S0328	unrefined whatever but erm not that's not kosher but apparently those like very big flake be really like desirable
S0326	kosher
S0328	good for cook and bake i it's bless i
S0329	i can't use any other salt i'm i find it very difficult to use the salt that you've get
S0328	what's that
S0466	it's sel de mer
S0329	yeah but it's it's not in i don't know how much i'm use cos it's all it's not soft and flaky
S0326	i think that's er where the word salary come from
S0329	yeah it's what they pay the soldier in
S0326	hey you've be fight have some bag of salt
S0329	it's really really good
S0328	it's delicious
S0329	really good
S0466	when i use to go you go to one of my favourite restaurants in paris
S0328	yeah we have such a good meal there
S0329	what do you eat there
S0328	mm
S0326	i can't remember
S0329	couldn't remember
S0329	but will remember
S0328	well i can remember some of it but not all i mean we eat a lot there erm there be some really good anchovies at the begin and then
S0329	that's all i can remember
S0328	yeah
S0328	anchovies be really good
S0329	anchovies how
S0328	and there be erm
S0326	just like ah just erm like the ones in the tin in the pot in the fridge but like big
S0328	just anchovies just er
S0329	just salt
S0328	mm
S0326	yeah
S0328	yeah
S0466	they're a funny couple
S0328	yeah they be so nice she be so cool i like her a lot
S0466	she be amaze
S0328	very like she take so much joy in it and pleasure she be really like enjoy feed us you know
S0326	i can't believe i can't remember what else we a have
S0328	she keep a light cigarette above the stave the whole time
S0328	and a glass of red wine and she's cook and then she just like smoke her cigarettes
S0329	so it's just like she's cook for her friends and family
S0328	yeah it be very like it it be very that kind of atmosphere home cook erm but i don't know i guess they just keep send and send and send stuff we didn't order anything so erm there be so many dish and i can't remember them all everything be like very delicious then we have like three four desserts too
S0466	be you with somebody that be
S0328	mm
S0466	friendly with her
S0329	can i can i have some more red wine please
S0328	we go with no they hadn't meet erm
S0328	they hadn't meet her before but with my friend who's like erm a a chef who be in town to do some stuff for and know all the people there cos like er i mean i didn't ask but i imagine like one of his friends in paris get him the reservation say he be come so then they be just kind of enjoy cook for us you know mm it's one of the best meals i've ever have i think
S0326	we can't remember it we can't remember it
S0329	really
S0328	i can't i can't remember er every single dish but just the whole experience you know
S0329	yeah
S0466	well it's just a cute little place
S0328	yeah
S0466	i mean it really in the early nineteen nineties when i be live there and it literally be you know the local riffraff
S0328	really
S0466	yeah no i mean the idea that people would come from any distance to go to be inconceivable
S0328	cool and it's the same people cook
S0466	mm
S0328	run it
S0466	yeah yeah
S0328	oh that's so nice i imagine maybe not much have change because it seem very
S0466	i mean they be one of the first place in paris to start sell you know erm natural wine
S0328	mm
S0466	real wine and that's where it get its reputation from and she's she's argentinian or venezuelan she's south american anyway
S0328	yeah
S0466	i can't remember and erm yeah it be er it be almost a kind of
S0328	be it cheap
S0466	it be cheap and erm it be raucous you know their their local pal but then somehow the kind of fashionistas get hold of it
S0466	it appear in time out
S0328	mm
S0466	it be somebody take a photograph of it that appear in erm some uk publication and suddenly it be difficult to get a table
S0328	er it's what happen
S0466	yeah it's what happen yeah
S0326	have you ever see anyone do that thing when they eat the bird with their napkin over their head
S0326	you know that thing what's that bird call that they do
S0328	i can't remember
S0326	it's like that french delicacy
S0326	where they drown this little bird in brandy and then they when they eat it they eat the whole bird
S0329	it's a lark
S0326	no it's not it's not call a lark
S0328	mm
S0329	i think it be a lark
S0326	it might be a it's call something else
S0326	it's a special kind of bird you get poach and it's illegal
S0329	yeah i think it's a lark
S0326	it's not call the lark though but
S0329	what do you mean the lark
S0328	well the dish might not be
S0326	it's not call a lark
S0329	well be it in french
S0326	it's
S0326	be be lark like a be there lot of different kinds of lark
S0328	well they you
S0326	well anyway it doesn't matter they put on their the napkin over their head so that god doesn't see their greed
S0329	oh yes i know about that it be a lark
S0328	sound like a lark
S0329	if i find out what a lark the name of a lark be in french will you know whether
S0326	i'll find out now on this
S0328	cos it might not even be that just that it's the french word for lark it might be the name of the dish or something
S0326	but you can sell them on the black market for a hundred and fifty euros each
S0329	the bird
S0326	yeah it's gotta be alive so you when you drown it in the brandy and er when apparently the best bite be when you bite into the lungs all the brandy's in there
S0329	urgh
S0328	oh no cos its lungs fill with brandy as it die
S0326	yeah yeah ah french people be so fuck
S0328	yeah put a napkin over your head for that er i feel like it be like a tablecloth or something
S0326	it be a what
S0328	something bigger than a napkin
S0326	yeah something that cover your whole head
S0328	mm
S0329	don't they do that in the in that film erm babette's feast or something
S0326	probably yeah i haven't see it though
S0329	but how do you know about it you've not see anybody do it
S0326	no
S0328	someone be just tell us about it that night we go for that dinner
S0326	it's ortolan
S0329	mm i would like to know what bird it be
S0326	yeah well i'll find out won't i it's an er it's call an ortolan
S0329	a lark be
S0326	it's not
S0328	mm bunt from
S0326	it's not nowhere nowhere do it say lark on the wikipedia page it's a separate species of bird
S0329	what
S0326	it doesn't even look like a lark
S0329	oh so the bird be call ortolan
S0326	yeah
S0329	bunt
S0329	ortolan bunt
S0326	but that's a that's not well maybe that's not its the whole name yeah its latin name be from oh it's from which mean little garden
S0329	and what be the french word for a lark
S0328	mm
S0329	alouette gentille alouette alouette gentille alouette alouette alouette
S0329	do you know that song
S0326	mm
S0328	yeah i do but i don't know where from
S0326	school innit
S0328	feel like maybe from school in saudi arabia
S0329	mm
S0326	do you know frère jacques
S0328	mm yeah
S0329	ortolan
S0326	well it's be it's outlaw
S0329	i'm not surprise
S0328	i'm sure it be better than be
S0326	yeah but the french don't outlaw anything
S0328	mm
S0326	they still do it though you have to be you have to be friends with the chef
S0329	or you could do it yourself
S0466	i'm begin to look more and more like howard jacobson every day
S0329	what
S0466	howard jacobson
S0329	no you don't look anything like howard jacobson
S0328	who's howard jacobson
S0329	he's a really not very good look jewish writer
S0328	we watch old old jewish people take tell joke to get prepare for this even
S0329	where do you do that
S0326	on youtube
S0328	on youtube there's a bbc thing do you ever watch it
S0466	yeah i do
S0328	it be so good
S0466	it be great it's just like regular joe people
S0328	yeah with like these great
S0466	tell like endless jewish joke
S0328	really really really long joke
S0466	yeah
S0328	and you know like one in every eight be funny but really funny
S0466	mm
S0466	but the people be so sweet you couldn't help be
S0326	yeah
S0466	utterly charm by it
S0328	yeah yeah yeah
S0466	and great you know slightly bad delivery
S0328	yeah
S0466	er er
S0329	that be delicious
S0328	it be really good
S0466	there's load more
S0328	mm
S0326	i'll have a bite more
S0328	yeah i'll have some more
S0466	there's cake there's cake
S0329	you have to remember can will not stop eat
S0466	okay
S0466	let's get it do
S0326	i will i'll take one little bite more that's all
S0466	one little bite
S0328	yes please
S0466	little bite
S0328	thank you
S0466	i might just put some heat under it for a minute
S0326	where be you go exactly tomorrow what part of the countryside
S0329	we don't really know
S0466	we be go to the soft underbelly of the english bourgeoisie
S0329	we're
S0328	where's that
S0329	we're go
S0328	
S0466	yeah it could be
S0329	we're go to 's new house
S0328	oh yeah i remember you invite me before
S0329	yeah i do invite you you're very welcome
S0328	it's up to innit
S0326	not i don't wanna go that's why
S0329	i'm gonna send your brother a picture of you be a jew boy
S0326	that mean what picture be it
S0328	just put it on the internet then everyone can see
S0328	don't worry it's just you
S0328	what be we gonna do tonight
S0326	i dunno
S0329	mm
S0466	have the erm emperor of instagrammed anything in the last twenty four hours
S0329	no
S0466	oh really
S0328	who's the emperor of
S0329	oh he's just like he's he's like me
S0328	do you guy call him j lo
S0466	we call him j lo
S0328	jenny from the block
S0329	have like me erm and have like me 's only like one of them though
S0328	yeah
S0329	he didn't like the matzos
S0329	he only like the bitter herbs and an egg
S0466	that's cos they're on a diet in the desert he's on a diet in the desert
S0328	be he in the desert
S0466	he's in palm spring have a have his colon
S0328	who he be but really
S0466	yeah
S0328	apparently that really isn't good
S0466	he's have his colon scrub in the desert
S0466	what
S0329	i really feel that you should be a bite more discrete with your friend's insides
S0328	apparently that really isn't suppose to do be good for you
S0326	what isn't
S0328	colonic irrigation
S0326	what's that
S0329	i'll do it for you we'll stick a vacuum cleaner up your jacksy
S0328	you don't know what that be
S0326	i don't fuck know what that be sick fuck
S0328	oh well explain it that's for sure
S0329	they irrigate your colon
S0326	oh whatever man
S0326	i'm not a field
S0329	no the last one from emperor of be erm four days ago and it look like oh be that in france
S0466	yeah he be in france
S0329	yeah
S0466	oh yeah yeah yeah yeah oh yeah yeah yeah yeah
S0329	spring
S0326	thank you
S0328	yay thank you
S0466	do you give me your fork oh yeah i think you do here sorry
S0328	oh thank good
S0466	i think i might have to have a little bite more be you have any
S0329	no thank you darling
S0466	you're save yourself for pudding
S0329	mm i be save myself for pudding
S0326	do you have anything to put with the cake
S0466	yeah like what
S0326	dunno what do you put with a cake
S0329	get load of things to put on the cake i can't believe you're you're panic about maybe there's not enough food
S0326	no i'm just wonder innit er mm
S0328	but you don't wanna with the cake
S0466	i've get a fantastic bowl of freshly prepare oranges segment
S0329	mm
S0466	like they come out of a tin
S0329	do you have those when you be a kid clementines in a in a
S0466	mm mm
S0329	mandarins in a tin
S0466	mm tin mandarins
S0329	and do your mum put them in jelly
S0466	fuck brilliant no she do not
S0329	my mum put them in jelly
S0329	my mum
S0466	yeah she open a tin i'm not sure she even do that
S0329	my mum would get us to make break off the square of jelly and stir stir it round and then we'd put the put the mandarins in
S0326	do you tell that you're do passover
S0329	no she'd just say oh
S0329	can't
S0326	should've invite
S0329	i'll tell you what i oh yeah 's well into be up for all this kind of malarkey but it's 's have a fiftieth birthday party and i'm really really really piss off that he hasn't invite me
S0466	's have his fiftieth
S0329	yeah
S0328	who's
S0326	erm my uncle or something
S0329	your uncle or something right
S0326	i don't know i don't know what happen though when you're er er
S0329	what do happen
S0326	ex uncle
S0329	yeah my ex
S0329	he's my brother from another mother
S0326	what
S0329	i don't know i still think of and and as my stepchildren when do they not when what do they become
S0466	i dunno
S0328	they can stay that i think right
S0329	so if if my dad and divorce i suppose
S0466	you know the genetic
S0329	well the thing be and will always be your brother and sisters
S0326	yeah
S0329	so
S0466	what
S0329	yeah
S0329	's get half siblings
S0466	oh yeah
S0329	there be blood mingle and they're jewish
S0466	mm
S0328	i meet wait i meet and
S0326	yeah you do
S0329	yeah we should've invite them
S0326	yeah hang out with
S0329	french jewish
S0326	hang out with and i send a photo er to dad of me and and be in the middle and he reply say who's the man in the middle
S0328	it's so that story be so heartbreaking
S0329	that's awful
S0328	i know er
S0466	i didn't get that say that again
S0329	send a picture to to his dad
S0466	yeah
S0329	of his dad's two sons two of his dad's three sons
S0466	mm
S0329	and one of the daughters er the the two
S0326	and er like be in the middle
S0329	the two sons be and and then the daughter be
S0329	and have get five children
S0466	yeah
S0329	three boys
S0466	yeah
S0329	but this picture be and and and be in the middle
S0466	mm
S0329	and say who's the man in the middle
S0326	and i think he'd be well chuff to see a picture of his children together innit
S0466	and be he joke
S0329	no
S0326	no
S0466	he really didn't recognise him
S0326	he send me a he send me an email like six hours later oh it's
S0328	mm
S0329	but when do last see him
S0326	i dunno they have a punch up
S0329	when they have a punch up mm mm
S0466	complicate all these complicate families imagine like another two generations down the line when you've all marry twice have two set of children and
S0466	fuck me work backwards from there be go to be impossible
S0466	so let's work it out be what
S0328	he can't even remember if it's his son or not so
S0466	's on his third wife and seventh child
S0329	don't say that in front of
S0328	which wife be you on
S0329	mm
S0466	oh so that thing of people call their erm their children a double barrel combination because they can cos the women be kind of ardent feminists so 's daughter be call
S0329	oh i didn't realise that
S0466	yeah that's what she be her real
S0329	she's
S0466	her real name be cos her mum's call and her dad's call so she's call and that's the but this be gonna get absurd what if she marry somebody who's double barrel
S0466	and she decide that have to stick and he get
S0328	sound like er so you've get an option anyway
S0466	or yeah or
S0329	yeah so
S0466	what's gonna happen
S0466	if she erm
S0328	yeah that's it then isn't it
S0466	be it gonna be
S0328	but also people be get much much more multicultural too so their names'll be like
S0328	and then you know
S0328	like
S0329	mm
S0328	more and more combos
S0329	have get cos he want to change his surname to erm but be a really good dj name but he want to spell it in in a variety of different ways
S0329	so that could be and could be
S0329	or
S0328	yeah
S0466	yeah but the point be the point of that that name
S0466	about be that that's not a make up name that be his name
S0329	er well it isn't his name
S0328	yeah
S0466	whereas a dj could call themselves anything
S0326	yeah
S0466	stupid that they want to
S0328	like
S0466	and that's fine but it it like yeah
S0329	no but he be i mean he be say he want to call himself
S0328	who he should definitely do that you should encourage him to
S0328	push him to into that one
S0466	or
S0328	the sillier the better i think
S0329	it's the kind of thing that he'll do drink one night and try and change his name my deed poll
S0328	and change his name by deed poll
S0466	there's quite a process to change your name
S0326	no you can't do it in one night drink
S0328	that time i get waste and change my name to
S0326	i'm wait for him to get a tattoo that'll be funny
S0329	oh god
S0328	a trumpet
S0466	that'd be good a trumpet yeah
S0329	he be gonna get a trumpet but it's not really valid anymore cos he doesn't play the trumpet for about a year
S0326	more than that
S0329	no i don't think so i think he be play it up until this time last year
S0326	mm
S0328	that's not long
S0329	he be at properly at school this time last year
S0326	i think the last time he do it be probably his a level do he do it at a he didn't do it he didn't do it
S0329	he do his a level last year
S0326	yeah but he didn't do a2 music he just do the in the er in the er the one before you know
S0329	no but he be practise properly
S0326	no he wasn't not after his as level
S0329	oh well whatever i don't care
S0328	yeah
S0329	blessedly silent
S0329	and the neighbour be very
S0326	someone someone on my hall on my on my floor play the trumpet it's like be at like here
S0329	be it like be do it do it make you regress
S0326	i don't regress it's like it sound like 's play the trumpet downstairs
S0329	be it a good trumpet player
S0326	yeah
S0329	i do quite miss it it be my it be my soundtrack for
S0466	do he play what do he play
S0329	jazz jazz trumpet
S0466	only jazz trumpet
S0329	yeah
S0326	ah he do all that hark the herald angels sing and stuff
S0329	no he never do that
S0329	you bastard he never ever do
S0326	he do that be his one tune man that be his famous that be his like go to tune
S0329	it wasn't his
S0326	yeah it be
S0329	it wasn't he can't play
S0326	hark the
S0329	hark the herald i've never
S0329	hear him play that
S0329	's he's so mean
S0328	it be his go to
S0329	he use to nothing but play miles davis and chet baker
S0326	no he never play any miles davis
S0329	he do he be totally obsess
S0328	don't rat on your brother no he never play any miles davis
S0326	i'm not rat on him
S0328	hark the herald angels sing
S0329	he watch that chuck berry film about five hundred time it's why he won't go to the dentist cos he think he'll end up look like chet baker thank you never a stop
S0326	when's elijah come round anyway
S0329	when's who come round
S0326	elijah
S0329	elijah oh yeah
S0466	oh yeah elijah
S0329	elijah when's he come round
S0466	well we should've open the door before dinner of course cos otherwise
S0329	er you fail
S0466	i fail ah i've fail on the i fail on the knödeln matzo ball i fail on the
S0466	but but my dad's watch me and he's go
S0466	i tell you
S0329	no he won't he'll be think well what do you care what he think but anyway he would be think
S0466	yeah it's his fault
S0329	it's his fault
S0466	yeah
S0329	and erm
S0466	that's what i tell him
S0329	do you
S0466	you know my hebrew's rubbish he's to blame
S0329	do you say that to him
S0466	yeah it say it say in the talmud that it's the father's responsibility
S0328	oh yeah
S0329	but how do that go down
S0466	it be his
S0466	poof
S0329	don't ah
S0329	i be really try to get transport when you be read i be think of all the all my my forebearers
S0466	the thing be that you know i i should've ask erm you should go to something like
S0326	jew camp
S0466	yeah
S0329	jew boot camp
S0466	jew camp
S0329	jew jew camp from the for the bear again jews yeah jew camp
S0466	could learn hebrew in five minutes
S0329	yes he could no his
S0466	you know
S0329	i be quite strike by the easy way in which he respond
S0466	yeah
S0329	and read
S0326	i didn't really do that
S0328	learn to drive instead
S0466	he'd pick it up in a minute
S0466	look at him i mean my god when the rabbi's get hold of him
S0328	the steer clear of rabbis
S0466	the the they wouldn't let you go
S0466	they'd they'd stick a big beard on him
S0466	and that would be it
S0329	but have you do it round at 's
S0466	er no but the first time i meet him be at a seder in south and erm er oh god what's his name er anyway a rabbi's son be there and he he do it and of course do it properly and and follow it word for word so you know i i realise very quickly i have to keep my mouth shut
S0466	so as not to reveal my ignorance but
S0466	but they be proper boys you know like spend every week er after after synagogue they'd go and do learn how to do hebrew so actually know quite a lot of hebrew as oppose to to just read it
S0329	so he know what it mean
S0466	yeah yeah up to a point cos old ancient hebrew be very different from modern hebrew obviously
S0329	can you even read can you you no you can't do modern hebrew
S0466	modern hebrew the thing if you look at the hebrew this hebrew be write with erm with vowels but modern hebrew be write without vowels it's only consonants
S0328	erm can you pass my jumper please
S0466	oh do you want to close the door
S0466	go and close the door
S0328	oh no no it's okay i'll be alright
S0466	i be i be
S0466	maybe in greek they don't do this do they they don't have er separate if you look at this so the large letter be erm consonants and all the dot and things underneath the little mark be vowels so
S0328	yeah
S0466	but in modern hebrew they take the vowels away because it's just
S0326	erm they do have a thing in greek call iota subscript which be when the i slip underneath the letter which be similar
S0466	right
S0326	but it's not it's only on certain
S0329	he's so clever
S0328	
S0329	iota subscript
S0466	that's not clever that's just know stuff that's know stuff though
S0328	what the hell
S0329	come on i've never even hear of iota
S0326	iota's a greek er in the alphabet the the their i be call iota
S0328	mm
S0466	that be the illustrations in this book be so bonkers
S0329	so i'm not get any noise on anything
S0328	vibrate
S0326	it'll vibrate i can turn it back on you should really learn for yourself that all you have to do be flick the switch on the side
S0328	mm
S0466	anyway do you want to erm oh the grace that use to drive me mad but who do these people remind you of who's that think it be actually look
S0466	if have a beard
S0329	hilarious how do they put these picture in there
S0466	it be very funny it's famous this book it's like
S0329	absolutely beautiful book
S0466	oh
S0329	do it
S0466	now children have to define you as the children cos it say there's celebration
S0329	don't worry i'll just it's much easier if i just do it
S0466	it's very important
S0328	i'll help er i'll do the
S0466	so i've hide the afikoman and the afikoman
S0329	yes 's tell you something
S0466	be a a bite of the matzo
S0326	that's be break off
S0466	so when you be out erm play in the garden
S0466	i
S0466	i hide a bite of matzo
S0328	oh where where do you hide it
S0326	probably in a napkin
S0329	you've get to find it
S0466	you you've to to find it
S0326	i know i know exactly where it be
S0328	be it in this room
S0466	it's in this room but it's not very far away and er cold no it no that's not good
S0466	stop
S0328	it's not on the table
S0466	no
S0328	there's a lot of matzo in there
S0466	yeah
S0328	so you know
S0466	hot hot hot no hotter hotter hotter hotter very hot not quite a lot very hot
S0466	well do you get a
S0329	that didn't take very long
S0466	you get a prize but i'm not sure what the prize be
S0328	i figure it be
S0466	so grace
S0329	yeah
S0328	it's a classic matzo in the microwave
S0329	don't er don't the matzos get get really wild and kind of intoxicate at this stage
S0466	i'm not i'm not what sure that that's what they do at the actual er at this part at the end when there's the songs yeah i think they do but not on this bite ah
S0326	my my er you know my friend mum
S0329	
S0326	yeah
S0329	yeah
S0326	she live in house in and next like next door be a house which be it's get in the garden they've build sort of a community shed so all the sort of hasids go round there and do like party and or like festivals or whatever and we and
S0326	and she have a really funny story about how she be lock out once and knock on the hasidic house and ask ask them cos her back door be open to give her a lift over the back garden wall
S0328	really
S0326	she be wear like a sort of like miniskirt you know and she be like two hasidic teenagers be like
S0326	over the wall and there be like like obviously like scowl at her
S0326	and the
S0328	what happen
S0326	they give her a lift over the wall but er you know it be funny
S0326	imagine like sort of two hasidic teenagers lift her over the world in her miniskirt
S0466	well i mean that probably ruin their life
S0329	i shouldn't think so
S0466	er i
S0329	this girl be a very very sophisticate person that ruin her life do you say
S0326	no the boys' life
S0466	that ruin the boys' life
S0329	oh ruin the boys' life
S0466	they're not even mean to look at women
S0329	no
S0466	that be not family and even family
S0329	have we not be we do with the wash of our hand
S0466	yes
S0326	i'll have a wash
S0329	mm
S0466	so this be the this be the grace and and it's about ten page long
S0466	er i'm not gonna say it
S0466	i'll give you a quick flavour of it but our god and good of our father's for thee may the come and reach and appear and be accept and be hear and be visit and be remember a lot of these things so er the english doesn't give you a sense of it but when it's read properly in hebrew it's get a fantastic sound to it get a real rhythm to it
S0326	yeah
S0466	it's get a kind of very very kind of musical quality and a lot of these be be be very very old and incorporate into the hagaddah over the years erm and er some of them be incredibly
S0329	what do hagaddah actually mean
S0466	no idea
S0329	no idea
S0466	oh
S0326	doesn't hagia mean like like hagia sophia
S0466	i should know all these things
