S0466	anyway i'm not go to bore you with but the main thing after dinner after the grow up have mumble all this stuff for a long time be that er you come to the the sing
S0329	oh yeah you're mean to sing now
S0466	and that be the best bite ah
S0466	so i'm go to sing myself but you can do what you like
S0329	you're just gonna sing
S0466	yeah
S0329	that'll be great
S0329	i know what's wrong with the harissa it's just too figgy
S0466	yes tell you not to put figs in it
S0329	mm
S0328	figgy pudding that's christmas
S0329	it's a bite figgy pudding
S0328	would you like some cake anyone
S0329	i'm
S0466	yes and oranges get the oranges
S0329	i'm go to do it oh
S0328	i hope it's alright
S0329	so what about if i
S0328	mm
S0329	take it off the how be it
S0328	it might be a bite underdone you know i don't normally cook in my oven
S0329	do you think we should just leave leave it on the
S0328	yeah
S0329	leave it on the paper
S0328	yeah
S0466	i've nobody to sing with me
S0329	erm
S0326	will 'll do it with you
S0329	la la la la la
S0329	it's fine god it smell amaze
S0466	by this time in my family we'd all be piss
S0329	would they really be piss
S0466	yeah
S0328	i think you be only allow four glass of wine and one for elijah
S0466	yeah well we'd all be piss and the song the sing of the song would be accompany i mean it would be at absolute full volume
S0466	everybody round the table
S0328	but i don't know the word do one that i know
S0466	and they'd be and they'd be like that
S0328	or something
S0466	it be fantastic fun
S0466	it make you feel you really belong you know
S0328	if i'd know i could've practise
S0329	and how many of you would there be
S0466	well at my grandmother's it'd be twenty people
S0466	and a lot of them would be fluent so they speak yiddish and hebrew much to my father's shame
S0329	why
S0466	cos we didn't
S0329	oh much to your father's shame i see
S0466	now we're now we're get professional this be professional food
S0326	i er i i'm i'm
S0466	none of that old amateur shite
S0326	i'm full
S0328	mm
S0326	i'm full i'll just have a really little one
S0328	okay then okay
S0329	not like the amateur shite
S0329	what be you talk about
S0329	erm wait
S0326	woah
S0466	do you think orange be an inappropriate accompaniment or er
S0328	no no not at all
S0466	mm have this get chocolate in it
S0328	well
S0329	i've never smelt such an intensely chocolate cake
S0466	have it get anything except chocolate in it
S0466	god it's
S0326	it's like mousse
S0328	that's chocolate and cocoa oh no
S0329	mm mm
S0466	wow
S0329	wow that be far out
S0466	wow
S0329	mm
S0466	that be moussey
S0328	i think it's a bite undercooked
S0466	it's a moussey
S0329	that be delicious how do you make that
S0328	erm so erm melt chocolate
S0329	mm
S0328	butter a bite of coffee
S0329	mm salt
S0328	yeah salt's on top and then beat brown sugar with the egg yolks six egg yolks and then fold the chocolate and the
S0329	oh
S0328	and er and and the yolk mixture together and then beat the egg white fold those in then salt
S0329	delicious isn't it
S0328	it be a tiny bite underbaked but it's a fine line you know
S0326	that's mean to be like that it's like a mousse
S0328	it's a fine line it's it's like a brown you know it's like brownies it's like
S0326	i don't know
S0466	yeah
S0328	you know when it have to be cakey
S0466	it's a fine line i i get that
S0328	but i i don't normally cook in my oven at home i just buy my mitts home today especially like
S0329	mm
S0326	what kenwood
S0328	kenwood my ex boyfriend
S0326	be that when you have to when you be cook when you live with five people and you could only cook during the night
S0328	yeah yeah
S0326	bake all night with kenwood
S0328	wait but but the i always wait till everyone go to bed that could be at any time
S0328	and bake all night
S0328	make up to a thousand cake a day well at night
S0329	really
S0328	yeah cake
S0329	up to a thousand
S0328	up to a thousand it be a share house in on street
S0329	so that wasn't my phone that make a noise no
S0328	might be mine hopefully get some lolzy responses to er 's picture that i've be send out
S0328	ha ha ha ha ha
S0328	that's the kind of response we want
S0326	and
S0328	where's the special candle with eight candle
S0326	where's the candle bra
S0466	where's the what
S0326	the er the
S0326	the two candle
S0329	erm should we've one of those
S0326	that's for hanukkah
S0466	wait what be we talk about
S0329	you know the eight the eight
S0466	no no no wrong thing altogether
S0328	so what do you be the
S0329	hanukkah you do cook brisket didn't you
S0466	yeah hanukkah's get nothing to do with that
S0466	hanukkah you have erm
S0329	when be it that you cook brisket
S0466	erm i don't know
S0329	you do it for you me and
S0466	really
S0329	yeah and it be some it wasn't hanukkah what could it've be
S0328	mm
S0466	it could've be er yom kippur
S0329	it must've be yom kippur then
S0328	when's yom kippur
S0326	it change
S0466	er it's kind of like september it's sort of er something like that it depend cos it's base on the jewish calendar
S0328	mm
S0466	so it's always different in relationship to it's really unusual to have passover on on erm good friday it's usually earlier than this but cos it be effectively it be the last supper you know the paint the episode of the last supper be be the passover
S0329	oh yes that i hadn't think about that
S0466	so easter you would er imagine come after passover cos we've gotta get
S0466	give them time to get the others
S0466	in the
S0328	mm
S0328	give them time
S0466	he have to be betray
S0466	he have to go before pontius pilate
S0329	cock have to crow three time
S0466	pilate have to go i wash my hand
S0329	shall we
S0466	hence the basis for erm the history of anti semitism
S0329	so don't we need to watch the master and margarita please twenty four hours
S0466	god yes we need to watch that we really need to watch that
S0328	for twenty four hours
S0466	it be a masterpiece
S0466	do you know that book the master and margarita
S0328	mm
S0466	bulgakov don't know it
S0326	no
S0466	you know it
S0328	mm
S0466	i've get the russians in two thousand and five the russians make a a tv series
S0328	oh really
S0466	yeah a film of it which be just hilarious and i mean
S0326	and it's twenty four hours
S0466	no i don't think it be
S0326	oh
S0466	but
S0329	it's quite long
S0466	but quite long anyway i i've get it it's really really really good
S0329	on erm
S0466	it's get her rid on her broomstick
S0328	be the latest season of walk dead good
S0466	erm
S0326	i haven't see that
S0466	no it's it it's kind of almost really be good
S0466	it's not ironically good
S0466	it really be quite good
S0328	oh no i'm sure the latest season of walk dead great
S0466	the devil and his entourage in in moscow they're just fantastic be fabulous
S0329	so we just watch up until the end of the first bite
S0466	yeah you haven't even begin
S0326	yeah russians do that well i think cos i watch this the erm in the summer i be watch that the russian jam bond tv stuff it be call
S0329	the russian jam bond tv stuff
S0326	it's call like seventeen moments of spring and it like nothing really it's just like er it's it's funny how different it be to jam bond
S0326	it's just like some guy who live a really like ascetic lifestyle and like undercover doesn't like have any spend his whole time sort of like write letter to
S0329	be it some kind of propaganda
S0328	jam bond it's like a spy thing
S0326	it's good though
S0328	it's it's it's it's really good it's really like poetic and the character be really really strange and interest
S0326	he's an undercover soviet spy in in sort of hitler's inner circle at the end of the war
S0329	and be it base on a series of book
S0326	yeah
S0466	russian book
S0326	yeah
S0329	mm
S0326	it's like by the russian ian fleming sort of
S0328	it be on youtube right
S0326	yeah
S0466	and what be it call
S0326	in english it's call seventeen moments of spring
S0466	mm what's that in russian
S0329	mm
S0328	mm mm da
S0328	no one know
S0328	delicious
S0326	what
S0328	delicious
S0329	it's the most totally delicious pudding i've have in about four hundred years
S0466	it's fantastic
S0329	mm
S0328	what about all those cake i give you on monday
S0329	cake
S0326	you didn't make those though
S0328	yes i do
S0326	er i think make them
S0328	as a matter of fact i do make those
S0329	i have those for breakfast
S0328	i work a rare saturday very rare
S0329	i have them for breakfast they weren't my pudding
S0328	no that that's when you should eat them
S0466	they be like macaroons
S0328	mm which ones
S0326	the ones that be leave for you be
S0466	yeah
S0329	mm
S0328	oh they be coconut macaroons
S0326	she er she scoff all the other ones
S0466	yeah
S0329	i didn't like
S0329	i mean
S0328	those so much that be 's favourite one i like the one that i i put your name in on the instagram the kumquat and erm black sesame one
S0329	mm
S0328	do you have that one
S0329	mm
S0328	that be a that be give you a like
S0326	sesame be good
S0329	i like this i could be your official cake taster
S0466	taster
S0328	come on in in the bakery
S0466	so there's no flour in this
S0328	mm mm no flour
S0329	it's sublime isn't it
S0466	amaze
S0328	flourless
S0329	but i don't think it be underbaked i think that
S0328	i think if it have a little bite more time it'd be more
S0329	i don't think so i think it's perfect and i think
S0326	we have to rush to come here cos you say seven fifteen
S0329	yeah and i think with this it's just a bite in another hour it would be the perfect consistency
S0328	mm but do you know what i do exactly cos i i'd be roast something before and i leave the oven at two hundred degrees when i put the cake in so it be too hot when i put it in so it be cook
S0329	mm
S0328	it be just a little like it just wasn't bake exactly right it be the right amount of time but just a little bite too
S0466	it's a very accurate little process you have to be accurate don't you exactly
S0328	especially with this cake
S0466	you have to have a cooker that you really trust an oven that you really trust
S0326	a book about the science of bake
S0328	yeah
S0329	i cook for my birthday i cook a a cake and
S0326	the most important ingredient be air be air
S0328	no it doesn't say most important ingredient
S0328	it say er a like an er an an an often overlook ingredient
S0326	where's that book anyway
S0466	be be what be air
S0329	air yeah
S0328	air
S0328	most of the step in the the the process
S0329	that's what be miss from the knödeln
S0466	yeah
S0328	be erm air be to to to to trap or or encourage
S0466	mm
S0328	you know air bubble to form
S0466	mm
S0329	but you be tell me that it didn't really matter today what erm the i didn't need to alter the temperature of the oven
S0328	definitely not to bake to bake a different size cake
S0329	to bake to bake the cake
S0328	no
S0329	no
S0326	although not
S0326	although not usually list as an ingredient air
S0328	can you do that in hebrew it's not traditional
S0328	afterwards everybody have to say what be it
S0329	i make a cake for my birthday in 's oven in france and i couldn't it be quite murky and i and i didn't have my glass and i couldn't actually properly read what i'd what temperature i'd set it on but
S0328	the temperature be important
S0329	but actually i i think that i cook it on the grill
S0329	it be good wasn't it remember it be the orange
S0466	yes it be delicious it be really wonderful
S0329	and and i make i hate you
S0328	you could do a grill cake
S0328	be nice
S0466	but get everybody i know have the same problems like you can't that you burn the bottom or you burn the top or one some bite of it burn because the oven isn't consistently deliver heat
S0329	in your oven in your france oven
S0466	the france oven be really difficult cos it's an old fashion gas oven you know it's like bottom heat there's no other form of heat
S0328	mm
S0466	and so of course that be the problem
S0328	you just need to get the hang of whatever oven it that's the thing be at home i erm just just haven't really use that oven very much
S0329	mm
S0328	but after a while you figure it out like where the hot and cold spot be and then you can move things around so
S0466	but what do you do if the heat be all come up from the bottom you can't it's i've get these two huge kind of ceramic tile in there
S0328	it should be okay if it's come up from the bottom yeah you can put like a stone in
S0466	that's cos it kind of disperse slightly but everything i ever cook in there can get bottom burn it burn at the bottom
S0329	so glad that wasn't my computer
S0326	something so funny i drop the book
S0328	what be it the punch line
S0326	from childhood
S0328	what it's true
S0326	i know it's nice
S0328	enjoy the book
S0326	the bite one be the best one be that
S0328	take that hat off before you make fun of me
S0326	don't don't be afraid
S0326	to get your hand dirty when you bake
S0328	it's true it be the it be a useful tool
S0466	how can you not
S0329	i've eat too much
S0466	me too
S0326	oh you should've read this bite mum there's a chapter on a note on tin size
S0329	on what
S0326	tin size
S0328	it's not a chapter it's a note
S0329	see i'm not really allow to instagram be i
S0326	why not
S0466	i think you need to you know it should be like the telly you're not allow to put things out there that you don't ask people for a release form from
S0329	yes i agree
S0466	i don't wanna be in your instagram world
S0329	you're not
S0328	oh
S0326	she's only get about twelve followers
S0328	yeah
S0328	don't worry about it you and be
S0466	make what make christmas dinner
S0328	yeah be go out with
S0329	yeah
S0328	my head baker that be that be her boyfriend for a while she's get a new one now
S0466	oh yeah oh yeah oh yeah
S0328	but erm i look at 's mum's instagram
S0328	and erm there be a there be a picture
S0329	see see look how how cool be i that they look at my instagram
S0328	constantly every day
S0328	it's sort of scary actually but erm yeah but there be a picture of you and make christmas dinner i couldn't believe my eye
S0328	screen grab it
S0328	send it send it to and
S0326	he's a new zealand like a new zealand person with a big beard
S0328	do you remember him
S0466	yeah he be only there very very briefly
S0328	well yeah because he have to go and spend it with
S0466	spend it with who
S0466	oh
S0328	she work for me
S0328	that that's why it be a coincidence cos they be go out at the time er i cos we saw you guy in the morning
S0329	oh yes
S0328	and then there be a picture of you
S0329	you saw us in the morning yeah
S0328	have christmas lunch with laugh your head off and then
S0326	while we be have
S0328	then have go to meet it be too that's a very funny
S0466	but meanwhile you're on your way to new york
S0328	have have christmas lunch in gatwick on wetherspoon's
S0466	yeah
S0328	wetherspoon's yeah chip and salad
S0329	in wetherspoon's not on it
S0328	yeah on wetherspoon's
S0326	no on
S0328	we be on it in wetherspoon's
S0326	twenty seven pints of guinness
S0328	fiver
S0328	christmas we arrive at midnight
S0326	yeah we arrive and then we get in a cab and be like can you take us to and the cabby say what's
S0328	he get so lose
S0328	it be like well we're from england and we don't have internet so you're on your own
S0328	he get into a dead spot on his like sit nav
S0328	because it's er you know it's like internet power and he get into a dead spot he get so confuse that he just pull over and be like
S0326	no he didn't pull over he drive in circle
S0328	no he pull over he be like i don't know like there's no internet i just have to wait for it to come back
S0328	it's be like it be the the worst thing to do be wait here you have to move he's like oh i've gotta stop there's no internet
S0466	so where be go then
S0326	we be go to 's friend's er restaurant
S0326	in the end i have to take his phone and like give him directions from like the map on the phone
S0328	we er we be call people and you know we have to basically get him there
S0466	but what part of new york be it
S0328	mm yeah
S0329	dad and i have to do that the first time that we go to new york guide a native of the city
S0326	well you must you must have be go to where it's just really easy
S0329	no we be actually go to
S0329	but the guy take it the guy didn't know what direction to point his car in because he be
S0466	they're all er you know ukrainian murder not do anything
S0329	well this wasn't this be a world class philosopher but they get absolutely
S0466	what drive the cab
S0329	yeah
S0329	not not only no sense of direction or no common sense or no i mean no kind of real sense of any sort at all and
S0329	one of the things that he do
S0328	he do
S0329	when he pick up first of all he pick us up from the airport which be incredibly nice and i think how sweet and then kind of follow him he's a very sort of person he's incredibly famous and i've forget his name he's dead erm and then we he forget where the car be park
S0329	and then he finally remember that it be in this car park
S0329	and we be walk through the car park and i saw this completely batter bash in car and i think it better not be that car
S0328	mm
S0329	and it it be that car and you have to crawl in cos you couldn't open the
S0328	really
S0329	certain seat and then because you couldn't once you be in you couldn't open the driver's door or wind down the window whatever it be
S0326	yeah you can't
S0329	have i tell you this story
S0326	no but
S0329	and then and we come to a toll and he overshoot the toll gate rather than reverse he decide to put his foot on the accelerator to lean to give him some purchase to lean back so he put his foot right down so the
S0329	the car be like rev
S0329	for all it be worth the
S0329	smoke burn rubber
S0329	and he be er try to give five cents to the guy back at the
S0329	at the toll window anyway that be a scary trip
S0466	he sound positively autistic
S0329	yes i mean he he be and really really really famous he's call er
S0466	you're mean to know
S0329	's mean to know she do a degree you do a degree in philosophy didn't you
S0328	mm yep david copperfield
S0329	anyway i can't remember his name it'll come back to me
S0328	er what what what
S0329	erm oh i suppose
S0328	can you remember
S0466	minicabbing
S0328	yeah
S0466	important area there
S0329	i suppose it be erm
S0328	new york cabdrivers be
S0329	analytical i don't know
S0466	they be famous minicab er new york minicab drivers
S0329	have another drink
S0466	well cos it go through immigration phase when i live in new york all the cab drivers be erm bengali or indian or you know from the subcontinent but now they're all eastern europeans apparently i don't know but in the in the late eighties
S0328	the guy the guy who get us really lose he be indian
S0326	yeah so be it when i get lock out i go up to the park and come back and the guy be talk to me about cricket
S0328	get lock out for seven hours
S0326	cos i go for a dinner with the guncles but and i didn't realise how long it have go on for and i think it be sort of one in the morning and i get back to the build we be stay at and it be seven forty or something
S0329	wow sorry you be late by six hours
S0326	no no i be leave the dinner and i think
S0328	he lose track of time by six hours
S0326	yeah and i get back and i be think it be weird when i be go back how quiet it be and then i ask the doorman sort of what time it be he be like yeah it's six forty five
S0329	what do your guncles cook you for dinner can you remember that
S0326	what do they cook me for dinner i can't remember
S0328	lot of
S0326	another thing be that they once cook me erm pasta with like mm bone marrow
S0328	didn't they make you like er there be like a print menu and they have a bunch of course and stuff
S0326	yeah it be yeah
S0329	when come back from new york the first time his gay his gay uncles his guncles who have nowhere to live and they look after him
S0328	ah i really i miss the dinner i fell asleep
S0329	and then when he come when he come back er be all sort of discombobulate and say well mum what time what time be cocktails this even
S0326	they be always talk about they take me to like restaurants and like classical music concert
S0326	and in return i take them to like club in
S0328	to go to like
S0329	he say oh yeah campari my guncle's always get that out
S0329	oh for god's sakes
S0329	yeah
S0466	nice
S0326	that be so funny and they have that
S0329	they have a tree grow in their apartment
S0326	yeah they no no that be someone else that be like the wall street guy i stay with but the when i go
S0326	when i go there when i go to the guncles they have their christmas tree hang from the ceiling above the din table
S0326	find the picture it be really good
S0328	be it right side up or upside down
S0326	it's the right side up but it look really good should be in here
S0466	and be it illuminate
S0326	i think it have light yeah
S0466	be it decorate
S0326	yeah
S0466	wow
S0466	that's kind of a good idea
S0326	cos one of them's a yeah when you see it you'll
S0329	christmas
S0466	yeah i get the
S0328	like a chandelier
S0466	i can i can yeah i can visualise it
S0328	you won't have to for too much longer
S0328	do anyone want more cake
S0326	no thank
S0466	i'm too full
S0329	i really do want some but i i'm definitely go to have to wait at
S0328	well you it will keep for a while you know
S0329	at least half an hour
S0329	oh yes you've show me that before
S0326	bite wonky but
S0329	that be quite mental
S0466	it be pretty fantastic
S0466	what's that bite there though what's that oh it's just cushion
S0466	and who be they exactly be they really
S0326	i can't actually remember how i meet them i meet i go to a party and
S0326	i be with my friend and then he be like i dunno like come back with these two guy who and dance with us and then we like exchange email and then i get i come back to new york from texas and la and i couldn't find any of my friends to stay with so i just email these guy
S0328	really from the dance floor
S0329	be homeless he be sleep on the on the subway and he get arrest
S0329	luckily i didn't know anything about it
S0328	do you get arrest for that
S0329	no for hop for hop the gate
S0328	oh yeah
S0466	what do they do to you
S0326	that nothing they
S0466	they just like
S0326	they're like i be like
S0466	too weird man
S0466	we're gonna have to get rid of this kid
S0466	get him out of here this be fuck with my head
S0329	have his british
S0466	do you understand what he say i dunno what he's say
S0329	have his british passport with him and that be enough
S0326	this be this be me and the guncles
S0329	oh i've never see what the guncles actually look like
S0328	she doesn't like it
S0326	one's french the the one who look kinda goofy be french
S0329	er i be worry
S0328	let me see
S0326	they're so sweet it's a funny photo cos i make er they'd never be in a selfie before you know
S0329	they'd never be in a selfie
S0329	i forget what it be that they do
S0326	one's a erm photographer and photography teacher and the other's
S0466	and he'd never be in a selfie
S0328	they give him an anne carson book for christmas they're gonna be alright
S0326	yeah
S0466	they get you a what
S0326	anne carson book
S0329	lolz at the other picture
S0326	but the other picture be
S0328	let me see the guncles
S0326	do i show you where we be stay in that apartment explain that apartment to them er 's one
S0328	it's hard to explain
S0326	it's like on the thirtieth floor sort of downtown
S0328	on have the most beautiful pool table i've ever play on
S0326	yeah so it's the kind of place that have a pool table and
S0328	like ten thousand dollar pool table
S0326	he have someone who work there all their job be to just restock the fridges
S0328	and they have a they have a receptionist call
S0329	you've get one of those it's call your mum
S0328	who literally would just like find really nice win to pair with the meals for these like hot girls that live there
S0329	how do you meet this person er
S0328	my friend live there but the guy who own the house be really really rich
S0326	he's a banker
S0328	she's just live there temporarily but i think he break up with his wife and then he just buy this like sick apartment on and fill it with beautiful young girls
S0329	cos i be i be
S0466	do when you break up with your wife
S0328	you can you can here i buy really nice win whatever you want the fridge be restock
S0326	you can live here rent free
S0328	just hang out here and invite your friends
S0466	wow
S0328	and erm it's a very strange it's a very new york scenario you know completely non sexual relationship but like just
S0326	he he really like to he like to party but he doesn't know how
S0328	invite us to this
S0326	so
S0329	sound like he do know how
S0466	remind me of girls
S0328	they take care of that for him
S0466	like
S0329	the first episode
S0466	yeah didn't didn't one of them marry a banker in girls she do the english one marry a banker yeah
S0329	yeah yeah pretend she pretend to be a lesbian with with erm marnie
S0466	yeah
S0466	and she marry the banker and the banker
S0466	he can't handle it in the end can he
S0329	neither of them can handle it in the end
S0326	it be it's like a really beautiful place to live i guess with a pool table
S0328	it's get a pool table we we go in there and
S0328	we be like oh my god why do you ever leave the house
S0326	it's get it's like a pool
S0326	it's a pool table out on the on like the thirtieth floor with like view down the city
S0328	they've so much nice wine and a pool table and there's a beautiful view and then binoculars and you can just spy on all of new york
S0466	be it one of those american pool table with the kind of blue
S0326	yeah yeah
S0328	it no it have blue like deep purple felt
S0466	oh wow
S0328	it be it be like
S0328	beautiful
S0466	so it wasn't the proper american
S0328	soft ball you know with all like beautiful like japanese like japanese swordsmanship on the cue
