S0198	no you haven't mum
S0192	shorter what happen be it just like
S0230	well your muscle shrink
S0192	be they just compress
S0198	yeah yeah
S0230	your muscle
S0198	cos your bone aren't
S0229	oi in ten years time you'll be a dwarf
S0230	i mean my mum be
S0198	yeah you've only gotta be like under five foot
S0230	five foot four
S0230	or five foot two between five foot two and five foot four my mum's height she be four foot ten
S0198	the only one that's order them have we
S0192	that's quite a big difference isn't it
S0198	er regular regular yep that'll be easier just pass it along mum to
S0192	let's get rid of all this let's make some space shall we
S0198	yeah
S0230	thank you
S0198	we don't need these condiments either do we
S0192	no
S0198	at least put them on the end do you want any salt and pepper
S0229	no
S0230	no
S0198	no i don't think so
S0192	thank you very much
S0198	ah it look good doesn't it
S0192	yeah it do look good
S0198	yeah
S0192	more
S0198	yeah get a bite of naan and get a bite of whatever with your pint i mean this be four this be even five pound in a couple of
S0192	yeah
S0198	get a whole meal for that price in here
S0192	bite of mango chutney
S0198	no i don't like it
S0229	yeah i don't like it
S0230	i know cos i push it along
S0192	yeah i just burn myself
S0198	well you have a warn
S0198	's very sensitive to burn he get something out of the oven
S0192	i don't have asbestos hand like you ladies
S0198	and i i can stand there and hold it for two minutes
S0230	when i be cook all the time erm my fingertips get so use to heat
S0192	yeah yeah
S0198	get like callous or something didn't it
S0230	yeah asbestos finger
S0192	yeah yeah
S0198	asbestos finger and yeah
S0192	that's what my mum use to say asbestos finger
S0230	yeah
S0198	and we've get the two large haven't we dad
S0229	yeah have we
S0198	no mess about
S0230	and the chip
S0229	yeah well i don't like them things
S0230	well neither do anybody
S0198	yeah it's a bite of salad or something isn't it i like the er generous spruce of er coriander there
S0192	oh coriander that be generous
S0198	really really spoil us with that one
S0192	do you like your poppadums
S0230	not particularly no
S0192	no
S0198	no i don't this so there's enough there without them quite dense now aren't they
S0230	mm
S0192	oi
S0198	i've get monies you've gotta be nice to me now
S0192	oh right
S0198	yeah
S0230	i find them really salty
S0198	yeah i like them on their own just a bite just on their own really
S0192	here it come
S0198	mm mm mm here come the large try and talk over him maybe
S0192	be there space for that just leave it here i'm sure it'll be fine
S0198	yeah that's dad's erm and the rogan josh be here should have a oh oh right there cheer
S0192	thank you very much
S0229	anybody want them
S0198	oh no
S0198	yeah yeah the yeah the samosa and the bhaji
S0192	bhaji
S0198	cheer alright then thank you
S0229	and the chip
S0229	and the chip what do you do with them
S0198	he doesn't like them alright get rid of it
S0230	you could have just put them there or something
S0192	that's his tip
S0198	he doesn't know what to say it's like oh alright then yeah sure
S0192	i'll just carry your food
S0198	the customer's always right and all that
S0192	yeah
S0198	that's a bite of a alien head isn't it
S0198	must be a but taste good i'm sure
S0192	what's this like then
S0198	ah i didn't get any season on mine either where's my bite of
S0192	there you go there you go i give it to you
S0198	ah where's my bite of coriander
S0192	mm
S0198	mm
S0192	it's gonna give me heartburn immediately
S0198	yeah especially with beer you haven't get your rennie have you
S0192	no do you get heartburn much
S0230	nah
S0198	no
S0192	i suffer from it
S0198	yeah he do
S0230	i use to get it when i be pregnant
S0192	oh god i'm not pregnant be i
S0229	well don't get it now you'll get me worry
S0230	ah could make a money couldn't we
S0198	make some what from be pregnant
S0230	yeah if i be pregnant now it'd be a bloody miracle
S0192	oh yeah
S0192	like the beard lady or something
S0198	cheer the beard lady i mean that's no miracle there's plenty of hairy old ladies out there
S0192	it's true
S0230	yeah
S0198	you should have see my nan
S0192	it's always those thin wirey ones isn't it
S0198	yeah
S0192	they really weird you out man
S0198	every time i've cut this mole i think of you mum
S0192	i don't mind ladies have body hair or whatever but not on your face
S0192	it's the only place please cut
S0198	just on the head there
S0229	do you tell daughter about that guide man
S0192	no thank you very much
S0198	no no that's alright that's lovely brilliant thank you very much awesome cheer thank you
S0192	thank you
S0230	thank you
S0198	yeah where we up to then
S0230	when we be in bruges we be erm eat at the restaurant very cosmopolitan you know that side on the balcony look down at the mass
S0192	oh lovely
S0230	yeah yeah and er
S0198	and it's in bruges be it
S0230	it's in bruges yeah and dad say erm you see that old boy with the brolly hold it up in the air and it weren't even open
S0229	what's her name in the rain
S0229	it's just
S0198	what be he do that for
S0230	he be a guide he be a guide
S0198	oh of course he be yeah
S0229	look at that old man walk up there brolly's close see it ain't even rain
S0198	i don't suppose dad hasn't see those type of people before have you dad
S0230	no
S0198	not have have not leave for some time
S0192	be they cherry tomatoes
S0198	mm
S0192	a bite strange
S0198	well half a bhaji and a samosa here
S0198	do you have a good laugh at that mum
S0230	yeah
S0229	never stop
S0198	never stop laugh i'm glad you have some giggle while you be away
S0230	oh we do
S0229	oh we do
S0198	yeah
S0192	you be a little bite concern weren't you
S0198	yeah
S0192	about the whole thing
S0198	mm spend the weekend worry be alright
S0192	yeah every day we be like we haven't hear from them be they okay
S0198	message me i be facebooking on friday even he say he try to call you a couple of time
S0230	yeah
S0198	i don't know make sure you be alright
S0192	there you go people care
S0230	yeah
S0198	care about you you have a bite of lamb yet
S0192	no i haven't
S0198	it be so tender last time
S0192	as you get older you see what you put your parent through
S0192	you know go travel and stuff
S0230	mm
S0192	yeah my brother start do it recently and family you do worry quite a lot
S0198	yeah be get be really worry you could see he go to thailand he be really worry about him go out there
S0230	be go to thailand
S0192	christmas
S0230	yeah
S0198	well i'm worry about him
S0192	's like i want him home for christmas
S0230	christmas day yeah he say i'll have i'll be up there
S0198	mm
S0230	he say i'll be there for my christmas dinner
S0198	it's really tender lamb
S0229	what
S0230	yeah he'll have his christmas dinner before he go he go he fly out in the even
S0192	yep
S0198	mm do you like how tender it be
S0230	so we're gonna have box night christmas morning
S0229	yeah
S0198	say that again
S0230	we'll have erm christmas
S0198	yeah yeah
S0230	christmas eve so he's there for christmas morning
S0198	oh to see
S0230	yeah
S0198	oh you're gonna have christmas morning
S0230	yeah
S0198	you never have that before have you
S0230	no
S0198	be alright about
S0230	well seem to be
S0198	what and then you'll go to 's christmas cos you usually do it the other way round
S0230	mm
S0198	surely she's gonna be want to drink christmas night though
S0230	well
S0229	end up with him
S0230	probably end up come back with us or something
S0198	yeah
S0192	my mum's really worry about christmas obviously it's the first year we're back for a while
S0198	help yourself
S0230	yeah
S0192	so she want to make it the best christmas ever
S0192	but as so far nobody be available
S0230	oh
S0192	everyone's do other things it's just gonna be my mum and and
S0198	and
S0192	and and no may be in spain so
S0198	mm 's get himself some spanish girl
S0192	so she's she's a bite stress about it i think cos obviously everyone's get their families and then
S0198	yeah
S0230	i'm a bite worry that i'm i might be work
S0198	no
S0230	i still don't know
S0192	oh you can't work
S0198	you can't work mum you're not allow to work those two days
S0230	if i'd be at you can guarantee i wouldn't have be work
S0198	yeah and i would have say no
S0229	so would i i'd have go round there
S0198	you're not work over christmas mum
S0192	the one year your daughter's home
S0230	i know well
S0229	no way
S0230	i'll have to tell them when i get my shift
S0198	just gotta be brave
S0229	so will i write them ticket fuck them
S0230	but then this be a bite different how many people have carers go on christmas day i shouldn't think there's many
S0198	no yeah
S0229	there's gotta be some though ain't there
S0198	they've gotta have their family on them haven't they
S0230	yeah cos they cos a lot of them have families and that around them i mean there will be some but then there probably will be some that don't mind work christmas day
S0198	yeah mm
S0192	do you get more money for christmas
S0230	yeah well yeah i should imagine so
S0192	well it's gotta be an incentive then for some people who think well i wasn't do anything anyway so
S0198	yeah
S0192	it be the only day of the year you get double double time on christmas day
S0198	stingy bastards otherwise
S0192	have you start your new place
S0230	no i do my i do three days' train last week but they're still wait for the erm
S0198	crb check
S0230	crb check and the erm
S0192	well you don't have a criminal record do you
S0230	well i only have one do in april
S0192	what since then
S0230	and i've have to pay for to have another one
S0198	she's on interpol's list now
S0198	yeah yeah
S0229	lovely mate yep
S0192	perfect thank you
S0198	erm
S0230	erm reference want reference as well
S0198	how many people have they get on this company then
S0230	huge well
S0198	do it cover all of the south east or
S0230	it cover all of the south east when i be say to it about it to she say oh i'm sure that's who grandad have as care
S0198	oh really
S0230	mm
S0198	oh crikey
S0192	what be they call
S0230	mm
S0198	like
S0230	mm suppose it be really yeah
S0198	nobody have make that no
S0230	no cos there wasn't a e
S0198	no
S0230	it's a g i n yeah
S0198	how do you spell age
S0192	don't feel that be need
S0230	a g e i n g isn't it isn't it we'll they've drop they've drop the e
S0198	we do normally don't we when there's an e in a word
S0230	oh yeah yeah we do yeah
S0192	there you go you're work at i'm not sure now you've ask me i'm not sure
S0198	do erm do they call it
S0192	it's not e i n g be it
S0230	it's a g i n you see agin
S0192	oh
S0198	yeah but so be a g i n
S0192	no g
S0198	oh no g
S0192	so it'd be like a london accent
S0198	so agin
S0192	agin
S0198	agin yeah yeah yeah yeah that's a dialect
S0198	we don't have a it's just an in swim
S0192	my family name at school
S0192	oi
S0230	oh this be good
S0198	yeah be you enjoy it
S0230	mm
S0198	how's your jalfrezi dad good
S0229	yeah nice
S0192	be it alright to steal the
S0198	yeah help yourself
S0198	have a couple of them
S0229	yeah help yourself
S0198	he doesn't need them he's just be greedy
S0229	so be i
S0198	i'm talk about you dad
S0192	chip and curry be the best though
S0229	oh
S0198	no i've just eat mum do you get any samosa mum none of it
S0192	well i've get some bhaji leave
S0198	it's alright
S0230	what
S0192	do you want some of this one
S0230	no
S0198	my dad should have share
S0229	no
S0198	mm
S0230	have you be chew at that
S0229	no
S0230	i'll have these hard bits
S0198	ah there you go have a bite of flavour in it
S0192	i'm gonna be stuff after this
S0198	i know we'll want a knap gonna go for a walk around small shop though aren't we
S0229	we'll stop on the way home and have fish and chip in one in won't we
S0192	right
S0198	he always say this doesn't he and mum always shrug you two you're like a little duo
S0198	little and large
S0230	little and large
S0198	yeah that be a thing wasn't it my bread's go completely it's a bite chewy
S0192	unfortunately i'm kind of a bite behind on my uni work so i need to to shoot back
S0198	yeah i tell them
S0230	mm
S0192	cos of the weekend
S0230	yeah you go home
S0192	yeah i come back a bite stress and i be really tire last week last week be really busy anyway first week at uni and then friday straight after university i go straight there
S0198	yeah you go straight from uni home
S0192	friday at my dad's saturday at my mum's sunday at 's
S0198	and then he have a busy a really busy monday don't you
S0192	yeah and then my monday be from eleven till six three different modules
S0198	whereas mine's four till six
S0192	and also come back on the train there be train like roadworks so i have to catch a connection and like run for that and get on a bus and go somewhere else so
S0198	yeah
S0192	monday night i be do i felt quite ill actually
S0198	yeah yeah you be really quite down weren't you
S0192	so i'm just kind of catch up in
S0198	it's alright we understand
S0230	mm we get really knackered last week didn't we
S0229	oh yeah still ain't right now
S0198	yeah mum dad say you've be try to like recover
S0192	from the holiday
S0230	yeah oh we'd just do so much walk
S0229	unbelievable
S0198	mm mm
S0230	we'd go we'd go to bed
S0198	mm
S0230	with a you know sort of bottle of wine and a whisky and the dvd and just start force start fall asleep straightaway
S0192	immediately
S0229	one two o'clock in the morning and i'm wake up turn the telly on
S0198	both of you have fall asleep well it doesn't help when you drink four whiskys before you even get out to dinner do it dad
S0229	no who tell you that
S0230	that be on his birthday
S0192	four
S0198	i know
S0230	he do go for it a bite
S0198	i be only have a chat with you for about thirty or forty minutes and dad have already get onto his fourth whisky
S0230	mm
S0229	no
S0198	yes thankfully you didn't drive anywhere do you
S0229	no no we be
S0198	be there somewhere to eat dinner at the holiday inn then
S0230	here
S0198	yeah
S0230	mm load of place
S0229	yeah
S0198	oh yeah that's good
S0229	every other
S0198	cos they can be a bite out of the way here can't they on like a junction
S0230	yeah
S0229	bigger boat in the harbour
S0230	it be right on the harbour
S0198	oh yeah of course it be in the harbour
S0229	millions of pound worth of boat
S0230	mm mm
S0198	really oh i'm sure stay on there then
S0230	we be eat you know in a nice place as well
S0229	yeah and just behind the hotel that be
S0198	ah see i think it might be a bite industrial round there when you think about a or something
S0229	no nah not where we be
S0198	oh that's good mm perfect
S0230	the erm the accommodation in bruges be a bite different
S0198	yeah
S0229	you can say that
S0198	i think it be gonna be
S0229	more in in my garden shed
S0198	but everything be book in bruges because of the market so
S0229	mm mm yeah
S0198	it wasn't easy to find anything still
S0229	when we go there there be hardly a car in the car park
S0198	oh it be empty be it
S0229	and a couple of hours it be full
S0230	full
S0198	oh what in the town or in the guesthouse
S0230	no
S0229	in in the b and b
S0198	ah
S0230	in the place we be stay
S0198	do they accommodate for
S0229	where they come from i don't know
S0198	it be just
S0230	oh yeah it be quite a big car park
S0198	ah
S0230	yeah and er the bistro that be attach to it that be so so busy
S0198	mm
S0229	couldn't believe it
S0198	be it ah yeah they probably get full up then
S0230	mm
S0198	fill up with the
S0230	yeah yeah she say they be full up didn't she
S0229	we be rush around
S0198	yeah imagine the accommodation just keep get full the further go closer to the market
S0230	mm and it wasn't that far it be literally five minutes in the car from bruges
S0198	oh really
S0230	mm
S0229	yeah
S0198	oh that's fine then oh that's perfect then good then
S0230	and the reception be still open when we get there
S0198	mm
S0230	because they be so busy they just they didn't
S0229	they be still open at nine o'clock at night
S0230	they didn't really keep their their hours
S0198	i didn't think they be go to
S0230	nah
S0198	i'm pretty sure the email you get be probably just an automate thing
S0230	well yeah
S0198	i think the night before that boot fair why wouldn't why on earth would they do that that weekend
S0230	mm
S0198	no way it's big moneymaker for them
S0230	see and you walk in and you walk straight into the bedroom and then there be the other door into the bathroom and in the bathroom be a a erm a fridge
S0198	oh in the bathroom
S0230	in the bathroom with a kettle above it you know
S0198	whose cutlery have i get then
S0192	dunno
S0229	and erm when you go in the bathroom i must have put the light on by mistake didn't we couldn't find a switch to turn it off
S0230	couldn't no
S0229	then i find another one put the heater on
S0198	i mean these be just the the kind of things you go through every time you check into a room you've gotta figure it out
S0230	yeah
S0198	they say they have problems with the door card
S0230	mm
S0198	say there's be a few time we've have to someone to show us
S0192	the worst be when you go in you pay for the room you sit down you unpack your bag and realise there's no plug sockets in the whole room
S0229	yeah
S0230	really
S0198	really room and you're like
S0192	no plug
S0198	can't charge anything or watch anything or do anything
S0229	oh we have plug everywhere telephone even telephone in the shower
S0198	yeah well that's cos you're disable
S0229	yeah
S0192	telephone in the shower
S0230	yeah
S0198	i say to my dad he like need disable park so they give him a disable room
S0192	oh
S0198	with disable toilets and shower
S0198	telephone and emergency button
S0229	it be brilliant it be absolutely brilliant
S0198	yeah that make a good a good bet
S0192	be that in
S0198	yeah
S0230	cos
S0198	it be just like a travelodge thing wasn't it
S0229	yeah
S0230	mm
S0229	lovely place
S0230	it be a travelodge
S0198	yeah it be travelodge or holiday inn
S0230	mm
S0198	but just really families
S0230	mm
S0198	accommodate which be good eh
S0230	yeah
S0198	and dorset tomorrow
S0229	yeah
S0230	mm
S0192	keep busy
S0230	mm
S0198	yeah you'll have to take it easy until christmas now
S0192	how long be you in dorset for
S0229	only till sunday
S0198	gonna be nice isn't it
S0229	go round the boot fair and have a look
S0198	yeah
S0229	i shall go and see saturday 's on a erm golf weekend
S0198	you put my purse somewhere dad
S0229	no i didn't have it
S0198	i panic you all then didn't i
S0198	what be that 's on a golf weekend
S0230	mm
S0198	i wonder how much that cost
S0230	i shall go and see on saturday
S0198	ah oh right in dorset yeah yeah yeah
S0229	we book a table in the er pub restaurant for eight o'clock
S0198	which one's that
S0230	we have
S0198	the one in the new forest
S0230	no
S0198	oh yeah the one we go to oh that be really good that be like eight pound nine pound really good pasta dish er
S0230	mm
S0198	mm it be good value in there
S0230	mm
S0198	yeah
S0230	yeah we we book that saturday night
S0198	mm
S0230	and there be this to that for dad's birthday
S0198	oh yeah he say he be gonna do that that'd be nice mm you have that nice lamb in there
S0192	mm
S0198	it be good grub what have you get now
S0229	it be really really nice
S0192	news
S0198	oh right
S0230	oh
S0192	just try to
S0198	interest
S0192	those two people that die in thailand be kill by someone from burma i think
S0230	oh be they
S0198	yeah do you read about that couple
S0230	mm
S0198	that be on the island my brother be on just a couple of weeks before
S0230	oh really
S0192	i spend a few weeks on it as well
S0198	yeah i mean it's a very very popular island
S0230	mm
S0198	tonnes of on there
S0192	certain people die there each year
S0198	mm
S0192	murder
S0198	be that normal
S0192	no
S0198	be there that many murder go on i mean thailand be quite a well there's so many tourists there you're gonna get a lot of bad stuff
S0192	as bad as everywhere aren't they
S0198	yeah i'm sure the statistics for spain isn't any different
S0192	mm i if you take ibiza
S0198	yeah exactly
S0192	how many people die in ibiza or
S0198	one of 's mat do a classic jump into the swim pool
S0230	mm
S0198	first day of the holiday
S0230	from what from like a few floor up
S0198	yeah spend the rest of the time in hospital watch in england spend another few weeks in hospital
S0192	oh god
S0198	he be the first one that do it
S0192	what'd he break he be the last one that do it i take it
S0198	he yeah no one else do it and he land on his head didn't he it's lucky he didn't die
S0198	yeah i mean he shatter he do his spine yeah i think he go in the pool it wasn't deep enough he land in the shallow end
S0230	oh
S0198	i don't know if he land on his head
S0192	yeah you need to
S0198	he do his spine in he be in a
S0192	maybe hit on his coccyx
S0198	mm
S0192	i don't know you want the pool to be deep you're get messy aren't you look at you
S0198	i wonder who i take after
S0192	indian style it's all over your hand
S0192	it's all up here and stuff
S0198	it's in my hair
S0192	it will be if i don't tell you to
S0229	mucky puppy
S0198	daughter eh
S0229	i clean mine off
S0230	soon as we get on the ferry come over he spill his coffee down him
S0192	hot
S0230	mm
S0198	yeah it didn't burn you though
S0230	no
S0229	stir it pull the stick out and it go all up me
S0192	that's where you get it from then
S0230	do you change these beers over
S0229	yeah
S0230	i be gonna say i didn't think i'd drink all of that
S0229	not you i have i haven't change it over yet
S0230	a bite
S0192	you normally go for a half
S0230	mm
S0198	yeah you do don't you
S0230	but you get a pint here for the in with it don't you
S0229	mm
S0198	say pint yeah
S0192	also make this be like four or five pound in
S0198	yeah in other pubs it's cos they're everywhere
S0229	it's why they do so well innit
S0192	the same just like aldi or lidl
S0230	mm
S0192	there's a gap in the market supermarkets get so expensive that people just couldn't shop there anymore so they have to get cheaper
S0198	you get we we go round like we pop into sainsbury's and tesco's for like one item and stuff we're like well it's not that much more but if you add fifty p or a pound onto every item then that double your shop bill by the end of it doesn't it
S0229	yeah
S0198	so we just we when we're suppose to be use aldi
S0230	i use aldi more and more
S0192	it's good
S0198	morrison's isn't as bad as tesco er isn't as bad as sainsbury's
S0230	sainsbury's no
S0198	we go to sainsbury's to get tahini so we could make hummus
S0192	that be all
S0198	that be er yeah keep mean to look in iceland to see if they have any other freeze fruit
S0230	even iceland's have drop everything from a pound to eighty nine p
S0198	oh have they
S0192	oh they've knock it down
S0198	well that's cos you're go to poundland there as well
S0229	yeah
S0198	and it's get and stuff that's all a pound
S0229	yeah yeah they're all do it
S0192	they'll probably have freeze fruit in iceland won't they
S0198	yeah do they have freeze fruit in iceland
S0229	yeah
S0198	just want like
S0230	i don't know
S0198	cos the ones i buy i get from aldi not so keen on the raspberries be you cos they have some a bite seedy
S0192	i don't like those really hard seed in raspberries
S0198	the berry definitely
S0192	i've get like i've get really gappy teeth they like stick in my teeth
S0230	mm
S0198	i mean the fresh
S0192	just need some freeze strawberries or something strawberries be never really cheap
S0230	no
S0198	no they're not
S0192	have freeze freeze blueberries a bag of freeze strawberries we're back to where we be in korea
S0198	in korea yeah but probably for well we get a kilo for like
S0192	six pound
S0198	it be six pound
S0192	seven pound
S0198	really but
S0192	yeah they be expensive turn out a bunch of bananas be four or five pound
S0198	yeah so unpredictable and we get use to not eat potato anymore unless it be in season which be for a short period it's really expensive
S0192	yeah you're talk about four pound for a kilo of potato
S0198	yeah
S0192	but in season it'd be like fifty p to a pound
S0198	yeah
S0192	do you remember that carrot i pick up once it be like two pound fifty for one carrot
S0198	it be a big carrot but still
S0192	it be a big carrot but
S0229	i want a wheelbarrow for that
S0192	yeah
S0192	it do get ridiculous
S0198	i'd want a rabbit attach to it
S0229	yeah
S0198	and make us all dinner
S0192	they do get ridiculously big carrots though i'm talk like a carrot like this big like that chunky
S0230	oh
S0192	ridiculous i mean the one that be wasn't that big they get everything
S0192	they have courgettes that as well don't they the average courgette would be like that big and that fat
S0198	so science courgettes from old er
S0192	it's more like a marrow or something
S0230	mm
S0192	you're not eat your chutney
S0198	no
S0192	do you say
S0198	no i like it i'm just full
S0192	it's just like a mango jam
S0198	mm waste not want not
S0229	ah be it
S0198	the old hoover have
S0229	bite more rice there dear
S0198	i've have a couple have some
S0229	them chip i'll only eat them i don't want them cos they're there they're quite cool now
S0198	cars on cars something like that yeah
S0198	more rice on my chip
S0192	this be dessert
S0198	yeah it's not dessert yet i don't know it's just stand there isn't it
S0229	mm
S0198	to keep an eye on the car from here
S0192	check out your car yeah
S0198	yeah
S0229	yeah
S0198	love it
S0229	i'll be there like rock beat the fuck out of that motor
S0192	i think i saw him key it earlier
S0230	you think what you
S0229	beat it
S0192	think he key it
S0198	get out of the car and shake the car in front of him he be piss off about that
S0229	nah not me
S0198	as a child
S0229	not me would i i wouldn't do that
S0192	you ever get into a fight
S0229	no
S0192	no
S0198	have he ever get into a fight
S0192	scare them off
S0198	i get the softer father didn't i wasn't a tail ender dad
S0230	mm
S0198	gentle
S0192	he'd calm down
S0198	flower
