S0230	by yeah he'd calm down a bite by the time come along
S0229	i have to
S0198	bless his next door neighbour
S0230	ah
S0198	still yeah i've never see you hit anyone in
S0192	you never get belt then
S0198	no the boys do though
S0192	yeah
S0198	all i get be the sound of the belt
S0229	yeah
S0198	he didn't actually do anything
S0192	my dad throw me across the room once
S0198	yeah
S0230	the boys never get hit with the belt do they
S0198	no do they not
S0229	nah
S0230	no
S0229	it frighten them
S0230	i can't remember dad ever hit them with the belt
S0229	no to scare them
S0192	my dad's
S0198	the sound he make with the belt
S0192	my dad strangle my brother recently
S0230	oh do he
S0192	yeah
S0230	my brother didn't enjoy that too much i don't think
S0230	i'm not
S0192	no
S0230	and that be recently
S0192	yeah i nearly come to blow with my dad just before he be sell the house
S0198	teenage sons and their father
S0192	oh he proper square up to me and go
S0198	he's not an aggressive person though be he he's not a violent person
S0192	but i mean like me he'll lose his temper every so often
S0198	and just cross the line
S0192	yeah as i say throw me i be lie on the couch when i be about twelve or something he tell me to go and get some milk which involve me jump on my bike and cycle for about twenty minutes cos we have no shop and i be just like no he he grab me by the hand and
S0198	what do you actually say to him
S0192	i just say no i don't remember but i remember he grab me by the legs and hand and swing me
S0192	and throw me and i hit the wall and i like fell to the grind and run to on my bike and go and get the milk
S0230	you go and get the milk
S0229	i'm stay firm now i tell you
S0192	don't say hello to your father
S0198	go get it yourself that's what he say to me
S0229	when i when i get change this morning i put on what i want to put on already on the bed wait for me
S0198	yeah yeah
S0230	oh let me put that top on
S0198	well you know i like this top don't you
S0230	i think
S0192	get him train
S0230	he look as though it's the only one he's get
S0198	i know
S0230	and it's not
S0198	he's wear that picture of
S0229	oh yeah what
S0192	oh yeah
S0198	see see that
S0192	do you just have many copy of the same type
S0198	you need to get some better trainers dad
S0229	mm sorry
S0198	get some newer trainers
S0192	they're alright aren't they
S0229	these be expensive ones them
S0192	there you go your dad's just you treat him back buy him some trainers
S0198	i try to buy him a coffee earlier jesus like i try stab him in the back
S0229	you look after him and
S0192	brutus judas
S0198	oh have you ever watch rome mum you haven't have you the tv series rome
S0192	it's british make
S0198	's get it on oh 's get it on dvd in
S0192	it's really good
S0230	be it
S0192	very well act
S0198	you'd love it yeah really good
S0230	oh
S0198	just
S0192	end of the first season's a bite dramatic
S0198	yeah yeah they've get yeah
S0192	season
S0198	they've get a great duo in it the the two soldier and
S0230	peaky blinders come back on tonight
S0198	oh tonight
S0192	it start again
S0198	oh there you go we'll be download that soon enough
S0192	peaky blinders
S0198	peaky blinders
S0192	from birmingham
S0198	that be good
S0230	do anybody want them last two chip
S0229	no thank you
S0192	they're yours
S0198	no i've get
S0229	i'm bloat
S0229	one one each
S0198	see on it somewhere
S0192	a v
S0230	oh it be isn't it yeah
S0230	definitely get my name on it that even their chip in here aren't bad
S0192	do you want that poppadum
S0230	no thank you i've get plenty of poppadum here
S0230	would you like some more erm
S0192	no give no i've still get
S0230	some poppadum
S0198	should have just give them
S0229	the way the way he's have his tip he's have his tip the waiter i'll give him two poppadums
S0192	he'll be back there enjoy that then
S0229	he'll that other couple
S0230	i wonder why it get send out to some
S0192	carry them off with his hand
S0230	i know
S0229	yeah probably
S0198	like from from another you know all this stuff's get manhandle and
S0192	you should have give him a karate chop before you them over
S0229	yeah break up
S0192	at least then you'd be
S0198	that would have be quite entertain
S0230	the chip be two pound sixty
S0229	no
S0198	that wasn't event that big of a bowl
S0230	we get all this really cheap food and then tell us two pound sixty
S0192	that's how they go yeah
S0229	that's how they make their money innit
S0192	don't order chip again
S0198	you do like their chip don't you it's obviously not necessary
S0192	i be work it out in my head and i think it be a little bite more than it should have be there we go
S0198	never mind eh
S0192	there you be there's a tissue there
S0198	how much be it in total how much do we owe you
S0229	nothing
S0230	bundle
S0198	how much be it
S0230	twenty nine twenty something like that
S0229	when i've run out of i'll let you know
S0198	it's fine
S0229	do you
S0198	yeah
S0192	i spend a load the other day i take him out for his birthday
S0229	i'll let you know
S0198	yeah yeah
S0229	i'm alright
S0198	yeah yeah yeah just let me know
S0229	i've still get one and a half leave
S0198	yeah do you take them to belgium
S0229	yeah
S0192	and they're all order starters and desserts and have about four pints there and i think he'd forget that i be gonna pay so then it come to the bill and he be he'll pay and i be like no i say i be gonna pay
S0229	so where we go now darling
S0192	so i stand by it but it be like seventy five quid for three of us
S0230	oh
S0198	there be a pint in there so
S0230	can go halve
S0192	he do he do offer but i be like no i can't really
S0198	but he pay for it in a way talk
S0192	well yeah i do seven hours of record with him er yeah over a couple of days and then i do well i manage to do fourteen hours in the three days i be at home
S0198	but i still think in a restaurant of an even three people desserts four pints like six seven pints between you and for the meal seventy pound be
S0192	the problem for me be the curry be no better than this
S0230	mm
S0198	i don't think it be in a lot of place
S0192	i actually think it be a little bite worse
S0230	i mean that takeaway one in i don't think their curry
S0198	yeah i use to think it be good but i anymore
S0229	it's crap mum's be the best one
S0198	yeah yours be
S0229	nice and thick and spicy
S0198	you've start to do a more generic just that general one where you cook the rice and that's really quite similar to yours actually it's good
S0198	we stick it in a wrap and then put the wrap in the george foreman and see we have like a toast tortilla yeah
S0192	yeah we have like a curry panini thing
S0198	yeah
S0229	oh the old george foreman's come in handy then
S0198	oh yeah
S0192	a chilli panini thing
S0198	we've make all kinds of paninis yeah
S0192	yeah we just keep stick
S0198	stick in the foreman
S0230	and the erm have you use the little oven grill thing for toast
S0198	yeah when come cos i don't if i buy bread i don't buy slice bread i'll buy the uncut bread i prefer it and so in the co op in the even once it get past a certain time
S0192	it's all reduce
S0198	anything that's leave on the baker section be half price
S0198	so yeah and then i cut a really thick slice
S0198	so it have to go or if you buy them again then
S0192	can't say i've manage it
S0198	yeah but i baguette in it
S0192	yeah you
S0198	those toast baguettes with butter and honey oh oh lovely where be honey in
S0192	i know you be miss out set honey be have it in my yoghurt recently
S0198	yeah you
S0230	always go round the market erm bruges i notice there be a stall sell honey
S0229	yeah
S0230	they've even get a little there with his feelers in
S0198	oh the cone oh really
S0230	yeah
S0198	that's someone be
S0230	yeah
S0198	i wonder how much he charge for that
S0192	do you both like honey
S0230	yeah i i like you know
S0229	i like real honey
S0192	raw honey
S0198	mm
S0229	yeah proper stuff i don't like the other shite
S0192	it's really it's really good for you raw honey
S0229	yeah i know it be if you can get it
S0198	it be
S0192	it's really nice with like a greek yoghurt it
S0198	yeah yeah fantastic thank you
S0229	nobody's
S0198	your poppadum rice
S0192	have you hear of this manuk
S0198	yeah can't take them all at the same time
S0192	no two at a time i'd drop it if i take more than that
S0198	yeah it's have you hear of manuka honey you'll see it in the supermarkets probably
S0192	it's from new zealand
S0198	it's ever so expensive
S0192	oh yeah you get like a little pot's like eighteen pound
S0198	it's mean to come from like the best type of erm best type of what's special about manuka honey exactly
S0192	it's probably all just a con isn't it
S0198	special type of
S0192	it's not cross pollinate like other honey be quite often be from different plant or from a variety of things i don't know it's a special
S0198	it's mean to be the best for your like really healthy for you and good for this good for that
S0192	but i refuse to pay eighteen pound for honey
S0198	korean yeah yeah
S0192	do you remember in china that honey
S0198	it's really weird expensive honey and then in the bottom of it
S0192	really expensive
S0198	it must come from some old tradition of have something in your honey there'll be little like
S0192	there be a chess piece
S0198	a plastic chess piece
S0192	and do you know when you get a you know when you get a stick with a balloon on it
S0198	yeah
S0192	and there's that little bite of plastic that connect the stick to the
S0198	yeah
S0192	there be one of those in the honey
S0198	in the honey but in the really expensive cut off section
S0192	it be like fifty pound honey and then like i'd be like oh there's a pawn
S0198	bite of plastic in there
S0192	there's a chess piece in there or there's a balloon grip
S0198	i don't know if it come from some old good luck thing but they're just chuck shitty bits of plastic in it
S0192	weird innit
S0198	shape like stuff we do see some bizarre things when you be travel didn't you
S0192	yeah
S0198	what different culture do
S0229	bring that food up darling
S0198	it's get there
S0230	there's no rush
S0229	it's
S0192	do anyone want my sweetcorn
S0230	there's no rush
S0198	i'm alright actually i think i'm full
S0230	i didn't even realise it be sweetcorn in it
S0192	in the samosa a bite strange
S0198	yeah i don't think
S0192	i think it be a bite strange
S0198	i don't think i don't think indians use sweetcorn much do they
S0229	no
S0192	how spicy be yours cos mine be really mild
S0198	yeah no they don't do spicy in here
S0192	really mild
S0230	not yet i'm too full up for anything else at the moment
S0198	what be you on about
S0230	magnum
S0192	oh
S0229	on the way out
S0192	yeah
S0198	co op's be do a pack of three magnums for two pound recently
S0229	be that
S0192	yeah
S0198	which we've treat ourselves to a few time cos it's over it's like it's nearly two pound for an a magnum in some shop you can get three for two pound
S0192	we can't believe how much chocolate bar and pack of crisp have go up
S0198	yeah
S0192	you'd swear it be thirty five p when we leave and now it's seventy p standard
S0198	if you go in a newsagents or a co op it's like seventy p or sixty p for a chocolate bar
S0192	but if you go in aldi it's still thirty three p
S0198	still thirty three p
S0192	like it use to
S0198	weird isn't it
S0229	weird innit
S0198	or go to poundland and you can get a pack of three for a pound
S0192	they want you buy in bulk
S0229	yeah
S0192	cos even in co op they're you get one chocolate bar for seventy p or three for one pound thirty
S0198	for one pound fifty or something like that yeah
S0192	one pound twenty so you're like well i'll just buy more but you end up just eat more
S0198	yeah you end up with a pack of three of wispa in the fridge and don't know how it's happen
S0192	we've we've have a constant supply of terry's chocolate orange haven't we for
S0198	they do it for a pound in the check chocolate orange
S0192	be it a quid though
S0198	i mean we've only buy them twice but we make them last like four days
S0192	be it a quid
S0198	it's a pound yeah
S0192	so much better than buy a chocolate bar
S0198	so much better value yeah we like terry's chocolate orange
S0192	it remind me of christmas
S0198	really good never have oh more haven't have any chocolate orange in korea oh once you say you're do you're do aren't you
S0192	well i catch that
S0198	cheer yeah dad that's where i get it from
S0198	my house be live in your house i think you've get burp burp and fart all day between you me mum ah
S0229	yeah and
S0192	nothing wrong with a bite of flatulence be there
S0198	it's natural i suppose
S0192	let rip
S0229	we be in
S0198	yeah
S0192	very regal
S0198	the other wetherspoons build be a bite nicer actually
S0192	we'll go to that one next time then
S0198	yeah mix it up
S0192	what be it call
S0198	wetherspoons i you could only see er the wetherspoons from
S0192	j d wetherspoon
S0198	yeah it look like it be on on a it wasn't on a junction it be just
S0192	it's that way isn't it
S0198	it's down there yeah it's down that road down there
S0198	no no next to oh yeah that road down there
S0192	yeah that's where i'm point as i say i find it on a map cos i have to look up this place
S0198	yeah
S0192	i'm glad we convene at the right one
S0198	yeah me too
S0229	be we walk from here or drive from here
S0198	we're gonna walk first to the second hand big one
S0229	yeah yeah
S0198	and go round that little area
S0230	antiquey one
S0198	and then we're gonna come back and then we're gonna drive to the charity shop
S0230	where be it
S0192	road
S0198	yeah
S0230	different in the oh mind you that be five o'clock in the morning
S0198	do we need anything else from the shop
S0230	there's that wet weather come down
S0192	winter be it
S0230	yeah
S0198	yeah
S0230	it be change
S0198	it's not gonna last much longer
S0230	it's gonna change this weekend
S0229	yeah
S0192	it's lovely at the minute
S0230	the jet the jet stream move in
S0198	the gulf stream
S0230	be it the gulf stream
S0198	yeah the jet stream
S0230	or one or the other i think there be a jet stream as well though isn't there
S0198	from a jet
S0229	only when you're in a jet
S0230	no i'm sure it's
S0198	it might be
S0192	it didn't sound wrong to me so i'm not sure
S0198	no it doesn't yeah yeah
S0230	i'm sure they say it be the jet the jet stream
S0229	zoom what be that jet stream
S0192	be it move then be it be it the end of the world
S0230	yeah it's
S0230	it's be go above scotland
S0198	oh yeah
S0230	and it's come down
S0198	yeah that's a different stream
S0230	and the the high pressure below it you see
S0229	ryanair
S0192	cos that's what keep us warm the gulf stream
S0198	yeah yeah there's there's a different stream we're talk about
S0192	we're on the same line of longitude as like freeze other part of the world so if we didn't have that our winter would be like minus ten minus twenty like consistently
S0198	they're not they're damp
S0192	but it could happen they've find in history that the gulf stream have reverse
S0198	it's go it reverse every x amount of thousands of years so at any point it could just plunge us into the worst winter ever
S0230	the ice age again
S0192	yeah
S0230	there be an ice age
S0229	yeah
S0192	yeah
S0198	there be definitely an ice age i don't know if yeah
S0192	what's crazy there's a tip point in the ice age as well
S0198	yeah yeah once some once it's
S0192	once it get below about middle of france
S0198	yeah then that's that's
S0192	the whole world will freeze
S0198	the whole world will freeze
S0192	so there'll be an ice age
S0198	yeah
S0192	we've have it before where it's come down about so far and then it's still kinda hot in the equator but if it get down to about southern france so i've hear
S0198	mm then it's chill the world enough to the the whole world really
S0192	the world's cold enough the world will freeze over
S0230	bite like that erm film
S0192	yeah just like it
S0198	the day after tomorrow
S0192	well i be think
S0229	when i have a lager oh when it come on
S0192	i be think i be think ice age
S0192	not not ice age
S0198	you've gotta have a whisky dad
S0230	there be a film i think it be the day after tomorrow
S0192	yeah
S0230	where it just
S0192	the day before the day after tomorrow
S0198	alright alright gonna need another wee anyway
S0230	and er
S0192	i'd better head back then hadn't i
S0198	yeah you'll get lot of work do today i'll get nothing nothing
S0192	there you go shall i pause this now then
S0198	no give it another
S0192	i'll just leave it
S0198	second yeah while
S0230	i mean it's still crazy that there be that you know dinosaurs wasn't there
S0192	yeah
S0198	yeah there be dinosaurs quite a few of them
S0192	what's crazy be there still be
S0230	and how many millions of years they exist for
S0229	instead of be walk about now
S0192	then poof
S0230	yeah
S0192	go
S0230	they die
S0198	have to say this don't we
S0192	although today we still kind of have i mean a crocodile be effectively a dinosaur
S0198	they're prehistoric
S0192	they're perfectly evolve they be around at the same time they grow up to like seven or eight metres in length in the sea which be like three or four time the length of your dad they're pretty big
S0198	just with a bite sharper teeth
S0192	yeah
S0230	what's that alligator
S0192	yeah crocodiles salt water crocodiles they're dinosaurs effectively
S0230	crocodiles yeah
S0192	mm mm
S0198	mm mm mm
S0230	well they think some of the fish in the ocean be prehistoric as well
S0192	yeah
S0230	don't they
S0198	oh yeah no they definitely will be yeah that's where it do survive the prehistoric stuff so
S0192	but they don't need to evolve anymore
S0198	no yeah
S0192	they're perfectly suit to their environment it's all good
S0198	what do whale evolve from cos they're massive
S0192	they be sea creatures that come out onto the land and then go back into the sea
S0198	and then go back into the sea yeah
S0230	whale
S0192	hence why they breathe
S0198	yeah
S0230	oh and they're mammals
S0192	yeah mammals in the sea will have come out of the sea and go back in the sea
S0198	it's probably also why they're
S0192	theoretically it's
S0198	i mean maybe not why but they're incredibly intelligent as well so
S0192	yeah
S0198	that cross over
S0192	you may have find that they never truly leave the sea
S0198	yeah yeah
S0192	they just kind of be a bite land sea base and then kind of go back in
S0198	yeah they be really
S0230	ladies run around
S0192	do you know there be
S0198	yeah you get worry about a centipede come towards you imagine a bloody whale come down
S0192	if you think how inland
S0198	those little legs
S0192	how inland russia be there's no sea in the middle of russia or anywhere near it there be dolphins in one of their biggest lakes there because of where the sea use to be connect where the sea level be much higher
S0192	where it be sea that far inland
S0230	yeah
S0192	and there be dolphins in the lake
S0198	yeah this i mean this lake be huge
S0192	it's huge lake
S0198	but it's very far from the ocean
S0192	yeah
S0198	and it's get all kinds of species of animals hide in it
S0192	it's massive it's about as far from the ocean as you can be but there be dolphins in it
S0230	you ever be to russia
S0198	no no we'd love to go
S0192	well we go through moscow on the way home
S0198	oh we do we do very very briefly run
S0192	yeah we be that be horrible
S0230	ah
S0198	in the end we go past we run past all the people on our flight and basically push in front of the queue
S0192	we be the first on the plane we didn't know
S0198	we think we be late
S0230	mind you that be like the first time we fly to italy wasn't it when we when we
S0198	yeah go to via amsterdam
S0230	via amsterdam and we only have a very small window
S0198	and mum be guide us cos i be a child
S0230	yeah so that be the first time either of us have fly
S0198	fly and we we be stand on the side of this glass bang on a window which be our gate go how do you get in there
S0198	so we be on the other side
S0192	how old be you
S0198	er ten eleven
S0230	do you tell about the suitcase
S0198	yeah yeah i tell you my mum get on the conveyor belt with the suitcase
S0192	you get on it
S0198	cos she think once it
S0192	brits abroad eh
S0198	she think once it have go it wouldn't come back again now it actually go
S0230	it go behind plastic you see and i didn't realise it keep just go round and round
S0192	what do you think happen to it all
S0230	i don't know
S0192	that be it furnace
S0198	so as it get near the end she jump on and grab it off
S0192	incinerator
S0230	and it wasn't even my suitcase and
S0192	do anyone say anything to you
S0198	no
S0230	well one bloke say well that be close or something didn't he or that be lucky
S0198	i don't remember that bite i just remember be horribly embarrass
S0192	after you weren't suck in there
S0198	yeah
S0192	you'd have get lose with the baggage
S0229	yeah could have do
S0192	yeah that'd have be it
S0198	we laugh about that for some time clearly
S0230	and at the end
S0198	ten years later no fifteen years
S0230	and that suitcase be still there as well at the end
S0198	yeah
S0230	wasn't it it wasn't claim
S0198	and my one wasn't didn't come through
S0230	and your
S0198	that look like it
S0192	be that the only time that's happen
S0198	er yeah lose our suitcase
S0192	if we know that we weren't gonna get our suitcases this time i know it i know it
S0198	yeah there be a feel it's cos our connection be too short
S0192	ah i know it mm mm
S0198	set her off didn't we
S0198	half a pint just leave her in here on her own now shall we of an afternoon
S0229	dog with you in a minute if we don't move out of here
S0230	when we be on the ferry go over
S0198	you say some priceless things dad i've get that on tape
S0230	when we be on the ferry go over dad give a run commentary on everything about the boat land and say about this boat in the distance now i could see it be a ferry come towards us he think it be another one in front of us
S0192	i'm not sure i get it
S0198	it's alright it's an in
S0192	do i miss the punchline
S0198	it's genetics
S0230	but when we actually get when we be cross them over he say bloody hell we've catch it up
S0229	it be come forward all the time
S0192	optical illusion yeah
S0230	i didn't even realise he didn't even realise that it be come towards us
S0198	realise that it be come towards us oh dear oh dear
S0198	priceless stuff at least you keep each other amuse there you go you can go darling don't stand here you don't have to wait around for this tomfoolery
S0230	no
S0192	cool
S0198	enough's enough eh
S0192	thank you very much alright lovely to see you again yeah
S0230	yes yeah and you
S0192	sorry it's only quick
S0229	ta ta mate
