S0327	i mean that's cos i i meet him twice the first time he come here
S0445	yeah
S0327	your mum bring him here and he look like quite chunky
S0445	really
S0327	i be
S0445	you say we okay yeah
S0327	and then when i meet him at the private view at the ra he he be really really thin
S0445	oh oh be he i don't didn't notice him
S0327	yes he'd lose a lot of weight well you know can you imagine five hundred calories a day
S0445	yeah yeah yeah yeah
S0327	i mean that's
S0445	no wonder he's in a bad mood
S0326	yeah
S0327	no wonder he's in a bad mood i don't know how he do it i'm really full of admiration
S0445	mm
S0327	that be a i mean that be an apple and a lettuce leaf
S0445	yeah that's
S0327	well not much more i mean
S0445	oh as much celery as you like
S0327	as much celery as you like my god you get tire of celery don't you
S0445	well it's good for like if you want something crunchy
S0327	anyhow your mum's happy and that's the main thing isn't it
S0326	mm
S0327	and what's wrong with your dad that he's so difficult to stay with
S0326	i dunno i just i would rather not
S0327	you'd rather not stay with him
S0326	yeah
S0327	be he demand
S0326	not really i just don't i just i dunno he's get a ponytail
S0445	oh
S0327	he's get
S0445	he's get a ponytail now
S0327	he hasn't have he
S0445	oh my god
S0327	he hasn't why do they do it
S0445	yeah that's so strange
S0326	i don't know
S0327	why do they do it
S0445	do he have a beard as well
S0326	no
S0445	oh just a ponytail
S0327	fancy that
S0445	yeah
S0326	it's really bad though
S0445	how be it long
S0326	i dunno but it's sort of like
S0327	be it embarrass have a father
S0326	it
S0327	with a ponytail
S0326	well i mean yeah i would never i i mean when i first saw it i be
S0326	i couldn't i couldn't barely speak a word for the next hour
S0445	really it's that bad
S0327	but you can't criticise him
S0326	cos he
S0327	you couldn't tell him
S0326	i can't i tell his step i tell his wife to tell him to cut it off
S0445	and she didn't listen
S0326	i be like no i be like i be like so what be you gonna do about that she say i know i dunno
S0445	oh really
S0326	cut it off in his sleep
S0327	tell tell him it's a
S0445	yeah
S0327	bite late
S0327	twenty years ago wasn't it when they be in
S0326	well
S0445	oh have get a ponytail
S0326	yeah it's okay if you're a young man though
S0327	it's exactly that's a whole different thing
S0445	mm
S0327	how old be your dad now
S0326	sixty three or something
S0445	mm
S0327	same age be exactly
S0445	oh really everyone seem to be the same age as
S0327	well only people who be sixty three
S0445	isn't the same age as
S0326	yeah i think so he's
S0445	yeah
S0327	be he
S0445	that's what i think
S0327	well it's obviously the age to be at the moment isn't it
S0445	yeah don't know
S0327	and be he do well in america
S0326	yeah i and i guess so but he's be here for the last year
S0327	oh oh have he
S0445	oh
S0327	i see
S0326	on a
S0327	nobody tell me anything
S0326	sabbatical
S0445	oh
S0327	i mean i i'm worry about your mum not have enough to do but she didn't think that be gonna be
S0326	yeah i know i think she won't have enough to do
S0445	no but she the she do tell my mum er like a long run through of the day it be quite funny
S0326	do you have any tea more tea
S0327	i'm alright erm
S0445	no i'm okay
S0327	what all the things she have to do
S0445	yeah and like
S0327	chores
S0445	get up she'll er stoke the fire and you do all these chores and then it take a good half a day to soak up the scenery she say
S0327	well she may
S0327	she may love it
S0445	yeah but er you don't need half a day to soak up the scenery
S0326	i mean can you imagine in sort of like
S0326	november and it's
S0327	she'd work hard
S0445	yeah that's true in the winter
S0327	in the winter yes i mean it's
S0445	yeah
S0327	but then she's not stick there forever maybe
S0445	no
S0327	she can stay there for a year i do say last time i say i don't i have a feel i'll never see you again and she say oh don't be ridiculous
S0326	but she also say that she's i mean more and more she's say that she won't she'll she'll be back in london quite often
S0445	mm
S0327	oh more and more she's
S0327	say that be she well they're still on honeymoon you know
S0445	honeymoon
S0327	honeymoon
S0445	what
S0327	well they haven't know each other that long
S0445	oh they're yeah yeah yeah
S0327	they still love each other
S0445	honeymoon yeah
S0327	very specially
S0445	yeah yeah yeah that's true
S0327	i mean you note the thing in their family they all get their boyfriends or girlfriends with the same name as the one before
S0445	yeah i mean yeah
S0327	isn't it
S0445	i know
S0327	you'll never find anybody else call though
S0445	unless i go to the gambia
S0445	where they're all
S0327	yeah
S0445	call
S0327	be they really
S0445	yes
S0327	oh right
S0445	yeah
S0327	yeah
S0445	i email it to you
S0327	oh good thank you
S0445	but i don't know if it's the end version i think it might be
S0327	well i'm very interest to read it
S0445	mm it's long but
S0327	so have you get an education now
S0326	get there
S0327	get there you're still get on with your tutor
S0326	yeah
S0327	that's nice sound to me like you hit lucky with one or two of them
S0326	yeah they're good i mean they be they be good they're
S0445	yeah
S0326	very sort of attentive you know
S0327	they're what
S0326	they've very attentive and available
S0327	i mean that of course
S0445	oh that's the opposite of my university
S0326	even the sort of like the hotshot ones be
S0445	really
S0326	even the one who's like sort of he's retire he's like eighty and he's sort of he's like but if ever you wanna go and see him you just email him
S0445	really
S0327	god
S0445	yeah
S0327	god you don't know what that's like do you
S0445	no
S0327	i mean i'm so disgust with what 's tell tell me about you know and the difficulty of get in touch with your tutor
S0445	the they cut load of fund to and increase all the fund to the like the like poly universities in and so if
S0327	be that right
S0445	lose like i can't remember it be like two million pound fund
S0327	that's very
S0445	and then everyone else
S0326	that's not a lot
S0445	gain it
S0327	no it's not a lot no
S0445	it it must have be more than that because i read it and i be like oh my god
S0327	really
S0445	yeah
S0327	mm
S0445	and be
S0327	well you know luckily people like you can do their own research and so on but the they it must be very difficult for some kid who have go go straight from school and don't know how to do that and also
S0445	i don't have a choice
S0327	you know nine thousand pound a year be not nothing
S0445	i know
S0327	and what's more now the government
S0445	yeah
S0327	have make these change that's go to go up
S0445	the maintenance grant thing yeah
S0327	and the
S0445	but it won't affect me
S0327	you're gonna lose your maintenance grant aren't you
S0445	no it's not gonna affect me
S0327	it won't affect you thank goodness
S0445	no
S0327	for that
S0445	if it do then i would literally i would just have to pack my bag and come home cos i couldn't afford to
S0326	what's the change they're do
S0445	get rid of the grant
S0327	they're get rid of the maintenance grant
S0445	but i think they're gonna increase the loan but it's like the grant's the free money you get
S0326	no it's not affect you but be it affect me
S0445	no i think i don't think it i don't think it'll go in the
S0326	i don't understand how it
S0445	you've already get your fund next year and i've already get it but it's
S0326	but i but i'm yeah
S0445	so i think it's probably
S0327	do you have a loan like that
S0326	i get load of i mean i get quite good deal
S0445	mm
S0326	cos
S0327	do yes
S0326	but also since my mum's leave her job
S0327	say it again leave
S0445	yeah that's true
S0326	since my mum's be leave her job
S0327	yes
S0326	i think i get i'm gonna get the full bursary from which be like three thousand a year
S0445	yeah but doesn't it work out as your last as the last year of pay
S0326	yeah i know but i'll just write to them i mean i'll go and meet them and be like
S0445	yeah yeah yeah yeah sure
S0326	it's not gonna show up on tax but that's what it be
S0445	yeah
S0326	and i don't have
S0445	yeah
S0326	other
S0445	yeah that's the annoy thing about it cos mum earn a lot like a fair amount last year but this year she's get hardly any money so like i'm get less money but she's get less money this year so it's a kind of a
S0327	well
S0445	dumb system
S0327	i've have a terrible couple of years but i have a feel it's turn now
S0445	touch wood
S0327	touch wood and if it do then i can always some money
S0445	well you can always get a job at the co op granny
S0327	i can always well i'll have to go on the train
S0327	i can always well i'll have to go on the train
S0445	yeah the train yeah the train that's true how many months about six months' train they say
S0327	no they i didn't don't know how long it be
S0445	oh i know it's probably a day
S0327	it's probably a day yes i have a feel i'm not cut out for that job
S0327	that they'd look at me with i don't think i'd get it
S0445	no
S0326	have to put on a
S0327	likely
S0445	mm
S0327	i see everything you know at night if i'm in my studio when i go in
S0445	mm
S0327	to close the blind i look across and i can see everything in there it's fascinate
S0327	well actually it's not very
S0445	but there's no people
S0327	yes it's it's up until eleven o'clock at night
S0445	okay yeah yeah
S0327	i could maybe
S0445	well you could work at scotmid which be the scottish co op and erm you might have easier customers cos you've get can't buy alcohol past ten pm
S0326	ten
S0327	be that right
S0445	yeah
S0445	you can buy alcohol between ten be to ten pm in scottish
S0327	no
S0445	in scottish shop
S0326	that's but that that's not
S0445	it's so
S0445	it's so bad
S0326	that
S0445	it's so bad
S0326	bad as in
S0327	but it's very sensible of them because of course people get drink and then they go and buy more
S0326	yeah but it's only one hour before it close
S0327	oh right
S0445	no but it's every shop it's every shop
S0327	oh well
S0445	you know that thing of like you go out to a club the club finish and three and you wanna go back to someone's house and unless they've already get alcohol
S0326	yeah
S0445	like you're screw
S0326	be there no no people like die of drink things
S0445	what like illegal
S0326	no not illegal i don't think
S0327	i don't you turn into an alcoholic now
S0445	oh no i'm not an alcoholic
S0326	do you drink that erm fortify wine they have in what's it call
S0445	erm yeah i have i can't remember the name of it
S0326	it's like get red it's get caffeine in it and stuff
S0445	oh yeah
S0327	oh my god
S0445	oh my god what's it call
S0326	it sound what's that what's that what's that sort of it's a subculture drink er neds be it neds
S0445	yeah it be neds
S0326	so you
S0445	i need to find i need to find it i have have it before
S0326	it's call like buck buckwheat or buck something
S0445	oh yeah yeah
S0327	be you be a great drinker
S0445	erm but
S0326	massive
S0327	oh serious seriously
S0326	yeah erm
S0445	do oh buckfast it's
S0326	not really
S0445	it's call buckfast
S0327	you can press down a decent amount can you or do you get sick or
S0326	no i never get sick
S0327	oh that's useful
S0445	don't you
S0327	oh well
S0326	i can do yeah i can drink a lot
S0327	at your age you can stand it all
S0445	mm
S0327	mind you i've get to be very careful what i say do you remember when i say to and i tell him off for be so stupid to put his glass
S0445	oh yeah
S0327	in a place that his mum
S0327	couldn't find
S0327	he tell you mum and she be furious with me
S0327	she think i should have tell him off and
S0327	and i do tell him off but for for be silly not
S0327	take drug
S0445	yeah but it wasn't like it be heroin
S0327	well one have to assume that you're
S0445	it be
S0327	none of you be stupid enough to do that kind of thing erm on the friday the twenty fourth i'm do a little party be you around
S0326	of
S0445	july
S0326	july
S0327	yeah it's in about two weeks
S0445	oh yeah
S0326	it depend if i go to or not
S0327	okay will you let me know when you know
S0326	yeah
S0327	because erm my friend upstairs be cook fish pie that's why i'm do it on that day and
S0445	oh yeah so what be i gonna eat then
S0327	bring your own
S0445	granny
S0326	why don't you eat fish what's wrong with the fish
S0445	it's gonna it's gonna have shellfish and i'm allergic to shellfish
S0327	well you just you can push the shellfish she's a very
S0445	it doesn't work like that
S0326	oh i i go to i i i well i saw a menu cos i go to portugal for one day and they have a menu there and it say
S0445	oh yeah
S0326	sell sell fish platter
S0445	oh
S0327	they they say what
S0326	they they
S0326	cos you know how they sign they make quite a lot of spell mistake on
S0327	oh sell fish they say
S0326	sell fish sell fish platter
S0445	mm
S0327	lovely
S0326	for two people
S0445	yeah i could have accidentally order that not know it be shellfish
S0326	there's something call a starry egg i don't know what that be though
S0445	starry egg
S0326	beef with
S0445	that sound disgust
S0326	starry egg or something
S0445	that sound disgust
S0327	do you think it's erm
S0327	what be they call those those little egg er shell that you hardly ever see here and you go to spain and portugal
S0445	quail's not a quail's egg
S0327	no no fish er they're fish like oyster
S0445	oh fish
S0327	they're seafood
S0445	caviar
S0327	not not fish
S0445	caviar
S0327	no
S0445	fish egg
S0327	it they
S0327	it look it it look
S0326	sound disgust
S0327	like an egg it look like an egg and you cut it in half and you dig it out like you dig out an oyster
S0445	that sound
S0327	it be utterly divine
S0326	no never have that
S0445	grim
S0327	it be like it be like eat pure sea
S0327	which be wonderful but it's one of those things to have to be absolutely fresh like oyster you know
S0445	mm
S0326	mm cos
S0327	forget what it's call
S0326	where we might go in be where we all go that time
S0327	oh yes
S0445	oh yeah
S0326	when we find oyster
S0327	yes
S0445	oh yeah you find oyster
S0327	yes yes that terrible
S0327	oyster that they have
S0445	oh yeah
S0327	that be one of the most embarrass things i've ever do
S0445	i know that be so
S0327	almost as embarrass as as your mum and the both your mums leave on the leave off the freezer full of full of erm and steaks and
S0445	oh no
S0327	but they do you know one of those great big freezers
S0445	oh no
S0326	at at that same house
S0327	at that same house
S0445	the same trip
S0327	same trip
S0445	or do oh no
S0327	which be that's why we can
S0445	that's why
S0327	never be able to go back
S0445	yeah we're never go back
S0327	for ten years
S0445	oh my god
S0327	i know i mean absolutely unbelievable
S0326	i can't remember that be it good good fun that house i can't remember
S0445	it be alright
S0327	it be alright erm
S0445	i i have a good time
S0327	er there be too many of us i think
S0445	i have fun
S0326	and we do fish
S0445	yeah we do fish
S0327	have a very good time cos he go out fish with your dad every day
S0326	yeah i go fish be you
S0445	yeah yeah
S0326	be fish be in charge of kill the fish
S0445	yeah i have a great time
S0326	now she won't eat them
S0445	no i never eat
S0445	i never eat fish though
S0327	i can still remember and the crab i think
S0445	yeah
S0326	oh yeah i remember that
S0445	yeah yeah
S0327	a big crab and i say oh you know er he say i'll kill myself
S0445	oh we find we bridget jones's diary watch that
S0326	oh yeah
S0445	like twenty time
S0327	oh yes
S0445	and we play that game that cricket game where you roll the dice do you know it
S0326	i can't yeah like
S0445	well you it be your game
S0326	i remember we tie load of string across the bedroom
S0445	oh yeah that be fancy there be a
S0327	what do you what do you do
S0326	we make sort of like you know how like i think it be
S0445	we make
S0326	inspire by like in movies when in sort of gallery robbery they have lasers all over the place
S0327	yes
S0445	oh yeah
S0326	we do one with like string all over the
S0327	oh i see
S0326	cos we have a room with two bunk bed
S0445	yeah
S0326	sort of thing
S0445	those be cool
S0327	and who sleep i the room with a bath be that your
S0445	er mum and dad yeah
S0327	your mum and dad yes
S0445	yeah
S0327	i mean be that how many year ago be that
S0445	oh a long time
S0326	probably ten
S0327	probably ten years ago
S0445	you have picture of it there's a picture of er all of us
S0327	yes a i never date i never date those picture which i should do
S0445	oh yeah mum be ill
S0326	it might say on the back
S0327	do it
S0326	some if they've be
S0445	wasn't that before mum get diagnose though
S0327	she be ill
S0445	but she have that be when she have me
S0327	that's when she have me yeah
S0445	so it would have be like
S0327	she have a hard time
S0445	twelve thirteen years ago
S0327	yes my god
S0445	ish
S0327	my god how time
S0445	or maybe even fourteen
S0327	no not as many as that
S0445	but her ten year all clear wasn't that long be like
S0327	that be a year ago wasn't it
S0445	it wasn't it two years ago
S0327	be it two years ago
S0445	i think so
S0327	it be twelve years ago so yes you might be right
S0445	and then it be the year before that
S0327	the worst holiday we have be in berlin that be awful
S0445	i have a like i have a fun time so
S0327	you be bloody miserable you be
S0327	i've get photograph to prove it have a sulk er with in some restaurant and then you run away as you be incline to do
S0445	oh
S0445	i can't remember why
S0327	i remember the problem for me cos i'm a morning person i get up early and i like to do if i haven't do anything by half past eleven i know that i won't
S0445	oh yeah
S0327	achieve anything
S0445	but wasn't
S0327	but nobody else would get up till about midday
S0445	well
S0327	and by then i ready
S0327	to practically to go to bed
S0326	should have go by yourself
S0445	i know
S0327	yeah and then then we go to the erm erm
S0445	we do good stuff
S0327	erm
S0445	oh that no that that wasn't nice we
S0327	that be not nice
S0445	there be so many nice lakes in berlin
S0327	i know
S0445	that be not a nice lake
S0327	that be a big mistake and it's get all that terrible history to it you know
S0445	but you have a nice naked swim
S0327	i have a nice naked swim yeah
S0445	and then you be sit like
S0327	i get to the i get to the the beach
S0445	you expose yourself
S0327	and i suddenly realise i hadn't get a swim costume with me
S0327	oh my god and but then there be a big fence and behind the fence
S0445	not a big one
S0327	be people swim with nothing on
S0326	yeah
S0327	and i think well i i don't know anybody i'll wear my i've get no clothe on i wear a scarf round my head and my
S0327	sunglasses
S0327	nobody my best friend wouldn't recognise me
S0327	but it wasn't very nice the water be rather warm and not very deep
S0445	yeah yeah it cos it be like horrible artificial and
S0327	and it be there in that they make the final
S0445	yeah exactly
S0327	the decision about the jews all that
S0445	yeah yeah
S0327	all that you know sort of sit over it
S0445	that be a stupid a stupid idea
S0327	i know altogether it be and and then it take us at least three quarter of an hour for to be able to work out how to get ticket well you know how how big berlin be
S0445	ticket for what
S0327	how spread out for the underground
S0326	you can ticket everywhere
S0445	oh my god ticket it's i always get ticket though
S0326	i i go i go to the sort of
S0445	it's so easy
S0326	the end of the very end of the line all the way without a ticket
S0327	do you
S0445	i've never be there
S0326	to the olympic stadium
S0327	oh i see what you mean er very nice and we have to go and visit you in prison in in in in germany
S0445	but that's the thing like the ticket
S0327	er
S0445	aren't expensive
S0326	they be if you use them a lot if you get on the subway like four or five time a day it's ten euros
S0445	no you no cos you get a day one
S0326	yeah i know but that's expensive
S0445	mm
S0326	i mean it's you save the money of your fine if you never buy a ticket
S0445	well last time i go we be just we be in and we be just walk
S0326	yeah
S0445	we walk everywhere
S0327	hello oh hi it's perfect but i've actually erm and how be you i can ring you back on your phone well well
S0326	in new new york i get catch twice
S0445	do you
S0326	i get a two hundred dollar fin
S0445	two two hundred
S0326	two one hundred dollar
S0445	two one hundred
S0326	but i'd already save like two hundred i still save two hundred dollars by do it
S0445	oh so like even
S0445	oh shit
S0326	also they
S0445	what do they do when you they
S0326	oh it be quite like it be quite first first time they like it be in it be like sort of the roughest
S0445	oh yeah
S0326	they like drag me into like the travel police station
S0445	mm
S0326	and like have i didn't have any id so i have to like sit there in like a cell with other people until like
S0445	yeah
S0326	til someone like till after i'd get my id off someone
S0445	oh really
S0326	i have to use my phone call to get my id
S0445	oh oh
S0327	oh here we go after 's be here every surface of every paper be always
S0445	it's so you don't forget me
S0327	it's so that unlikely to forget you
S0445	when get erm be arrest he use his one phone call me er on me and i didn't answer it cos i think it be ppi
S0327	oh no
S0445	it say erm unknown number number
S0327	poor
S0445	yeah i know
S0327	who do he ring he be only allow one phone call
S0445	yeah
S0327	just like in the movies
S0445	no they actually ring me twice and both time i didn't answer
S0327	yes well most people with mobiles don't answer i think it's
S0326	i never answer the phone
S0445	no but if if you've get
S0327	incredibly irritate
S0445	or like unknown number i kind of tend to avoid those cos
S0327	yes i suppose so
S0445	or like a it come up as block
S0327	yes oh right well i don't use my mobile
S0445	mm
S0327	mm be phone get out of fashion to have mobiles now and people
S0445	well what do you have
S0326	i don't have one
S0327	you don't have one well there we be
S0445	but that's not on purpose
S0326	yeah it's not really on purpose
S0327	oh i see what happen you lose it
S0326	erm it break i mean i have one but it's not it's not i can't use it as a phone it hasn't get it's not unlock or anything it hasn't get a sim card in it
S0327	so what do you use it for to tell the time
S0326	i've get a watch now i don't have to do that anymore
S0326	i don't really carry it around but if i want to go on wi fi i could
S0445	oh the wi fi yeah yeah
S0327	well maybe it'll all stop all this
S0326	no i doubt it
S0327	i doubt it too
S0445	well i've get rid of facebook
S0327	do you
S0445	age ago
S0327	why's that because you think you're get have some more cake
S0445	don't need it
S0326	no i'm full
S0445	i don't like it either
S0327	do you not
S0445	no
S0326	yeah it's pretty useless
S0327	i must say i don't understand it
S0445	i just have instagram
S0327	everybody would know know my business
S0445	yeah but you know what be
S0327	i know what be although i've i've never be about to sum it up
S0327	in a sentence
S0327	but obviously something with a title like grindr you know that they're up to no good
S0445	yeah but i i i can't remember why i be talk about him and you be like oh yeah i know
S0327	yes
S0445	of course i know
S0445	oh right okay fair enough
S0327	i don't think of all the things that the terrible things there be
S0327	i mean all these things that people do that be
S0445	mm
S0327	and meet strangers all that that be just beyond me do you find
S0445	yeah
S0327	something else in the bottom of my cup
S0445	no it smell funny
S0327	can you smell it
S0445	mm probably just milk i'm think i'm smell milk
S0327	it smell alright to me
S0445	mm
S0327	ask what's that
S0445	i be gonna drink it
S0327	so what else erm how about friends at have you make friends
S0326	yeah kind of
S0327	that's be a bite of a disappointment hasn't it
S0326	not well i mean not really cos i'm not really like i have get i've get perfectly decent friends there but they're not of sort of that great
S0327	they're not soulmates
S0326	calibre
S0327	they're not of great calibre
S0326	i mean of of course there's like two or three that be but generally speak i'm er but i'd rather spend time by myself
S0445	yeah well you're not far from anyway
S0326	yeah
S0327	i'm kind of surprise
S0326	i'm not actually when you think about it
S0445	no
S0327	what do you mean exactly
S0326	erm i think it's not it's not a give that all the sort of the most brilliant best people be gonna end up at
S0327	no of course it's not
S0326	and it's not even even the ones that might be be sort of erm there's a lot there's a big sort of everybody be quite there's sort of this there's obviously some it's not true for everybody but basically everybody's sort of the same kind of person
S0445	mm yeah
S0326	and even if they're not they try to be like one there's quite a lot of pressure
S0327	they're all middle class
S0326	to be like
S0327	straight middle class
S0326	no like upper like to be
S0327	oh really
S0326	sort of
S0327	posh
S0326	or to be a certain way in to like make
S0445	posher
S0326	like to be friends to do what be the status quo to do
S0445	mm
S0326	which sort of i think stop people be sort of a bite more interest than they might be otherwise
S0445	mm
S0326	i mean there's all sort of things like it doesn't happen in my college but every other college there's lot of drink societies and that and if you're not i've get one friend who isn't in one in her college and be just sort of
S0445	mm
S0326	ostracise so you have to be in one of these
S0445	really oh my god
S0326	archaic sort of perverse
S0445	that's
S0326	outdated club where you sort of binge drink and get humiliate in order to be have a social life it's that kind of thing go on
S0445	be the er or
S0326	there be an equivalent at but it's also just sort of sort of smaller ones
S0445	yeah
S0326	like there's
S0445	yeah
