S0617	thank for the tea mum
S0525	oh you're welcome you're the only one eat because i wasn't expect your father back yet
S0617	no well you didn't you
S0614	i be back and i'll put the oven on
S0525	okay well we'll have something in a minute
S0614	okay
S0525	so i've get to tell you erm i've just have a a text on the group chat start a group whatsapp with me and him on it this be what he call start when we go ski in bansko i don't know why anyway he's
S0614	x
S0525	he's just erm
S0525	he have just let me read this to you this be funny erm he's just put a a whatsapp on say
S0617	there he be
S0525	hear the saga of the forklift truck question mark i be there you may as well still be there you know exactly what's go on
S0614	yes
S0525	and i just put a load of question mark think well what
S0617	how do know
S0525	exactly so i put a load of question mark down so say he's be down over the easter weekend to give a lesson in how to use the forklifts get a call on monday as well but couldn't make it down then then they get the two forklifts erm stick make me chuckle say they have a new hardcore area put down which be like a big tarmac bite yeah
S0617	mm
S0525	erm cheapskate didn't do it properly both the combi and the forklift get stick in it
S0614	stick
S0525	the transport company have to come and lift them out this morning with a hiab which be erm a lorry with a crane on the back
S0617	how do they
S0614	and it's a forklift truck
S0525	the combi as well i mean the combi's massive
S0525	so it's i say brilliant go yeah it's a laugh a minute erm say wasn't in this morning there's nobody in there be no one seem to know that the combi be stick until they arrive this morning so i don't know what have happen be off first thing probably drive it in them so they tell to drive
S0525	the other one on it which immediately sink and get stick too
S0525	poor
S0525	poor be rush off her feet and then say and be off to lunch and after lunch we're go to so 's the only one in and he'd have plenty to say about it this morning so i don't know when they get stick i bet drive the one in and leave if he be in on monday and now they tell the young lad to to use the other one if he couldn't get that one work so he drive that one and
S0525	get sink into the grind i mean can you imagine i mean how
S0614	there's that bite of er land next door isn't there that er 's get
S0525	be be that what he's
S0525	be that what he's do
S0614	something like that yeah
S0525	so but next erm
S0525	so before the car park area cos they've get the their yard
S0614	yeah
S0525	be there a bite still next to the yard before the car park cos they've make one
S0614	well i think so yeah
S0525	they've make one for all the cars in it
S0614	he do yeah yeah
S0525	it's before that be it or after
S0614	no i don't exactly know
S0525	oh dear
S0614	but all i hear be he'd get he'd get three months free rent from er
S0525	well there's two forklifts stick in it now
S0525	imagine a great big hiab have to come and lift these things out
S0614	yeah
S0525	so he's gonna have to redo it properly now
S0617	be that cos they do it cheap
S0525	yeah yeah he didn't put down enough erm well he cos er er they vary tarmac and what you can get down but obviously if you're carry big heavy
S0617	you want the best
S0525	tonne
S0617	yeah
S0525	a tonne erm could be a fit could weigh up to a tonne
S0617	gotta be hardwearing
S0525	and that's why they couldn't use the the forklift they have the big combi truck which be three time the size of the little forklift
S0614	yeah
S0525	so that's a massive truck to lift the big fit so if you've get that truck and a fit on it of course you need a really substantial and it's gonna be expensive
S0617	oh my life
S0525	he's gonna be try to argue now against the company that do the hardcore i'm sure but go he just do it on the cheap
S0617	yeah
S0614	yeah yeah
S0525	well that's make me laugh i tell you
S0614	cos if you
S0525	how funny be that
S0614	if you look down the erm from the avenue down near the the gate
S0525	yes
S0614	er you can see there's a couple of pip actually where the cars usually go so i don't know whether they've
S0525	oh unless it's on the it's the other side of the cars could be
S0614	feel like you can see but er anyway it's er obviously not haven't do a very good job
S0525	oh dear say half a day be enough for this week
S0617	oh yeah she go in today didn't she instead of come to
S0525	yeah yeah so erm
S0617	that sound hilarious
S0614	have they erm those big blue pip in glasgow weight three tonnage
S0525	that's about right yeah
S0614	yeah
S0525	yeah
S0614	so if you've get you've get some hardcore hold you know these type of pip yeah
S0525	yeah i mean we we don't tend to move anything quite that cos they're thirteen and a half metres long as well aren't they i mean we do get some that big but we tend to get they might have a bite less than that job
S0614	oh
S0525	the odd five metre length or a and they do tend to bring that back there because sometimes they use it for demonstration purpose they cut it and weld it again to show people how to do it or if somebody want the odd offcut and they can sell it so we don't but we don't tend
S0525	to get the the big big pipe but yeah it of course it's heavy stuff i mean as i say a fit can weigh a tonne i think they buy that truck which could take be the truck to take up to a tonne or up to four tonnes i forget what why
S0525	they buy a truck but erm
S0525	yeah when you're when you're carry those erm those pip on it and they do do that
S0525	oh dear me
S0614	they get stick in the
S0617	have send me a link
S0525	would have be hilarious to what
S0617	the fire
S0525	well we saw a fire be you sure
S0614	no we
S0525	it wasn't from the because and i drive up to the and there be
S0617	recycle site fire see more than eight hundred tonnes ablaze
S0614	oh well that'll be near
S0525	near where
S0525	but wouldn't that also be cos we saw something from behind the into it be bind to be the same one
S0614	yeah yeah
S0525	yeah it would have be yeah we saw load of
S0617	more than a hundred
S0614	yeah yeah we
S0617	firefighters be now deal with the blaze about eight hundred tonnes of metal and plastic be on fire at a recycle plant in with huge plums of smoke visible across the city
S0614	plume
S0525	crikey
S0614	or plums plume
S0525	plums plums of smoke
S0617	erm
S0614	here's a plum
S0617	hundred firefighters be tackle the blaze now
S0525	that's not good be it be that tea nice
S0617	yes thank you
S0525	mm i bet can't see it now yes it look it when and i saw it when we when we get off the train station at erm cos hadn't sleep he didn't sleep
S0617	two o'clock
S0525	he didn't sleep hardly at all we go over there
S0614	yeah mm
S0617	no
S0525	and then he didn't sleep again and er and then she say she be go back to the car to fee him so i have a look in boot i buy some more
S0617	the car
S0525	sunglasses i can't find the sunglasses i take to bansko i don't know if i leave them there
S0617	in mum do you buy from do you
S0525	yes yes
S0617	oh
S0525	but then we drive to the after we get to
S0617	oh
S0525	cos want to go they've get a new primark
S0617	have they in the
S0525	it be ram
S0614	oh
S0617	really
S0525	the be ram the primark be ram yeah
S0617	whereabouts
S0525	oh
S0617	it's
S0525	in the corner where they've get nando's and the the food place there's a wh smith up there
S0617	yeah
S0525	it's massive it's nice cos it's all new and er so it's all erm you know doesn't look like a jumble sale yet
S0617	yeah and do she get anything
S0525	no because erm she get a text off say that work have come back to him say they've take the money out of his salary and in the store and there's no payment plan so he say don't spend anything cos he's have one and a half thousand take out of his april salary and one and a half thousand take out of his may salary and the rest take out of his june salary which be only half a month anyway so but the plus side of that
S0614	worse than
S0525	be it do he say it come out before tax
S0614	oh right
S0525	so that that's a a little bite of a help
S0525	but i don't
S0614	right so and then he's only tax on what he get
S0525	yeah
S0614	as oppose to
S0617	but
S0614	get his salary
S0525	yeah
S0614	they take it out and tax it
S0525	yeah that's right yeah
S0617	can't he speak to his new employers
S0525	well i think he's go he's do that via the recruitment agency because he get that job via a recruitment consultant so i think he's approach them to see if they'll approach the for him so finger cross but yeah so she go back to the car to fee so i think well i'll just wander into boot cos she'll be feed him by the time i get back she be about to drive round the car park cos he wouldn't have anything to eat and he be just cry and he be so tire and we get in the car and he start really really really howl and then really get himself in a state like
S0614	oh
S0525	so i i take my seatbelt off and try to hang over the back seat and he be red in the face so i be try to cool him down i think he's too hot cos he be just get so wind up
S0614	wind up
S0525	scream like you wouldn't believe so she drive into erm those shop just up from the island there's an industrial
S0614	yeah yeah yeah
S0525	opposite the the
S0525	yeah that's right she drive in there er and she get him out just to calm him down and then i sit in the back with him so he be half smile and laugh then all the way home but
S0525	i have to keep him entertain and then he start cry
S0617	you be in the back with him
S0525	he well yeah cos he be just
S0614	ah
S0525	work himself
S0525	into a state
S0614	you troublemaker
S0525	so get home and feed him and he do have his milk then and then she say oh i'm gonna put him upstairs in his bed
S0525	he wouldn't have it she be upstairs she close the curtain she be feed him it be all you know this be about four o'clock and i and then i say well i'll make a coffee but there be no milk so go yes i'll have a tea please but there be no milk so i say well let's walk him up to the co op and we'll take the dog and we'll all go and he might fall asleep now he's have his food and she be oh i don't wanna go i say well i'll take him then and then she didn't want me to take him so
S0617	why
S0525	well i don't know
S0617	if she doesn't want to take him outside she she want him to learn he have to go to sleep in the house
S0525	but he be really get on her well not get on her nerve but you know you
S0617	yeah
S0525	wear her down and she
S0617	yeah
S0525	be upset
S0617	of course yeah
S0525	so erm we do we all go out we go up to the co op erm and he'd just start to fall asleep as we get to the co op so i take and carry on walk then he wake up again on the way back and then the heavens open and it throw it down so we be run back to the house and he go to sleep so we get him in the house and he be asleep and nobody move and nobody say anything so i say well i'll leave now but she send me a photo of him in his bouncer forty minutes later so it be only a quick nap so he's gonna be ready for bed tonight because this morning he
S0525	he he sleep less than an hour this morning on the train
S0617	really
S0525	but on the train come back erm she have him er it on her knee he be just watch
S0525	he be look on the train cos he think that be good fun he wasn't gonna go to sleep
S0617	but he he he be very like and even in wagamama's when i saw him he be hello he doesn't wanna sleep that boy he want to see what's go on around him
S0525	i know he be look around wasn't he every he'd just have his food then as well so he be quite full he'd have pear and he'd have his milk so he be quite happy
S0614	so long as he sleep in er more in the night though i suppose then like learn to to
S0525	yeah but for for a five months old i'd have think you'd would need
S0525	a couple of hours in the day
S0614	yeah well yes well
S0525	even if you're sleep ten hours at night
S0614	oh really okay yeah
S0525	oh yeah yeah absolutely erm but anyway we'll
S0617	if he's anything like his nanny
S0525	we'll see well and his dad
S0617	well
S0525	but we'll see but come to me to after lunch and we end up in wagamama's so
S0617	nice of nan to pay
S0525	yes well i pay for me she get all her cash out and i get mine out so i only er kind of have enough for
S0617	oh
S0525	just work out it be my portion so she pay for the other three that be nice well i didn't want her to pay for all if really
S0617	no
S0525	so i'll pick her up tomorrow and we'll go the funeral if i can find this place in she's get a postcode so i'll stick it in my phone and so what have you do today then how come you're you're back
S0614	i be home at about half six there be anyway
S0525	oh do you
S0614	mm
S0525	well why didn't you want tea
S0614	i say it would be later i
S0525	oh i
S0614	much later and i say i'd
S0525	oh
S0614	i'll i'll erm
S0525	be i not pay attention
S0614	so what's that about and you be gonna have that you know the beef
S0525	well yeah i
S0614	which you'll have another time
S0525	i don't need to
S0525	i don't think i need anything to eat i'm alright i've gotta cut back too little too late now not gonna have time to diet
S0617	well you're go on holiday in
S0525	i'm go on holiday now yes there'll be no time to diet when i get back before the christen never mind
S0617	so do you go in any shop there
S0614	you can go on the vodka diet on holiday
S0525	the vodka yeah erm
S0617	diet
S0614	while you're in bulgaria
S0525	it work in bulgaria
S0614	if you're in bulgaria
S0525	yeah
S0617	that make it sound good mum the
S0525	the yeah do the vodka diet yeah you lose ten pound on that i've do well on the vodka diet but that's only really be vodka
S0614	well no we we do have half board so we be
S0525	yeah it's and it that be when i be on my own as well and when i'm on my own erm i just stop in and have a an omelette an omelette and a vodka and i don't really eat throughout the rest of the day but that didn't
S0614	well you could
S0525	work last year because they be ask me out all the time i i didn't get leave alone so i be out every night so you're at the for two hours drink and then you're out in a restaurant
S0614	mm
S0525	so it didn't work last year
S0525	i yeah if you're sociable it doesn't work but when i be just on my own and i be leave on my own it be it be handy we've get half board anyway at this place so
S0614	yeah
S0617	mm
S0525	we'll do what and i do and we'll we'll take some fruit for lunch out of the buffet eh
S0617	yeah so do you go anywhere then
S0525	we
S0617	shop
S0525	no debenhams really and accessorize i be look for a bag and then we go to the and i say well i'll keep look for a navy bag to go
S0617	mm
S0525	with my dress but of course they and i find one well no i walk into dorothy perkins and i didn't see anything and then join me and we walk past dorothy perkins and she look in the window and she say that's nice say oh i like that one and i say she say it's evans not dorothy perkins anyway it wasn't it be dorothy perkins i say well i've be in there so we go in again and we couldn't find it so i ask the lady in the who work there and i say you've get erm a bag in the window and i can't find it and so she have a look and she go and she come back and she's yes erm it's the only one we've get
S0617	mm
S0525	and i say well be you sell it
S0617	mm be that what you say
S0525	yeah she say oh yeah yeah do you want it i say well well yeah i i really like it oh yeah i'll go and get it so she go back again to the front of the shop into the window and she be gonna
S0525	say look it's at which point go off to fee and she come back with it and i say oh okay and i be hold it and it look a bite odd the shape didn't sit right cos it be erm it have a a zip pocket in the middle and erm a thing over the top of it
S0617	yeah
S0525	so it be quite a fat chunky bag if you like
S0617	yeah
S0525	when i put it down it be about that wide at one end and that wide at the other end i think well that doesn't sit right and it have erm a strap around each end
S0617	right
S0525	i think i wonder if you can tighten this strap and then i look behind this strap be sew behind the handle this strap be sew on the corner of the bag so it be make badly
S0617	oh
S0525	so i
S0617	that's why it be in the window probably
S0525	i take it to her
S0614	oh
S0525	and i say oh i say look at this she go oh that's really shoddy isn't it i say well i i don't i'm not gonna buy it
S0617	oh
S0525	because it it be too you know if it have have be something i i could have get at a discount on that be worth it but it it look
S0617	yeah
S0525	wrong i say oh i i don't want it she say oh well that's dreadful that be so i say well put it back in the window i think she do how much do you take today
S0617	nothing absolutely nothing it be really quiet actually
S0525	you must have make a sale
S0617	oh just me my sales
S0525	oh the shop i be talk
S0617	oh the shop yeah we've make a few sales yeah a couple of grand
S0525	quiet though
S0617	i need an iron
S0525	do you get somebody in then to cover for the late shift cos you say she'd
S0617	i just ask one of the girls to stay
S0525	and they do
S0617	and she yeah yeah she stay till eight o'clock
S0525	oh that's good
S0617	yeah
S0525	not
S0617	this girl have just not turn up
S0617	yeah it burn the girl she i just try to get hold of her and i couldn't get hold of her it's really weird cos she's actually one of the really good members of staff
S0525	what do she phone in originally to say she
S0617	no
S0525	she couldn't make it well how do you know she wasn't come she just didn't turn up
S0617	she'd not turn up
S0525	oh
S0617	try to get i try to call her her phone range about three time earlier and now it's just go straight to answerphone
S0525	oh dear that's not very good
S0617	no and she's mean to be in tomorrow but i can't
S0525	well tomorrow your dad be gonna we've get a portion of chilli for two in the freezer but i've also get a chicken curry so shall i just get all of that out there's enough for three of us and you can choose which one you want
S0617	erm what be i do tomorrow
S0525	cos if if you don't if you say you don't want anything well i won't get the chicken curry out and then when you come back
S0617	yeah no i don't think i do need anything cos i think i be see and but 's windscreen erm have smash this morning
S0525	hell
S0617	and she be on the motorway and she's always drive the windscreen her car windscreen
S0525	and be she alright
S0617	oh here she be
S0525	oh be she alright that be dangerous
S0617	my phone's ring now
S0525	well that's okay you can take your call
S0617	can i
S0525	you can go out then take it out there
S0617	she'll be age
S0525	oh okay
S0617	hello yes thank you be you yeah just just get home just have dinner
S0614	why would it smash i wonder so
S0525	i don't know i don't unless it have a crack in it to start with it's alright for some isn't it walk in put your dress gown on meal on the table
S0614	yeah yes yes she do well today leave home for the station
S0525	i know i
S0614	it be pretty wet today
S0525	i oh well i think she'd be call me and i think well this be a good lesson to take an umbrella because that coat's get a hood it's just in a zip pocket that that that big coat she wear
S0614	yeah but the shoe be no good for walk in the wet
S0525	well she need to prepare for it
S0614	yeah she she oh yeah
S0614	she do
S0525	you know
S0614	she have to er you know just you know so if you've get something up there mean you need something down there as well mind you i've just find that mine have get a hole in as well so i might chuck mine
S0525	well you be gonna buy new shoe age ago and you need new trousers you've gotta do it yourself
S0614	exactly that's my next job well on anyway what shall i have to eat
S0525	dunno do you get hold of
S0614	no no no he erm
S0525	mm
S0614	didn't call back and i haven't call him i i presume he
S0525	i wouldn't be surprise if he be at home yet and he want you to go up instead of him
S0614	could have be yes
S0525	yeah er
S0614	yeah
S0525	a last minute thing and cos you weren't there that be it
S0614	oh so he say
S0525	oh yeah it would have be something like that he just didn't didn't feel like it couldn't face it
S0614	couldn't face it yeah
S0525	probably
S0614	four million pound job and
S0525	be there be that football match at wembley today then be that what and have go down to
S0614	yes it's on the tv in a bite mm yeah now yes they it's only a another friendly like it be the other night
S0525	mm but they haven't be auction their ticket off then if er 's go then
S0614	go themselves
S0525	yeah
S0525	always the way
S0614	yeah
S0525	well i haven't look to see if i've get a birthday card yet for so i'll do that in a minute
S0614	you'll need to get one
S0525	mm
S0614	we'll need to get one if we haven't as well but
S0525	where be you work tomorrow
S0614	i might might not be any work tomorrow
S0525	be you not
S0614	i do thursday and friday
S0525	oh
S0614	well cos i do all today
S0525	oh
S0614	they'll give me
S0525	do you not go to a meet today
S0614	yeah we we go this morning at er it be although it be the only three of us cos lot of people be on holiday i think
S0525	okay
S0614	four of us four of us so er tomorrow i'll erm there'll be 's work and er erm i've speak three or four phone call with my mother today about this wash machine be leak erm i'll tell them i'll pick them up tomorrow cos i say i would and want do they want to go to say well let's go there first cos dad's get an eye test after his cataracts so that's five minutes apparently i'll drop them off and he can go and do that and i'll bring them back here to see let's hope he doesn't scream
S0525	well then that mean you'll be take them back which take you forty five minutes cos he's here
S0614	that's what i do
S0525	well he's here for two and a half hours so
S0614	okay
S0525	it's not actually alright no cos i'd rather you be here look after cos i'd have be out all day take
S0614	yeah
S0525	mum to the funeral then take to the dentist
S0614	well i could always when it's convenient and they can wait until er
S0525	well if
S0614	we go
S0525	well it will be it'll be quarter past half past six
S0614	mm that's alright okay yeah have to wait and if it's not convenient to take them back see how we go with it
S0525	well if cos if he's like he be today and it's there's no way
S0614	yeah he er perhaps we'll take him out for a a walk or something
S0525	well you can but they can't walk
S0614	well not very quick but they can walk can't they
S0525	will they
S0614	not very quick and not very far admittedly but er he's suppose to walk anyway my father
S0525	mm
S0614	we'll see
S0525	mm when be you gonna get the euros for the holiday
S0614	erm i'll nip down to tesco some time or there'll be a i'm go to on thursday and plenty of place in will do
S0525	oh okay
S0525	two hundred pound worth
S0614	yeah where be i go oh on friday so
S0525	sorry
S0614	's on friday so er plenty of opportunity to pick them up put a steak in
S0525	a steak
S0614	well a fish fish
S0525	oh fish
S0614	fish steak whatever they call it fish fillet
S0525	mm
S0614	fish steak wish i have a pizza
S0525	oh depend what you feel like
S0614	yes
S0525	if you're do any chip i'll have a few of the have you get like the oven chip the low fat ones or something
S0614	yeah i've get these er rustic three per cent i think
S0525	i'll have a few of those then that will
S0614	take they're only about fifteen minutes
S0525	oh okay yeah
S0614	put this in first
S0525	oh do you know what our erm luggage allowance be on saturday
S0614	erm i don't
S0525	have we get any paperwork that we need to take or be it all on
S0614	actually i i do
S0525	have you
S0614	i forget it'll be on here won't it
S0525	do you print out the thing for the hotel as well cos they want it off me and last year and i didn't have any paperwork with me cos i think it be all online
S0614	what they they want me to print off the the ticket so i print off most of it bar the term and condition i miss off oh well
S0525	okay but have it get the hotel on there
S0614	on there
S0525	sorry
S0614	there's the hotel
S0525	oh oh it well that's fine then it it's get that on there
S0614	and there but here you be twenty twenty
S0525	twenty kilos
S0614	kilogram
S0525	okay so
S0614	mm
S0525	well shall we take those hard case
S0525	that wheel along the ones we take to bansko cos they're
S0614	yes
S0525	and we've get one each haven't we
S0614	yes
S0525	erm
S0614	and we can get and they're each yes
S0525	okay fine
S0614	quarter past one be
S0525	yeah i say we'd leave here about eleven 's gonna take us
S0614	okay nice
S0525	it's the same flight and i go on
S0614	be it
S0525	yeah it be the one we go on last year
S0614	okay
S0525	cos we do it's isn't it
S0614	yeah
S0525	we do and it be the same time and it be a longer flight it take over five hours and then when we get there so we get off half past three i be
S0614	yeah it erm well well well twenty five past five it land so
S0525	when do it go
S0614	four
S0525	quarter past one
S0614	quarter past one get there at twenty five past five so quarter so four hours
S0525	it's four hours yeah ours take longer than that erm just cos it be a slow flight they say you know the head wind or whatever and then erm there be a complete mess up with the coach and we be stand there for an hour at the airport wait for the coach cos we didn't get to the hotel
S0614	oh no
S0525	till about nine o'clock and i think oh we'll be in plenty of time but they do say to us when we get there last time oh you can go in the restaurant
S0614	right
S0525	while we take your bag up to your room so we do that and then wait for the bag to get to the room but i know it be really badly organise
S0614	oh mm
S0525	and slow that's the only thing about this as i say i've read a lot of tripadvisor report on do the coach transfer and people have always say i'd get a taxi next time but
S0614	right
