S0525	when you know we book on that we'll see oh yeah it take age cos we be wait there and then i send back inside to ask them if we're wait at the right place
S0614	yes
S0525	they say yes and a few more people turn up and then the rep the guy come out and he say oh what be you all do here we say well we're wait where you tell us to
S0525	he say oh have nobody be
S0614	no we wouldn't be
S0525	and he say i'm we're i'm just go home you know now so he have to phone up and there be no coach come and it oh and then people start complain obviously and moan it be a bite of a nightmare especially when your flight be an extra hour or something stupid as well
S0614	mm
S0525	there be that hijack today do you hear that don't often hear of hijack plan any more
S0614	true although
S0525	it doesn't seem
S0614	the bite i hear about it wasn't it there be a single guy who be
S0525	yeah oh yeah i don't think it's connect to any terrorist he he want to get a letter to his wife or something
S0614	they're question his mental yes his mental capacity i think
S0525	and his wife be in cyprus which be where he get the plane to land
S0614	right
S0525	i wonder if he have he say he have a bomb strap to him but he probably didn't but
S0614	no
S0525	even so you know it's not
S0614	he should have be stop shouldn't he
S0525	yeah
S0614	yeah crikey
S0525	i didn't think you'd have be able to get on a bomb strap to you although it be it be egypt he go and you wonder how good the security be
S0614	yeah egypt yeah
S0525	what be that letter that come to address to
S0614	a a gift aid and it tell us
S0525	oh
S0614	thirty nine pound we've they've make out of the stuff i've do
S0525	hasn't even get your name right
S0614	i know
S0525	and you work for them
S0614	true
S0525	that's appal
S0614	thirty nine pound forty three p it's it's the last
S0525	they've make out of what
S0614	well we i i give them you know some of the jar the flower jar that you didn't want any more i take them down to the
S0525	oh
S0614	and er say here you be take them
S0525	vases you mean
S0614	yes yes jar
S0525	flower jar that's another name for a vase
S0614	jar well er well enough yeah
S0525	i can't remember what be i
S0614	they be two smaller
S0525	clear out cupboards be i
S0614	things yes
S0525	mm
S0614	well there be
S0525	how's how be then what happen
S0614	her windscreen
S0617	yes she be drive it's not it's not fully crack but she's still drive i mean it's bad isn't it they can't can't get it fix until thursday
S0525	oh so you mean when it's smash a a stone hit it
S0617	but she say it's
S0525	and it crack
S0617	a foot long on the windscreen the crack be
S0525	well that's dangerous to drive because it
S0617	really dangerous
S0525	well it could go at any time now
S0617	cos i tell her i say that but they've tell her she's get a erm glass or something along those line erm
S0525	oh there's some breadsticks and hummus there isn't there
S0617	yeah
S0525	will you get the hummus out she's get what sorry
S0617	why don't you have the erm
S0525	well i've have to have a few chip now why don't i have the what
S0617	why don't you have the carrots
S0525	i don't want the carrots there's only four breadsticks but we weren't do you want the hummus
S0617	no i don't want that
S0525	i don't wanna just keep
S0617	i be look for apple juice i be just
S0525	i don't wanna just eat carrots do i
S0617	carrots with hummus
S0525	oh no
S0617	that's what i mean
S0525	oh i
S0617	put the carrots in the hummus
S0525	but they're cook
S0614	bite of bite of broccoli bite of
S0525	but they're cook
S0525	and they'll go all soggy
S0614	have some er sweet potato sweet sweet potato
S0617	yeah with your hummus
S0525	i'll
S0617	yeah no so she's it's not
S0525	i'll have this instead of chip i don't want chip put in now yeah go on
S0617	it's not crack into piece like but she's she's get a foot long crack i say what be you drive it for she say well they've tell me i've get erm crack resistant no i've get something resistant glass on my windscreen so it shouldn't it shouldn't like
S0614	well clearly not crack resistant otherwise it wouldn't have crack
S0617	yeah well what's the word i'm after shatter maybe er
S0525	shatterproof
S0617	shatterproof
S0525	oh
S0617	something like that
S0614	that'll be yeah that'll be alright
S0525	do something hit it then when she be go along oh
S0617	big stone
S0525	big what
S0614	a stone
S0617	stone
S0525	oh
S0614	she still get a ka have she or er be that what she have
S0617	no she's get a brand new car
S0614	oh
S0617	she's get a focus
S0614	focus
S0525	mm
S0617	she's already have to have two new tyres
S0525	on a brand new car
S0614	on a brand new car
S0525	what's what's she do
S0617	nail
S0614	oh right where's she drive in a nail yard
S0525	i use to remember i use to get that when i park outside work
S0614	yeah well go down the tip you could guarantee you'd drive over a nail in the days when they didn't clear them
S0525	mm
S0614	mm
S0525	that letter that get his name wrong be his employer
S0617	really
S0614	yeah
S0614	it's probably a different record of to gift aid er the list of people i guess so it's a different
S0525	different department
S0614	a different section i suppose i don't know
S0525	mm
S0617	yeah so we're go to 's tomorrow night so i don't need any dinner
S0525	be you come home oh for your car or be you drive to work
S0617	i'm gonna drive to the probably
S0525	where do live then
S0525	with her boyfriend
S0617	yeah
S0525	mm
S0614	car park look good they've get the i haven't see it since it's go up a storey but to the
S0617	do you see it today
S0525	oh they've build
S0614	in the
S0525	oh i saw them build it no cos i think we didn't we get on at so
S0617	oh
S0614	i haven't see it since it's you know be build up and er they get presumably they get two level
S0525	be it free
S0617	yeah
S0525	still
S0617	no
S0614	no no no
S0525	oh
S0525	it be always free to park at
S0614	it be yes but you could never get on cos it be so busy but
S0525	yeah
S0617	be always a very very busy erm
S0614	oh it be always it always use to be
S0617	be it
S0614	no change
S0525	mm they send a text ha ha ha ha ha ha ha ha ha etcetera etcetera he's obviously still laugh over the forklift debacle
S0614	yeah
S0617	yeah so erm we'll go there
S0525	where will you eat tomorrow then
S0617	tomorrow night
S0525	will you go out or
S0617	erm i dunno actually
S0525	where's work these days
S0617	just work in some office admin get a job the job the job for her mum from next
S0525	yeah mean be it still with
S0617	no no no after she's
S0525	yeah she move
S0617	it's where her mum work
S0525	right
S0617	but her mum work in the one in and she work in the one in so
S0525	do you know what company
S0617	no i dunno what the company be call
S0525	right
S0617	adminy stuff bore by the sound of it nine to five though monday to friday
S0525	uhu
S0617	yeah
S0525	standard office job do she like it
S0617	erm she never really say whether she like it or not i think i think she's alright
S0525	and be still work for be it
S0617	mm
S0525	still in
S0617	i dunno she work with the for age
S0525	
S0617	yeah and now she's an assistant manager at
S0525	mm oh
S0614	
S0617	she go to every day
S0525	mm good for her
S0617	not too far though be it
S0614	no no
S0617	only the same distance
S0525	mm
S0617	as would you think
S0614	probably less than that cos you're go main road like not much traffic
S0525	well good for her
S0614	down that way
S0617	m42
S0525	have she get a boyfriend
S0614	er
S0617	yeah
S0614	no a road across the you cross the m42 and
S0525	mm
S0617	yeah she's get a boyfriend he's call
S0525	have they be together for a long time
S0617	quite a while now yeah yeah about a year and a half
S0525	what about be she go out with somebody
S0617	yeah she's get a boyfriend
S0525	be that
S0617	yeah
S0525	it's on facebook mm
S0617	he seem quite nice
S0525	when do she start her new job
S0617	i think next week
S0525	mm
S0617	next week
S0525	in
S0614	er well
S0617	yeah
S0614	when i saw her that be that last saturday wasn't it
S0617	oh okay so i know she's not there this week cos she say she's off from tomorrow cos i think she might be come into tomorrow
S0617	so i know she's not there now
S0525	will you try and see her when she's at then
S0617	yeah yeah yeah i think she's come in tomorrow
S0525	just to you to see you at your stall
S0617	yeah both go out and meet her
S0525	uhu it be ever so busy today on the train and and all the shop we try to get into café rouge but erm all the table where you put a get a pram be reserve he say er for this reason and cos it's half term he say it's crazy so i'm really sorry so we so we turn to go out the restaurant there be a group of four behind us say oh they've get no table let's leave and erm i say oh no they have and the the guy who own the restaurant be no no no no we have we have we just can't fit a pram in people be turn away in the queue think there be no table
S0617	oh they just couldn't fit you in
S0525	yeah mm i no no it's just us and this guy be very keen to go run after them no no no please come back
S0617	oh
S0614	oh
S0525	we have plenty plenty of table upstairs as well he say he would have carry the pram up but there be no lift
S0617	ah
S0525	he be try to be helpful nan say well we'll sit up there he say i'm sorry that's reserve as well
S0614	oh
S0525	and they'll be here soon and we'd go early specifically cos as soon as we leave you
S0617	about twelve o'clock
S0525	so mm yeah we think we'd go now rather than wait because we won't get a seat and you saw how busy wagamama's get that be pack
S0617	yeah
S0525	and need to eat
S0617	these place will never erm go out of money will they go out of money
S0617	i wonder if it will ever
S0525	well
S0617	go out of money
S0525	do wagamama count as the because i suddenly think be it have cancel her meal because of the rat crisis
S0525	yeah make me think
S0614	here's here's here's the
S0525	i have a few crunchy bits in my er in my meal
S0617	mum oh have we miss it
S0525	probably
S0525	yeah yeah
S0614	that be it anyway
S0525	right
S0525	yes
S0614	pile of rubbish
S0525	and quite a big fire but it throw it down with rain so hopefully that would have help as well
S0617	yeah
S0614	yes yeah
S0617	it be chuck it down
S0614	douse it a little bite
S0617	when we saw it
S0525	cos it wasn't when we be at the and we saw all the erm the smoke then but we didn't know what it be from
S0617	so what's happen about the hijack plane have you see that on the news
S0525	well they erm they're all off it's some random guy i think he's just a little bite derange he's not with a terrorist group he want to get a letter to his wife who live in cyprus so he get the plane to land at cyprus he have a bomb on him but i'm not sure if they establish if he do have a bomb on him i don't think he'd have get on the plane if he have a bomb on him so er
S0617	yeah i'm sure it would
S0525	i don't think he do
S0617	it be a fake bomb they say when i hear it
S0525	yeah i don't think he he he could have get on
S0614	yeah
S0617	or he be lie or something
S0525	he let yeah let everybody off so i don't think he could have do any real damage that be the
S0617	oh so he let everybody off but keep them on there as hostage
S0525	he he's off now they've get him
S0617	oh
S0525	they they all get off and he get off
S0525	that be that
S0614	thank for the lift
S0525	i don't think well i don't think the plane be
S0525	bind for cyprus be do he have to divert to cyprus cos that's
S0614	well i i don't know which
S0525	that's what he say be my eye i've just be rub them be they all black oh
S0617	no no
S0525	make my eye sore
S0617	i think mine be
S0525	i'm not i think it might be hay fever i don't know why any of us be sore
S0617	oh
S0525	i've get the opticians on friday so he can tell me these be two different type of daffodils in here look
S0614	yeah they've get a nice effect though
S0525	oh a lovely effect yes i'm not complain i'm just comment i'm just say
S0525	see as you buy just a handful which barely fill my vase at all
S0614	they look alright actually don't they good
S0525	well they do now they've all come out mm
S0614	nice might be one or two that die off before the others maybe
S0525	mm
S0614	we'll see
S0525	yeah so we only go into to debenhams and accessorize before you and that be it really then we go home after we come out of wagamama's cos i think erm
S0617	yeah
S0614	do you meet
S0525	i hear her
S0614	yeah
S0525	cos i be in the store i hear her say we will need one hour give us one hour come back it will be ready
S0617	that be to clean the bracelet
S0614	oh this be the one
S0617	that we can't clean
S0614	can't can't clean she's tell them you can
S0525	oh you can't clean
S0617	oh no
S0614	they couldn't clean so yeah they can't and she know apparently
S0617	yeah
S0525	oh
S0614	she's
S0617	yeah you you'd be you you know how i take your silver one to be clean
S0525	yeah
S0617	basically it's a silver cleaner okay
S0525	yeah
S0617	so she take in a rise bracelet you know your rise our apparently that
S0525	yeah
S0617	that can't be clean with the silver polish cloth that we
S0525	be that what she take off her today
S0617	and she take a whole rise bracelet
S0525	oh when i overhear her say give us an hour
S0617	yeah
S0525	well why why doesn't she know that
S0617	well she do know it she's just stupid again she's just say things just for the sake of it i dunno why she's do it
S0525	do they have to pay for it to be
S0617	dunno whether it's to annoy me up
S0525	clean or be it a free service
S0617	it's a free service
S0525	oh okay so mm
S0525	so at least she wasn't gonna charge her for something she couldn't clean
S0617	no but then the customer get annoy
S0525	yes cos it's not clean
S0617	cos they've drop it off and they've get to walk around for an hour like
S0525	do they do they come back and say they be annoy then
S0617	i er when they come back i be in the back and say you can go and explain to her why
S0525	yeah to
S0617	and i send her out with the bracelet yeah
S0614	and that'll make sure you don't
S0525	yeah it will do
S0614	complaints
S0617	i dunno i didn't ask her
S0525	you didn't do you watch her on cctv
S0617	no to be honest i didn't
S0525	nan just want to buy the finger with the ring you know they come on those fake white finger
S0614	oh just the finger so that she could
S0525	she want the finger
S0614	right
S0525	mm
S0614	she like the finger
S0525	i say it wouldn't go
S0525	too big
S0614	oh
S0525	i dunno if she's still get a fake one if she still wear it i don't know cos she have a second one make didn't she
S0614	mm i dunno whether she
S0525	no i never see her with it
S0525	i daren't ask her if it still bother her if it still tingle cos it tingle and tingle didn't it for years
S0614	mm
S0525	i don't know if that ever stop or not really
S0614	no
S0525	mm so say 's come to the christen do you hear that
S0617	oh no
S0614	oh nice
S0525	and she's do a fingerprint for her to
S0614	of the
S0525	as a gift
S0525	cos that's what want
S0614	right
S0525	a fingerprint she need to erm decide what she's gonna do with the cake anyway she know it's now in the freezer so she have to do it
S0614	yeah yeah
S0525	i be gonna say to her she could ask 's to marzipan ice it because they would just prepare it for her if she just want to decorate it cos i don't think she's get hold of that she work at the bridal shop now
S0617	oh yeah
S0525	at
S0614	do she
S0525	i be be down twice i be with them the last time and she wasn't there
S0614	mm
S0525	she's get 's number but because she's say to us oh she'd she'd do the christen cake for free
S0617	mm yeah and how typical she can't can't get hold of her
S0525	no could do something with it though i'm sure
S0617	yeah
S0525	she just need to
S0617	be anyone eat
S0525	plan it
S0617	the food in the fridge by the way that we cook yesterday
S0614	not at the moment
S0525	no why
S0617	can just have it
S0525	yeah
S0614	yeah
S0525	where be he
S0617	he's possibly on his way
S0525	well what do he want with it there's an what's there carrot sweet potato
S0614	sweet potato carrots and er gravy
S0525	oh yeah there's the gravy i mean if you do erm if you do that would be quite nice on pasta cos it's get apple and bacon in it
S0614	what else be there
S0617	be there any meat
S0614	there's no meat
S0617	no if there's er there's only
S0525	there's no meat out if he buy himself a chicken breast
S0614	yes fry it up with the onion
S0525	yes
S0617	probably the bread and butter pudding
S0525	oh yeah
S0614	oh the yeah
S0525	bread and butter pudding
S0614	pudding i know there be three bits but i couldn't
S0617	be there a lot of sauce in there
S0525	oh there's quite a bite of sauce that would that would be erm
S0614	yeah that's a third full
S0525	if he do a chicken breast and do pasta with it and put that on that would be lovely
S0614	mm
S0525	mm
S0525	or just do chicken breast and have it with the carrots and the sweet potato he didn't find the sweet potato too sweet
S0617	no
S0525	cos i must admit it be for me with the with the maple syrup in it when we go to nan say that be the first time she'd be at the entrance with the erm what do you call it you know distort glass
S0614	with the discs on it yeah
S0525	discs
S0617	he's talk about
S0525	the
S0614	yeah
S0525	no but come out at the er erm the train out of
S0614	oh right
S0525	do i say the
S0614	no but the entrance i just think you mean the main
S0525	of no you know where you where you look back and you've get the big advertise thing and you've get all the mirror glass up there
S0614	oh
S0617	yeah
S0525	the distort glass
S0614	yes yes
S0525	and i say i quite like it and she say that she and always think it be horrible
S0617	say that
S0525	oh it's horrible i say oh it's really i i like it think it look quite nice
S0614	smart mm
S0525	but erm mm that be that
S0614	right good
S0525	somebody have let go of a helium balloon inside and that be very very very high up no way anybody's get that back down
S0614	no lose
S0525	mm they've get smart lift in there though cos we have to take up and down a few
S0614	yeah
S0525	we miss one train so we go down and up a couple of time
S0525	cos you've gotta get different lift for different platforms but they're nice they must have refurbed all those huge things
S0614	yeah yeah
S0525	they're nice and clean and
S0614	oh good
S0617	no rat
S0525	no you're cos you always think go up in stuff like that it's gonna be tatty but they be nice ones
S0617	be it busy in do you go to
S0525	no we didn't walk anywhere in cos i dunno how you how you get up i didn't see the lift to go upstairs because the lift from the platform just
S0617	oh
S0525	just do the platform to
S0617	oh
S0525	the concourse cos when i be at be they say concord i say they say concourse
S0614	concord concord
S0525	she say what what's that lift just say but that's all they do so then you've get the escalators i don't know we didn't look around for the lift
S0617	no
S0525	so i don't know there there must be some somewhere but i don't know where they be
S0614	but but the platforms be still
S0525	tatty
S0525	oh yeah they need to sort those out
S0617	have you be to it recently dad
S0525	even if they just
S0614	well
S0525	put the
S0525	some seat and of a and a coffee shop down there or something
S0614	yeah it's still dingy and
S0525	it be dingy
S0617	there's no room to put a coffee shop on the platforms mum they're so busy aren't they
S0525	no you have bits where they open out because there use to be
S0614	it be just wait room there
S0525	a wait room in enclose where it be warmer
S0617	oh
S0614	yeah
S0525	and you could get a coffee or something
S0617	okay i don't really see them these days i don't think there be wait room
S0525	no they they they get
S0614	no there use to be
S0525	they get rid of them all
S0617	oh
S0525	erm and not obviously where the platform you've only get a small gap but where they open out and you've get between the two
S0617	yeah
S0525	and you've get one on each side underneath like the stairs and things like that you can walk one to the other
S0617	oh okay yeah
S0525	they use to have or at last some seat they've get no seat there or anything now
S0617	mm
S0525	they could put seat down there and they could make some warm areas cos it be cold in the winter
S0617	oh yeah it's freeze
S0525	and they they use to have that you could go inside so you're right on the platform aren't you but you could i suppose they're just encourage you to go down when your train come now which we do or we miss it
S0525	so we go back up again
S0617	you do miss it
S0525	mm but it just say there be a one so and the next train be on a different platform
S0525	so we we go up and sit upstairs somewhere it be nice because we be sit in and under the big roof and it be nice sit up there much nicer than sit down on the platform
S0617	yeah
S0614	yeah
S0525	mm be come round now
S0617	i think so yeah
S0525	what just for tea or
S0617	a sleepover
S0525	oh he's have a sleepover
S0525	that's nice be he drive there then
S0617	yeah
S0525	he's alright
S0614	no he's recover
S0617	he's not go to badminton 's go
S0525	well i wouldn't have think he would have go back there yet no
S0614	no
S0617	no he say he's drive all day though
S0525	oh that's good he's gotta take those crutches back i bet he won't he'll just shove them in his garage somewhere and that'll be that
S0617	do you not think he could take them back in the morning
S0525	i know he could
S0614	but will he
S0525	will he yeah which a and e do he go to
S0617	dunno
S0525	well obviously he could take them back in the morning where to where do he get them
S0617	i think
S0525	well that must have be the a and e he go to then
S0617	yeah
S0525	oh gonna take my lenses out in a minute my eye be kill me in fact i might erm do that
S0614	right yes
S0617	okay then you go and take your lenses out
S0525	and then i'll be back in a minute
S0614	yeah and then i've gotta get change and then i'll have my dinner
S0617	and then i'll cook 's dinner
S0614	and you do 's
S0525	well his
S0614	dinner
S0614	what a routine we have
S0617	yes
S0614	excellent
S0617	excellent
S0614	excellent yes
S0617	this be the new aeroplane isn't it
S0614	the big one that's come to yeah
S0617	be it
S0614	yeah they've extend the runway and er they can now take the big a380 which be a double decker six hundred people carrier
S0617	here
S0614	yeah so that'll be good for er
S0617	come to what airport
S0614	if if
S0617	
S0614	yeah yeah
S0617	when do they
S0614	they've already have them in and and and so
S0617	oh
S0614	i think it be just inevitable that we would we would have it here
S0617	isn't that what we go on to erm come back on from thailand i'm sure it would have be you know
S0614	well no it's only just come
S0617	no no to heathrow we go to
S0614	oh i see
S0617	i'm sure we fly on a massive plane like that
S0614	could have be yeah
S0617	the plane go out there i keep say to be smaller than the one that we come back on the one that we come back on dad i've never be on a plane like it i don't think
S0614	right good
S0617	you know erm
S0617	where else so you've get like the three seat by the window you know how when you're by the window normally it's just the window here isn't it
S0614	right yeah
S0617	on this plane you go a big circle
S0614	oh yeah
S0617	so like could or put your arm and you could put your head in the the window almost
S0614	oh okay almost like a sort of
S0617	like a
S0614	pod
S0617	pod yeah yeah
S0614	you could sleep in there
S0617	yeah the the
S0614	sleep in the pod
S0617	it curve out so much
S0614	oh well there you be
S0617	cos like no this isn't bigger this isn't bigger i be like it a hundred per cent be bigger
S0614	right yeah they're massive plan now look at the size of that thing
S0617	yeah do they have to extend the runway cos it take so much longer to stop do it
S0614	yeah yeah
S0617	why do it take longer to stop
S0614	cos it's bigger and yes anything bigger and travel at a faster speed be gonna take longer to stop
S0617	do they travel at a faster speed
S0614	although yeah i think they can probably sort of the same speed but anything bigger will take longer to stop if it's bigger
S0617	right
S0614	wouldn't it
S0617	okay yeah
S0614	so er amaze bigger and better look at the size of that
S0617	yeah it's massive how many people six hundred
S0614	yeah
S0617	be that the most a plane can hold
S0614	any plane you mean
S0617	yeah
S0614	well i don't know i presume it must be close to it yeah so should be erm the fanfare about this plane that it must be er
S0617	be this the
S0614	the biggest no no no
S0617	oh it's not
S0614	it's it's that's the that's national news that be that's the steelworks
S0617	oh
S0614	yes
S0617	there he be
S0614	anyway i er oh there's the hijack let's check my tea shall we see whether it's erm whether it's do or not do you want a chip
S0617	no what have you get in there
S0614	erm fish fillet steak fish and erm
S0617	chip
S0614	chip i think i'll do some i mean there's peas with it or something or some bean
S0617	good idea
S0614	and peas
S0617	peas and bean
S0614	or i dunno
S0617	oh
S0614	it's nice and sunny
S0617	yeah
S0614	oh the sun's go down
S0617	yeah but it's twenty past seven and it's still light
S0614	still light that's better isn't it
S0617	yeah
S0614	yeah
S0617	it'll make it lot nicer when i'm walk home now
S0614	if you're walk home now
S0617	yeah
S0614	as long as it's not rain
S0617	no
S0617	this morning though it wasn't as light as it normally be but that's because we've
S0614	turn the clock
S0617	the other way
S0614	forward mm
S0617	so whereas it be quite well it be light in the mornings when i be get up
S0614	yes well it'll won't take long to get back to
S0617	it be still light but i think the fact that it be actually spit as well and it be very cloud this morning it didn't help
S0614	right yes
S0617	but it wasn't like nice and light as it use to be
S0614	have be yeah well that'll improve
S0617	beforehand
