S0417	what have you be do
S0416	i've be play pokémon
S0417	pokémon
S0416	yep
S0417	what the game you use to play or be it a different kind of game
S0416	erm it's the same kind of game but it's a different game if you know what i mean it's like i use to play old versions of this game
S0417	mm
S0416	but then new versions come out and i get those and i'm play those
S0416	i play them already but you can do competitive and battle which be where you can make your pokémon really strong and do all different kinds of trick to make them good and there's different combinations and things and i'm just try that out
S0417	yeah
S0416	mm
S0417	do you do you play with other people online
S0416	erm yeah i don't know who they be like
S0417	okay
S0416	unless i wanna play with my friend then i can
S0417	and when you skype do you have anybody else skype that you don't know
S0416	no they're all people like
S0417	that you've be to school with
S0416	yeah or people that i know from england like 's friend that that might come round 's house then i know him
S0417	okay
S0416	like
S0417	
S0416	yeah he go round 's house one time when i be there and he be kind of we be just kind of friends so we just occasionally play a game together
S0417	mm
S0416	yeah i don't skype anyone that i don't know
S0417	good
S0417	maybe you could have a shower today before we go out
S0416	i'm go out
S0417	i think we be gonna go to
S0416	oh yeah
S0417	we don't have to go another day
S0416	mm
S0417	well what would you prefer you have to sort of decide soon so that i know to plan my day
S0418	yummy
S0417	yummy
S0416	next friday next friday maybe
S0416	yeah sound good
S0417	okay
S0416	cos then it's like
S0417	mm
S0417	look
S0416	cos then it's like one big birthday treat
S0417	it's don't know what you're say sorry
S0416	it'll be like one big birthday thing if if i do it next week it'll feel more like my birthday cos we'll do more things if you if you if you
S0417	okay it's not really for your birthday though
S0416	yeah but it's like near my birthday party
S0417	yeah but you have to just move him right out if it's easier put your phone number on you didn't give me the number for 's erm 's mum
S0416	oh i'll give you that today or 's
S0417	whoever it be
S0417	be you just drop the chicken on the grind again that's really there we go mm yummy yummy yummy yummy
S0418	yummy
S0417	yummy you see oh what's wrong with it i don't know haven't hear you practise your guitar
S0416	i haven't practise it yet today
S0417	i didn't hear you yesterday
S0416	didn't you
S0417	no
S0416	i do practise
S0417	okay
S0416	i didn't practise full strum though i practise finger pick do you know what that be
S0417	kind of but explain it
S0416	it's where you don't just strum your guitar you pluck individual string so kind of like i dunno it kind of make the sound more refine
S0417	distinct do you think be that the word you're look for
S0416	dunno make it just sound more sharp and more yeah
S0417	mm
S0416	so yeah now i know how to do the song misty mountains
S0418	yummy yummy
S0417	yummy
S0417	do you want some of this
S0417	mm
S0417	it's chicken
S0416	i'm gonna go and put my plate away
S0417	what about your chip you don't want them
S0416	erm no not really
S0417	why not
S0416	chip do eat chip
S0417	no don't think so
S0416	okay oh over the
S0417	maybe you should get out in the garden as well sometime today otherwise you're just stick in your room on the computer
S0417	will you come and sit down again
S0416	yeah
S0417	you can have some pudding in a minute not yet though just let your food go down you can have some ice cream
S0416	okay thank you
S0417	you better change your top cos you've get chicken on it or gravy or something
S0416	aw i just change this today
S0417	you're mucky you be
S0417	mucky pup mm do you want some more
S0416	far over the misty mountains
S0417	do you want to practise talk
S0416	i want what do you want do you want juice i want mummy i want daddy
S0416	i want
S0417	just leave them up here
S0416	sorry
S0417	just point to them
S0416	i want juice
S0417	he know juice now though since i show him those card
S0416	do he know juice or do he just say juice when you say do you want juice
S0417	he know what it be he know it's mean juice and he say it himself
S0416	that's good
S0417	but he doesn't still doesn't ask for it he doesn't ask for anything well kind of just moan sometimes
S0416	be good if he could say mummy when he want mummy or
S0417	he do say mummy
S0416	when he want mummy cos a lot of the time when you go upstairs he just go ah
S0417	no he doesn't really say it when he want me no know why he doesn't do that it's funny
S0416	maybe he he think we can understand different time of different type of cry i dunno
S0417	do you think we should go through your clothe again things be get small
S0416	this isn't small be it why
S0417	go through your wardrobe well it's good to go just everybody every now and again otherwise still wear my clothe from the eighties if i didn't go through my clothe
S0416	do you know what i can't understand skinny jeans
S0417	you just ask for skinny jeans a month ago
S0416	i know but
S0416	they're really uncomfortable when you wear them
S0417	so now you don't want skinny jeans
S0416	i dunno if it's a comfy skinny jeans then yeah but
S0417	oh they're just like just come in one bite
S0416	they just feel like they're just gonna eat up your waist like they're gonna eat them
S0417	i don't like it when people go around in their skinny jeans just hang off their arse and it it just look weird and then it's just like legs like matchsticks
S0416	skinny jeans hang off their arse
S0417	well yeah cos they fall kind of fall down don't they
S0416	you mean jeans
S0417	well people's jeans hang down as well but skinny jeans do as well
S0417	no yes hello
S0416	mm erm
S0417	where be you
S0417	who's gonna take you down cos you're just annoy so what do you do you like wear
S0416	i like wear tracksuit bottom they're really comfy
S0417	mm yeah but
S0416	it's not like they look bad
S0417	they do look a bite bad cos it look like
S0416	would you let wear tracksuit bottom right now
S0417	he's a baby it's different he be wear tracksuit bottom
S0416	i know that's er that be my point
S0417	he wear his wear trousers more than you do
S0416	that's not
S0417	look look
S0416	that's not true
S0417	you haven't even get your slippers on you can't
S0416	can go and put them on if you want
S0417	you can put them on later
S0416	okay
S0417	okay but you why won't you you yeah you can't wear tracksuits be really just around the house you can't really wear them out cos they just it just look like you haven't bother
S0416	okay
S0417	there's also there's a bite of a tracksuit brigade around here
S0416	tracksuit brigade
S0417	yeah they're a bite mean and a bite kind of
S0416	what do you mean
S0417	alright boy
S0416	
S0417	and they wear tracksuits as a kind of statement on like we're a bite rough cos that's what they
S0416	around our estate
S0417	yeah i see i see them not so much round our estate but
S0416	they're like the but they're the silky ones they're the waterproof ones just look horrible
S0416	and they're with like weird strip
S0417	you don't you don't look to be honest you don't look good wear tracksuit bottom when you go out
S0417	you just don't look as if you've make an effort you look like you've just kind of it's pyjamas which be kind of why you're wear them as though that's kind of true isn't it
S0416	do this
S0417	sit down
S0416	okay
S0417	yeah what be you gonna say
S0416	i be gonna say do this look fine
S0417	your trousers well if you'd actually get a clean t shirt on and sock and slippers
S0416	outside
S0417	get some sock or shoe
S0418	no way no way
S0417	what be that
S0416	no way
S0416	yeah i think i need new slippers
S0417	
S0418	no way
S0416	i think i need new slippers cos they've get to the point they're not even comfy anymore
S0417	you wear your slippers every day and i don't you don't have i don't have to ask you then i'll get you new slippers okay then i'll get you those pikachu ones that you want
S0416	oh deal deal deal deal deal deal deal
S0417	for the next ten days
S0416	deal
S0417	okay
S0416	deal
S0417	everyday and like all the time
S0416	deal deal okay june the fourteenth
S0417	so annoy if you remember all the time now and all the time i just want you to wear slippers you didn't
S0416	june the fourteenth i'm expect my pikachu slippers wait june fifteenth
S0417	well then i'll order them
S0416	okay i don't know when the ship be but hopefully in june
S0417	yeah
S0416	i'll try and wear them all the time
S0417	no nothing there be there
S0418	no way
S0417	no
S0417	come here come here
S0418	no way
S0417	no way why have you get look you're just as bad you've get one shoe on and one shoe off look
S0416	he's like an oompa loompa he's get that little curl on his head
S0417	yeah i know
S0416	like a candy bar
S0417	yeah
S0416	candy floss
S0417	yeah he's get these mad curl that stick up stick big big face big eye hasn't he
S0416	and it's always that one side right there he always have it right there
S0417	yeah that's cos he twiddle it with his finger and make a
S0417	right i'd better okay
