S0091	do you want tea now or later on
S0058	um i'll have some now if that's alright
S0058	i i i don't mind
S0179	oo ah oy huh
S0058	be you gonna have the chicken one or just share them
S0179	i'm gonna have a nibble
S0179	mm
S0058	i think you've get a you've get a an omelette one a veggie one
S0179	oh right yeah
S0058	it's an egg one which
S0179	i don't mind
S0058	do you get um er
S0179	do you get what
S0058	er do you get oh what's it call wasabi with it
S0179	er yes but not ginger
S0058	oh right okay
S0179	um uh sorry um
S0058	yes um i be gonna the cheese in it it's quite nice
S0179	i'll have
S0091	do you have sugar
S0058	no thank you
S0091	milk
S0058	yeah
S0179	see i didn't know that milk
S0058	just milk
S0179	why not sugar sugar
S0058	sugar just the taste of it
S0179	kind of what you'd expect really
S0058	yeah well er well the way to start yourself onto tea be to have it with sugar in and then you wean yourself off
S0179	why
S0058	cos it taste more kind of i dunno if you don't particularly like the taste of tea you'd have sugar in it cos it's just
S0179	why would you drink tea
S0179	okay huh um
S0058	i'll just gonna snaffle all the cheese out of
S0179	sorry
S0058	i'm gonna snaffle all the cheese out of
S0179	quite
S0058	mm um
S0179	mm
S0058	i i i do like that one shall i have that half one and one
S0179	well shall we see what er
S0179	turn out to be popular
S0058	yeah yeah
S0179	mm i've be er read this morning's which about er local mislabelled food produce
S0058	in which
S0179	i'm sorry
S0058	in which
S0179	yeah
S0058	i never know they
S0179	they do everything that you can buy virtually everything you can purchase
S0058	so
S0179	er so you
S0091	oh you don't want tea
S0179	er no i don't thank you um
S0058	thank you
S0179	oo ah
S0058	okay
S0179	okay yeah would you like to try one of these it's er fish in the middle rice on the outside
S0058	they're japanese
S0179	very popular think that's mackerel you've get
S0091	mm mm
S0179	and what would you like sandwich wise
S0091	pardon
S0179	what would you like sandwich wise
S0091	i've not get i haven't get much bread
S0179	yeah we've buy them
S0058	we've bring some some sandwich
S0091	you get oh you've bring some
S0058	yes that's er
S0179	mm
S0058	that's right
S0179	so you have a selection er what would you like to start with hang on er salmon chicken
S0091	i'll have one of these oo
S0058	i'm gonna start with one of these
S0179	oh i'll start with one of these
S0058	excellent
S0091	how do you open this
S0179	er so it's get bits on the box i think
S0058	right
S0179	yes bite of an initiative test
S0179	um
S0058	oh down
S0179	ah should i do it for you
S0179	might be there's a knack to this
S0058	yeah
S0179	oo
S0179	right hang on right
S0091	mm you still can't get at it
S0179	make you whet your appetite
S0179	mm
S0058	mm
S0179	er also get a tomato and cheese one well mozzarella specifically
S0058	mm
S0179	mm how's that
S0058	yeah it's nice
S0179	may i have a small bite
S0058	you may
S0179	just curious
S0058	there be another one if you want it
S0179	they do the simple things well
S0058	yeah they do
S0179	mm mm oh yeah
S0091	what be you do nowadays
S0179	ah so i've be work with um ttp for six months now
S0091	with who
S0179	um at a mechanical engineer consultancy um so we do um so the team i work for um big er drug company employ us to um do their um device research so we make things like er inhalers and injectors that sort of thing
S0091	and be it well pay
S0179	um yes um be the short answer
S0179	um particularly for technical engineer work it's very well pay in fact it's about as well pay er as er actual engineer as you can find um like the oil company so shell and bp um they're the only people who pay fractionally more but i've get much better benefit so the majority of my pension be pay by the company not by me so they pay twelve percent of my salary and i pay three so that's um quite nice and i also get um things like um what else do i get um life insurance um really good leave etcetera er
S0058	and you enjoy it
S0179	yes it's also quite good because it the company's employee own so um there be sort of um share purchase scheme which you can do ah but um yeah so the team er the company's about two three hundred people in total and the team i work for's get about fifteen mm and you're um actually you've just be promote haven't you
S0058	mhm yeah i've just be
S0091	sorry
S0058	i've just be promote um in my job which be nice
S0091	mm
S0058	um so i'm still work at which be be nice it's er still enjoy it
S0179	that describe your entire job experience really
S0179	doesn't it it's just very nice
S0179	drink tea and eat cake
S0058	yes
S0179	and occasionally do some work
S0058	it's um yeah it's it's nice it's very low pressure and i have more responsibility now which be nice
S0179	low pressure but with responsibility
S0058	mm um i'm wonder whether to open that one or leave it or just have some of that one
S0179	um go for it just open it
S0091	should i fill this up
S0058	oh that would be lovely thank you
S0179	bottomless um cup
S0058	yeah a bottomless coke can you imagine what would be like in a cafe with bottomless tea
S0179	they must have that
S0058	i don't know i've never see it anywhere
S0179	i i think there's a gap in the market here
S0058	we could call it unlimited tea the unlimited tea shop
S0179	think more of a system so you know you can get hot water dispensers in your home
S0058	mm
S0179	make one of those for tea
S0058	that would be a very bad idea for my health
S0179	put them in
S0058	mm
S0058	go on then
S0179	er
S0179	um
S0058	actually yeah
S0179	it
S0179	mm so um we're just think our holiday plan cos we haven't actually be away since i start work so we're contemplate go to wales to and because and now they've just get the one cottage because they sell farm itself so we're think we might um go some point early summer
S0091	to one of the cottages
S0179	yeah
S0091	mhm
S0091	have you be there before
S0179	yeah repeatedly
S0091	yeah
S0179	mm little bite of sushi
S0058	hm
S0179	and you have as well haven't you
S0058	mm i've be twice
S0179	yeah
S0058	no three three time i think i've be twice with your parent and once with
S0179	mm
S0058	and hm
S0179	hang on twice with my parent no
S0091	always in the same cottages
S0058	yes
S0179	no always the same cottage
S0091	cottage oh okay
S0058	yeah
S0091	which one though
S0179	it's the one
S0091	oh the one that stand alone
S0179	yeah
S0091	mm
S0179	but they er we be on their website er a few days ago
S0091	pardon
S0179	we be on their website a few days ago and they seem to have redecorate er all of them so they've get new kitchens and er furniture and stuff
S0091	be it new people own it then
S0179	yes um
S0058	look quite smart
S0179	yeah so they've still keep all of the original sort of er wooden beam and floor and what not but they've just change all of the interior fittings actually i think they have i think
S0091	have you be there before
S0058	mm i've be i think three time
S0091	oh my good gracious
S0179	no it's only twice
S0058	oh i've be yeah only i've be twice sorry yeah
S0179	because i go you didn't come with me at easter in first year you come at easter second year
S0058	mm
S0179	you didn't go on easter third or fourth year so
S0058	right
S0179	so
S0058	it's twice
S0179	yeah twice kind of feel like more
S0058	oh dear
S0179	mm
S0058	that be the first time i hear your dad sing in falsetto
S0091	have it change much over the years
S0179	um not much no um
S0091	doesn't doesn't belong to the same people now
S0179	no
S0091	er they move didn't they and they they next door
S0179	mm so they still own
S0091	they've move over to that in the valley
S0179	yeah
S0091	mm
S0179	er and they convert the barn which be next to the cottage
S0091	yeah
S0179	um it's a spectacular house now it's huge
S0091	mm
S0179	er well you know like build things
S0091	sorry
S0179	er like build things a lot so he's get his little um he's get a a barn with about four or five different mini tractors in it
S0179	it's a nice hobby if you can afford it build a big house
S0179	for yourself to live in
S0058	mm
S0058	very nice
S0179	mm and i don't think he trust anyone else
S0091	mm
S0179	to do it right so he just build it himself he get sort of er his crew of builders in but er he do most
S0058	mm
S0179	of the work
S0058	yeah mm
S0179	and he's sort of push seventy now actually he's
S0058	be he
S0179	mm
S0058	wow
S0179	i think so well that's why they sell the cottages cos they be sort of semi retire then he get bore and build another house
S0058	excellent
S0091	get rid of it he oh do he
S0179	no they sell the most of the cottages
S0091	mm
S0179	but they've um still own the one which be by itself
S0091	next door to where they live
S0179	yeah
S0091	mm
S0179	so that's where we'll probably go and stay apart from anything else they let us still let us have it very cheaply um as in the price be constant throughout the year so it doesn't increase in summer and they haven't increase it over the last five years so
S0091	mm
S0179	sort of inflation adjust hasn't really happen
S0058	yeah which make it much cheaper than pretty much anywhere else er i think for a similar level of
S0179	yeah it's half the price it should be
S0058	mm
S0179	but they don't let it commercially they just let it to um sort of er people they know
S0091	mm
S0179	i could ring them tonight actually
S0058	mm
S0179	find out when it's available
S0058	you could do oh there
S0091	i can remember you cheat at play card in the
S0091	in the corner in the corner
S0179	i can remember be falsely accuse of cheat in the corner
S0058	um no i i i can i can believe that
S0091	of falsely accuse or cheat
S0058	no no cheat
S0179	yes i'm try to teach sarah to play chess
S0091	cheat be wrong
S0179	well it's easy when your when your opponent doesn't know the rule
S0058	so you can just make up new rule
S0179	actually um we be in theory go to learn to play bridge at some point soon
S0058	hm
S0179	um cos um so my not my boss at work but the guy who's project manage a lot of the work i'm do um he and his wife be avid bridge players and they have ask us if we'd like to play them at some point which would also involve them teach us to play
S0179	apparently it's similar to whist which i do know cos you teach me that but i'm not um a hundred percent sure it look really complicate on the score card
S0091	i use to play it i couldn't i couldn't now
S0179	mm do you use to play in the navy
S0091	oo i don't know what it be in
S0179	i'm sure oh no it's er cos you use to tell me that you and um you and a friend of yours
S0091	oh yes but
S0179	have er like a championship thing
S0091	mm
S0179	whist or bridge or it wouldn't have be poker would it
S0091	no it be bridge
S0058	mm
S0179	didn't you use to win load of money do that
S0179	i think that's a yes
S0179	but um yeah it should be nice because they've get the um at farm they've get the swim pool the outdoor one
S0091	oo that that's a long time ago ain't it
S0179	mm well cos we never use to go when it be hot enough to use but hopefully this year we can actually go in the summer and er wrangle its use
S0058	it's heat isn't it
S0179	i think so can you remember if it's heat be it heat or not i'm not sure
S0091	i don't think so
S0058	mm
S0179	mm see i don't but it say it's possible it's moderately heat
S0058	unless they've do it recently mm not sure why you'd
S0058	yeah maybe
S0179	have you have your um
S0091	mm
S0179	sushi er can i suggest put a little bite of this on it it's er soy sauce
S0179	um
S0058	mm you do get wasabi
S0091	have it change much down there
S0179	no it's all pretty similar um
S0091	down at the down at the beach i mean not in the cottages
S0179	oh that's exactly the same that hasn't change in decades
S0179	um actually no it have some of the you know the little shop there use to be um near the beach where you could buy ice cream and what not
S0091	yes
S0179	well i think they've mostly go bankrupt um that's not surprise though they can't have get a lot of custom um i think there's still one there ah yeah we buy a huge last summer we buy a huge inflatable dinghy
S0179	um and have some fun with that in the cos you know coniston the lakes
S0091	yeah
S0179	well we go camp um on a campsite right next to the shore um so we buy this dinghy and er sort of er blow it up and then we actually take it sort of swallow and amazons style we go right the way across the lake and then back again
S0058	it be good fun
S0179	i'm not sure how we do that without sink
S0179	but we manage it somehow
S0058	we have a picnic on the shore on the other side really nice
S0179	and then i sort of swim back um which be quite fun um
S0058	mm we could take that to wales and use it in um
S0179	wales
S0058	wales and use it in the um what's the cove call the quite shelter where we go last time
S0179	er oh no
S0058	well yeah we could
S0179	um
S0058	take the dinghy there
S0179	you have to be careful use stuff like that in the sea
S0058	cos you still think er you'd be in danger of er drift
S0179	you'd need to be very careful as to where you go coves be better than un coves i would say
S0058	that's what i be think but
S0179	well no what we'd all we'd do be we'd make sure we have a lifejacket in it and to be fair i can probably tow it back
S0058	mm
S0179	if we have currents um
S0058	in all fairness if we all get in and tow it
S0179	well can everyone swim
S0091	do you want some more tea
S0058	um
S0179	er no thank you i'm er i'm good oh er sorry it be the last bite of cheese
S0058	that's alright i've have a few bits you're a fiend for the cheese
S0179	that be true i've be know to be fiendish
S0179	about the cheese um
S0058	yeah i can't imagine a tide where you couldn't get it back in but then i could get in and swim as well seb could get in and swim as well
S0058	she can sit in the boat and
S0058	get tow
S0179	it's my new ambition like to get her in the water somehow
S0058	she's never swim have she
S0179	no
S0179	um so um so that's quite good fun but it be really so when we be in on um in the dinghy all of us be get er sort of strip off prior to jump in there be a national trust sort of pleasure um cruise boat go past
S0091	hm
S0179	and they be look at me slightly oddly
S0179	i don't think it have occur to them that it be possible to swim in the lake
S0058	i be worry about the massive
S0091	weren't you cold on the
S0179	no it be fine
S0091	mm
S0179	well it be sort of towards the end of summer so it have be warm up all all summer um
S0058	be they colder than the sea or warmer
S0179	depend which bite of sea
S0058	mm
S0179	cos there's shallower
S0058	mm yeah true i guess some bits of the sea you get um so like on the west coast you get all the um
S0179	oil
S0058	no no the the coves the the warm water from the pacific you know
S0179	do you mean from the mediterranean
S0058	no what's it call
S0179	gulf stream
S0058	yeah
S0179	i think you mean the mediterranean
S0058	okay mediterranean
S0179	do you know where the pacific be
S0058	america
S0179	no that's a continent
S0058	no the one between
S0179	what
S0179	so where be the pacific er ocean
S0058	pacific ocean
S0179	so where's it between
S0058	america and europe
S0179	no do you seriously think er
S0058	america and africa
S0179	no
S0179	south atlantic
S0058	oh it's the atlantic there's a
S0179	oh my god
S0058	be it on the other er side of america
S0179	so it's between america and
S0058	russia
S0179	and
S0179	what what before you get to
S0058	australasia
S0179	yeah before you get to russia japan
S0058	that's the one
S0179	god
S0091	more tea anybody
S0058	um
S0179	no thank you
S0058	yes i'll have some thank you
S0091	er
S0058	that's the one atlantic that's the one i be think of
S0179	you muppet
S0179	a primary school an infant school child would know that
S0058	i wasn't teach that
S0179	really
S0058	yeah i don't know it
S0179	what be you teach
S0058	about the tudors mostly
S0179	what be you teach in geography
S0058	um how to colour in with a blue pencil round the edge of the islands so
S0179	yeah do you actually just
S0058	with a nice blue
S0179	do you look in at what you be colour in
S0058	not normally
S0091	if it's not hot enough i'll put it in the
S0058	i'm sure it'll be fine thank you
S0179	right er
S0091	be it be it hot enough
S0058	i'll have a have a check
S0179	oh eh ah
S0058	that's fine thank you yes
S0179	once you've er finish your er sandwich and cake we've get some nice desserts
S0058	hm
S0058	get some desserts you're leave the um
S0179	yes i'm quite full i've have sort of three or four sushi roll four sushi roll and three sandwich
S0058	i can't see the point of egg in sushi
S0179	oy oy um huh
S0058	mm
S0179	school geography have really take a plummet
S0179	um so what er what what be you teach in school geography
S0058	school geography um
S0179	do you know what a tectonic plate be
S0058	yeah
S0179	what
S0058	so the all the bits that be on the surface of the earth all tectonic plat and they move past each other like that which be why you get earthquakes and tidal wave
S0179	do you know what the ring of fire be and don't say it
S0058	that's a song by johnny cash
S0179	there's also a card game call er ring of fire
S0058	ring of fire be um where there's all the volcanoes because it's the edge of the um there's like er er
S0179	yeah where
S0179	yes actually that be part of it
S0058	yeah i'm try to think where
S0179	where's where be there volcanoes
S0058	where be there volcanoes peru south america
S0179	yeah
S0058	general area
S0179	that's part of it
S0058	um hawaii
S0179	no
S0058	can't remember
S0179	round the pacific rim so sort of go up er
S0058	yeah i didn't know where the pacific be
S0179	yeah so the west coast of north and south america
S0058	mhm
S0179	alaska um bits of russia er japan um sort of the what use to be polynesia
S0058	mhm
S0179	and this kind of thing
S0179	you're learn today
S0058	well it no it's it's not that i'm not keen to learn things
S0179	i just don't understand how you could go through life not know that
S0058	hm
S0179	learn a lot about the tudors apparently
S0058	we do lot of victorians lot of victorians and lot of tudors
S0179	so how be the um so what the victorians do for us
S0058	mm
S0179	that's easy er
S0058	it wasn't anything useful it be just um yeah
S0179	so what do you do about the victorians
S0058	lot of stuff about chimney sweep and um children in victorian england and things
S0179	might that have be because you be in a victorian school
S0058	mm we have victorian day so we have to dress up in kind of victorian clothe and we have like a sort of er you know a a morning of what would've be so we have like spell and time table and and then the boys go outside for drill while we stay inside and sew just to give us an idea of um kind of the er gender segregation in victorian school i think all the boys would rather have be inside sew and we'd have all rather be outside do drill
S0179	yes purely because the other one be do it
S0058	mm
S0179	oh dear
S0058	yeah we have we have victorian day and then we have um
S0179	world war ii day
S0058	world war ii day yeah that be do you have one
S0179	no
S0058	oh okay cos it's obvious so we have to pretend to be evacuees
S0179	ah yes now we do have er have something in primary school where um where there be a sort of show and tell thing bring in something from if you've get any sort of world war ii artefacts
S0058	uh huh
S0179	this be when you lend me um amongst other things a spitfire tail wheel a massive swastika
S0179	flag
S0091	oh yes i do
S0091	mm
S0179	yeah um
S0091	do you give them back to me
S0179	yes
S0179	something i've always wonder how do you get the tail wheel from a spitfire didn't they miss it
S0091	no
S0058	wow
S0179	very very drag take off
S0091	and and i i remember it but i don't know dunno how i get it
S0179	how do you get the tank flag
S0091	goodness know
S0058	i bet yours be the best artefacts
S0179	yes
S0058	for show and tell
S0179	well no actually they get a mini exhibit for those artefacts
S0058	wow
S0179	er cos there be a gas mask as well wasn't there
S0179	yeah there be definitely at least one gas mask
S0091	there be a big flag at the back wasn't there
S0179	yeah
S0091	mm
S0179	but it be er
S0179	no it be literally it be mean to be a sort of group exercise but it do turn into
S0179	what have 's grandad get
S0058	wow
S0179	um but um yes of course nowadays you couldn't put up a huge swastika at the back of the classroom
S0091	swastika
S0179	well it be a yeah it be a red um it be a black swastika in the middle of a red background
S0091	well what's happen to it now then
S0179	you've get it
S0179	well we give it back to you
S0179	um i'm fairly confident we give it back to you
S0091	pardon
S0179	i'm fairly sure we give it back to you
S0091	it's probably on the roof then
S0058	mm
S0179	cool
S0179	um
S0058	er anyway
S0179	what else do
S0091	how do i get hold of it though do you remember
S0179	sorry
S0091	do you remember how i get hold of it
S0179	well you definitely tell me it be a tank flag
S0091	pardon
S0179	you definitely tell me it be from a tank but i can't imagine cos you spend most of the war in the um pacific didn't you
S0091	well yeah
S0179	in india or
S0091	in
S0179	yeah
S0091	pacific
S0179	so i can't quite imagine how you get hold of a german flag
S0179	as in you well you you be never in the mediterranean or north africa
S0091	no i be in
S0179	oh right
S0091	mm mm
S0179	um oh that's probably when then maybe hang on malta er or hang on crete
S0091	i can't er i can't think where i get it from now
S0179	well do you get it from someone else or do you get it from sort of an actual
S0091	i can't remember er what it come from
S0179	no um
S0091	it probably probably come from north africa
S0179	yeah i be think that
S0058	mm
S0091	yeah
S0179	the most likely bet um
S0179	oh the something interest i find out the other day it turn out one of my um at one of my supervisors um be a spitfire pilot in north africa
S0091	mhm
S0179	probably his tail wheel you've get
S0058	he want it back
S0179	oh
S0058	who's that
S0179	the the guy who refuse to retire um
S0179	yes he's er he's still doggedly teach um the um yeah i think they'd sort of the the department make him retire when he hit eighty but he's um be continue to teach in college um and show no sign of stop
S0179	it'll be a great shame if he do he's by far the most entertain supervisor imaginable
S0179	um
S0058	do you get lot of stories or be he just good
S0179	well no but when you get sort of examples of materials' properties illustrate with stories of dogfight
S0179	you start to think yes
S0179	not quite sure how we get onto this
S0179	um remember it anyway
S0179	um what else be there cos there be a er some ration book
S0058	mm
S0179	um i think an identity card and just er load of little bits and then the large bits
S0091	where i've get them no do you
S0179	i think you're probably right and they're in your loft um
S0179	it's er come up with a small museum
S0179	you could open a small museum
S0179	um so yes that be the er very memorable um
S0058	yeah
S0179	world war ii
S0058	i think we have one like that and i take in my mum's ration book because she er i think they be still ration when she be bear
S0179	yes they would've be
S0058	so in in
S0091	it go on for a long time after the war
S0058	mm cos she be bear in fifty two so um sort of when she be until she be kind of one or two i think she have a a ration book um so i think i take that in for my er my world war ii day
S0179	cos you know at um at the imperial war museum
S0091	pardon
S0179	you know
S0091	yes
S0179	er well they've get a er a nineteen forties nineteen fifties prefab there um you know one of the er sort of er what do you call them like the er so the um the build they just put up
S0091	mhm mm
S0179	um all over the place and er you can go round it it's really interest
S0058	so like a quick er kind of house to replace
S0179	yeah
S0058	yeah i know what you mean
S0091	i mean there be quite er good ones you could build
S0179	well it's bigger than our house
S0091	pardon
S0179	it's bigger than our house
S0091	be it
S0179	that's the depress thing
S0058	yeah
S0179	i mean admittedly we've get you know a flat screen television which they didn't but
S0179	and a gas oven
S0179	but put that aside they've get it have everything
S0091	yeah
S0058	mhm
S0179	it have a larder
S0058	i guess they be brand new so they could
S0179	mm
S0058	make them kind of up to date
S0179	yeah cos you have a er a council house er mum tell me after
S0091	mm um it be somewhere near um er you know the garrison place between here and london what's it call
S0179	um not sandhurst presumably
S0091	no not sandhurst close to sandhurst
S0179	warminster
S0091	pardon
S0179	warminster
S0091	no
S0179	er no i've not no idea um
S0058	mm
S0179	but um but yeah again that would've be a good thing at the time presumably house wise
S0091	somewhere just beyond um um tut stonehenge
S0179	chelmsford
S0091	that's much farther along
S0179	um ah think of far away um last weekend we go up to see um tut to see um 's parent in sunderland er because your grandfather have just um come out of hospital um he be in sort of ten days or so for a heart operation um and the um so we go to see him but then on the saturday we wander about and have a look at we go to hadrian's wall
S0091	mhm
S0179	we try to go to kielder and fail um because it turn out there be no petrol station anywhere in northumberland
S0179	and they're all they're all close down and we get as far as i think it be
S0058	mm it be it's
S0179	and there be one there
S0058	yeah
S0179	but it close at lunch time and we be there at one o'clock
S0179	so we end up have er a full english breakfast in a a sort of all day english breakfast in a
S0058	mm
S0179	café and er come back to hexham er to find some fuel and then wander off to um chesters
S0058	yes it be
S0179	chesters
S0058	it's the er the er the roman fort
S0091	chester
S0179	chesters
S0091	chester no
