S0555	or if i or if i call a white person a cracker like
S0402	no no
S0555	cracker
S0402	okay obviously that that example's funny but then if you look at your
S0554	can we can call that one of our segment
S0555	yeah
S0402	but you're but you're exonerate these people just because they're in a position of power
S0555	no you didn't no you didn't let me finish explain
S0405	okay go on yeah
S0555	okay racism be a be a system and white people benefit from the system
S0402	yeah
S0405	you're right
S0555	no matter who they be they benefit from the system you
S0405	no that's generalise it okay yeah
S0555	no no no no no no let me let me finish let me finish speak
S0402	yeah cracker
S0402	yeah
S0555	for example
S0405	yeah
S0555	even if you have even if you don't if your family have never own for example slave or something
S0405	yeah
S0555	all white people have benefit from the slave trade due to the economic advantage gain by the british empire by the by americans because on the whole for example when when when erm erm like ah ah ah i can't remember but but
S0402	okay yeah yeah
S0555	i can't i can't argue very well on the spot but erm
S0402	no i hear you
S0555	but white people as a whole have benefit from structure like that
S0402	that's like that's like that's half a fair point because
S0555	i'm so i er i yeah it's half a fair point but go on yeah i'm not go to
S0555	but but also there's erm shit i i don't know what i'm say any more
S0405	go on go on think about it
S0555	erm
S0405	i'll i'll start and then you'll realise
S0555	but erm
S0554	wait can i make a point
S0405	yeah go on
S0554	when i go to india have you be to india so like when i go there every single advertisement on like a billboard be white people
S0555	right
S0405	yeah
S0554	all the advertisements on the tv be white people
S0402	it's like that poem we read
S0405	mm hm
S0402	do you remember the one for er for our gcse the one about the indian girl who say there be load of white people
S0554	electricity yeah
S0555	no just no oh erm
S0402	no something with the girl and he's get like a on her hand
S0555	yeah yeah
S0405	oh er a lone er er lose girl lonely girl erm
S0402	don't worry cambridge will help
S0405	yeah
S0555	er it be it be by or something i dunno
S0402	lucky yeah sorry why sorry go again though
S0405	but i think yeah
S0555	no but all all people all all basically almost all white people be implicit in the in the racial power structure because they like because because they don't
S0402	i see your point
S0555	because cos they be i don't know i
S0405	i disagree so i think
S0555	why
S0405	racism be wrong because it's racist not because
S0555	the thing be so many people don't say that they're racist and then power be
S0405	yeah i i totally agree racism towards black towards minorities in general be such a huge problem i no i i i i'm totally for that
S0555	yeah yeah
S0405	but to just completely dismiss it because
S0555	no but i'm not dismiss anyone
S0405	no but you're say the whole not a single white person can be you you say the whole of white people have benefit
S0555	no but no no no
S0405	from from the racism erm system
S0555	i guess yeah fine
S0405	and you can't put that on all white people
S0402	yeah no no er he's not say that they benefit because they they they outwardly do it and want to benefit
S0555	yeah
S0402	they're just say it it be what there there there be events that happen and without their knowledge or desire they benefit it from it anyway
S0555	yeah
S0554	right
S0405	that doesn't that doesn't mean that any that racism can't happen to these white people though yes there be generations that have benefit but
S0402	yes but but but it it doesn't make any sense for them because if you look at everywhere around the world especially like asia and africa the er and south america they idolise white people like white people like
S0405	again these be all examples there be go to be examples that be on the other way as well
S0555	not really
S0554	well there aren't
S0555	can you give me can you give me a genuine example of reverse racism
S0405	obviously i can't just quote something that's actually happen
S0555	yeah i know
S0405	but there must be white people that have be discriminate against
S0402	but that's a that's a not a a we're not i'm i'm
S0555	minority
S0405	no no no okay but the point be that you can't dismiss it because in general
S0555	no but the thing be like how would a white person be discriminate against what be that situation i can't even imagine
S0405	okay okay
S0555	i can't even imagine a situation where a white person be discriminate against for be white
S0405	so think of okay so say there be a black community wherever it be and there be a white person there and he's erm bully because he's the white kid or or bully and yes this thing these things have happen for thousands of years to black
S0405	not thousands
S0405	hundreds of years to black people and that's totally wrong but of course it can happen to the white person and like
S0555	but that's not that's not racism that's bully
S0405	no no yeah that's still racism though you can call someone racist
S0555	no it isn't
S0405	you can be racist you can hate that person because they're not black or they're not indian or they're not
S0555	you you can you
S0554	okay so
S0555	but that's bully but i don't think that's racism
S0405	so you only see racism in the culture in in the context of our in the historical context
S0554	no but what's the like ratio between a white person be bully for be white and a colour person be bully for be colour
S0405	but it's not yeah i'm say i i'm say the vast majority
S0402	you can't say colour any more
S0555	person of colour apparently
S0405	i'm say the vast majority happen to obviously happen to to
S0555	yeah person of colour
S0402	obviously we need this to go out we don't want to get take down for any race reason
S0405	no but
S0554	cambridge can you tell us which one's right
S0405	no but that's genuine it like they they would see this and they'd be like oh okay people be racist these days they're not go to take that out of it erm
S0402	we're not racist disclaimer
S0405	erm
S0555	yeah ah
S0405	racism in the form that you're say cannot occur but there be discrimination there can there can be the obviously the majority be against but but
S0554	in theory yes
S0405	but but discrimination
S0402	discrimination against anyone it doesn't happen
S0405	and i think you can call that that you can call that racism
S0402	yeah obviously it be possible i'm sure there's like
S0405	there have they have to be circumstances
S0402	there be there be a small amount a small amount of circumstances where it do happen we're just say the vast vast majority of the time a white the white culture be idolise to the point where everyone want to be in so if you wanna be it you have to
S0405	everyone there be seven billion people you can use something like the whole of the world
S0402	yeah no no
S0554	no no no
S0555	the thing be the thing be you're say that we can never make a generalisation so then why do we have doctor cos they can't cos doctor make generalisations all the time to treat their patients like we might as well
S0402	i have asthma when i be four
S0405	that's a completely different issue you're put you're say
S0555	no no but the thing be you're a concept you're use be that don't make generalisations
S0402	yeah
S0555	we're not buy it
S0405	okay i won't use the point you shouldn't use generalisations but i'll make the point you're say whole of white people to represent billions of people and that's all how about hundreds of millions of people and that's you can't do that
S0555	no but the thing be when i say white people it's short hand for people who be white people who be racist and the thing be a lot of white people be racist without say they're racist so the whole racist view be
S0405	no but you're say
S0555	without admit to be racist
S0402	wait what what
S0405	but you're say the whole of white people cannot cannot but
S0555	the whole of white people the whole of white people
S0405	yeah that's
S0402	or one of them
S0405	basically what you're say
S0405	cannot be subject to this kind of racism because
S0402	we're not we're say yeah obviously it's possible like in the way i could win the lottery tomorrow it's possible we're just say it's incredibly unlikely
S0555	but like no
S0405	it's not a probability thing
S0555	like how would a white person how would a white person be subject to racism
S0402	just because no i i'm say that it be possible i'm say it's possible i'm just say it's unbelievably unlikely because
S0555	yeah
S0402	there's no there's no reason
S0555	have you ever hear of like someone be deny a job because they be white
S0405	okay but
S0554	okay no no no but the way it work be the reason white people be in so much power be because most of the western worlds be white so a lot of the colour people that be subject to this like racism
S0405	mm hm
S0554	be immigrants that's why
S0555	it's it's not only that it's cos of erm colonialism
S0402	yeah i mean if you look at if you look at the part of the world that be the most develop they be the place with the greater proportion of caucasians
S0555	like you know your know your erm situation of the white person be bully
S0405	okay can you say yeah right
S0555	that would happen if white people move to say africa or asia or asia that doesn't happen
S0405	and there be okay no no okay yeah no but it do it it it would happen so
S0555	that wouldn't that wouldn't necessarily happen and that wouldn't necessarily
S0402	do a guy just get bully in sierra leone
S0405	okay okay can i make a point can i make a point okay
S0405	no matter what i say even if i use examples the reason that your point over supersede whatever i say be because you're say that it's such a small proportion
S0402	yeah
S0405	but of course it can happen so there's a black community in erm i don't know detroit or some lower no i i i use that seriously erm erm some kind of erm work industrial city in america
S0555	yeah yeah
S0405	where it's be populate by work class erm people who be black
S0555	yeah
S0405	and there be then still white people there
S0555	yeah
S0405	and they they can be discriminate against they can be call whatever term you white boy you white whatever i'm sure that i'm sure they at some point
S0555	but the thing be they call
S0405	can i finish
S0555	yeah sorry
S0405	so so at some point these white people have be discriminate against and or they'd be erm discriminate against purely because they're white if they be black it would be different now to put that in the context of the world yes that's so small but of course that's racism
S0555	no no no no no okay okay no the thing be it's not just cos it's small it's because of the fact that can you really compare for example call someone a cracker to someone call someone the n word
S0405	okay
S0555	can you no wait wait wait
S0405	okay okay let's yeah i will
S0555	can you ever compare those two situations
S0402	okay let's i i have an example i have an example yeah
S0405	i'm just about to
S0555	can you can you ever compare those two situations
S0405	yes yes you can and i'm i'm about it
S0555	okay how
S0405	okay so let's say someone again you're not gonna believe me
S0402	to call someone a cracker doesn't have the same connotation though
S0405	listen to me come on please look look look you're not go to believe me cos you're not go to believe that something like this could happen so someone be be
S0555	no no
S0405	someone be be so abuse because he and he's so socially exclude cos he's white that he commit suicide now that be
S0555	okay that's bully that's not that's not racism
S0405	now that be
S0402	possible
S0405	yes that why isn't that racism you're say it be racism it be
S0555	no no no no no but you're talk about cracker you didn't mention the word cracker in that argument at all
S0405	no stop say cracker that's such a trivial statement let's
S0554	what do that even mean where do you take this from
S0555	no but no
S0405	stop think up stop think of racism
S0405	cracker before okay
S0554	not not to me
S0555	erm black people in america say cracker it's like
S0405	if be here she would back up cracker
S0555	yeah right so we're
S0405	okay now how be it that person's
S0402	that be racist and it be bully at the same time it's both racist and bully
S0555	yeah okay so
S0405	okay so but why be it not racist
S0555	no no i know i know as in you say you be gonna compare cracker and the n word you didn't do that
S0405	i didn't no no i didn't compare i say no i i i i didn't say i be gonna compare cracker and the n word i think you be exaggerate that and you're look at racism and think
S0555	no but the thing be
S0405	give me one sec you're look at racism and say okay if you look at it from a profanity point of view then oh look ha ha white racism can't happen to white people cos cracker doesn't mean much but but what the n word be serious so but if you look at it from racism doesn't isn't just someone just say a word on the street racism cause
S0405	no it's funny racism cause people
S0402	stop say cracker
S0555	i haven't say cracker what it's you two
S0402	you say it like thirty second ago
S0555	continue continue continue
S0405	i'm say it cos of you guy i didn't want to bring that up okay racism cause people to commit suicide
S0555	okay
S0405	and discrimination against someone because of their colour be cause people to commit suicide
S0555	okay
S0405	therefore how be it that person's fault why be it not a serious problem because no he hasn't commit suicide because he's be call the c word he's be he's be he's commit suicide
S0555	what
S0405	if i say cracker you're go to give me shit for it
S0555	i think you say cunt
S0554	the c word you can't say the c word
S0405	racism isn't just word it's it's it's social exclusion it can be it can be
S0402	yeah yeah we know that i know that
S0555	no no that's the thing it's not just word it's also historical context that's why that's why the c word
S0405	that's worse
S0405	can we get away from the cracker thing
S0555	no but that's the that's the thing cos
S0405	yeah
S0555	that's how those that's how that's like a point where those two things be not comparable at all because
S0405	i know and i didn't want to compare them it be you guy that bring up that word
S0402	you guy
S0555	no i i i say it and you say you be just about to compare them so
S0405	i'm try to compare no i be gonna compare the seriousness of racism against white people against the seriousness
S0555	okay i i you know okay first of all i i i understand that situation
S0554	we get that we get that
S0555	i guess i guess i guess that okay that situation would be racist but i don't really know
S0405	yes the vast majority happen to black but it can be against white
S0555	no no no no no stop stop you're anticipate what i'm go to say and it's wrong
S0405	yes i be
S0555	but the thing be that racism be systematic and it do not happen on the same level as it do to white people to so people of other people of other race it happen systematically where the point where we be social train to think look at look at a person for example like me and say oh he could he's brown he's a terrorist which be why whenever whenever i go out somewhere like in london my money my money be always check it's always check they always like do the thing on my money
S0405	right
S0555	because it's true i have a beard i'm brown he must be dodgy that's why
S0405	yeah yeah yeah
S0555	and things like whenever we whenever there's a situation where bag need to be check our bag will always be check if if if we're like if we the come from a muslim family so if your name if you have a muslim sound name it's all the time there be no point where you can compare compare that to the current treatment of white people that's what i'm say
S0405	them people white people commit suicide
S0555	no no no no no no listen to what i'm say
S0405	yes
S0555	that's why you cannot compare that's why you cannot compare because in the state of the unite kingdom today the the state your your you only see racism as an instance racism be not an instance it's a historical system
S0405	mm hm
S0555	which be currently perpetuate negative stereotype on people and enforce behaviour which for for example like they do this experiment where they send in cv's and they put give one person a hispanic name and one person a white name
S0405	mm hm
S0555	and the white and the person
S0402	oh yeah yeah yeah
S0555	with the hispanic name get erm get erm get way way way less responses there be a reason that happen
S0402	yeah load of people change their name to sound more
S0555	exactly my my uncle's change his name
S0405	you yes you can use as many examples as you want
S0555	no but no no
S0405	no i agree with you
S0555	but the thing be you you you why do you only see racism as one instance it's not an instance racism be a system
S0405	okay how about from a
S0555	cos like
S0405	legal standpoint okay erm firstly i agree with everything you say yes racism happen on such a massive scale
S0555	no no but that that's what we disagree on you you you you you seem to be think you seem to think
S0405	and so much history and
S0555	no you seem to think that racism be an instance like something happen that's racist that's not necessarily true
S0405	the reason i'm argue that
S0555	racism happen because there's a system behind it like like if someone seem someone and doesn't like them or like someone like if if someone see me and i and i and i and they look and i like maybe try to steal something from a shop shop or i i like look really and that's why that's why they follow me round the shop
S0405	yeah yeah yeah i get it i get it yeah right
S0555	that's not racist that's they have a reason
S0405	yeah
S0555	but if they see me and they have the automatic assumption because of culture which have perpetuate the idea that people like me
S0405	yeah
S0555	steal things in shop that's racist
S0405	i get what you mean
S0555	but the thing be that that that that perpetuation do not exist for white people on the same level
S0405	right okay
S0555	there's no
S0405	i agree it's not on the same level but if you look at it okay let's take it a different path on a on a legal level you can be fin for incite racial hatred
S0555	yeah
S0405	surely you must agree that you could incite racial hatred against white
S0555	okay yes fine fine
S0402	sure but no one's ever be charge for that
S0555	fine but that have nothing to do with what we be that have nothing to do with
S0405	i'm sure there have be
S0405	it that be the point that i be make because the the way i saw what you be argue be either that racism against white be irrelevant or that it cannot happen
S0555	no no it's
S0402	no no
S0555	it's not it's not irrelevant when it happen and it and it can happen
S0554	and it can happen
S0555	but the thing be i it's racism as it's as when white people talk about racism what they talk about be be rude to someone because maybe they're white it's not it's not the systematic abuse receive receive by a group of people because of a historical which have a historical basis and be perpetuate in modern culture
S0405	okay alright i get what you're say so
S0555	there be there be no equivalent for white people of that kind of systematic abuse
S0405	okay i get you i i'm not try to conflate erm discrimination so but just just so i get in your mind set
S0555	for white people
S0405	so if you look at sexism do you think that sexism can happen to males in the same way it your say female sexism have happen i know it's different and maybe i'm generalise er not generalise but conflate
S0555	you're conflate
S0405	conflate
S0555	i don't think you can compare them you you can't
S0405	but i know they're so different but this be what i see from your logic the the the sexism that be that you would be describe as the racism against minorities and black would be the sexism that have happen to women over thousands of years women
S0555	minorities and black as if black people be not a minority
S0405	yeah yeah erm
S0555	they're special
S0402	let's hope she never hear this podcast
S0405	that that sexism have always happen to females and that's the reason we're in this society it's perpetuate and females be pay less and de de de therefore sexism against males be not part of that systematic system of sexism
S0555	yeah
S0402	yeah
S0554	i think that's right i
S0405	so would you guy not argue that sexism can happen to men
S0555	okay what give me an example of
S0402	i think i think the exact same thing we say er racism can happen to white people it just happen so little that it's not even on the radar again sexism can happen to men
S0405	yeah i think you're argue different point well i think you be but
S0555	i i think i what i think what he mean by little as in
S0402	what he's say be
S0555	it's not back up by any historical basis it's not back up in culture it's not back up systematically
S0405	right
S0402	yeah those be the reason those be the reason why it be so little
S0555	yeah
S0405	but neither be
S0555	but like like you can't compare the two instance like erm a woman say that a man be sex drive that's not the same as a man call a man call i mean a man call a woman a floozy like or like call her a bitch cos you she won't sleep with him or something
S0405	right right okay
S0555	those be two different they're two different power dynamics that you can't compare
S0405	they be different but i think they're they both can be they both can be legitimate
S0402	i think they're pretty similar
S0405	and be serious offenses that we need to deal with
S0555	no but can you can you give me an example of a sexism against men
S0405	sexist against men erm i guess maybe it's a bad example
S0554	women abuse men on the street and no one care
S0405	no cos that you're go to say that's like the incidence thing like i be say about cos that do happen but it's a minority thing
S0554	oh okay
S0555	no that that that's
S0405	so er er
S0555	no but but the the thing be but the thing be that with that example
S0405	i've get a better example
S0555	that's not that's not
S0405	you'd say that happen so much less than
S0555	no no no no no
S0402	that's not as a result of the system
S0555	the the reason that people don't take that seriously
S0405	right
S0555	be because of patriarchy patriarchy be what uphold sexism patriarchy also erm in some instance go against some men for example men who be abuse by their female partner aren't take seriously because a patriarchy state that women be weaker than men men must be er like erm the dominant force in their relationship so to see a man be lower in that way be not take seriously because of patriarchy not because not because she that's sexist it's because of patriarchy that happen
S0405	why can't it be sexism though
S0555	because it isn't because it isn't because
S0402	well it be sexism
S0555	no but it how be it sexism
S0402	well sexism like erm
S0405	because it's just discrimination against someone because of their sex
S0402	discrimination because of their sex
S0405	and because they're male they're not take as seriously
S0402	yeah
S0555	yeah no no they're not the reason they're not take seriously be because be because of the
S0405	right
S0402	cultural societal reason
S0555	yeah because men have be state as superior so
S0402	but it's still it be sexism
S0555	it be it be it's sexist but it's not it's not it's not the same thing as say it's sexism against men because it's still patriarchy which affect which be the same force that oppress women so it's
S0405	right
S0402	yeah but it's not a moral standpoint it's sexist because discrimination be
S0555	yeah no no no i'm say yeah it's sexism but it's not the same type of sexism as
S0402	people
S0555	no it it it it it stem from the same force as the sexism that women face as in it's it's because of the fact that men be consider to be superior to women which be why it's so it's so people see it as so demean or people feel so or people see it as so pathetic to see a man be abuse by women that's because of the same those be the same reason that women be be discriminate against because those those things be similar but i don't think that's different i don't think that's sexism against man men
S0402	right
S0405	but then don't you think just because females tend to er er er be at a disadvantage more than men in those situations it's it's only important to consider the female side of it
S0555	no no no it's
S0405	i really don't get this cos cos okay so so you're say there's this system okay and yes it's sort of the vast majority benefit men but part of that system that we've now realise be because men be in these position of power they feel an inclination to not fail as much and therefore because of that pressure more men commit suicide than women
S0555	yes
S0405	so
S0402	okay
S0405	erm i'm try to relate that to sexism but erm okay so let's let's say if that be sexism because they be not take as seriously as a female who be erm
S0555	like men aren't allow to talk about emotions and stuff like that
S0405	right yeah i guess yeah yeah
S0555	so if he if he talk about his emotions he's consider like weak
S0405	yeah if someone tell him
S0555	you see that that stem from the same force as that oppress women
S0402	exactly so isn't that sexism as well or yeah
S0555	it be it be sexism but it's not the same thing as like cos we're compare it to like white people experience racism it's not the same thing
S0405	no i know i that
S0555	it's not the same it's not the same thing as like be sexist against a man that be the same cos the patriarchy enforce gender roles
S0402	uhu mm hm
S0555	what's happen what would happen in that situation be that a man's gender role isn't be follow he's not be strong or he's not be like stoic or whatever
S0402	right yeah yeah yeah
