S0555	genetics and erm they be say that other other other primates like erm what be it chimpanzees have like
S0402	pan chimp er pan troglodytes they
S0555	they have like sex with just like load of they just have like
S0402	yeah
S0555	and and gorillas have harems so you have like a group of females and they just have sex with them
S0555	but humans like cos cos at a hunter gatherer stage it make more sense to have like a a specific unit between people like one person to go and forage and hunt another person to raise a child and maybe also forage as well
S0402	yeah yeah yeah
S0555	so we be also partially at least engrained with the idea that monogamy be be beneficial
S0402	yeah
S0405	mm hm
S0555	but also not cos of the fact that other primates do like just try and spread their seed as much as possible
S0402	yes yeah i envy er chimpanzees
S0555	most people yeah yeah
S0402	isn't that what do in the back of spanish
S0555	ah ah ah ah no
S0402	but i think the problem with try to look at it biologically compare to primates be that humans humans buck the trend massively
S0555	that's true
S0402	when when we become
S0554	mm
S0402	so life get so easy for us it be kind of like survive wasn't a problem any more so it wasn't our main life protectant
S0405	yeah
S0555	yeah
S0402	it be to like start move to like like i'm pretty sure primates wouldn't aren't as emotional like like you know if be a primate he wouldn't be so clingy to yeah but
S0555	yeah
S0405	but but the ideas of clinginess be quite substantially initiate by hormones like oxytocin and and so
S0402	no i'm just say that people run out of things people run out of things to do like two hundred years ago
S0405	right
S0554	so like people in africa who be still have that instinct to survive
S0405	yeah
S0554	what what do they how how be they look
S0405	in africa
S0554	some people in africa like the ones who be
S0555	do you mean people in poverty
S0405	do you mean like tribe
S0554	in poverty
S0405	oh okay
S0555	anyone in poverty
S0402	i i i think it's
S0402	different again because they they they can see the the the world
S0405	mm hm
S0402	the entire world as it be cos they're so connect it's not i mean you you look at from a like tribally i'm sure that that you know tribes people be more likely to be polygamous than monogamous
S0555	really
S0402	yeah
S0405	erm okay so then how about the idea that
S0555	i don't know
S0402	because we we have stuff like tv now right it it's not like we're gonna starve tomorrow or
S0405	no but like what do you mean by like tribe people be more polygamous can you give a specific
S0402	like like so so er no no i i mean do you know there's those there's place in like indonesia say where there's tribe that no one that the rest of humanity have never touch before they they're they're unaware of the world around
S0405	yeah okay yeah
S0554	yeah yeah yeah like there's this island near india
S0555	okay yeah
S0554	which no one have ever be to like andaman islands yeah
S0402	yeah
S0555	yeah the andaman islands
S0405	right yeah
S0402	and so so no one have ever be there no one have even
S0405	yeah
S0402	they don't have an understand of the the culture and society we build up
S0405	yeah
S0402	right so and and they don't have the technology or any of that
S0555	yeah
S0402	that we've use to like make our live so amazingly comfortable after over the last like three hundred years right
S0555	uhu yeah yeah
S0402	so they're still in that kind of hunter gatherer stage right
S0555	yeah
S0402	so their aim be to survive and rear their children
S0555	yeah yeah
S0402	where our aim no one go what be i do today i'm survive and i'm rear my children
S0555	yeah yeah
S0402	yeah what's what's your job i'm a survivor yeah no one say that
S0555	right yeah yeah
S0554	bear gryllis
S0402	bear gryllis
S0554	i'm a celebrity
S0402	yeah so so it's kinda like that's not a problem for us any more so we've have to find something else to do to fill our time with and that's when we develop stuff like emotions because we just have the time to
S0555	yeah mm i don't think we i don't think that's how
S0405	i disagree with that
S0555	it happen but i do i i think i kind of
S0402	i'm just say that's like the reason that we can't really accurately compare ourselves to primates because primates
S0555	i think the the reason that we can't be mostly because of the fact that when we develop we because of the fact that we're so successful we develop such large brain and now we're and now we be too complicate to compare to primates who who
S0402	yeah
S0554	yeah
S0555	who be much more simple
S0554	have you see rise of the planet of the ape
S0402	caesar
S0554	yeah
S0405	there be ways to look at primate anthropology in the right way and there be ways to do it the wrong way and most people do it the wrong way in that they get really defensive because if they all they just assume that people be just look at primates and just make these ridiculous connections the only reason we'd look at them be to look at an evolutionary history and try and identify trend as to why we develop certain either instinctive behaviours or er physiological erm or psychological motivations for why we do things
S0555	mm
S0405	but that doesn't always include the idea of nurture or the idea of our society the kind of effect that they have erm so you know it's just important to look at things in the right way the point you make about erm erm you say you think most sort of tribal culture would be polygamous
S0402	yeah yeah lot
S0405	how about well roughly right right yeah erm how about the idea so do you think erm so basically if you look at tribal culture the vast majority of them except this one tribe one single instance where it's the other way round most of those be polygamous in that it's of one male and multiple females
S0402	yeah
S0405	whereas this one tribe in tibet or former tibet that be multiple males and one female
S0402	mm right
S0405	so why do you think it be why do you think that do you think it it do you think our biology promote have that kind of polygamous culture or do you think it's just individual circumstances or do you think
S0555	well because women can like women's i think i feel like the idea that women be pregnant and they need to be care for by a man if there be multiple women then he need more protection to do something for all of them
S0402	yeah
S0405	yeah yeah right it's more practical right yeah
S0555	it's just easier
S0402	but isn't that just part of who the father be
S0554	isn't it just part of their culture
S0405	yeah
S0555	it could be yeah the father be yeah that's true
S0402	isn't it just part of their culture though
S0405	yeah that's the thing
S0554	something they've build up from
S0405	mm
S0555	no but they they can and like western and western and asian and like i don't know about amero indian culture but lineage be actually quite important as a social concept
S0402	mm hm yeah
S0555	there's a lot of myths around it erm
S0402	i think it's just i would say from a a kind of logistical stand point it's easier to have one man because like a woman's only gonna produce an egg every month
S0554	yeah yeah
S0405	whereas a man can basically produce sperm on point
S0555	for his whole life because women stop produce egg after like fifty or something
S0402	yeah yeah
S0405	yeah
S0402	yes
S0405	yeah erm as long as people don't then assume that that mean that erm it's natural for men to go around have sex with lot of different women and women will have the instinct to try and find one man that's no one's i'm paraphrase this argument
S0402	well no i i'm also sure that like cave men like just because one man would have sex with load of women
S0405	mm hm
S0402	i'm pretty sure there would be some where a woman might have sex with many men
S0405	right
S0402	i i think just because the tribes be then kind of branch off like that that that could possibly be because of an imbalance of men to women because if you have if you have many more women than men
S0405	right
S0402	obviously a man's gonna have sex with more women and a woman be gonna have sex with more different men
S0555	when you say cave man what do you mean by cave man
S0554	just mean erm ten thousand years ago
S0402	yeah
S0554	erm
S0402	like the most basic start of what we call humanity
S0555	do that mean like
S0405	we're likely we're likely to have evolve from our most previous ancestor about fifteen thousand years ago erm fifteen to forty thousand years ago to the species that we be now erm
S0402	communication
S0555	erm i saw a national geographic
S0405	yeah
S0555	print like two months ago they find a new er hominid
S0405	erm
S0555	no erm homoniphalis or something something like that yeah erm
S0402	in south africa
S0555	nipo nipo
S0554	homonipo homonipo
S0405	no no no genuinely it begin with an n it begin with an n that's it they find it in
S0402	well he be basically a primate
S0405	yeah
S0554	should we should we explain who be
S0405	no no no
S0555	never
S0402	no we can't we can't use the word i'm sorry
S0554	micro penis
S0402	micro penis
S0402	we can bleep these out later
S0554	yeah
S0405	but the thing they take from that be that it be basically deep into a cave into like really tiny crack
S0555	yeah it be an all female team who do it as well
S0405	yeah and and basically they conclude that this be some kind of
S0554	cos they're too cos men be too big to fit in
S0555	yeah yeah yeah that's why they have an all female team
S0405	they should have just get children in there
S0402	yeah they should have children
S0405	no the children might die
S0554	it's not just yeah
S0554	in the name of science
S0405	oh yeah
S0402	it's homonipo care
S0405	homonipo yeah
S0555	it's for science if they write it down it's okay
S0402	it be really weird they conclude that either it be some kind of someone be hide a body because they be there be these body in these tiny crack or what be more plausible be probably some kind funeral rite which be
S0555	yeah yeah they think it be which be really interest because it's because of how old it be so
S0405	yeah yeah yeah
S0555	so that be like the first instinct
S0402	or or maybe they all just feel down there
S0555	no no
S0554	that's another thing
S0555	it be impossible it be so intricate that it have to have be someone
S0554	yeah they do they do think that maybe like there maybe there be like more high water level so it be wash through
S0402	yeah
S0555	oh i see
S0554	but but it it they they think it isn't really cos there's no recent erm geological evidence for that
S0402	or anything
S0555	no
S0554	no there's no there's no there wasn't any geological evidence for it so they think maybe it be like a burial place
S0402	yeah yeah i know but i think scientists be always so quick to like attribute mean to anything that happen
S0554	yeah i know no but that's that's humans that's not scientists
S0402	yeah no but i'm say
S0555	that's the public
S0402	er if if you're a scientist it's your job to unearth the facts from what you see not get your emotions involve
S0405	i don't know no they be they be very initial initial find it's gonna be like plenty more
S0402	it's like if you see that you go oh my god it's funeral rites look how develop we be that's a problem
S0554	yeah no yeah no no that no that's the thing that's that's why people find it so odd because that we haven't previously think that that be possible and like people would in that with that stage of development in that species or in that time
S0555	mm hm
S0554	be develop enough to consider things like death and like erm recognise it and like
S0402	yeah art and
S0554	and like actually bury it cos that's too advance for them
S0402	yeah mm hm
S0554	but that's why it's so that's why people be think it's funeral think it think it's so controversial that it be
S0402	be they sure they didn't go oh 's dead let's just toss him in the crack
S0405	's dead
S0402	he he's start to stink a lot
S0405	no there be there be multiple body there be like five five or ten body go down so it wasn't just one guy
S0402	oh right oh right yeah the dead as well
S0555	yeah but even so they be so their brain be so small it would have be really weird if they do that
S0405	oh yeah
S0402	er er er smell smell bad toss in crack
S0405	what what do you say
S0402	toss in toss in toss in crack
S0405	oh toss him that's 's joke
S0402	toss him in crack
S0405	yeah ah yeah so do you think because i slightly because erm it's you sort of think it might be natural that one male would provide for many females just because of the physical nature do you think it be harder for males now put it into today's society do you think it's harder for males to be more monogamous or to be commit whereas for females it's easier because their biologically make that way this be the main debate so
S0402	i i feel like i feel like recently right so so you have like thousands of years of male domination right
S0405	yeah
S0402	and now like the last
S0554	male domination mean
S0402	like where where erm typically males have be see to to have all the job to have all the power where they be in charge of like absolutely everything and now because the roles be become more equal you have this like almost counter revolution where it's like there's a there's a lot of man hat i'd i'd say
S0555	ah
S0405	so when you say evolution do you think that's just cultural evolution or do you think
S0402	i i think this be cultural societal
S0405	do you think there's anything biological behind it
S0402	no i don't think there's anything biological about it
S0555	oh the man hat
S0402	yeah where where where
S0405	you just mean really angry feminists
S0402	yeah basically a a lot of really like like
S0405	right
S0402	where where feminism should have be about equality it's now about that everything a man do be wrong because because cos men for a thousand years be do wrong stuff
S0405	just step over yeah right but they're just people just assume all feminists be like that it's not the truth like
S0555	i don't i i don't i don't when people say that about feminists i it's that's not true
S0405	it's a bite strange yeah i know i know
S0402	yeah but there be there be a a strong proportion or at least the loud ones
S0405	a strong
S0555	no but the thing be that people say the same thing
S0405	but there's not
S0555	about islam they say the same thing about that
S0405	yeah
S0555	they're like oh those be the those be the loud ones those be the people do things that hear about that's the reason you hear about them
S0405	they only get report
S0555	you hear about them those it's like the same the same thing with aeroplanes you only hear about faulty aeroplanes aeroplanes that crash you only hear about like feminists that piss people off same with that
S0405	yeah this be thing he only ever re tweet the most extreme stuff about feminists or trans or
S0402	can we use name
S0405	yes name's boy
S0402	can we call him like er
S0555	we can't use name of people we're talk shit about
S0402	yeah that's right
S0405	they're not gonna hear this
S0554	okay how many 's be there in the world
S0402	there must be a lot
S0554	yeah
S0555	i mean i go to his birthday remember
S0402	but can't hear this now
S0555	oh no ah would lose it would have lose it just there ah man but er but yeah and do you hear about er there be a university in american and erm there be a lady who for about ten years have be give free yoga sessions to students really awesome
S0402	yeah yeah
S0554	be this again
S0555	yeah it's
S0405	right
S0555	and then erm
S0402	we should make a podcast about
S0405	right and so then the university get involve after a complaint have be put in
S0402	oh my god so annoy
S0405	and she be ban from do it because they make the case that yoga be steal culture
S0554	yeah
S0405	from certain culture from probably buddhist or indian culture or
S0402	wasn't it also cos like disable people be angry that they they couldn't do yoga or something they also make that point as well
S0405	it be from no yeah no it be from like the disable union or something but the point they be make that it be steal culture from from culture that do yoga and and it be about white oppression and for so many years we've steal
S0555	yeah yeah
S0554	white oppression
S0554	white white
S0555	white oppression
S0554	white supremacy
S0405	white supremacy even that that we've be steal these culture for so long it be it be ridiculous it be
S0554	obviously
S0555	i i the thing be like that that example be a bite weird can be a bite extreme but there be things like like in music festivals white people like to wear bindis and stuff
S0405	right
S0555	and the thing be like some people don't like it because a lot cos when people when when like a lot of people be younger
S0402	yeah
S0555	they be like mock or even now even nowadays they're mock or like stuff for wear bindis by other people and now they think as soon as they as soon as it become something beneficial for them like
S0554	right
S0555	they can use it as a fashion accessory they think it's okay they no no longer do it and they reduce it of it's any any religious value cos some things like that be religious and like yoga be originally a religious thing
S0402	yeah
S0554	have you be to like have you ever be to like any festivals the amount of like white people
S0405	i've be to one music concert
S0554	white people like girls and boys just wear really indian stuff that they have no idea the mean of
S0555	yeah
S0405	right
S0554	and that just take away all value
S0555	yeah it yeah exactly
S0554	like as an indian be at those festivals i just felt like it's almost disrespect
S0405	right
S0554	what my culture be and my family and my religion's about
S0555	exactly like i i i i do understand why it's kind of weird
S0554	uhu
S0555	because the thing be something like yoga have be so divorce with actual with what yoga be what yoga be originally
S0405	right yeah
S0555	that the only thing it have in common be the name that's the only thing cos yoga's originally a religious practice
S0402	mm hm
S0555	and it's like it's like
S0402	but isn't it then its own thing so it doesn't matter because it it's become so devolve that it's
S0555	no yeah no that's that's the thing that's why i think yoga's a bite weird but something like a bindi people don't wear bindis for decoration that's why people in pakistan generally don't wear bindis
S0402	mm
S0555	cos even though it's a cultural thing for that part of the world
S0402	mm hm
S0555	people because most people be most muslims don't wear it because they see it as a hindu thing because it's actually religious
S0405	right do do most of these do most of these people that wear bindis er er put bindis on be they do it to mock them or
S0555	no it's
S0554	they they think it's they think it look cool and it do look cool
S0405	yeah so what what's the problem with that
S0555	the thing be the thing be that you're reduce something to an accessory
S0405	okay right
S0555	it's like it's like if i get a picture of like i don't know it's like if i if i saw someone pray a muslim prayer and i think that's a cool dance move
S0555	and i start do that or if i like
S0555	or if like erm get like a sample from the quran and i put it in my song call weed weed weed or something
S0405	right yeah yeah yeah
S0555	like it's it's so divorce from actual context that it become disrespectful that's why people don't like it but i also understand like people think that's a bite weird
S0402	yeah
S0555	because sometimes things i don't know you can't you can't police everything and some things don't need to be police
S0402	i think i like that kind of
S0555	cultural syncretism
S0402	yeah but i you know i don't really see a lot of indian culture other than like you know people take the piss out of call centre
S0555	yeah
S0555	but they're that's what it be they take they they they make fun of what shit that they don't like and then they and then anything else that they want they just take
S0402	yeah i know but that's that's like everything though in life you know people don't eat broccoli because they don't like it but that doesn't mean that they like they're not go to eat the meat as well unless they're
S0405	what
S0554	it's an analogy
S0405	i don't like his analogies in general but this be particularly bad
S0402	wait if you if you if you if you have a plate of food right yeah and you have like chicken yeah
S0405	can you explain your point and not use an analogy
S0402	no i can't do that cos the word don't make sense in my head
S0405	okay alright okay okay okay
S0402	right so you have a plate of food right with like chicken and vegetables on it you don't like the vegetables you're still go to eat in chicken though cos everyone like chicken
S0555	what
S0405	and and how do that relate
S0402	because you're like say you you take the best stuff from it and and you leave the the stuff you don't like
S0555	yeah no but the but the people but the thing be you're take good stuff but the people there be still people who still practice the things that you think be less favour
S0402	yeah but that's like anything in life
S0555	and you're take the stuff which you like
S0402	that's stuff like everyone in life people will like and hate it everyone doesn't go i love you know everyone go yeah that's amaze we can all agree that we like this it doesn't work like that
S0555	also people mind that i'm just say why people believe it i don't necessarily believe it
S0405	what do you what do you do you do do you agree with most of what you've be say
S0555	i don't know actually
S0405	i say that like completely natural do you do you er do you do you do you er do you
S0555	do you do you do you i i don't know cos the thing be like
S0405	yeah yeah it's complicate
S0555	i'm i'm i'm my what be there for what be there in my culture for them to take so i have no personal experience of it
S0405	right
S0555	so i don't know if i have personal experience i can speak on i can speak on it but i can't so i don't have anything
S0405	do you think it's up to the dignity of the culture that be be take from
S0555	i i don't think like if if you're like discuss it you should be if there's a discussion about it you should only include people who have actually have who be from those culture where people thing things be be take
S0405	you should do that or should not do that
S0555	you should only have those people
S0405	oh okay
S0555	cos if you have like it's like it's like when they have like discussions about islam and they invite no muslim speakers
S0555	that's dumb like don't do that include people of the group that you're only
S0402	also it's important to have a range of speakers cos you're always on that show when they do invite a muslim they find they find the most hard line
S0555	yeah well
S0402	like right wing muslim
S0405	yeah yeah yeah
S0555	anjun chowdrey
S0405	yeah anjun
S0402	yeah and they they they get no they they don't get no no leave wing to balance it out or no one in the centre
S0405	yeah
S0402	it's always let's get the the most racist person we can find and then stick them on the show
S0405	yeah do you see the thing at brunel university with katie hopkins
S0402	oh yeah do they all just walk out
S0554	they all just like
S0405	yeah they stand up turn their back for like a minute
S0554	they they all
S0405	then they be like
S0402	fuck hate katie hopkins
S0555	yeah
S0405	it's such a student thing to do but i like it's a dick thing to do but
S0402	i like that they do it though
S0405	i don't i be like so happy with the the whole
S0554	yeah
S0555	after after martin luther king that's my top protest of all time
S0402	martin luther king
S0555	i mean they make no sense but
S0405	oh it be oh it be top top quality quality
S0402	why do people still listen to hopkins
S0554	they don't cos they stand up and leave though
S0402	yeah people subscribe to her beliefs
S0554	so many
S0405	why do people read the sun why do people read the daily she's a columnist for the daily fuck mail how can someone like that be a columnist
S0554	yeah but everyone know the daily mail's shit
S0405	i know but people read it and the sun have the second er er yeah the second wide er biggest readership in the uk
S0555	that's cos white people be racist and they don't like to say it
S0554	that's cos of page three and page three
S0405	they've stop page three now
S0402	they've stop page three
S0405	no no why
S0554	so why do people still read it
S0555	white people be racist
S0405	all white people ever
S0554	yeah how dare they
S0555	what's wrong with say white people be racist
S0405	what be it serious or not serious
S0555	yeah
S0554	well because white people
S0405	cos there's sixty million people and like forty million people of them be white
S0402	the last hour
S0555	no the thing be when i say white people
S0405	yeah
S0555	i don't mean i'm use it as a stand in for white supremacy but the thing be a lot of white people aren't very er er racism racism be systematic and white people generally
S0402	yeah actually yeah no that's a fair point because you're less likely to be racist if people have say racist things to you right
S0405	yeah
S0402	no one's ever say racist things to a white person
S0555	yeah
S0402	or it's very unlikely
S0554	yeah that's true
S0405	have you hear of reverse racism i know it might be a ball of shit thing
S0554	because because of white supremacy
S0555	no reverse racism be bull shit
S0405	okay okay but
S0402	not the ridiculous ones that be like
S0555	okay reverse racism be basically
S0402	you're gonna use the worst example
S0555	you can be racist no reverse racism be basically you can be racist to people who be in a position of power for example white people on a in a racial demographic white people
S0402	oh okay yeah but they're in power so there's nothing
S0555	yeah exactly so a reverse racist thing would be like if i say we're gonna have a discussion about something no white people include or if i say something like that
S0402	oh my god the white people would go mad if you say that
