S0520	be this be
S0519	i don't know where we be but you'd deliberately leave your computer in
S0521	no it wasn't i know i wouldn't do it in be the worst
S0519	and he and his excuse for this aberration
S0519	be well they just stop and check me every time so i may as well just do it
S0520	oh no no
S0519	but if you've leave your computer in
S0520	play the game
S0519	they know that you're be annoy so they they put him through three time
S0521	yeah
S0519	we be there a good half an hour i go straight through
S0521	they have a sniffer dog come out
S0519	pick my bag up he
S0521	paste all my equipment through the
S0519	and it's because he deliberately leave it in you know if he's just take it out and put it in the tray like everybody else we'd have be alright
S0520	yeah dad
S0519	yeah dad
S0520	same train leave at sixteen thirty nine
S0521	there be one super there be one
S0519	we'd have to leave at four with the children
S0520	we'd have to take the children
S0519	yeah and take them it's just not worth it i know that's a shame but
S0520	no it doesn't matter at all i just wonder if it be a
S0519	no
S0521	there be one super stressful event i in frankfurt airport
S0519	be i there
S0521	no you weren't there
S0519	thank god
S0521	and i take my computer out put it through in x ray machine and forget to pick it up again
S0519	oh oh
S0521	and then i be
S0519	oh oh oh oh oh
S0521	in i be sort of it's an enormous you've be there haven't you frankfurt be that where you come from last time
S0520	er yes yes yes yes
S0521	enormous airport and i wander about a mile to find the the business lounge and then go into the business lounge oh no computer
S0520	oh dad
S0519	he his computer
S0521	and
S0520	panic
S0521	and it be a complete panic erm of course it wasn't there it have be pick up
S0520	oh gosh
S0521	and it be in the lose property office which be about four miles away on the escalators and the time be tick away and i basically have to wait while he get on his tractor and go to fetch the computer from somewhere else
S0520	oh dad
S0521	and it be about five second to spare to get on the plane
S0520	oh god actually do a funny thing totally unlike him in frankfurt last time
S0521	do he
S0520	he leave his passport and ticket in the trolley
S0521	oh oh
S0520	and walk off and i mean he's never do that before he's not like you know it's not like a regular event like it be for me
S0521	mm
S0520	and erm you know that's a panic moment right there er go to lufthansa and they some nice person have just hand it in to them
S0521	yeah
S0520	very lucky i mean you would if you find a passport you'd go and give it to someone wouldn't you but you know he just send me a text message like slightly panicky moment leave my passport on the trolley
S0521	yeah
S0519	mm
S0520	i'm completely erm panic panic in airports with those things
S0519	i be
S0520	cos they're just it's you've get so many things with you
S0521	yeah
S0520	and like i always have the head cushion and a blanket my bag be like stuff and there's computers and things and i'm not good at put the passport in the same place all the time
S0521	yeah no that's right you've get to have everything in hand haven't you
S0520	the thing be you have to keep pull it out all the time
S0521	yeah
S0520	show it to people you know and the board pass and show it to these people show it to those people get duty free
S0519	you've not go to have too much in the bag have you cos you can't get at it
S0520	now i'm bring this trolley so i've put a few clothe in it the head cushion thing you know the and then i'll just put my lap my laptop bag inside it inside the trolley and i hope it's not too
S0521	there be another occasion
S0520	big the trolley for hand luggage
S0519	the wheely thing
S0520	yeah i have to ask your opinion
S0519	mm
S0521	there be another occasion when i be on a flight to oman and i be all last minute and i be erm make view graph for a presentation the follow day and the computer go flat
S0520	mm
S0521	so erm
S0519	it be a black you know it be a black screen jobby wasn't it it wasn't just battery go
S0521	well no it it be battery and then and then i say have you get any
