S0521	volkswagen td whatever
S0519	oh you
S0520	oh you could
S0519	it be a very sweet little van we get
S0520	it's always funny when you have a new car and you don't know where the bits be some of them have things inside that you
S0519	that you tweak yeah
S0520	open the outside on
S0521	mm yeah
S0519	yeah that's right
S0520	yeah
S0521	i find a switch inside it open the bonnet
S0521	i saw the girl look at me from the
S0520	yeah no you start to feel a bite self conscious don't you
S0521	inside the er the the
S0520	i couldn't on the bike in thailand i couldn't work out how to turn off the indicator
S0520	cos there's like a switch that you click
S0519	mm
S0520	to the right to turn it the right indicator on and vice versa and then how do you turn it off you think you just flick it back to the middle but it doesn't it just go right indicator leave indicator right indicator you know like and er then you're drive along with indicators on which isn't ideal so eventually i figure out you have to press it as a like press it as a button
S0521	ah
S0519	ah
S0520	to turn it off yeah it take me age it's the kind of thing you don't want to stop and ask someone just you feel like a bite of a knob
S0520	oh
S0519	er so that's a bite odd isn't it you have to open the passenger door
S0521	i think it lock doesn't it it it say on the cap it's a lock cap
S0519	so but what be happen so i dad and i meet at in a a mark and spencer's sort of petrol station
S0520	mm
S0519	er and buy a toasty and a coffee and i get in his passenger side and it so i i didn't have a lot of room so i be kind of squeeze out and every time i squeeze out i open the petrol cap and so every time i go to close the door it wouldn't close cos the petrol cap wasn't in
S0521	ah
S0520	mm
S0519	erm so i'd realise but it's a bite daft cos if you're the only driver then you have to go round open the passenger door
S0520	yeah
S0519	to open the petrol cap it's a bite weird isn't it
S0520	very weird these germans you expect more from them
S0519	i be listen be you listen
S0521	it a volkswagen diesel as well
S0520	i saw that it be a volkswagen
S0521	pollute the country
S0520	yeah
S0519	be you listen to the volkswagen programme
S0520	guilty
S0521	yes
S0519	i be think you would be
S0520	on radio four
S0519	it be interest
S0521	it be interest wasn't it
S0519	they be say that volkswagen really be quite a corrupt company really be what they be say weren't they
S0521	yeah
S0519	erm or not corrupt but that it be
S0521	it be a family business
S0519	the it be a family business and you need a board that that would question what be happen so
S0520	i see yeah
S0519	they all they be all say you know what do you think happen and they say they all the panel all agree they be all experts that erm everybody on the board would need to just ask the question so you have somehow very cheaply manage to make the engines do this
S0521	much less emissions
S0519	much less emissions how do you do it
S0521	yeah
S0519	erm and they didn't ask that question
S0521	evidently wasn't ask
S0520	oh i see because everyone's on the inside type of thing
S0519	erm yeah exactly so everybody just say oh great they've do it cheaply let's just go with that
S0520	i'd be surprise if you investigate any company that you wouldn't find all sort of things go on
S0519	yeah
S0520	i mean i don't
S0519	i i like what these people be say they be say the the the roll of the board be to keep a check that the check and balance of you know balance out make the profit against run ethically and all of those things
S0520	ethical things yeah
S0519	erm and that be all the board so they all just basically say you know where do the buck lie they still didn't really get to who do it so who decide
S0521	who's responsible well yeah they say that that the board be responsible
S0519	er but every engineer in the in the company
S0521	must have know
S0519	have to know
S0521	yeah
S0519	that you're you've put a part in that do this thing you know maybe the people actually fit the part don't know it but all of the engineer know
S0520	mm
S0519	so it's er it's dire but they seem to also say which i think be really interest and quite good that they didn't actually think that any other company be do it that they be all you know
S0521	yes bmw be fine
S0519	cheat on their emissions slightly and that there be gonna be big repercussions for diesel cars but erm nobody be actually in this terrible situation of just lie
S0519	cheat basically
S0520	cheat the system yeah
S0519	so the the thing be er erm they be set this task to meet the emissions level that the americans want and all of the other car manufacturers come up with engineer solutions that cost a lot of money and therefore their cars be dearer the performance wasn't quite a good and other factor come in but they meet the criteria
S0520	mm mm
S0519	whereas they just cheat and so they be really popular cos everybody think well you can get this cheap
S0520	affordable yeah
S0519	affordable clean system
S0519	oh oh oh oh
S0520	it's damage isn't it for the brand the whole thing
S0519	terrible
S0521	damage for the make in germany brand
S0520	agree agree yeah
S0521	there be a german on the panel wasn't it
S0520	it sort of make you reflect doesn't it
S0519	yeah there be a german on the panel
S0521	that's what he say it's damage for the make in germany brand
S0519	mm
S0520	mm i agree with that put the whole thing in question a bite
S0519	erm
S0521	be you alright my lovey
S0519	have we get another box of tissue
S0520	both of you be a disaster
S0521	well it be wasn't it
S0519	well it
S0521	he he be in a chronic state
S0520	yeah he tell me on the phone
S0519	he
S0521	yeah
S0520	erm do you want me to get tissue for you
S0519	we have a box i i don't know what i've do with it
S0520	i can get you bog roll
S0519	bog roll
S0520	oh here it be
S0519	thank you darling
S0520	these ones be softer on the nostrils area
S0519	oh dear
S0521	i'm homeward bind
S0519	but it wasn't really 's fault cos i be already sneeze the day after him
S0521	well he give it to us
S0519	i can't have
S0521	i'm not ascribe fault but he certainly give it to us
S0520	he be the first one to get it he say as well yeah
S0519	mm
S0520	well it's the time of year isn't it for erm
S0519	but you he wake up he say i've get flu
S0520	yeah he do describe it as the flu so i be expect you guy to come in like shiver and
S0519	no we've get colds
S0520	well not it's not cool be it but it's not the flu be when you're properly out
S0519	no but whereas with it go straight to his chest
S0520	for the count
S0519	and he's you know he's really wheeze
S0520	oh he'll be cough all winter yeah
S0519	it's an awful thing
S0520	that'll happen
S0519	but he do make me laugh cos he do take it all very much to heart
S0519	erm so he wasn't sure he'd be well enough blah blah for the party
S0520	do you get reduce fat cookies
S0519	oh please
S0520	what be you do that for
S0519	tell me i didn't
S0520	i mean
S0519	i didn't know i just buy them
S0520	it's a disaster
S0521	be they reduce fat
S0520	they're reduce fat all butter reduce fat
S0521	reduce fat cookies
S0519	how do you do that
S0520	which seem to be a contradiction in term i'll have to eat one anyway
S0521	there's probably an app in the make process
S0519	you'd better test them
S0521	an app to reduce the fat when it's be test
S0519	so he manage the party and you know be chat enjoy himself in chat with everybody all even you know have a few glass but didn't overdo it in his term and erm
S0519	and then you know maybe about eleven he sort of say oh i think i'll have to go to bed now so you know that's unusual for him but it wasn't like nine o'clock or eight o'clock where he's hardly have any fun at all so he go to bed a little bite early and then er he get up the next day and he he say i be go to go to a erm
S0520	to the a and e
S0519	to a and e i say you can't go to a and e when you've be up party and swig beer
S0521	a and e with a hangover
S0519	and chat
S0520	a and e with a cold cold and a hangover
S0519	to everybody and then you just go oh you know what i think i'll go to a and e now erm
S0519	it's ridiculous oh dear dear
S0520	mm man flu
S0519	man flu man a and e
S0520	these be not very tasty
S0519	oh how annoy they be buy specially for you
S0520	thank you
S0519	i be like quickly buy potatoes bean what can i see oh look belgian chocolate chunk
S0520	on the other hand those ones we buy last time in mark and spark erm that i have in my pack lunch they be like erm short not shortbread all butter cookies with toffee and pecan or something
S0521	all butter cookies
S0519	yeah they be
S0520	be so good do you not like them that much
S0519	no i do
S0520	i be like wow
S0519	i don't think i get many dad pretend he doesn't like biscuits
S0520	dad have it all
S0519	but
S0520	well you pack some for me on the train
S0519	be that a nice little lunch
S0520	yeah it be cool it be really fun actually that train journey because it be
S0519	oh do everything go okay you didn't get accost
S0520	nobody check my ticket so that be a relief
S0519	we love those people
S0520	and erm i change in and it be er direct from to and it be all really easy and painless and erm comfortable
S0519	i've do that journey a few time
S0520	have you
S0519	mm
S0520	no way
S0519	when i be do my choir from thing i do i do that loop the loop journey erm
S0520	well it's really slow till like and after that it's all fine
S0519	and then it's pretty damn speedy isn't it and
S0520	it be good
S0519	and quite quite nice you know i'd have a table seat and
S0520	yeah that's what i do
S0519	i do something
S0520	work
S0519	mm
S0520	and erm yeah and productive quite productive and it be completely full when i get on cos people commute from the intermediate station you know to
S0519	mm mm yes yes
S0520	so all of those people be go home so i didn't have a seat at the begin but after one or two stop it be all fine
S0519	oh
S0521	so the er
S0520	even travel to as a as a work
S0521	yeah you don't surprise me
S0520	thing as well
S0521	so the car hire guy send a whole series of instructions you need to register with the dvlc and get a code so that they could access your drive license detail
S0520	mm
S0521	and you have to produce independent evidence of identity
S0520	crikey
S0521	so i go with all of this this morning didn't want any of it
S0519	he just give you the key
S0521	give him my drive license there you be key
S0520	mm
S0521	didn't
S0520	so they're come here tomorrow to pick the car up
S0521	oh yeah we're we phone them specially to
S0520	mm
S0521	cos we didn't fancy get up at seven o'clock to get to
S0520	oh god
S0519	i have to say that we realise it be the same company that i have use when we first move here
S0520	oh funny
S0519	and by complete fluke and coincidence and they have i have choose them because they would pick the car up and funnily enough i i say to you and you remember it happen it be a weekend and i be really worry cos they didn't pick it up the next they say leave it outside the front and leave the key in and we'll just come and pick it up
S0520	leave the key in
S0519	yeah
S0520	be you serious
S0519	and erm it wasn't go the next day and you only pay for the twenty four hours
S0520	mm
S0519	so i be like oh dear something's go wrong we're go to be charge
S0520	they'll charge me mm
S0519	erm and er no they didn't come the whole weekend they come on the sunday even or something
S0521	didn't need
S0519	i suppose they just didn't need it and they just pick it up whenever
S0521	cost twenty pound twenty pound for them to collect it
S0519	oh imagine
S0520	hundred percent worth it
S0519	hundred percent i'd give them heap of money to collect it tomorrow so we don't have to
S0521	well it's sort of thirty miles that's sixty miles
S0520	yeah the petrol be
S0519	and two people
S0521	and we need two cars
S0519	they need two people to come
S0521	no i'm i'm say that
S0520	no i'm say if you go
S0521	it would have cost us
S0519	oh god yeah
S0521	it would have cost us two cars and a lot of time
S0520	yeah and an early morning which be exactly what you don't need
S0521	well i can't just leave it with the key in
S0519	no not unless you be tell to
S0521	how come you've get all snuffley you you say you be better after a day
S0519	i know it come back
S0521	you be all be brave
S0520	have you take vitamin c
S0519	be there any vitamin c
S0520	in wine no
S0519	i've be take some of that
S0520	you've get to take the er million a thousand milligrams vitamin cs when you get a cold as soon as you have the first symptom
S0519	you have to whap it oh
S0520	yeah take load of it i'm not sure if it work or not
S0519	no but it's worth a try
S0521	sound like a bite of old wive to me
S0520	no it's not old wive i mean it's
S0519	it's new age
S0520	it's not new age either everyone take vitamin c and echinacea when they have a cold
S0521	everyone
S0519	even he do too
S0520	if you go into boot in the winter there's like a whole aisle dedicate to vitamin c pills
S0519	there be
S0520	so not i don't think it's old wive i think there's some scientific evidence
S0519	it's no there's some
S0521	sound like old wive to me
S0520	boost your immune system
S0519	i just can't stop
S0520	that's grim so what about
S0521	yes bite of a trial really
S0520	yeah sound like a mission
S0521	the whole episode
S0520	you've do it now
S0521	first morning we be think we be go to have to leave half the house the guy send a text message
S0519	oh i didn't tell this
S0521	from main office say we will collect only the follow items
S0519	everything that be on 's list that's all that they be suppose to collect
S0521	everything else will be leave behind
S0520	oh god see they should have make that more clear shouldn't they
S0519	i say what sort of removals company get list from a family home and doesn't question that you haven't put any ornament or picture on it
S0520	yeah exactly
S0519	and doesn't just say do you have ornament and picture
S0520	yeah they should have i mean it's their responsibility as well isn't it mm
S0521	anyway not to worry
S0520	panic yeah it's all fine isn't it
S0519	we panic and they he be in a meet for an hour and a half so we have to wait to ring him up and then we ring him up and he say he just say oh it's fine as long as it go on the van it'll be fine
S0521	which it didn't
S0519	but it didn't and he hadn't send any erm equipment to wrap picture they have special bag or them
S0520	yeah
S0521	the first thing be the er do mum tell you the lorry couldn't get up the drive
S0520	i know that's awful
S0521	so the first thing he do we just saw them try back in and there be crunch go on and they
S0519	and wreck all the
S0521	wreck the board at the front of the house
S0521	and there's nothing surer than the new
S0520	bless you
S0519	sorry
S0521	owner will object so then he say i can't get the lorry up the up the drive we'll have to park it at the top
S0520	oh no
S0521	and then it be torrential rain for the whole day and they be trudge up and down
S0519	two days rain wasn't it
S0521	furniture in the rain so it be very
S0520	that's a disaster
S0521	very er fraught
S0520	it's just a fraught thing overall isn't it move there's a lot of stress
S0519	it's a bite stressful it's always stressful
S0520	yeah
S0521	move house
S0520	ooh bless you mum
S0521	oh my goodness what's go on here
S0519	sorry
S0520	oh mum
S0521	be it the wine
S0520	you need to the wine
S0519	i'm allergic to wine
S0520	you need to have erm some
S0521	a thousand milligrams of vitamin c
S0520	lemon also
S0521	i'd like you to google it it sound bite old wivey to me
S0520	oh dad
S0521	be you sure
S0520	i think it's a question of
S0519	i've be like this all the time in the car what's go on
S0520	you need to have tea instead of wine mum
S0521	we have be walk around in the rain all day that's not good for colds either
S0520	yeah that's true print my plane ticket
S0521	so be you off tomorrow
S0520	i'm off tomorrow
S0521	oh oh be you fly tomorrow
S0520	just to add to the things to do yes i'm fly at nine thirty pm
S0521	from
S0520	from
S0520	really oddly
S0519	as long as there aren't any hajj followers
S0521	you'll be join the
S0519	amble about you'll be alright
S0520	there's probably a few hajj people go from birmingham yeah erm it will be me and the er birmingham indian community
S0519	it will
S0521	birmingham indian pakistanis
S0520	they have really birmingham accent that's what's really funny
S0519	i know sort of
S0521	do you do you hear the pakistani guy on the comedy tonight
S0519	i do i couldn't be bother with it
S0521	it be very bore really wasn't it
S0519	i turn it off yeah i turn it off till he be over
S0521	yeah
S0520	what be he say
S0521	sammy
S0520	google chrome have stop work why why do you stop work why
S0520	you don't really need you ticket these days in an airport it's just for the sake of just feel more secure
S0519	i
S0520	so have you have you clear it with about tomorrow be that a
S0519	i don't know i haven't look at my phone for a while
S0520	i would check just in case you have to go at ten
S0519	she's not go to make me go at ten
S0520	she might do
S0519	mm
S0520	just
S0521	deary me what to do
S0520	it doesn't really look like a ticket that it's just kind of
S0519	i've put the tp link in somewhere i haven't the smallest idea what
S0521	which er which consignment be that then
S0519	well
S0521	be that go to edinburgh or macclesfield or
S0520	erm
S0519	it's go into the so originally we have a pile which be the stuff we actually intend to bring here
S0521	i think there be a bird behind me
S0520	yeah it's weird isn't it i'd be sit there and you know forget that i'm gonna that i've print like and suddenly and you think what's
S0521	sorry my love what be you say
S0519	erm i don't know i don't think it be very interest
S0520	occasionally and in a weird way the bbc news twenty four theme tune come start play out of something over there
S0519	come
S0521	yes that's right yeah
S0520	what be it
S0519	erm it's dad he have alert
S0520	dup dup dup
S0519	he have bbc alert
S0521	bbc alert switch on
S0519	and they they come in at all hours you know something be break news
S0520	that's funny well the first time i be like woah what's happen
S0519	the bbc be turn into a
S0520	the bbc have land
S0519	big brother
S0521	there's a funny another funny thing i have wasn't it where it suddenly start talk never quite work out what that be
S0519	what be that
S0521	you know we have i have the erm what's it call the voice
S0519	siri
S0521	siri siri switch itself on sometimes i didn't quite get that what do you say
S0520	oh i see bite weird
S0519	i be have a funny day where i be put everything that that be on the floor go into my pocket
S0520	you need a little bin next to you there mum for the tissue
S0521	your mother's be in hyper mode for about a week
S0519	oh
S0520	yeah i can imagine hyper mode
S0519	i couldn't sleep you know what it's just there be nothing to worry about but i just wake up at three like ping and can't go back to sleep and i'm not even worry
S0521	now how about
S0519	i'm just think
S0521	how about this one we phone up your mother phone's up the estate agent and she's tell her what be the latest news about the house not the other way round
S0520	no they're a bite rubbish those people aren't they
S0519	and she get back to me two days later
S0519	i've already find everything out from somebody else
S0521	we believe they might still be buy the house
S0520	pickford's how reassure pickford's phone today as well
S0521	pickford's
S0520	do i not tell you yeah pickford's oh yeah want a quote on your removal but it's already be and go
S0521	i ignore i ignore them cos they be so poor so slow i just ignore the mail after that
S0520	mm they just want to take you off their list so i say yeah do that
S0519	aye
S0520	yeah they be really slow that's bad isn't it
S0521	yeah what be it any any van
S0519	any van
S0521	any van that be a complete disaster weren't they any van be you there when i be do that
S0520	what yeah the van thing
S0521	yeah
S0520	mm
S0521	you have to commit yourself to thousands of pound before you know who it be that be go to do it
S0520	oh yeah yeah yeah yeah
S0521	the most ridiculous idea i've ever hear of
S0520	yeah it's a bite silly isn't it well it must work
S0519	be you be you go to start sneeze and snuffle
S0520	don't give me anything
S0519	you be cough in the night
S0521	i've be cough yeah
S0519	it be wake me up
S0520	yeah
S0521	i of cough yeah
S0520	mm to
S0519	b h x
S0520	international
S0519	mm
S0520	hotspot of the north
S0519	pakistani blah
S0520	erm leave tomorrow i
S0519	to
S0520	i want you to oversee my pack
S0519	oh
S0520	but it's too late now i just follow your example
S0519	oh good girl
S0520	i've get quite a lot of stuff i've get i've i'm go to take one of the small trolleys if that's okay
S0519	yes and erm
S0520	cos i can take that as hand luggage i can actually take two bag of twenty three kilos on the flight but it just any onward flight won't have the same generosity
S0519	that's the trouble
S0519	that's i've
S0520	so what i can take twenty three kilos to india and just leave it there but it's not a good place to store things
S0519	no i do this whole ludicrous things go to spain
S0520	mm
S0519	that we go with jet two and we come back with ryanair
S0520	yeah it's a mistake
S0519	it be all in a package but
S0520	yeah
S0521	yeah that's true yeah
S0519	but erm jet two have one load of nice
S0521	one set of rule
S0520	oh no jet two give you a free bag and ryanair
S0519	exactly
S0520	mm
S0519	erm and you go oh jolly nice and then you realise you've get to come back with ryanair and you've get no chance
S0521	pay for everything with ryanair
S0519	and so i we'd do everything we could to sort of squash everything into the two bag and they have a strict no hand luggage no
S0521	oh gosh yeah yeah
S0520	yeah they have a strict everything
S0519	nothing in your hand not even a handbag
S0521	i remember there be some rage
S0519	and i be go mad at you
S0521	you be go mad at me cos i what do i do put something in the
S0519	you have cameras and everything all over the place
S0519	and erm anyway we finally manage to get it into two bag and a oh no wouldn't he refuse point blank to put his camera in so we arrive and i say okay erm we'll see how we go and erm walk up to the nice little man at the thingy and he say oh would you like to have our free check it in service today erm cos we've get a full cabin we we're check in everybody's bag for free
S0520	oh jols that doesn't happen ever
S0519	and we be like yes i'd spend the entire morning fret about whether you be go to let me on the plane
S0521	as you do
S0520	you weren't fret be you mum
S0521	lot of fret go on
S0520	can't imagine you fret
S0521	have you never see that before
S0520	never see that before
S0519	oh
S0520	fourteen forty five from
S0519	yeah
S0520	change at
S0519	yeah
S0520	some of them be direct but they're not really ideally time arrive at international at eighteen nineteen my flight's at nine thirty i think i'm go to do that one
S0519	sound good
S0520	cos the next one be an hour later and then it's nineteen nineteen and if it's delay
S0519	oh no yeah
S0520	then i'm cut it fine i mean be probably like one flight a day but
S0519	it's great that it's
S0520	i'd rather be there
S0519	yeah
S0520	to be honest and just be like have a coffee or something
S0519	and it's it's dinner time so you could have a little
S0520	have dinner yeah exactly
S0519	something couldn't you find somewhere nice to eat there's a pret
S0520	i do have you be there no you be at leeds bradford mum it's different
S0519	no i be at
S0520	oh you've do both
S0521	you know come on
S0519	there's a pret in
S0520	i've never be to airport before
S0519	there's a pret it's
S0520	i like pret and erm usually these small airports be quite fine they
S0519	it just have a nice big concourse with everything around
S0520	have a boot or whatever
S0519	and you just sit in the one little place
S0520	mm
S0519	and that's it but
S0520	yeah that's nice
S0519	and there's just little corridors off
S0520	i can't be deal with where do i fly there's two place i don't like airports
S0521	only two
S0520	there's a few airports i don't like
S0519	houston's gotta rate right
S0520	heathrow
S0519	oh yeah
S0521	heathrow be horrible
S0520	be a nightmare
S0521	yeah
S0520	erm i be there like on a stopover of some kind and i just be like get me out of here it be so busy and it be like this massive hall
S0521	yeah it's very stressful isn't it
S0520	with like so many things go on
S0521	yeah yeah
S0520	and nowhere to really have a quiet moment i just really and you have to take a bus for like fifteen minutes to get to your gate
S0521	and you know they have this and they have they have this really cool system where they put your bag down and it's like a little railway and then it go along and then it it there's a fork in the railway and if it go down the wrong side that mean bad news
S0519	you're go to be check
S0521	they're go to make you wait
S0520	yeah
S0521	half an hour
S0520	the security there be horrible
S0521	because they find that you've get a bottle top in your handbag or something
S0520	yeah no exactly they're so over the top with the security
S0521	i it's infuriate
S0519	i've never tell anyone this
S0521	what
S0519	that last time
S0521	be you wag your finger
S0519	i'm wag my finger because i be so cross i've never ever know anything like it deliberately put his
S0521	i leave my iphone in the
S0519	erm ipad and computer in the bag and didn't take it out how long have he be travel he know
S0520	oh dad you've get to take the ipad out
S0519	and he just say oh they stop you anyway and they don't
S0521	er actually in fact truth be tell
S0520	truth be tell
S0521	er i have get into a habit of do that because the in schiphol they don't care
S0520	yeah well this be the thing in england be the worst for that
S0519	but you you know darn well in they care and more or less everywhere else
