S0198	so next time i'm home i might give you a quick lowdown but then i do it depend what you use your computer for you you don't really use it for much
S0230	no we don't do we
S0198	but for us it's good because when you turn on your computer everything's already there for you to click on so if you click on your mail application 's get both his hotmail and his gmail link to that account so even though he's get two separate email account from different company they're both link under that and they both stay open automatically you click on the facebook app and you're already log in like you're already log in to lot of different things already
S0230	ah
S0198	which save you the whole time of go to the internet and open it it you can save document on there and stuff stuff it's it's just there it's just faster they call it your start screen because before you use to go to start in the bottom leave corner didn't you
S0230	yeah
S0198	and that bring up everything well now you don't have to do that that be what be on your screen
S0230	oh
S0198	that's the whole idea of it that be your start bar
S0230	oh
S0198	so once you get kind of over that and you get use to how you have to click and drag things around the screen that's not that bad at all he seem quite happy with it so
S0230	good
S0198	yeah i mean
S0230	what do he pay for that one
S0198	three fifty
S0230	oh that's not bad
S0198	on on from amazon yeah it be on sale but yeah so not bad at all i mean it's not i think it feel a bite flimsy as an actual laptop i guess they're get lighter and lighter anyway it's lenovo it's a chinese company
S0230	oh
S0198	and er some people love it and some people like buy the products and it doesn't work
S0198	so it's a bite hit and miss but overall they get good review
S0230	ah
S0198	as good as any other company and for that price it's gonna do what we need it to do for the next couple of years so can't really grumble erm but yeah it's definitely yeah it's fine three fifty can't complain but really it's i mean we call it our laptop or do but i mean really it's his laptop
S0198	he get he want to show me it show me everything and i just don't find it very excite
S0198	he's tell me to stop unpack when we first move in he be like let me show you this like just sit down for two minutes and let me do this let me show you i don't really care the printer come something else he's order ah i don't find it that interest
S0230	ah boys and their toy
S0198	yeah basically he still get excite about things like that organise stuff on the calendar
S0230	there's a there's a word now for erm the antique that men go for
S0198	oh be there
S0230	mantiques
S0198	mantiques
S0198	what be mantiques then
S0229	that be
S0230	all things like i suppose er gun and i dunno really cars you know
S0198	mm
S0230	model
S0198	antique
S0230	vintage model i dunno
S0198	mm
S0198	i'll have to google that one can i have some water please
S0230	but they've they've use it on erm bargain hunt before
S0198	yeah i'm sure they have bargain hunt's gotta find ways of become more and more entertain the same formula all the time do you still watch it dad all your antique show
S0229	well yeah but it it's like go to boot fair more or less the same you know what i mean it's all
S0230	fancy notice my hair
S0198	i know he's really good at things like that it's yeah i mean it's a safe bet with women if you haven't see them for a while comment on their hair and they've probably change it
S0198	i feel that's what i dunno er he do notice people's hair around them
S0198	always before i do unless it's something dramatic
S0229	what a crappy way to come jesus
S0198	ah yeah it's start to rain now er god what's the time
S0229	hours to get there
S0230	they're still say twelve thirty three on here
S0229	be it
S0230	mm
S0198	oh right so that's the oh yeah of course it be ah so it must know how slow the roads be then how slow the traffic be go at the moment
S0229	well it update itself doesn't it
S0198	yeah handy little things aren't they really
S0230	mm
S0198	oh we use to just read map before though people manage didn't they
S0230	yeah
S0229	oh yeah
S0198	it's not
S0229	on the other old satnav it would tell you how many miles you have to go but it never give you the time do it
S0230	no
S0198	be this not a
S0229	this give you the time but not the mileage
S0198	be this your second satnav then
S0229	yeah
S0230	yeah this one's
S0229	this be the new one
S0230	i get this one for cos for europe as well you see
S0198	oh
S0230	whereas the other one wasn't
S0229	for over here but we go anywhere with that one
S0198	good so you'll be fine in belgium
S0230	hopefully
S0229	hopefully
S0198	get off at
S0229	yeah
S0198	i mean can you have you try look into europe on it
S0229	no
S0230	no what on the satnav
S0198	yeah well
S0230	we'll have to won't we we'll have to
S0198	i don't know how to
S0229	well be down here why's he
S0230	why's he come over
S0229	i don't know why
S0198	there's a dent in the back of his car
S0230	yeah
S0229	that's probably why
S0198	oh that wasn't that be a naughty move to make be it dad
S0229	yes i'm in a naughty mood
S0198	why be these people be we gonna have to get in er er lane at some point
S0229	probably i don't know
S0230	oh yeah
S0229	we'll have to go round the roundabout now
S0230	well cut in
S0229	i will do up here up here i'll get in front of this caravan
S0198	might be a few things cor look at the caravan
S0230	you're not gonna be able to be you here
S0229	yeah
S0198	there be some nice big space back there
S0230	yeah
S0198	yeah why didn't you just do it back there when there be a bloody space
S0229	oh dear oh dear oh dear get in here
S0198	ah you're not the only one though be you dad
S0230	jesus
S0229	don't worry don't stop plenty of room what's up with you
S0198	she's get another one come in from the other side
S0229	you watch this black one you watch this black one pull in he won't give a shit
S0198	oh dear oh dear i do dislike be in cars
S0229	well i tell you what we save an hour's journey there
S0198	do you reckon
S0230	an hour you reckon we save an hour there do you
S0198	do you see an hour come off the satnav time's only go up on it at the minute
S0229	well it would have be a lot longer now if we have a what's her name
S0198	be that why yeah ah it's the a two seven be it
S0229	yeah
S0198	you you could you come down on that part of the a do you come down on that bite
S0229	i don't think so
S0198	when you come from to i don't recognize the a two seven
S0230	no
S0229	you can go
S0198	what a three seven erm not even in yet be we
S0229	no
S0198	dear oh dear what be talk of
S0229	i'm wonder if we could have go straight on and then go round the roundabout you know what i mean
S0198	yeah
S0230	well suppose there ain't another roundabout you go straight on
S0198	yeah what can't just guess these things dad
S0229	we'd have go to erm
S0229	or
S0230	that's where grandad work when they live at
S0198	oh right sound like a medieval name
S0230	it's get a castle
S0198	oh it do
S0230	mm
S0198	when they work at be that when
S0230	well they live at
S0198	when they live at do you live at
S0230	no
S0198	oh it be before you be bear
S0230	no they move to from
S0198	oh ah
S0230	and they be they be only there a year again and then they move to from
S0198	ah couldn't just go straight down there could they
S0230	no
S0198	have to keep to stop one more place and then they finally move to
S0230	yeah
S0198	how old be once she once they move to
S0230	erm eleven
S0198	so she once she go to secondary school she be settle sort of thing
S0230	yeah
S0198	she be at that age kind of like the rest of you then you all go to lot of middle school didn't you dad why be you have to break so hard
S0230	because he keep accelerate
S0198	stop it make me feel sick when that
S0230	do me as well
S0198	i'll have to eat all your mint
S0230	no i mean i be lucky that i only go to one secondary school but and never
S0198	oh because you'd be move around yeah
S0230	yeah cos they be older than me and especially
S0198	yeah i can imagine i bet go to a lot didn't she
S0230	yeah
S0198	never really settle down in any of them do she like any of them do she make friends or get along well with any of them
S0230	well when we when we move to she would have be i think about thirteen
S0198	isn't that where you be bear
S0230	no i be bear in
S0198	oh yeah
S0230	still
S0198	yeah
S0230	when we move to be about thirteen fourteen something no thirteen i think it be
S0198	mm
S0230	and she have a real hard time at the secondary school she go to
S0198	ah
S0230	they be horrible to her
S0198	ah
S0230	it take her a long long time to settle and she be very unhappy
S0198	ah
S0229	now you fuck wait a minute let you out i've sit there long enough
S0230	oh so
S0198	poor
S0230	so when couple of years later when we be gonna move to
S0198	yeah she
S0230	she be fifteen and she have cos you could leave school at fifteen still then
S0198	mm
S0230	she have we move just before christmas and the follow summer be when she could leave school
S0198	mm
S0230	july and there be no way she be gonna change school again for the last few months
S0198	no
S0230	she be absolutely determine and she really stand up for herself that time and say she weren't gonna do it so she use to get the ferry from to and then the bus from to
S0198	oh my goodness how long do that take
S0230	i don't know
S0198	every morning
S0230	yeah and back again of an even
S0198	cor bloody hell imagine do that now jesus i wonder how long that take
S0230	but of course then when she leave school she didn't know anybody in
S0198	yeah
S0229	fuck hell
S0230	eh
S0229	nothing dear
S0198	never have any friends or anything
S0230	no no
S0198	ah so she have a hard time really grow up
S0230	yeah
S0198	i guess she's never have too many strong attachments to england then
S0230	no probably not
S0198	more family and friends in italy
S0230	and then she start in her hair apprentiship at a hairdressers at it be just the lady that own it and her
S0198	oh
S0230	cos it be only a small hairdressers so she didn't actually get to meet anybody
S0198	anybody that way either
S0230	either i mean she do make friends eventually but when she be qualify as a hairdresser she move onto a bigger hairdressers and make a couple of good friends and i think she's still in contact with
S0198	contact with them
S0230	yeah
S0198	so i didn't know she be a hairdresser so 's qualify to cut hair can she still cut it alright
S0230	well i dunno
S0198	have she ever do it do she do do she ever do the kid
S0230	no i don't think so
S0198	she could give my hair a trim though surely
S0230	yeah
S0198	a straight line
S0230	yeah i'm sure she could do yours alright she do some of her old people
S0198	yeah she do
S0230	er
S0198	mm and be that what she stay at work until she
S0230	no
S0198	go to italy
S0230	no
S0198	oh no so she wasn't at that one too long then
S0230	no i mean after i don't know a few oh there's castle look
S0198	oh look at that i wonder if that's what drive past the other day he say he go past a castle out this way
S0230	mm
S0198	we didn't know if it be cos we saw the sign for it but he didn't recognise the name
S0230	no it wouldn't be cos 's not on the main main
S0198	set back
S0230	erm
S0198	bet it be er this one then
S0230	yeah
S0198	oh yeah medieval come over the hill just in a car instead of a horse but yeah what do do after that then
S0230	she do waitress and mainly
S0198	oh she do
S0230	yeah and then she er oh she go off to spain for a holiday and didn't come back she get erm i think she get some waitress work out there for a while
S0198	oh do she
S0230	then she come back and live up north somewhere for a while as a like chambermaid or
S0198	oh really
S0230	yeah
S0198	oh she have a bite of a colourful time of it then
S0230	yeah
S0198	i bet she's get a few stories from those days
S0230	yeah i bet
S0198	ah that's good when do she what what point be she at then when she erm so where be it you're go towards london isn't it
S0229	this be the traffic's ridiculous down this way
S0198	not quite like the motorways be it
S0230	no
S0198	better off go back up to the motorway
S0230	well i don't think you probably be cos you come a long way off the motorway
S0198	motorway yeah so at what point do she meet
S0230	er sometime obviously she come back to the pub and that's when she meet him he be work he be work in as a waiter and they meet at a nightclub
S0198	oh right oh god i can't imagine him work in a nightclub everyone be a bite younger then i suppose
S0230	well he weren't work in the nightclub
S0198	oh right he she just meet him in the nightclub
S0230	yeah yeah
S0198	oh
S0198	even fair just picture the that's nice isn't it nice i bet those flats be expensive although you be look at the motorway at the same time
S0230	i say nightclub it be more more of a disco
S0198	i just mean picture them lot young basically
S0198	young italian ah so she travel a little bite then get the taste of something more
S0230	yeah
S0198	foreign i'll have to ask her about it the next time i see her dish the dirt young escapades and then obviously she move to italy she get pregnant first i assume
S0230	no
S0198	oh didn't she
S0230	no
S0198	but they weren't but she be pregnant when she be marry though wasn't she
S0230	yeah but they didn't get marry until she'd be out there about crikey 's the same age as
S0198	yeah
S0230	so yeah they'd be out there about four four years
S0198	oh have she
S0230	yeah
S0198	oh god
S0230	before she get pregnant and then have get marry and have
S0198	ah so she be just live out there for that time
S0230	yeah yeah
S0198	try to learn the language
S0230	and she be a er erm
S0198	au pair
S0230	yeah
S0198	that make sense doesn't it
S0230	yeah
S0198	yeah that's a good thing to be i have a friend that's do that recently and in sardinia of all place
S0230	oh
S0198	quite oh no it wasn't sardinia they live in no i take that back they live on the mainland but they take her on holiday to sardinia that be it they be quite rich people they rent she get her own flat from them and they rent her own private accommodation and she just have to be there during certain hours and they take her on family holiday and stay in five star hotels and all of this kind of thing
S0230	oh
S0198	say they be really nice she love it but she just doesn't earn very much money from it but a nice way of get to experience the life out there
S0230	yeah
S0198	but yeah make sense that be an au pair
S0230	and through one of the the last au pair woman she work for
S0198	yeah
S0230	it be through her i think that she get the job then in the embassy
S0198	oh she work in the embassy
S0230	er the erm embassy
S0198	oh what do she do there then i didn't know that she work in an embassy
S0230	yeah like secretarial work
S0198	ah
S0230	yeah
S0198	ah that work out then
S0229	day there
S0198	just cos she be an english speaker i suppose and it be
S0230	well she be bilingual by then anyway
S0198	oh she be oh so she be learn she learn spanish er italian before she have any children
S0230	yeah
S0198	ah so i always think how difficult it must be to go through the whole have a child thing and still try to learn the language
S0230	good lord i didn't think these these they never forecast this
S0198	this rain
S0230	might have some light shower they say
S0198	yeah today be mean to be alright wasn't it what about tomorrow i haven't even look at the weather forecast
S0230	well tomorrow's suppose to be alright i hope so i haven't even bring a coat with me
S0229	do you
S0198	umbrella
S0230	no
S0198	haven't even bring an umbrella
S0230	no
S0198	have to borrow one of 's i'm sure she's get some cor you really can't see can you when the rain start come in change lanes dad in this kind of weather
S0229	go now
S0198	yeah he call that annoy me he call me on wednesday and numerous time
S0230	do you
S0198	yap like your mother er but it go alright move stuff in didn't it dad
S0229	yeah
S0198	be the guider definitely
S0229	clear it
S0198	get a thing to do that have you yeah i'm glad come down cos that stairway i don't know if i point i didn't really point it out to you but it's ever so narrow come up the stairs
S0230	yeah stairs
S0229	couple of cars there
S0198	yeah so i don't think there's any way that would be able to er and his dad would be able to get that double double the double bed isn't go up those stairs
S0230	but doesn't it come apart
S0198	apparently it can't like they've put it together in such a way that they don't think it would be take apart certainly not very easily so it just basically sound like no one want to try take it apart
S0230	oh
S0198	i don't know anyway it's fine but yeah them just get the er futon up be a mission cor
