S0086	you man up
S0041	yep
S0086	that's harsh man
S0041	or
S0086	what do say
S0041	hence why i look like shit this morning cos i spend the night and this morning just cry like a girl
S0086	ah mate well you do look really em really away with the fairies this morning but i i have to go to mum so i have to leave i be worry about you
S0041	i say to i say i know it sound stupid but i'm sick of have shit throw at me every single time whether it's crazy or ill dad or stupid divorce or her steal my save or have to move job just i'm sick to death of it and then in the last minute you think well actually the whole point of this be in my control hit by a fuck bus like what be the luck of that what be the luck of that
S0086	mm you think you'd be due a break now wouldn't you really after all that shit once you've actually find something that you think now this be my career this be what i want to be do
S0041	yeah
S0086	oh mate well suppose the only thing you can do be take it day by day at this point
S0041	mm
S0086	go to the doctor tomorrow get the scan take a view on it be you just go to go to work in the morning or be you go to take the day off
S0041	i'm go to go to work in the morning because if i take the day off they won't pay me
S0086	oh yeah
S0041	nice so i'm go to go to work in the morning as soon as i get there i'm go to ring the doctor and i'm go to lie through my back teeth and say oh yeah just me i just need you to write me a letter to say that you're happy for the navy to put me forward for my medical not go to mention anything about need to be mentally fit not go to mention that shit
S0086	need to know information and they do not need to know that
S0041	right and if he say well what about the haematoma i'll say oh no no it's fine i've tell them about it and as long as i go for my scan today and take my scan result to prove that it's just haematoma it's just a bruise really isn't it and the fin the just need to okay for me to say yes i'm happy to put her forward for it and hope that he's daft enough to just do it
S0086	to be honest if he's anything like my gp he'll be like who be you what be you yes fine come and get this letter be like i don't know i don't think he's go to question it cos he sound like he's not really that bother he just be keen to get you out of the doctor's surgery really he wasn't really engage with you
S0041	no so
S0086	yeah well that sound like a plan and then leave work at twelve one
S0041	one yeah i'm just go to say to them if you don't want to do it we're go to have a problem cos i'm go to stab it open and you're go to have to deal with it as emergency so your choice
S0086	yeah the fork actually turn out yeah
S0041	i will literally use the fork
S0086	the fork be actually a viable option who would have think last week the fork would have be a viable option
S0041	yeah just go to do it and i'll tell you what oh my god the solicitor send me a letter
S0086	national accident helpline
S0041	well it's gould solicitors oh my god they're fuck thick as pig shit
S0086	oh no
S0041	she get the statement wrong the time on it twelve pm she write
S0086	good wasn't it be
S0041	yes yes something else be wrong i just think fuck that and rip it up send her an email say fuck off if i can't trust you to write a statement you've get no way of represent me not a clue no way so fuck off
S0086	so be that someone that's appoint by national accident helpline
S0041	yep no way can't trust them
S0086	can you get someone from tezza
S0041	i'm go to barr ellison
S0086	okay fine
S0041	and they have a be tell me they have an office within the hospital so tomorrow when i'm there i'm gonna go straight to barr ellison and do it through them so it's just ridiculous that somebody that you don't know that you know just didn't wasn't think properly can have so much of an impact and be sit here think of you know when you have a problem you always think there be a way round his there be a way i've just get to find it and i be sit think there isn't one there's actually nothing i can do
S0086	at this point this and it's all down to the hand of other people it's just that butterfly effect isn't it like if you have if you'd be on an an eight be shift rather than a ten be shift you know if the bus driver have stop if you'd go a slightly different route you know and all of those things
S0041	if the gp have say keep off your feet
S0086	yeah don't go swim
S0041	do i tell you i've get two haematomas
S0086	yeah oh well i be there when they say leg cos actually there's a mark of the bar isn't there isn't there like a straight line on your leg well that's it's just mad like how it can have such an effect
S0041	yeah just one thing just spiral i be speak to she be like i can't believe this be what you've get to accept i can't believe that that's the option there's get to be a way round it we've try everything her chris and i be all google ways to do it i say do you know what if i know a doctor and i think i know every profession through uni i know lawyers i know opticians i know all sort i know one of everything coders stupid computer people anything i don't know a doctor i don't know a surgeon
S0086	i don't know a do i know a doctor not that i could call up i mean i go on a few date with a guy a two years ago don't think that really count unfortunately
S0041	cos i say to you know they say six weeks if they cut it open say that's bullshit six weeks in a c section cut half your abdomen open
S0086	really
S0041	she say i'm tell you know if they cut that open say two inch three inch we're talk a week if you take the week off work keep your leg up you're talk a week and you'll be good to go
S0086	well yeah cos when i have my knee cut open and it be all like that it probably be about ten days before i could walk on it and that be twenty stitch so yeah
S0041	we're talk six stitch if that
S0086	yeah and that's if they do all of it
S0046	yeah
S0086	it shouldn't be even if they have to scalpel it open say it's like that big they only scalpel off a little bite at the top and squeeze it out wouldn't they
S0041	yeah
S0086	how be they go to get it out be they just go to
S0041	they literally just scoop it out
S0086	scoop what
S0041	okay cos they say they can't needle it because it's congeal what if they can cos there's something really squidgy there's not all of it congeal what if they vacuum it out with a syringe get most of it out my body get rid of the rest because as long as it's not this big heavy mass and all that's need be the pulverise vein in there
S0086	yeah
S0041	that's basically do my body's work for it
S0086	yeah i mean i think they probably just want to get rid of it all or nothing because i suppose you would run the risk then of it a you open it so if you then train it could be in a bite of trouble also it might just fill it with blood again because there's still a pouch so do you speak to about whether he's get em private health insurance
S0041	no he's in shit in the divorce thing i just didn't want to
S0086	be that actually be that this week or be it next week
S0041	mm it's this week
S0086	this come this come week
S0041	they've have it yeah
S0086	they've have it how be it
S0041	she be a douche she didn't even say hi to him
S0086	really
S0041	yeah have the gumption to say let's have half the divorce now and half the divorce when your invitation money come through and she be so badly behave during the hear the judge actually say i think you'll find the compensation be in order because of pain and suffer to one person and quite frankly i don't see any pain of suffer that have come your way the past thirty years so no we won't be do that
S0086	wow
S0041	mm
S0086	she must have really piss him off well they must have just see her for her true colour she's out there for money she's not upset because she think it's her right to have it mean that she do but it's not she's not entitle to that money just because she happen to be marry to him there's no love there it sound like
S0041	no
S0086	she's just out for his money
S0041	and the whole time both only solicitors be suppose to speak and she be write post it note and wittering and whack them in front of the solicitors face and really show herself up and my dad just say the judge be pay him more attention than her completely blank her and my dad didn't say anything
S0086	right
S0041	but just because he must have be so fuck off with the way she be behave and i say well if you think about it she's use to deal with people that aren't as bright as her so the judge have see her a billion time over gold diggers come every week to him
S0086	yeah absolutely
S0041	spot them a mile off
S0086	well he's get to make a judgement call hasn't he on the very small amount of time that he get to spend with the people in front of him and the evidence he's get to make a call on who these people be and as you say he's see that character a hundred time before so ah man well that's that's the start of it though
S0086	so at least my dad's happy
S0041	yeah my dad's quite happy because it's a good judge basically they go away now they've get to answer load of question but mum's get to go and be see a consultant about her life expectancy so in the next hear she's get to prove her life expectancy my dad think it's three years
S0086	oh really
S0041	but we don't know how much of that be lie from her so she's go to have to prove it because if it's three years there's no way they're just go to order a a proportion of his pension because she'll only be able to claim it for three years and then it's go to go back on to the
S0086	into the state yeah
S0041	the state yeah so yeah
S0086	shit three years though that's go to be fuck weird if that's the case
S0041	yeah well her mother my grandma only make it to sixty six and wasn't ill my mum's sixty this year so consider how ill she's be if it's be truthful if she's not be mess on then they reckon it's three years
S0086	it's difficult to know with her isn't it
S0041	difficult to know whether she's lie or not yeah but she'll have to prove it in write now
S0086	mm
S0041	so
S0086	shit hell you're family eh
S0041	fuck nutters aren't they the lot of them
S0086	but the thing be it's for you like there's no sort of relief there's no let up i mean obviously you've get which be quite nice but she's obviously be unwell as well and you don't want to burden her with your problems even though i know she would want you to to go to her because you don't have mum and dad at the moment
S0041	she want me to move back in with her
S0086	do she
S0041	yeah cos i tell her about work and she say you can't you know if this be if this navy thing be go to be next may you can't stay you can't stay live hand to mouth all the time and look after your bank account so i'm go to start apply for new job but she say apply as far as cos i'd rather you just come and live with me she say if you want to go and stay you can go and stay with us you can go and stay with for the weekend and just stay with me during the week
S0086	yeah that's it
S0041	so and yeah i prefer not to do that cos that i prefer to just have my independence but
S0086	well if need must i mean if that's if you really can't stand the job like the thing be with this be that you think there be an end light at the end of the tunnel like you're gear up come the summer that's it i'm go from the hotel it's gonna be good i'm go to start my new career now all that's topple down a little bite not say it's over
S0041	yeah to a whole year from now
S0086	to this time next year yeah and really if you've already be tell yourself it's pokey it's shit now but you know i'm go to out soon to then have to think could i do it for another twelve months and really not just for your own sanity but financially it's not viable
S0041	financially it's impossible yeah
S0086	but that's not to say that there aren't market job or language job out there you know particularly over the summer if you think ah i'll just get a job for the summer you know teach in a language school or something like that i don't see why that would be a problem and then you need to find something from september so just something that's a bite interest
S0041	i mean say be work with her and be bar tend in the bar of the local pub like i wouldn't pay board she say i wouldn't take rent from you because i'll pay the mortgage whether you're there or not she say obviously i'd put something towards food and electricity and that i say yeah but it's not the five hundred pound a month be it she say oh no nowhere near so
S0086	well that would be pretty nice and then at least you can concentrate on get yourself fit
S0041	mm so
S0086	peterborough be quite far
S0041	yeah
S0086	but you know i'll still be here will still be here you know he'll be here you've get place to stay i mean emily have get a spare room hasn't she hasn't she get two bedrooms
S0041	no one bedroom she's get enough space though
S0086	you know there's always go to be people that you can stay with if you come back to visit so that's not a problem i be plan to go to japan on friday night i have it all lay out talk to my friend in the pub on friday and i be just like yeah that's it i'm go to japan but then no but i'm not go to japan because of the i'd forget about the radiation
S0046	can you turn that off
S0041	yeah
S0046	i think you be turn it off
S0041	you'd forget about the radiation
S0086	in tokyo well not in tokyo in japan
S0041	do you mind pour me some please
S0046	no help yourself it's alright ankle leave one
S0086	what have you do
S0041	well yeah i mean it's get this mark on it but it work pretty well
S0046	bloody twist my ankle
S0041	we be play earlier it's such a fun game basically we be in the garden i one person stand here with all the footballs and to get it into the park
S0086	i want to see how my wash get very damage
S0041	one of the lads be stand at the back of the park chase it in because if it be a double team chest in it be double point
S0086	right
S0046	it be like the the orange one be two for a chest in and two for the person who chested it in as well
S0041	for the orange ball it be really really funny it really proper cheer me up lie down the bottom of the garden
S0046	it be like it be hard
S0041	he be like yeah i'm go to lob in a throw from right back here and i be like i can't throw that far i'm just go to stand a little bite there and it fell down the crack in the pavement
S0046	i do first i do the right foot in the gap
S0086	shit
S0041	the crack be like that though it's massive
S0086	yeah yeah yeah
S0046	and then i do the leave foot and that leave foot have do me in it do hurt a little bite now to be fair but
S0086	have you put ice on it
S0041	ice
S0086	mm
S0046	no
S0041	do it do it do it
S0086	you need to put ice on it cos it'll be massive by tomorrow
S0046	i'll be alright i'm a man
S0041	yeah
S0086	no cos you'll need to walk
S0041	yeah no i'm a man as well
S0046	i'll play football and that still
S0086	yeah no i'm a man as well i'm a man as well get ice on it
S0046	you you you put any man to shame
S0086	it's quite a growth you've get go on there
S0041	it's gonna have go by tomorrow though say goodbye
S0086	it'll be go by tomorrow
S0046	it better you'd better come home tomorrow and
S0086	drain
S0041	if they don't do it i'm go to say to them in a and e if you don't do this now watch me sit here and slice it open in front of your face and then you'll have to deal with it as an emergency
S0046	yeah yeah
S0041	i'll do it he's on about the ball toy story
S0086	be it very literal
S0046	well way to go
S0046	oh do it
S0046	it doesn't matter i've get very little leave
S0046	i think i've only get two leave
S0041	i will slice it i'm be deadly serious if i sit in a and e tomorrow and they say no i'm go to cut it there and then
S0086	do it we'll just be in your way
S0041	in fact i might actually take a knife with me i know that sound like crazy people but then they're go to have to do something about it
S0046	well no you'll get nick for that don't do it
S0041	you can't get nick for that
S0086	yeah you can
S0046	it'd be it'd be it'd be my mate that that would be arrest you as well
S0041	for slice your own leg
S0086	no for carry a knife
S0041	oh
S0086	you can be em you can be arrest for carry hairspray if you tell you them that you be use it for self defence becauseyou're carry a conceal weapon
S0041	be you serious
S0086	he use to do self defence
S0046	you can get eight years for knife as well
S0086	self defence class at school they use to tell us carry a rape alarm don't carry hairspray as a weapon because you'll be arrest yourself
S0046	yeah
S0041	yeah i'm not do that fuck shit
S0046	i go past the memorial today
S0086	what memorial
S0046	to the one who get stab to death on off
S0041	it be in the newspaper
S0086	oh shit
S0046	yeah i go past his memorial today
S0086	where where's
S0041	yeah if you go off you're go down towards the grand arcade and instead of go the main road way you turn leave down that backstreet
S0086	oh yeah by the round by the whatever it's call yeah
S0046	something like that yeah
S0041	yeah down there
S0041	yeah so you get to the co op and the leave and then when you come out you're opposite the road that go towards the grand arcade
S0086	oh yeah yeah i'm with you yeah yeah eh no
S0041	yes you're in the right place it's opposite but towards way
S0086	yeah okay and he be stab
S0046	he be stab to death i'm surprise you didn't hear about it it's everywhere
S0041	do you not read it in the paper
S0086	i don't read the paper when be it recently
S0046	two weeks ago
S0086	who be the one that the guy the guy that you die you know who he be and he be stab
S0046	yeah i know him
S0086	that be him
S0041	yeah
S0086	yeah i do know about that but i don't know where it be though
S0046	go pass his memorial do you know there's there's about
S0086	that be three week ago wasn't it
S0046	there's about five hundred quids worth of football shirt on it so and they ain't be touch
S0086	football shirt why football shirt
S0041	what leave there
S0046	football shirt he be a football fan he use to train youths free of charge football and yeah there's football shirt galore there and they haven't be touch i'll tell you what that's a sign of respect right there that
S0086	why be he stab
S0046	i don't know there be a a load of commotion in town em
S0041	cos i remember use to live up he be live up somewhere in some flats
S0086	the guy ta stab him
S0041	cos there'd be trouble there before no him
S0046	yeah he
S0086	do he didn't live in he just happen to be there
S0041	no yeah
S0046	and eh yeah
S0086	but the arrest the guy be it the same night or the same weekend
S0041	do they do they get him
S0046	no they didn't they arrest someone
S0086	oh right but they haven't
S0041	but there have be quite a few incidents in the same area in haven't there
S0046	they've catch him now though yeah yeah
S0041	before he get stab
S0046	but they hey have catch him
S0086	there's a rise in knife crime definitely it's quite scary
S0046	they have catch him now and he be slowly be sentence for you know he'll he'll he'll be put down for a very long time
S0046	eh yeah it's eight years for knife crime full stop regardless any any kind of knife crime you know i i i could have get put down for for eight years
S0041	you just don't i know it sound well it might sound naïve cos i'm not from here but you just don't associate that with at all
S0086	no
S0046	you wouldn't would you
S0086	no
S0046	but now you've get to two of my mat get stab back in o five no o seven
S0046	i i i be with my fiancé and she let me out of the first night the first night she let me out on the loose
S0086	what do you mean she let you out
S0046	she let me out lads night
S0046	lads night out it be the first time she'd let me out on my own basically we use to go out socially together anyway it be never a problem but it be the first time that she actually didn't go out at all cos she didn't feel up to it she tell me i could go out myself i didn't crawl back until half past five and i be blood soak
S0086	you be
S0046	yeah cos i be help my two mat that have be stab i be there with them i wasn't there with them i hear a load of commotion and me be in security i saw saw a lot of commotion i just walk over to have a little bite of a gander i be on the phone to my colleague that be in the control room that could control the cameras and what i saw be just literally a load of black guy run for a ford focus a six digit ford focus number plate and i say make sure you write this number plate down i think it be t six one o something and yeah anyway i get the number plate and the number late get trace and the guy get catch but they get away with it
S0086	they get away with it why
S0046	they get away with it i don't know don't know how they get away with it
S0086	maybe they didn't do it
S0046	there be so many people in that car they they can't have all get away with it to be fair
S0086	yeah yeah
S0046	one guy my mate my actual mate who i go to school with get get stab there he's only he's only get a little six inch scar em but the other guy that 's mate we pick him up off the floor with basically half of his face hang off
S0086	they stab him in the face
S0046	no they be stand on his head so he be try to keep his skin on on his face as as horrible as that sound that's what we be try to do we we be try to look after his face and then he go my tummy hurt my tummy hurt and we lift his shirt up and there be a stab wind he'd be stab there and it have be slowly pull up so he's get he's
S0086	what the what's the matter with people
S0046	he he he's get a nice well either way he's get a nice nice scar
S0086	they're so lucky that no organs be puncture cos that would have be in game over
S0041	yeah
S0046	yeah but it be it be literally straight i think it be there
S0086	must not have be that deep
S0046	and straight and straight up he he he's get a massive scar now like from nipple nipple to groin
S0086	have like have they provoke it i mean not that it's okay but be they or
S0046	it be all over a girl funnily enough it be it be black guy all over a girl this guy be in a bad way like i'm i'm not be funny he be he be horrible and i i get to mention here because in the in the paper em i didn't want to give my name for obvious reason
S0086	mm mm
S0046	cos i work in the city centre but i be just name as an off duty security guard
S0086	where be this
S0046	just by the side of in front of
S0086	shit
S0041	do you know what's mental i be say to these earlier right when i go to see the navy person i'm sit in the office and i'm always the only girl there so i be look out the window there's all people walk past in peterborough and they're rough as fuck
S0086	yeah
S0041	like they be rough as fuck i'm in my killer heel hooker heel people go to work in them you know totter along the girls with like their boob hang out of their work shirt and like skirt up here full work for the office i be like holy fuck bleach blond hair like break off cos it's that shit i be like oh my god like you look horrendous but where i grow up it be like that i my friends that i've leave at home would think that be acceptable so i've move here and i've be here for three years now and i've kind of get a bite get a bite soft in my own age think that the people that live here be be general standard no they're not the farther north you go peterborough be the standard that i should be use to so i think be quite safe and then you hear and you're like what the fuck because no matter how rough the people be and i mean i've tell you about people send for fighter from you would never see that never
S0046	i've have two knives pull on me in one one one be i think be about an eight inch serrate blade at when it be twenty two's i just go to the bar i be on my own and i guy stand next to me be get some shit from a guy behind me and it be it be abusive stuff that he be say to this guy and i be just i be try to be friendly i be try to sort of right cos i be still in my security days i be just try to
S0041	diffuse diffuse
S0046	diffuse the situation so i think i do next thing you know i'm get a tap on the shoulder this guy pull his suit jacket open and show me this fuck blade
S0086	shit
S0046	that's strap to his jacket
S0086	what the fuck
S0046	yeah so
S0086	but you know that's where a girl get rap in the toilets while under at knife point in
S0041	really
S0046	yeah yeah
S0086	yeah a couple of years ago a girl get rap there when it be twenty two's
S0086	doncaster be renowned people basically all the shop in doncaster when i be eighteen turn from shop in to bar so people from as far as newcastle be take trip for stag do and hen do to come to doncaster it be like as massive night out obviously i didn't know cos i'd move away by that time em but they come from all over the place every single weekend it be ram to fuck but you never hear of one stab ever and they be rough people really rough people you never hear of any of it
S0046	that's weird
S0041	that be one thing you hear like
S0046	yeah you be be dictate you've get to sign a sign a disclaimer before you eh
S0046	no you have technically you have
S0041	have i tell you about get punch by that guy in godzilla
S0086	yeah of all people
S0041	yeah and i be out take the piss basically set each other up for tune the person we be just really drink by this point we be half a bottle whiskey down choose a person and i think i think the aim of the game be to get them to buy you a drink or to like pull them and get them to buy you a drink i don't remember but either way we be play this game and he go for a girl that i'd choose and he be talk to her her the girls boyfriend rock up and he you know what like he wouldn't have say anything other than how's your night go em and the guy punch him in the stomach punch him
S0086	he have a bruise the next day didn't he
S0041	yeah yeah i be like fuck
S0046	be that here
S0041	yeah it be here
