S0086	that be after that comedy club night wasn't it
S0046	be it really
S0041	yeah
S0046	you never tell me about that
S0041	do i not mm yeah even in barnsley and that be the roughest dive in the world ever if anybody ever say come with me for a night in barnsley say fuck off cos honest to god it be bad it be so bad
S0041	yeah it's so bad it's so so rough really like you've never see anything like it there's not a place where you wouldn't stick to the floor or people would think it be okay to vomit in the club like
S0046	it's a bite like really get to do it sorry ladies and gentlemen i've get to take it off and have a look
S0041	not on the top not on the top
S0046	sorry you're the only person who wouldn't care
S0086	i didn't say anything actually to fuck off so yeah fuck off
S0046	and this be do hurt
S0086	why don't you put ice on it
S0041	i don't want to see that if i'm honest can i have a fire
S0046	that look normal don't it
S0046	do that look normal it doesn't look overly normal but not to me anyway i know my own feet
S0041	that look a bite fat on the outside
S0041	that look a bite fat on this outside
S0046	yeah
S0086	you need to compare it to the other one cos we don't know what they normally look that
S0046	no that definitely doesn't look overly normal
S0041	yeah on the outside it look a bite fat
S0046	in all fairness my right foot look worse than my leave
S0086	the right one look bigger
S0046	yeah i know
S0086	stilton
S0046	in all fairness that that's what worry me that bump there
S0086	put some ice on it you won't be able to walk on it in the morning
S0046	it be weird cos my leave foot be veinier than my right foot it always have be the case that be a yawn
S0086	i've be awake since five be
S0046	that's normal if it's go to be anyway it's there that's where it hurt
S0086	be you suppose to be work tomorrow
S0046	yeah
S0086	not hear from
S0046	he's weird apparently i'm suppose to be in tomorrow
S0086	where's that
S0046	which be just up the road
S0086	okay
S0046	and i'm suppose to be with him i be speak to my mother and she tell me oh i've not long get off the like see steve you're in mumford tomorrow aren't you what no i'm not as far as i know i'm bike to work this week
S0086	oh right
S0046	yeah
S0086	have you speak to him
S0046	i've text steve i say right
S0086	be i cycle or be i wait
S0046	well what i hear you tell me one thing mum tell me another and he text me go they be that help that really help and i text him go rumford what time and he hasn't text me back so i i've really get a feel that tomorrow be just go to be a blow out because if it be rumford tomorrow there's no point in me go because rumford don't as far as i'm concern
S0086	oh it's where you've be already
S0046	yeah there's there's there's no work for me leave there apart from clean up and there isn't that two people can do that there's no work leave for me there but i'm cheaper than the other dude
S0086	so do you hear back from the premier inn
S0046	no
S0086	that's weird that they would interview you cos normally if they at least if they interview you
S0086	girton
S0046	yeah
S0046	that's so that's premier inn and travelodge
S0046	i know but i make spray them she's hot she's young
S0046	really oh dear oh dear kid you can tell i do fall over can't you
S0086	you've get grass stain on your knees
S0046	it's not from fall over on grass though funnily enough on here
S0086	you fell over on the slabs
S0046	yeah
S0086	ah man alive
S0046	yeah
S0086	challenge you to a rematch
S0046	can't see her it's good fun
S0086	you can't really see oh there she be
S0046	as immature as it may be it be good fun
S0086	it be really fun
S0046	it really be it really be it's very immature but it's great fun isn't it
S0086	what be
S0046	basketball yeah it actually really do cheer me up it's a complete game you play when you're like thirteen but it be really funny
S0041	i'm not sure i'll be really less painful cheat it if i'm honest
S0046	be a wicket keeper be harder than actually chase after the ball
S0041	should have strap a cushion to my chest then i could play please
S0046	next sunday be on
S0041	huh
S0046	next sunday be on
S0041	yes sir
S0046	you'd better not be
S0041	i have a proposition and 's already shoot me down so let's just pretend 's not listen be that i go to the garden centre with yesterday who's obviously redo her whole garden and i think it would be a really nice thing
S0046	i haven't shoot you down
S0041	for us to do all together if we go to the garden centre and buy some compact and just choose some flower and out them all out down the little side i'm not go to guarantee that they will survive
S0086	none of us be go to look after them
S0041	well no
S0086	well what i be think be after
S0041	we could just buy some bulbs and buy some compost and just a have a day in the garden
S0086	if we could if we could what we get then it'll be cheap won't it you've just gotta find roses
S0041	of course just choose the cheapest ones we don't care what look great we'll just choose the cheapest ones buy a load of compost and a shovel and just have a day in the garden
S0046	you you see my theory be the patio
S0041	he's say that he want basically to ask trudy to move these slabs basically like two feet this way so they go to the edge of the conservatory
S0046	patio to the leave of the conservatory
S0086	why why
S0046	i want three cos there's four row of slabs
S0086	yeah
S0046	i want three of them
S0086	right
S0046	one for to get out if if she want to get out and the other three to lay by the conservatory so we've get somewhere to sit comfortably in the summer and bake
S0086	and cook yeah
S0041	we could have a garden day
S0046	i think that's more sensible
S0086	a garden day would be nice i'd quite like a little allotment be think we could maybe we could buy a little
S0046	that's another one
S0041	we could buy a little tray and put them
S0086	that could be where the shed be you know
S0041	yeah
S0046	it'd be better it'd be better that end where the toilet be
S0086	take yeah get compost and plant them down there
S0041	yeah cos you can buy there's a little place in the garden centre you might already know this but i didn't know
S0041	there's a little place in the garden centre make for children that have like runner bean and
S0046	so be that
S0086	yeah i know it's like a little a trough like this isn't it
S0041	yeah yeah
S0086	oh well i go when i be with mum a couple of weeks ago and it's amaze it's like a massive like yeah like a trough isn't it
S0041	easy things to grow for kid
S0086	yeah that's what we need
S0041	shove them in
S0086	cos that's our intelligence level
S0041	yeah
S0046	how be your chillies go
S0046	you need to keep water your chillies darling
S0086	oh no that's well that's what i mean i don't i'm rubbish i only
S0041	no cos they survive
S0046	yeah well we play children game today
S0041	children yeah we could do that
S0046	we play children game today we're allow to do it we use more imagination today
S0041	so yeah we could do that and that would be a nice thing to do one go out in the sun on the weekend
S0046	no it be call childhood imagination
S0041	we'll take the eh take the lot to the garden centre choose easy shit and shove it in the garden
S0086	we well i've also be keep an eye out for like cheap garden furniture cos we don't have anything in the garden that's the thing and then
S0046	yeah
S0041	yeah
S0041	it might be the cost effective option i'm afraid
S0086	i wonder if we can like liberate certain things
S0041	liberate yeah
S0046	i'm work i'm work on a picnic bench i've get my eye on the haymakers
S0041	yeah
S0086	where be it
S0046	portland road
S0041	the one that's close
S0046	yes
S0041	be there picnic bench in there
S0046	they've get a beer garden
S0046	's just as bad
S0046	yeah do it
S0046	do it i'll come and get it cos a picnic bench we need
S0046	how awesome would that be to have a picnic bench
S0041	ha ha yeah kick and thrill
S0046	it's a good thing to have innit a picnic bench
S0086	yeah it'd be really good to have some garden furniture
S0041	mm
S0046	yeah
S0086	especially if we're go to like if the weather's go to be nice now and then shit in the summer be good to get stuff now like
S0041	yeah
S0046	twenty eighth of april big barbecue
S0041	it's barbecue time
S0086	it's a wednesday isn't it or be you go to do it at the weekend
S0041	weekend after yep
S0046	yeah twenty eighth big barbecue cos 's birthday be on the twenty seventh which be friday twenty eighth we're go go cart first hand or want to do it
S0046	we
S0046	i can drive
S0046	well yeah this be true mark stay here on a friday night
S0046	yeah
S0046	the bowl alley do it to you completely
S0046	you see whereas i get home from work now and i just want to sleep
S0046	i really do i'm up at five i get home two three four five o'clock and i i just want to die
S0046	what
S0046	thursday off
S0046	why would you maybe go to
S0046	don't give up on
S0046	okay
S0041	i'm a bite concern that they allow a crazy horse to look after children
S0046	he's he's good with kid he really be he really be he's too kiddish with kid he really be that's the bad thing
S0046	you're still too childish with him
S0041	how old be he
S0041	and they allow you to look after him
S0041	take the towel out take the towel out
S0041	yeah maybe one more spin
S0086	have you already put them on a spin
S0041	yeah but they're still quite damp pretty pretty damp in there
S0041	that's not guilty as try harder
S0041	i'm a godmother
S0041	do you take him out place
S0041	let's take him lamb yeah i be really excite i get to go see the lamb next weekend baby lamb i haven't see a baby lamb before
S0046	have you not
S0041	i'm excite no
S0041	baby anything really
S0041	but i think see a baby shark
S0086	i can't imagine a baby shark
S0041	they're not very big they look like fish
S0086	maybe i will
S0041	maybe i'll go there now
S0086	just for shit and giggle
S0041	i think the eh baby lamb come out like what baby puppies like this big
S0046	no
S0041	they come out with legs
S0046	yeah like horse
S0086	what do you mean they come out with legs obviously they come out with legs where would their legs be
S0041	i mean like they're as big as the
S0041	i mean like as big as a as big as a cat they can walk after a few minutes
S0086	yeah
S0041	i didn't know that didn't know it go to see them go to see them and the guy that i can go and see the with he's the one the farmer he's the one that i keep say he's gay he's gay and say no he's not no he's not i've know him for years come out this week he's gay it's like tell you i know i know
S0086	be surprise
S0041	yeah he be surprise cos he spend the last couple of weeks defend him say he wasn't gay i know it
S0086	where be you go to see the lamb
S0041	somewhere near some farm
S0041	yeah
S0041	i use to live in be it here
S0041	i use to live in near
S0041	be here cottingham be near hull i use to live there
S0041	so i move from cottingham to
S0086	that's amaze
S0086	me too
S0041	yeah i use to live there
S0041	last year just before i move in here
S0041	in the barn
S0046	you be there years ago mate
S0041	just near the
S0041	thirty nine years ago thirty years ago be say that em they're close the on a sunday at eight kick everyone out
S0086	really
S0041	yeah they're not keep it open cos they don't make enough money and i be like what be you go to do where's your social where's your social life go now he's like i know it's hard isn't it
S0086	so that's just go to be saturday night
S0041	friday night and saturday night but sunday night they're close from eight
S0086	from eight pm
S0041	yeah
S0086	oh so it's open during the day then so it's only for like three hours
S0041	yeah yeah
S0046	but have you see open at lunch time close at three open again at six
S0041	no they have the old boys sit there all afternoon play the race
S0041	what
S0046	the old boys
S0041	you must be older than me see as i'm twenty two soon
S0041	sod you sorry for you sorry for you
S0046	big two seven this year
S0041	penny lane
S0041	penny row be you on about in
S0041	yeah
S0041	that's the wrong end of the high street
S0041	it's what now
S0041	sunday
S0046	they all drink
S0041	on sunday's only
S0046	and they will pay
S0046	two sixty
S0046	when it's a pound in tesco's
S0041	yeah i do watch big fat gypsy wed yesterday
S0046	i watch brian chillers yesterday
S0041	no it be this morning
S0046	brian chillers yesterday and oh my god the women on there be fuck one one one one one if it ain't right
S0041	who do you think have to deal with them organise the wed
S0046	oh my good god
S0041	me me vickers arrange weddings
S0041	yeah there be bridezillas
S0046	when when
S0041	good good yeah
S0041	that's fine don't get marry before you're thirty ever ever
S0046	i'll go with that and all no way he's get marry before he's thirty
S0041	don't do it
S0046	be he really
S0046	seriously
S0046	okay
S0041	i'm his friend
S0046	will get him up he's get stuff yeah
S0041	will you sort out this store for me please
S0046	all i want him be to design grandma in an arch
S0046	yeah
S0041	i'm not talk about that shit i just want these tattoo go over in black please these star both black
S0041	yeah yeah yeah do it
S0041	that's an easy one for him to do if he's only start they're already there i just want him to go over them in black
S0041	yeah fill them in
S0046	just fill them in
S0041	they're in colour now and i want them go over in black
S0041	no the whole lot just completely black
S0046	no just fill
S0041	no i mean they're already colour i want them go over in black completely
S0046	another word about my grandma arch i want old english write
S0041	yeah if you're go to do something serious you don't want him to do it but it's already there they're already they're already a perfect shape i just want them go on in black colour in fill in black do
S0046	how much do he charge do he charge by the hour
S0041	do you know have one on his arm do at tattoo crazy be that what it's call
S0041	be that what it's call
S0046	down the
S0046	the hobson street place
S0046	place yeah you know
S0041	what yeah it's near there what he have do could have be so easily fuck up it's like be look at i really really precise really precise
S0046	no they're shit for tattoo in there
S0041	whoever do his be good and the girl that do it be her name isn't it
S0041	she's really good she's better than they guy that do his ad i can't pick a flaw in his she's even better
S0041	be you go to say 's
S0046	do you want
S0041	yeah i be go to say the other thing about be
S0041	's a bite full of hisself though isn't he if it's not something he like if it's not something he like to tattoo
S0041	do you know tattoo here be so much more expensive you know the one on my back that you've see
S0041	here cos i want the colour touch up here eh they want to charge me a hundred pound to touch up the yellow and the white cos obviously when i get on the sunbed everything get fade but the guy that actually do it
S0041	the guy that do it thirty quid i mean i know him so it should have be forty five
S0041	but still to have it do here initially hundred quid straight off
S0041	and the same with pierce here as well
S0041	like when i have that bite pierce i've take it out now cos i have to for work but i have it do here again cos i let it heal up here she charge me thirty five hull tenner
S0041	well that to me if normal like i think it's madness do you know there's a guy call kamal in london and he's well he's in new york most of the time now cos he's really really good like his tattoo look like watercolour
S0046	i've hear of him
S0041	i saw this guy about a year ago i be stand in h and m and i be look at this guy's tattoo and it be like em it be like a landscape really nothing special as in i don't know why the fuck he choose that but look at it i be proper star at it and i couldn't make out if it be a real tattoo or not cos it be just flawless it look like it have be paint there be no outline or anything it have just be i couldn't believe it
S0046	what with
S0041	no
S0041	yeah and i be star at it and in the end i say to him i say i'm really sorry do you mind me ask be that a real tattoo and he be like yeah a guy call kamal do it and so i look him up and the wait list to have a tattoo with him be i think it's eighteen months now cos he's out the country most of the the time
S0046	yeah
S0041	but to go to london to have him the thing that the guy have do be two hundred pound
S0046	what's he london ink or something or
S0041	i don't know i don't know what that be but still two hundred pound but it be out of this world
S0046	his brother 's brother
S0046	yeah
S0046	didn't he get call up by miami or something like that
S0046	this kamal guy have get load in miami
S0041	i know but it just show you someone who's that at that height of the profession be go to charge two hundred quid and fuck fabio's sit on say three sixty i don't think so
S0086	no
S0041	she have sense
S0046	it's alright you're not leave alone you're not i haven't get any
S0086	i don't feel alone i've think about it for while for a long time when i get back from cuba i be go to
S0086	yeah absolutely otherwise you're go to regret it or i mean you know when you're young and impulsive
S0041	i know a lot of people like i would never ever have a name tattoo on me ever never a lot
S0086	no no
S0041	that's different yeah i just wouldn't do it yeah but i need this bad boy do over
S0046	i'd have my first bear and my grandma tattoo on my back well i want grandma tattoo on the nape of my neck in an arch
S0086	i would never do that i would never put a name on me
S0046	i want grandma
S0041	yeah your reason be a bite different though i'd never put a name on me
S0041	no
S0041	no
S0046	no
S0041	i would never do it
S0046	no i wouldn't
S0041	i see the i see the logic behind it but i just would never do i could never do it
S0086	you must have be there about that
S0046	it's too straight
S0046	well yeah it's not straight though
S0041	after i've get this one sort i want something do down my spine i don't know what though
S0086	it's fine it's really difficult on a girl choose somewhere that's not too
S0041	findable
S0086	butch butch like or sluttish like my friend get a a flower tattoo on her back and it be nice and after that she get like a panther on her arm
S0046	no ooh
S0041	panther
S0086	which be really butch butch lesbian
S0046	be that the one you have round here that time
S0086	no she hasn't be here
S0046	no okay who be that crazy girl that you have round here that weren't the at uct
S0086	what at the party
S0041	the crazy girl
S0046	no there be another girl
S0086	well be here at the party it be and with the short short blond hair
S0041	i like her i like her
S0086	with yeah and they be the ones that be here till the end
S0046	this this this wasn't party time this be random
S0046	i think i come knock on your door
S0046	but she and she come across quite lesbian
S0041	think do you so you think he's think of cos she's get short hair she doesn't come off very lesbian like though
S0086	oh
S0046	possibly
S0086	be it a christmas
S0046	yeah ish
S0086	be she sit on my futon in the corner
S0046	she be on she be in your bed she be ill
S0086	oh yeah it probably be actually
S0046	yeah
S0086	a blond hair quite skinny
S0041	i haven't meet her have i
S0086	you haven't meet her she be only here for a few hours i don't think you be at home
S0046	yeah yeah she be ill she be quite dark
S0086	lesbian
S0046	sorry no it be just you know you you get that kind of instant impression about people
S0086	what cos she be in my bed
S0046	yes it's cos you be you pufta
S0086	what be go to do
S0046	no nothing like that nothing like that no she she just come across
S0046	why
S0046	fuck find
S0041	it doesn't hurt
S0041	the one on the back didn't hurt but think at the bottom of your back i think it's fat there that didn't hurt me at all the one on my foot really hurt
S0086	it need to be fleshy if it's on the bone it's go to kill you
S0041	that really hurt i want one on my rib when i'm skinny
S0046	oh be busy now
S0046	be he
S0046	i'd get it do now
S0041	you tell him you tell him this
S0041	be an easy one for him to do
S0046	just tell him i'll give him twenty quid
S0041	thing be for a girl i think you've to to choose somewhere that you can hide it
S0086	exactly not a butch lesbian tattoo on your arm imagine on your wed day
S0041	no wed dress
S0086	yeah cos then only certain people then get to see it
S0046	yeah
S0046	i love 's tattoo
S0046	's tattoo be awesome and it hook up it start off at the back as a little little back piece at the bottom of the spine which everybody's get which be just
S0046	yeah
S0041	stamp yeah i've be tell that so many time
S0046	but she's she's adapt it and it's all be move and curve around and it go up there now it's discreet because not everything show it off and she want to get the other side do as well it's not all her back that's cover it be literally stamp
S0046	and then round and it look stun it look absolutely amaze
S0041	mm i'd quite like that actually i don't want it up my side i want it up the front to the top of my rib just below the boob
S0086	yeah
S0046	yeah you've see her here haven't you
S0046	whizz's tattoo though
S0046	be you on about
S0046	's tattoo be pretty hot though aren't they
S0046	she she's get so many tattoo it's unbelievable
S0086	dragons
S0046	but it doesn't it doesn't come across slutty subtle
S0046	it doesn't come across as slutty at all it's it's it's weird she's she's get tattoo on the inside of her thighs on her outside and they they look amaze
S0086	really on the thighs
S0046	they really really do yeah
S0041	see i think this i'd i'd have on at the very top of my thigh here because then i could hide it i just think for girls there's always go to be a time where you're go to show that what happen if you're a granny
S0086	you see that's the issue when you're a mum
S0041	when you've get wrinkly skin no
S0046	but she's just pop out a kid
S0041	yeah she's young though no don't do it
S0046	yeah
S0041	i'd have one on my but it would stop before my collarbone
S0041	be this yours
S0046	yes
S0041	i just take it off cos it's do put it on the stairs
S0046	yes
S0046	yeah i would as well
S0086	what about a spider web on your face
S0046	no
S0046	yeah
S0086	on their face
S0046	oh no you're on yeah you're on about yeah pit bull yeah yeah
S0046	no his name be
S0046	yeah he have it's not on his like full on on his face
S0041	it's not really on his face you're not be serious
S0086	blimey he sound like a winner
S0041	yeah it sound like
S0086	he's get issue
S0046	yeah
S0086	wasn't it illegal in this country to tattoo on your face
S0046	employment wise yes experience wise no it all depend cos that they can quite easily grow their hair and shave it off during employment
S0086	i think it be on your face and on your throat you weren't allow to get tattoo but obviously there be place that would do it but i think it be actually illegal
S0046	yeah but you can get you can get friends friends that will do it you know and it's not like it's unsafe it's just advise against
S0086	yeah but the throat though
S0046	it's a bite like smoke though isn't it
S0086	em
S0046	you know i i i want i want one there but i think that would freak me out a little but too much as a first tattoo
S0086	mm that's that's your skull mm
S0046	pretty much isn't it although i have get a lot of
S0086	you haven't get cartilage there i suppose have you
S0046	i get a lot i get a lot of give there on that bite
S0086	you've get like muscle and stuff
S0046	you know i get i get muscle and i get flab but i i want want i really want an arch grandma over over my shoulder the nape of my next i just want it she save my life so
S0086	your gran
S0046	yeah so i don't really she be dead and she stop me from do something very stupid
S0086	oh really
S0046	so em grandma
S0086	that's a nice name
S0046	yeah her name be which be very weird
S0086	very weird
S0046	very very weird how do you get out of
S0041	me too
S0046	yeah
S0086	well it's like isn't it be short from
S0046	yeah
S0086	what the fuck
S0046	yeah i get an aunt i get a great aunty call
S0086	yeah my nanny my nanny be call
S0046	she's an alcoholic
S0086	fine all the best people be
S0046	she's she's an alcoholic through and though never work a day in her life and she's rich as anybody
S0041	i'm beered out be we beered out
S0046	almost beered out
S0086	i've get one if anyone want one
S0046	i can't i'm injure now
S0046	i be still injure
S0086	have you notice i have my hair cut
S0041	yes i love it i notice do i not say it to you no i really like it i will touch it will touch it yeah it's like the way you you have it cut not long ago i love it like that it suit you face a lot 's ask me load of question about you you know
S0086	about me why
S0041	yeah how's she's fine what's she do now i say what you do for a live all this blah blah blah and then she tell me how jealous she be of your face
S0086	of my face
S0041	she's jealous of your face i'm go to see her actually next weekend
S0086	be you i think you be go
S0041	i think it's the
S0086	oh no what be you do on sunday
S0041	and she em didn't offer me a out and find out to make sure it's for sunday but she's go erm to see a consultant about her botox
S0086	okay really
S0041	yep so i'm go with her
S0086	oh god be she go go through with it
S0041	yeah yeah i think she be i think she be i mean she's think about it no really
S0086	she's take the
S0041	she's it's the only thing she's self conscious about she's self confident but then she's good to go she say it's the only thing that i feel conscious about and everyone see it i don't feel like i'm at the age that i be i'd feel a lot better if they weren't there i be like well if that's it
S0086	fair enough
S0041	let's go see what they have to say so
S0046	i have one have you have one
S0046	you have one and i'll have one
S0046	get one
S0046	yeah
S0046	oh
S0046	oh
